,Artist,Title,Track_id,Year,Lyrics
31,Elmore James,Standing At The Crossroads,TRMXRQL12903C9D2C8,1960,"Well I'm standin' at the crossroads,
With my head hung down and cryin'
Well I'm standin' at the crossroads,
With my head hung down and cryin'
Well I was thinkin' about my baby,
And I know she can't be found

I work hard for my baby,
And she treats me like a slave
I work hard for my baby,
And she treats me like a slave
Well she was be tired of livin',
I'll put her six feet in the grave

Well I'm standin' at the crossroads,
And my baby's not around
Well I'm standin' at the crossroads,
And my baby's not around
I began to wonder,
If this is Elmore's second down

I' standin' here waitin' baby,
With my heart right in my hand
I' standin' here waitin' baby,
With my heart right in my hand
I'm thinkin' about my baby,
And she's out with another man"
32,Elmore James,Sunnyland,TRPEOZC128F4291E51,1960,"Seems like I heard that lonesome Sunnyland blow
Seems like I heard that lonesome Sunnyland blow
Now it blowing just like it won't be back no more

Well I feel bad this morning, feel just like I want to cry
Feel bad this morning, feel just like I want to cry
Well my baby rode that Sunnyland this mornin', she didn't even once say goodbye

I got a letter from my baby, and she said she was coming home
Got a letter from my baby, and she said she was coming home
Well sat around waiting, baby, and I hope it won't be long

She said, cool down papa, now you better change your way
She said, cool down papa, and you better change your way
Yeah it's true, you know I love you baby, and you gonna need my help some day"
33,Elmore James,The Sky Is Crying,TRTECTP128F932C81D,1960,"The sky is crying, look at the tears roll down the street
The sky is crying, look at the tears roll down the street
I'm waiting in tears looking for my baby, and I wonder where can she be?

I saw my baby one morning, and she was walking on down the street
I saw my baby one morning, yes she walking on down the street
Made me feel so good until my poor heart would skip a beat

I got a bad feeling, my baby, my baby don't love me no more
I got a bad feeling, my baby don't love me no more
Now the sky's been crying, the tears rolling down my door"
34,Elmore James,Dust My Blues,TRVUTUU12903CD46E5,1960,"I'm gonna get up in the morning, I believe I'll dust my blues
Gonna get up in the morning, I believe I'll dust my blues
I gotta leave my baby, I ain't got no time to lose

I don't want no woman, that'll treat me wrong all the time
I don't want no woman, that'll treat me wrong all the time
Well I'm tired of the way she treats me, 'cause I'm about to lose my mind

I'm gonna write a letter, I better send her a telegram
I'm gonna write a letter, I better send her a telegram
She left me soon this morning, and she's got me in an awfull jam

I believe, I believe my time ain't long
I believe, I believe my time ain't long
I gotta leave my baby, I gotta leave my hapy home"
35,Elvis Presley,Such A Night,TRMEPOY128F4293449,1960,"It was a night oo-oo what a night
It was it really was such a night
The moon was bright oh how so bright
It was it really was such a night
The night was alight with stars above
Oo-oo when she kissed me
I had to fall in love

Oh it was a kiss oo-oo what a kiss
It was it really was such a kiss
Oh how she could kiss oh what a kiss
It was it really was such a kiss
Just the thought of her lips
Sets me afire
I reminisce and I'm filled with desire
But I'd gave my heart to her in sweet surrender
How well I remember, I'll always remember

Oh, what a night oo-oo what a night
It was it really was such a night
Came the dawn and my heart and her love
And the night was gone
But I'll never forget the kiss
The kiss in the moonlight
Oo-oo such a kiss, such a night

It was a night oo-oo what a night
It was it really was such a night
Came the dawn and my heart and her love
And the night was gone
But I'll never forget the kiss
The kiss in the moonlight
How well I remember, I'll always remember

That night oo-oo what a night
It was it really was such a night
When we kissed I had to fall in love
But I'd gave my heart to her in sweet surrender
How well I remember, I'll always remember

Oh that night oo-oo what a night
It was it really was such a night
When we kissed I had to fall in love
Well she's gone, gone, gone
Yes she's gone, gone, gone
Came the dawn, dawn, dawn
And my love was gone
But before that dawn
Yes before that dawn and before that dawn
Oo-oo, oo-oo, oo-oo, oo-oo, oo-oo
Such a night"
36,Elvis Presley,Tonight Is So Right For Love,TRFLPXO128F428F5A7,1960,"Hold me tight
The moon's so bright
Tonight is so right for love

Now's the time to say
You're the only one
Tonight is so right for love

One by one the stars appear
They twinkle in your eyes
Who'd believe that we'd be here
So near to paradise

This could be the kiss
To unlock heaven's door
That magic hour of bliss
That we both waited for
I love more and more

Oh' we could fly right up to the sky
The things we've been dreaming of
And how real they would seem
A midsummernight's dream
Can't you see that tonight's so right for love

And how real they would seem
A midsummernight's dream
Can't you see that tonight's so right for love

Hold me tight
The moon's so bright
Tonight is so right for love"
37,Elvis Presley,Known Only To Him,TRQFDVL128F42886A6,1960,"Known only to him are the great hidden secrets
I'll fear not the darkness when my flame shall dim
I know not what the future holds
But I know who holds the future
It's a secret known only to Him

In this world of fear and doubt
On my knees I ask the question
Why a lonely, heavy cross I must bear
Then he tells me in my prayer


It's because I am trustworthy
He gives me strength far more than my share

Known only to him are the great hidden secrets
I'll fear not the darkness when my flame shall dim
I know not what the future holds
But I know who holds the future
It's a secret known only to Him"
38,Elvis Presley,Pocketful Of Rainbows,TRNVJYK128F428C0AB,1960,"I don't worry
Whenever skies are gray above 
Got a pocketful of rainbows
Got a heart full of love

Mister Heartache
I've found a way to make him leave
Got a pocketful of rainbows
Got a star up in my sleeve

Kiss me extra tender
Hold me extra tight
'Cause I'm savin' your sweetness
For a lonely night, aye
Aye, aye, aye, aye, aye, aye, aye, aye

No more teardrops
Now that I've found a love so true
I got a pocketful of rainbows
Got an armful of you

Kiss me extra tender
Hold me extra tight
'Cause I'm savin' your sweetness
For a lonely night, aye
Aye, aye, aye, aye, aye, aye, aye, aye

No more heartaches
Now that I've found a love so true
Got a pocketful of rainbows
And an armful of you

Rainbows...
Rainbows..."
39,Elvis Presley,If We Never Meet Again,TRPKBDR128F42A338C,1960,"Soon we'll come to the end of life's journey
And perhaps never meet anymore
Till we gather in heaven's bright city
Far away on that beautiful shore

If we never meet again this side of heaven
As we struggle through this world and it's strife
There's another meeting place somewhere in heaven
By the side of the river of life

Where the charming roses bloom forever
And where separations come no more
If we never meet again this side of heaven
I will meet you on that beautiful shore"
40,Etta James,My Dearest Darling,TRMCOIB128E078F56C,1960,"All I need
Is someone like you
My dearest darling
Please~love me to
Within my heart 
I pray your answer's yes
I'll make your life
Full of happiness

I'll be there by your side
Oh,I pledge my love to you
With God as our guide..

Unh~my dearest darling
I offer you my heart

Oh, yeah whenever you need me
I'll..I'll be there by your side
Oh~I pledge my love to you
With God as our guide

Oh nothing,nothing,nothing in this world
Can keep us apart
Unh~ my dearest darling
I'm offering you my heart

Unh~my dearest darling..."
41,Etta James,I Just Want To Make Love To You,TRCFPJF128F428A872,1960,"I don't want you to be no slave
I don't want you to work all day
But I want you to be true
And I just wanna make love to you

Love to you, ooohooo
Love to you

All I want to do is wash your clothes
I don't want to keep you indoors
There is nothing for you to do
But keep me making love to you

Love to you, ooohooo
Love to you

And I can tell by the way you walk that walk
And I can hear by the way you talk that talk
And I can know by the way you treat your girl
That I could give you all the loving in the whole wide world

All I want you to do is to bake your bread
Just to make sure that you're well fed
I don't want you sad and blue
And I just wanna make love to you

Love to you, ooohooo
Love to you, oooh

And I can tell by the way you walk that walk
And I can hear by the way you talk that talk
And I can know by the way you treat your girl
That I could give you all the loving in the whole wide world

Oh, all I wanna do, all I wanna do is cook your bread
Just to make sure that you're well fed
I don't want you sad and blue
And I just wanna make love to you

Love to you, ooohooo
Real love to you, ooohooo
Love to you, ooohooo"
42,Etta James,At Last,TRBUCIY128F422B984,1960,"At last
My love has come along
My lonely days are over
And life is like a song

Oh yeah yeah
At last
The skies above are blue
My heart was wrapped up in clover
The night I looked at you

I found a dream, that I could speak to
A dream that I can call my own
I found a thrill to press my cheek to
A thrill that I have never known

Oh yeah yeah
You smiled, you smiled
Oh and then the spell was cast
And here we are in heaven
For you are mine
At Last"
43,Etta James,Anything To Say You're Mine,TRSRGZB128E078F56B,1960,"Oh, oh, I'm so blue
'Cause I'm worried over you
Oh I, I sometimes wonder
Why I never hear from you

You promised to write me
Each and every day
And I haven't heard from you
Since you went away

Oh, oh, I sit by my window pane
Hoping for a letter
One that never came

My heart cries for just one little line
Anything to say you're mine

Oh, oh...

Well I said a prayer
Every night
Hoping, hoping and praying
Someday, someday you'd write

Oh, oh, my heart cries for one little line
Anything to say you're mine"
44,Etta Jones,All The Way,TRCCXGI128F92FCFEF,1960,"When somebody loves you
It's no good unless he loves you all the way
Happy to be near you
When you need someone to cheer you all the way

Taller than the tallest tree is
That's how it's got to feel
Deeper than the deep blue see is
That's how deep it goes if it's real

When somebody needs you
It's no good unless he needs you all the way
Through the good or lean years
And for all the in between years, come what may

Who knows where the road will lead us
Only a fool would say
But if you'll let me love you
It's for sure I'm gonna love you all the way, all the way

When somebody needs you
It's no good unless he needs you all the way
Through the good or lean years
And for all the in between years, come what may

Who knows where the road will lead us
Only a fool would say
So if you'll let me love you
It's for sure I'm gonna love you all the way, all the way"
45,Etta Jones,Fine And Mellow,TRIPMCH128F92FCFE6,1960,"My man don't love me
Treats me oh, so mean
My man don't he love me
Treats me awful mean
He's the lowest man
That I've ever see

He wears high drape pants
Stripes are really yellow
He wears high drape pants
Stripes area really yellow
But when he starts in to love me
He's so fine and mellow

Love will make you drink and gamble
Make you stay out all night long
Love will make you drink and gamble
Make you stay out all night long
Love will make you do things
That you know is wrong

But if you treat me right, baby
I'll stay home every day
If you treat me right, baby
I'll stay home every day
But you're so mean to me, baby
I know you're gonna drive me away

Love is just like a faucet
It turns off and on
Love is like a faucet
It turns off and on
Sometimes when you think it's on, baby
It has turned off and gone"
46,Etta Jones,Something to remember you by,TRNZFGV128F92FCFEC,1960,"All give me something to remember you by
When you are far away from me

Some little something meaning love cannot die
No matter where you chance to be
I will pray for you night and day for you
It will see me through

Just like a charm 'til you're returning home
Give me something to remember you by
When you are far away from me

Give me something to remember you by
When you are far away from me"
47,Etta Jones,On The Street Where You Live,TRNDHUJ128F92FCFEB,1960,"I have often walked down this street before
But the pavement always stayed beneath my feet before
All at once am I several stories high
Knowing I'm on the street where you live

Are there Lilac trees in the heart of town?
Can you hear a lark in any other part of town?
Does enchantment pour out of every door?
No, it's just on the street where you live

And oh, the towering feeling
Just to know somehow you are near
The overpowering feeling
That any second you may suddenly appear

People stop and stare, they don't bother me
For there's nowhere else on earth that I would rather be
Let the time go by, I won't care if I
Can be here on the street where you live

And oh, the towering feeling
Just to know somehow you are near
The overpowering feeling
That any second you may suddenly appear

People stop and stare, they don't bother me
For there's nowhere else on earth that I would rather be
Let the time go by, I won't care if I
Can be here on the street where you live, yeah
If I can be here on the street where you live"
48,Etta Jones,Don't Go To Strangers,TRSALBU128F92FCFE3,1960,"Build your dreams to the stars above
But when you need someone to love,
Don't go to strangers darling, come to me.
Play with fire till your fingers burn,
And when there's no place for you to turn,
Don't go to strangers darling, come to me.
For, when you hear a call to follow your heart,
You'll follow your heart I know.
I've been through it all, for I'm an old hand,
And I'll understand if you go! So,
Make your mark for your friends to see
But when you need more than company
Don't go to strangers darling, come to me."
49,Etta Jones,I Love Paris,TROCESW128F92FCFE5,1960,"I love Paris in the springtime
I love Paris in the fall
I love Paris in the winter when it drizzles
See, I love Paris in the summer when it sizzles

See, I love Paris every moment
Every moment of the year
I love Paris, why, oh, why do I love Paris?
Because my love is near

See, I love Paris in the springtime
I love Paris in the fall
I love Paris in the winter when it drizzles
I love Paris in the summer when it sizzles

See, I love Paris every moment
Every moment of the year
Yes, I love Paris, why, oh, why do I love Paris?
Because my love is near
Because my love is near
Because my love is near
Because my love is near"
50,Fats Domino,Walking To New Orleans,TRJEWUK128F14602C1,1960,"It's time I'm walkin' to New Orleans
I'm walkin' to New Orleans
I'm going to need two pair of shoes
When I get through walkin' these blues
When I get back to New Orleans

I've got my suitcase in my hand
Now, ain't that a shame
I'm leavin' here today
Yes, I'm goin' back home to stay
Yes, I'm walkin' to New Orleans

You used to be my honey
Till you spent all my money
No use for you to cry
I'll see you bye and bye
Cause I'm walkin' to New Orleans

I've got no time for talkin'
I've got to keep on walkin'
New Orleans is my home
That's the reason why I'm goin'
Yes, I'm walkin' to New Orleans

I'm walkin' to New Orleans
I'm walkin' to New Orleans
I'm walkin' to New Orleans"
51,Ferlin Husky,Wings Of A Dove,TRMBXMA128F92FBC29,1960,"On the wings of a snow-white dove
He sends his pure, sweet love
A sign from above (sign from above)
On the wings of a dove (wings of a dove)

When troubles surround us
When evils come
The body grows weak (body grows weak)
The spirit grows numb (spirit grows numb)
When these things beset us
He doesn't forget us
He sends down his love (sends down his love)
On the wings of a dove (wings of a dove)

On the wings of a snow-white dove
He sends his pure, sweet love
A sign from above (sign from above)
On the wings of a dove (wings of a dove)

When Noah had drifted
On the flood many days
He searched for land (he searched for land)
In various ways (various ways)
Troubles, he had some
But he wasn't forgotten
He sent him his love (sent him his love)
On the wings of a dove (wings of a dove)

On the wings of a snow-white dove
He sends his pure, sweet love
A sign from above (sign from above)
On the wings of a dove (wings of a dove)

When Jesus went down to
The river that day
He was baptised (he was baptised)
In the usual way (usual way)
When John baptised God's son
God told him, ""Well done""
And he sent him his love (sent him his love)
On the wings of a dove (wings of a dove)

On the wings of a snow-white dove
He sends his pure, sweet love
A sign from above (sign from above)
On the wings of a dove (wings of a dove)
On the wings of a dove (wings of a dove)
On the wings of a dove (wings of a dove)"
52,Frank Sinatra,The Coffee Song,TRAPWCY12903CCF30D,1960,"Way down among Brazilians
Coffee beans grow by the billions
So they've got to find those extra cups to fill
They've got an awful lot of coffee in Brazil

You can't get cherry soda 
'Cause they've got to fill that quota
And the way things are I'll bet they never will
They've got a zillion tons of coffee in Brazil

No tea or tomato juice
You'll see no potato juice
The planters down in Santos all say no no no

The politician's daughter
Was accused of drinking water
And was fined a great big fifty dollar bill
They've got an awful lot of coffee in Brazil

You date a girl and find out later 
She smells just like a percolator
Her perfume was made right on the grill
Why they could percolate the ocean in Brazil

And when their ham and eggs need savor
Coffee ketchup gives 'em flavor
Coffee pickles way outsell the dill
Why they put coffee in the coffee in Brazil

So your lead to the local color
Serving coffee with a cruller
Dunking doesn't take a lot of skill
They've got an awful lot of coffee in Brazil"
53,Frank Sinatra,Embraceable You (1999 Digital Remaster),TRUSQYS128F14616D1,1960,"Embrace me, my sweet embraceable you
Embrace me, you irreplaceable you

Just one look at you
My heart grew tipsy in me
You and you alone
Bring out the Gypsy in me

I love all the many charms about you
Above all, I want these arms about you

Don't be a naughty baby
Come to papa, come to papa do
My sweet embraceable you

I love all the many charms about you
Above all, I want my arms about you

So don't you be a naughty baby
Come to papa do
My sweet embraceable you"
54,Frank Sinatra,I've Got a Crush on You,TRJLMMG128F931881E,1960,"How glad the many millions of Annabelles and Lillians
Would be to capture me
But you had such persistence, you wore down my resistance
I fell and it was swell

I'm your big and brave and handsome Romeo
How I won you I shall never never know
It's not that you're attractive
But, oh, my heart grew active
When you came into view

I've got a crush on you, sweetie pie
All the day and night-time give me sigh
I never had the least notion that
I could fall with so much emotion

Could you coo, could you care
For a cunning cottage we could share
The world will pardon my mush
'Cause I have got a crush on you

Could you coo, could you care
For a cunning cottage
That we could share
The world will pardon my mush
'Cause I have got a crush, my baby, on you"
55,Freddie King,Have You Ever Loved A Woman,TRCFBMN128F42515D6,1960,"Have you ever loved a woman
So much you tremble in pain? 
Yee-es!
Have you ever loved a woman 
So much you tremble in pain? 
Yee-es!
All the time you know
She bears another man's name

You just love that woman
So much it's a shame and a sin 
Yee-es!
You just love that woman
So much it's a shame and a sin 
Yes, you know, yes you know
She belongs to your very best friend

And yee-es!
Have you ever loved a woman 
One that you know you can't leave her alone? 
And yee-es!
Have you ever loved a woman (sing!)
One you know you can't leave her alone? 
A- yee-es!
But there's something deep inside a-you
Won't let you wreck yo best friend's home.

Yea-ay-ay-ay.
~"
56,Gary U.S. Bonds,New Orleans,TRVZYZT128F92F1809,1960,"I said, a-hey-hey-hey-yeah
(I said a-hey-hey-hey-yeah)
I said, a-hey, a-hey-hey-yeah
(Said, a-hey, a-hey-hey-yeah)

Well, come on ev'rybody
Take a trip with me
Well, down the Mississippi
Down to New Orleans

They got the honeysuckle bloomin'
On the honeysuckle vine
And a-love is a-bloomin' there
All-a  the time

You know ev'ry Southern Belle
Is a Mississippi Queen
Down the Mississippi
Down in New Orleans

I said, a-hey-hey-hey-yeah
(I said, hey-hey-hey-yeah)
I said, a-hey-a-hey-a-hey-yeah
(Said, a-hey-hey-hey-yeah)

Well, come on take a stroll
Down to Basin Street
Yeah, listen to the music
With the dixieland beat

A-where the magnolia blossoms
Fill the air


Yeah, an if you ain't been to heaven
Then you ain't been there

They got the French moss
Hangin' from a big oak tree
Down the Mississippi
Down in New Orleans

I said, a-hey-hey-hey-yeah
(Said, hey-hey-hey-yeah)
I said a-look out, child!
Yeah, yeah, yeah
(Said, look out child, yeah, yeah, yeah)

Well, come on ev'rybody
Take a trip with me
Well, down the Mississippi
Down to New Orleans

Well, the honeysuckle's bloomin'
On the honeysuckle vine
Yeah, and the love is a-bloomin' there
All the time

You know that ev'ry Southern Belle
Is a Mississippi Queen
Down the Mississippi
Down in New Orleans

Hey, hey!

(sax &amp; instrumental)

Well, I says, a-hey-hey-a-hey-yeah
(Said, yeah-yeah-yeah-yeah)

FADES-

I said, a-look out child!
Yeah, yeah, yeah

~"
57,Hank Locklin,It's a Little More Like Heaven,TRGHTEW12903CFAAA2,1960,"I have sailed the peaceful water salty ocean deep and blue
Felt the rapture of the dawning thrilled through sunset's golden view
I've sought above the mountain peeks for valleys great and wide
But it's a little more like heaven by your side
It's a little more like heaven where you are
I have sought for happiness both near and far
But my search for love was through the day that I met you
Cause it's a little more like heaven where you are

I have watched the crystal raindrops fall to earth to cool the day
Watched the rainbow at twilight when the clouds have flown away
I've adored the clinging roses round my mountain home so dear
But it's a little more like heaven when you're near
It's a little more like heaven...

I've been tempted for a moment by your lure and magic charms
Of a fickle flame and beauty while waltzin' in her arms
I cherrished mem'ries of the past of friends so kind and true
But it's a little more like heaven here with you
It's a little more like heaven..."
58,Hank Locklin,Send Me The Pillow You Dream On,TRHAKLN128F4285373,1960,"Send me the pillow that you dream on don't you know that I still care for you
Send me the pillow that you dream on so darling I can dream on it too
Each night while I'm sleeping oh so lonely
I share your love in dreams that once were true
Send me the pillow that you dream on so darling I can dream on it too
Send me the pillow that you dream on maybe time will let our dreams come true
Send me the pillow that you dream on so darling I can dream on it too
I've waited so long for you to write me but just a mem'ry's all that's left of you
Send me the pillow that you dream on so darling I can dream on it too

So darling I can dream on it too"
59,Hank Thompson,I Was The First One,TRFEOCO128F429BD88,1960,"I was the first to chose her to make her mine
I was the first to lose her be left behind
I was the first she cried to harsh words I spoke
I was the first she lied to first heart she broke

If she seems so warm and tender the way she kisses now
Then you might remember I was the one who taught her how
I was the first to show her those stars above
I was the first to know her to know her love
[ fiddle ]
If she seems so warm and tender..."
60,Hank Thompson,We've Gone Too Far,TRUPHUQ128F429BD87,1960,"Our first affair was just too dared to tempt our patience greed
I slipped around with you and found the kind of love I need
Now on the sly both you and I are deep in love somehow
These things they are we've gone too far to ever turn back now

We've gone too far to tell our hearts that our love was reckless fun
If we'd made a bad mistake I'm not sorry it was done
Though you belong to someone else and another has you now
Yet here we are we've gone too far to ever turn back now
[ steel - fiddle ]
We've gone too far when I can't sleep because I always think of you
I breathe your name and see your face in everything I do
So never leave let's make believe that it's all right somehow
For you must know I love you so and we can't turn back now"
61,Hank Thompson,Squaws Along the Yukon,TRSMWBX12903D01FE9,1960,"There's a salmon-colored girl who sets my heart awhirl
Who lives along the Yukon far away
Where the Northern Lights they shine she rubs her nose to mine
She cuddles close and I can hear her say

Ooga ooga mooska which means that I love you
If you'll be my baby I'll ooga ooga mooska you
Then I take her hand in mine and set her on my knee
The squaws along the Yukon are good enough for me

She makes her underwear from hides of grizzly bear
And bathes in ice cold water every day
Her skin I love to touch but I just can't touch it much
Because her fur lined parka's in the way
Ooga ooga mooska...
[ guitar ]
She has the Air Corps down the Sourdoughs hang around
Chechakos try to date her night and day
With a landing gear that's fine and a fuselage divine
And a smile that you can see a mile away
Ooga ooga mooska...
Carry me back to old Alaska
The squaws along the Yukon are good enough for me"
