,Artist,Title,Track_id,Year,Lyrics
84,Musical Youth,Youth Of Today,TRYKHGZ12903CD950B,1982,"Dennis
Come back with
My apple pie!

Don't blame the youth (Don't blame the youth)
Don't take us for fools (Don't blame the youth)
You know that it's true (Don't blame the youth)
So don't blame the youth (Don't blame the youth)

The youth of today has got lots to say
it's our life, it's our future
Because we're living today
so don't blame the youth - what do you say?

My mother went to town to buy a little bike
And when she see the price she nearly lose her sight
Ca dis a judgement time slang bong
Lord ca dis a judgement time
Slang bong bong bong. Ai

the youth of today
the youth of today
We're under heavy heavy manners yeah
We're under heavy heavy manners yeah
What did he say?

I went down-town to buy a set of drums
but when me see the price
It have me tumble down
ca dis a judgement time boy 
Lord ca dis a judgement time. Do it right.

the youth of today
the youth of today
We're under heavy heavy manners yeah
We're under heavy heavy manners yeah
What did he say?

I went down-town to go buy keyboard.
The price of the board make me shout out loud
ca dis a judgement time
Slong bong biddley bong
ca dis a judgement time mirror style

the youth of today
the youth of today
We're under heavy heavy manners yeah
We're under heavy heavy manners yeah

All night long shine

The youth of today has got lots to say
it's our life, our future
Because we're living today
Don't blame the youth (Don't blame the youth)
Don't take us for fools (Don't blame the youth)
You know that it's true (Don't blame the youth)
My mother went to town to buy a little bike"
85,Marshall Crenshaw,Whenever You're On My Mind  (Remastered Demo Version),TRQLSGP128E078D199,1982,"I think about you and forget what I've tried to be 
Everything is foggy and hard to see 
It seems to be, but can it be, a fantasy?

Whenever I think about you, strangers eyes in the crowd flash past 
I go on and think of the fate you've cast 
It seems to be a reverie, you're here with me

'Cause whenever you're on my mind 
Whenever you're on my mind 
I leave the world behind 
Whenever you're on my mind

I think about you and I'm weak though I'm in my prime 
Set my watch and still lose track of time 
It seems to be, but can it be, a fantasy? 

Whenever I think about you, strangers eyes in the crowd flash past 
I go on and think of the fate you've cast 
It seems to be a reverie, you're here with me

'Cause whenever you're on my mind 
Whenever you're on my mind 
I leave the world behind 
Whenever you're on my mind

I never thought I'd be in this situation 
It seems wherever I go I'm with you 
And though I never seem to find my place 
At every turn I see your face.

Whenever I think about you, strangers eyes in the crowd flash past 
I go on and think of the fate you've cast 
It seems to be a reverie, you're here with me

'Cause whenever you're on my mind 
Whenever you're on my mind 
I leave the world behind 
Whenever you're on my mind

Whenever you're on my mind 
I leave the world behind 
Whenever you're on my mind

Whenever you're on my mind 
I leave the world behind 
Whenever you're on my mind

Whenever you're on my mind 
I leave the world behind 
Whenever you're on my mind (fades)"
86,Roxy Music,While My Heart Is Still Beating (1999 Digital Remaster),TRSDIVY128F146A0AF,1982,"All of those people
Everywhere
Ever so needing
Where's it all leading
Tell me where
Nothing insincere

I'd better have pity
I'd better go easy
I never will lay down
While my heart is still beating

Where's it all leading
Walk on air
Am I still dreaming
Words to spare
Lost in their meaning

I'd better be strong now
I'd better stop dreaming
My heart has flown away now
Will it never stop bleeding?"
87,Bonnie Raitt,River Of Tears (Remastered Album Version),TRBVDNP128E078D31E,1982,"I guess you got me in a sentimental mood
Never thought I'd feel this way again
Lyin' here with my dreams
I get so lonely thinking of you

River of Tears
Oceans of heartbreak
I want to feel
What your love can be
I close my eyes

Chances that I take
Got me so blind
Til I can't see
I never let you know just what's been on my mind
Never thought I'd hurt so bad for you lovin' this long
Lyin' here at nite alone
I keep on wonderin' just what went wrong

River of Tears
Oceans of heartbreak
I want to feel
What your love can be
I close my eyes

River of Tears
River of Tears

[Chorus]"
88,Obus,Prohibido Hacer Rock,TRIBHCW128F42A8094,1982,"Lees en el diario
Que la gente lucha
Sólo caos, destrucción

Si esto es el progreso
Yo lo tengo claro
Sólo salvo el rock and roll

Cien asesinatos, asaltan un banco
Dos golpes de estado en irán
Dos chicas violadas,
Raptando a un ministro,
Encuentran pertróleo en el mar

Pasas otra hoja, siguen con sus luchas
Ya no lo pueden parar
Baja la peseta, se mantiene el dólar
Sube el paro y la inflacción
Más asesinatos, más golpes de estado
Más invictos para ganar

Sabes como pienso
Si esto es el progreso
Sólo salvo el rock and roll

Sólo eh,eh, rock and roll
Sólo eh,eh, rock and roll
Sólo eh,eh, rock and roll

Grandes titulares
Dos jóvenes muertos
En un concierto de rock
Hay que castigarlos, locos peligrosos
Hay que prohibirles el rock
Aún siguen las guerras, los asesinatos
Pero es más peligroso el rock

Grita que te oigan
Que nadie te calle
Dile que amas el rock and roll

Sólo eh,eh, rock and roll
Sólo eh,eh, rock and roll
Sólo eh,eh, rock and roll"
89,Chron Gen,Living Next Door To Alice,TRZQLEC128F9305917,1982,"""you fucking cunts""
Sally called, when she got the word,
She said 'I suppose you've heard about Alice.'
So, I rushed to the window, and I looked outside,
And I could hardly believe my eyes,
A big limousine pulled slowly into Alice's drive.

I don't why why she's leaving, or where she's gonna go,
I guess she's got her reasons but I just don't wanna know,
'Cause for twenty four years I've been living next door to Alice.
Twenty four years, just waitin' for a chance,
To tell her how I'm feeling, maybe get a second glance,
Now I've gotta get used to not living next door to Alice.

We grew up together, two kids in the park,
Carved our initials deep in the bark...
Me and Alice.
Now she walks to the door with her head held high,
And just for a moment, I caught her eye,
As the big limousine pulled slowly out of Alice's drive.

I don't why why she's leaving, or where she's gonna go,
I guess she's got her reasons but I just don't wanna know,
'Cause for twenty four years I've been living next door to Alice.
Twenty four years, just waitin' for a chance,
To tell her how I'm feeling, maybe get a second glance,
Now I've gotta get used to not living next door to Alice.

Then Sally called back, and asked how I felt,
She said 'I know how to help get over Alice.'
She said 'Now, Alice is gone, but I'm still here.
And you know I've been waiting twenty four years...'
And the big limousine disappeared...

I don't why why she's leaving, or where she's gonna go,
I guess she's got her reasons but I just don't wanna know,
'Cause for twenty four years I've been living next door to Alice.
Twenty four years, just waitin' for a chance,
To tell her how I feel and maybe get a second glance,
But I'll never get used to not living next door to Alice.

No, I'll never get used to not living next door to Alice..."
90,Flux of Pink Indians,Blinded By Science,TRRMGYB128F92F56F5,1982,"Pussey eyes is not a pretty sight
But to you it is not a high price
To have your hair shiny and bright
To have your eyes stand out like a light
Four million animals die in experiments
Each year in Britain for what?
So vivisectors can gain praise and a wage
For prodding animals as their bodies distort

Don't think by turning your face the other way
All pain and suffering will just go away

Eighty-eight percent of your experiments
Are done with the use of no anesthetic
But now you've put it's eyes in a bowl
He thinks the animal has been stunned
At the expense of animals' lives
Man has tested and discovered new drugs
But has also destroyed animals eyes
Just so we can live our convenient lives
It's up to you
If you think man is justified
But just save a thought for the animals
That have died in pain for you

Don't think by turning you face the other way
All pain and suffering will just go away

Don't be blinded by scientists
Like so many animals have been
If you think this cruelty is wrong
Protest against it happening
You don't have to use products
That contain animal abuse
There are many many alternatives
Go and have a look

Don't think by turning your face the other way
All pain and suffering will just go away"
91,Amy Grant,Arms Of Love,TRDJSYS128F424841B,1982,"Lord I'm really glad You're here.
I hope you feel the same when You see all my fear,
And how I fail,
I fall sometimes.
It's hard to walk on shifting sand.
I miss the rock, and find there's nowhere left to stand;
I start to cry.
Lord, please help me raise my hands so You can pick me up.
Hold me close,
Hold me tighter.

I have found a place where I can hide.
It's safe inside
Your arms of love.
Like a child who's helped throughout a storm,
You keep me warm
In Your arms of love.

Storms will come and storms will go.
Wonder just how many storms it takes until
I finally know
You're here always.
Even when my skies are far from gray,
I can stay;
Teach me to stay there,

In the place I've found where I can hide.
It's safe inside
Your arms of love.
Like a child who's helped throughout a storm,
You keep me warm
In Your arms of love."
92,Michael Jackson,Billie Jean,TROTIPO12903CCE92B,1982,"She was more like a beauty queen from a movie scene
I said don't mind, but what do you mean I am the one
Who will dance on the floor in the round
She said I am the one, who will dance on the floor in the round

She told me her name was Billie Jean, as she caused a scene
Then every head turned with eyes that dreamed of being the one
Who will dance on the floor in the round

People always told me be careful of what you do
And don't go around breaking young girls' hearts
And Mother always told me be careful of who you love
And be careful of what you do 'cause the lie becomes the truth

Billie Jean is not my lover
She's just a girl who claims that I am the one
But the kid is not my son
She says I am the one, but the kid is not my son

For forty days and forty nights
The law was on her side
But who can stand when she's in demand
Her schemes and plans
'Cause we danced on the floor in the round
So take my strong advice, just remember to always think twice
(Do think twice, do think twice)

She told my baby we'd danced till three, then she looked at me
Then showed a photo my baby cried his eyes were like mine (oh, no!)
'Cause we danced on the floor in the round, baby

People always told me be careful of what you do
And don't go around breaking young girls' hearts
She came and stood right by me
Just the smell of sweet perfume
This happened much too soon
She called me to her room

Billie Jean is not my lover
She's just a girl who claims that I am the one
But the kid is not my son

Billie Jean is not my lover
She's just a girl who claims that I am the one
But the kid is not my son
She says I am the one
But the kid is not my son
She says I am the one
But the kid is not my son

Billie Jean is not my lover
She's just a girl who claims that I am the one
But the kid is not my son
She says I am the one
But the kid is not my son

She says I am the one
(you know what you did
(She says he is my son
Breaking my heart babe)
She says I am the one

Billie Jean is not my lover
Billie Jean is not my lover
Billie Jean is not my lover
Billie Jean is not my lover
(Don't Billie Jean)
Billie Jean is not my lover
Billie Jean is not my lover"
93,Tuomari Nurmio,Punainen planeetta,TROCOQU128F934449C,1982,"Anna anteeksi eno että katosin
Sanomatta sanaakaan
En tahtonut navetan piikaa
Syliini kikattamaan
En sietänyt silakan hajua
Ja koirien haukuntaa
En jaksanut lypsää lehmää
Viideltä aamulla

Navetan piika kikattaa liikaa
Ja nukahtaa heti
Jos ei sitä kutiteta

Minä valvoin aamuun asti
Ullakkokamarissa
Ja katselin putkeni läpi
Punaista planeettaa

Otin käskyjä vastaan kaukaa
Viisailta olennoilta
Jotka käyttävät vaivattomasti
Valtavaa energiaa

Minä painoin mieleeni kaiken
Unessa opetetun
Alusten aikataulut
Reitit ja asemat
Baarit ja käyntikortit
Tullit ja valuutat
Eno hyvä meitä kutsuu
Punainen planeetta

Siellä tyttöset laulavat lalalaa
Jodoladi jodolaiduu

Vaikene kaikesta tästä ja pakkaa tavarasi
Me lähdemme yhdessä matkaan
Kohti punaista planeettaa"
94,Iron Maiden,Gangland (1998 Digital Remaster),TRXMGJD128F146F759,1982,"Shadows may hide you but also may be your grave.
You're running today, maybe tomorrow you'll be saved.
You pray for daylight to save you for a while.
You wonder if your children will face the killer's smile.

Dead men - tell no tales,
In Gangland - murder's up for sale.
Dead men - tell no tales,
In Gangland - where the jailbirds die.

Face at the window leers into your own.
But it's only your reflection, still you tremble in your bones.
How long can you hide? How long 'til they come?
A rat in a trap but you've got to survive.

Once you were glad to be free for a while.
The air tasted good and the world was your friend.
Then came the day when the hard times began.
Now you're alone but alive for how long?

A knife at your throat, another body on the pile.
A contract to keep and it's service with a smile.
Murder for vengeance or murder for gain.
Death on the streets or a blacked out jail.

Dead men - tell no tales,
In Gangland - murder's up for sale.
Dead men - tell no tales,
In Gangland - where the jailbirds die.

In Gangland you tell no tales."
95,Romeo Void,Chinatown,TRTYEUE128F426BA31,1982,"Take the words out of my mouth
And throw 'em out the door
I'll follow 'em out and if you want
If you want more
Bring a bag, some money
Food stamps, whatever
In this part of town, boy
You get a lot for your money

Spending time with family friends
Pleasure in unknown weather
Associates on the landscape
Sovereign from their rulers
I braid arrows in my hair and ambush your radio
It's a history lesson, my money's missing
It's how I get my pleasure

Chinatown, run aground
Broadway turned it down
Chinatown, run aground
Downtown turned it 'round

He waits in the shadows
A black leather jacket
So close are we now
I know he can smell it
Our hope, our desire
Our money in hand
On Chinese New Year
We're gonna burn the white dog, man

Though all around town there are risks to be taken
Bars to fall out of and asses shakin'
In twenty-four hours, in twenty-four blocks
I couldn't count more faces, understand less talk
Oh, oh, oh

Chinatown, run aground
Broadway turned it down
Chinatown, run aground
Downtown turned it 'round

Chinatown
Chinatown
China, China, Chinatown
China, China, Chinatown"
96,Alabama,Take Me Down,TRYNUGG128F4283E60,1982,"Fly away with me tonight
Take me on a one-way flight in your lovin' arms
And ev'rything's gonna be alright
You're the one who took my hand
When no one else could understand
You're the one who moves me
Like nobody else can.

Take me down where I wanna be
Turn around, this man who lives inside of me
Take me down and love me all night long
Hold me close and make me strong
Take me down, take me down tonight.

In your eyes I see a light
It's your emotions glowin' bright
So keep the fires burnin'
And let it warm me through the night.
You can be a part of me
'Cause you're what love was meant to be
You and me, baby
We'll set this flame inside free.

Take me down where I wanna be
Turn around, this man who lives inside of me
Take me down and love me all night long
Hold me close and make me strong
Take me down, take me down tonight.

You don't have to stay forever
Let's just put our hearts together
Share another night in ecstasy
We know that it's feelin' better
Ev'ry time we get together
Maybe love was meant for you and me
Whoa.

Take me down where I wanna be
Turn around, this man who lives inside of me
Take me down and love me all night long
Hold me close and make me strong
Take me down, take me down tonight.

Take me down tonight
Ooh oh, take me down tonight
Ooh oh, are you gonna take me, (take me)
Shake me, (shake me)
Take me down tonight.
um hum
Take me, take me..."
97,The Adicts,Disco,TREIBLK128F148642C,1982,"hey pete!
what do you want
hey pete!
can't here you monkey,your music is too loud
don't you wanna go
don't you wanna go
hel mel!
what you talking about
hey mel!
what?
don't you wanna go
go where 
don't you wanna go
no mate
tonight,tonight,tonight,tonight,
tonight,tonight,tonight 
to the disco (2 times)
hey kid!
shut up monkey i'm talking
hey kidcan't hear mate
don't you wanna go
na na
hey you!
what 
i'm talking to you
who, what
don't you wanna go
no 
don't you wanna go
no!
tonight,tonight,tonight,tonight
tonight,tonight,tonight
to the disco (2 times)
i don't wanna go 
to the disco"
98,Ronnie Milsap,You Took Her Off My Hands (Now Take Her Off My Mind),TROEKWT128F42936BC,1982,"You took her off my hands when you've stepped in
You changed everything we're not even friends
Don't leave the job half done leave nothing behind
You took her off my hands now please take her off my mind.

Please take her photograph engraved on my heart's so blue
And take all the memories she now belongs to you
Don't leave the job half done leave nothing behind
You took her off my hands now please take her off my mind.

Please take her photograph engraved on my heart's so blue
And take all the memories she now belongs to you
Don't leave the job half done leave nothing behind
You took her off my hands now please take her off my mind..."
99,Dazz Band,Let It Whip,TREAWNP128F1490DFD,1982,"Wanna see you whip it
Sho could treat you right
Give me just a minute
Of your time tonight
We both are here to have good fun
So let it whip

We'll get into grooving
Love your body language
Baby, let me know
You've got me sort of anxious
We both are here to have good fun
So let it whip

So let it whip (let's whip it, baby)
Child (let's whip it right)
Get a grip (let's whip it, baby, whip it all night)
Now don't you trip (no, no)
Child
Come on, let it whip (oh)

Now that you can see
How you groove with me
What else can I do
To get closer to you
We both are here to have good fun
So let it whip

We have the natural feeling
Obviously revealing
Let me be your paper man
I'd love to be your joker man
We both are here to have good fun
So let it whip

So let it whip (let's whip it, baby)
Child (let's whip it right)
Get a grip (let's whip it, baby, whip it all night)
Now don't you trip (no, no)
Child
Come on, let it whip (c'mon whip, c'mon whip)

So let it whip (let's whip it, baby)
Child (let's whip it right)
Get a grip (let's whip it, baby, whip it all night)
Now don't you trip (no, no)
Child
Come on, let it whip (c'mon whip, c'mon whip)

(There's no time to lose)
There is no time to lose, yeah
(You're the one I choose, you're so right)
You're the one I choose
I only want to be with you
You're the one for me
Can't you see that I
(I won't waste your time)
I won't waste your time
(I sense something divine in you)
Something divine in you
(Yes I do)
Ooh-hoo

So let it whip (let's whip it, baby)
Child (let's whip it right)
Get a grip (let's whip it, baby, whip it all night)
Now don't you trip (no, no)
Child
Come on, let it whip (c'mon whip, c'mon whip)

Let's whip it, baby
Let's whip it right
Let's whip it, baby
Whip it all night
C'mon whip, c'mon whip

(There's no time to lose)
There is no time to lose
(You're the one I choose, you're so right)
Hey, you're the one I choose
I only wanna be with you
You're the one for me
Can't you see that I
(I won't waste your time)
I won't waste your time
(I sense something divine in you)
There's something divine in you
(Yes I do)
Ooh-hoo

So let it whip (let's whip it, baby)
Child (let's whip it right)
Get a grip (let's whip it, baby, whip it all night)
Now don't you trip (no, no)
Child
Come on, let it whip (c'mon whip)"
100,Bad Religion,Slaves (Album Version),TRVNTLS128F931BF91,1982,"Don't try to say that I threaten your freedom
We've done without for 20 years, so think if we really need 'em

We're all just slaves for the troop commanders (3x)
We're all slaves

We can blow up things better than in any country except this one
Waiting for it too then you realize it ain't too much fun
We're in a country, democracy, supposed to be the best on the globe
Living from the denoument lifted from the high class clones and

We're all just slaves for the system masters (3x)
We're all slaves

And we're all just slaves for the system masters
We're all slaves"
101,Dead Kennedys,Forest Fire,TRKNQYA128F42AC2F7,1982,"No junk food, just earthly goods
I ate weird berries in the woods
Now I'm seeing colors, I'm getting higher
I think I'll start a forest fire

There's a forest fire climbing the hill, burning wealthy California homes
Better run, run, run, run, run, run from the fire
But some of us stay and watch and we think of your insurance costs
And we laugh, laugh, laugh, laugh, laugh, laugh at your lives

Windows covered with bars, security guards
Is that a house or a fortress against the rest of the world?
Your windows covered with bars, security guards
Is that a house or a prison, how you gonna get out?

Electric bull and your tennis courts, pink sports cars and your boats
Getting fried, fried, fried, fried, fried, fried by the fire
Windows covered with bars, floodlights for the yard
It's a pleasure to watch you watch it all melt

But hey, what about the cocaine
Stockpiled in the basement?
You'd better save it
You know you're gonna need it

Where's your brand new pretty wife? She might still be inside
Either save her or your cocaine from the fire
But the gates and doors are locked 'cause the burglar alarms went off
Ever wonder why we laugh, laugh at your lives?

Windows covered with bars, fences spiked with barbed wire
Never looked so helpless engulfed in flames
Cameras watching the walls, don't forget the dogs
Now you're trapped in your prison, how you gonna get out?

See the gerbil run run run run run run run run from the fire"
102,Talking Heads,Stay Hungry (Remastered & Expanded 1980 Version ),TRYTGYY128F14A8C58,1982,"I think that we can signify our love now
Ooh girl, you can initiate an impulse of love

Stay hungry, stay hungry, stay hungry
Move a muscle, move a muscle, move a muscle
Make a motion, make a motion, make a motion
Pull it tighter, pull it tighter, pull it tighter

Double beating, double beating, double beating
Double beating, double beating, double beating
Palpitation, palpitation, palpitation
Stay hungry, stay hungry, stay hungry

Here's that rhythm again
Here's my shoulder blade
Here's the sound I made
Here's the picture I saved

Here's that rhythm again
Here's my shoulder blade
Here's the sound I made"
103,Romeo Void,Wrap It Up,TRUJWBQ128F426C40B,1982,"I've been watchin' you for days now Louie
I just love your sexy ways Louie
You know my love will never stop me Louie
Just put your lovin' in my pocket Louie

No more will I shop around Louie
I've got the best thing in town Louie
I've seen all I wanna see Louie
Bring your love straight to me Louie

Wrap it up, I'll take it
Wrap it up, I'll take it

I've been watchin' you for days now Louie
I just love your sexy ways Louie
You know my love will never stop me Louie
Just put your lovin' in my pocket Louie

No more will I shop around Louie
I've got the best thing in town Louie
I've seen all I wanna see Louie
Bring your love straight to me Louie

Wrap it up, I'll take it
Wrap it up, I'll take it
Wrap it up, I'll take it
Wrap it up, I'll take it

I'm gonna treat you like the king you are
Give you sweet things from my candy jar
You've got tricks you've never used
Give, give it to me it won't get abused

I've been watchin' you for days now Louie
I just love your sexy ways Louie

No more will I shop around Louie
I've got the best thing in town Louie
I've seen all I wanna see Louie
Just bring your lovin' straight to me Louie

Wrap it up, I'll take it"
104,Dexys Midnight Runners,Until I Believe In My Soul,TRAESWB128F149CB2C,1982,"I'll need tonight to sit and think about this
Think what to do.
I'll take some strength to banish hollow sorrow.
Hollow sorrow's nothing new.
Just enough strength to last until tomorrow
Until I believe in my soul.
Tonight I lost sight of all purpose
Despite all this trickery you told me was right.
I was such a good boy I let you hold the door
So kind, so nice, where's my prize?
(That's all there ever is) Oh yeah yeah yeah?
(That's all there ever was) Ah you must be fucking joking.
(The same for everyone) Oh yes. Yes yes.
Would you repeat that. Break it to me gently,
Stand over there.
Oh I know I was an arrogant boy but I let you hold the door
Oh I was kind. I was nice, where's the prize?
And I'm on the train from New Street
To Euston. I'm going out to Harrow again
And I'm trying to get the feeling
That I had in nineteen seventy two.
Oh but you're going too fast for me here,
I'm saying, wait a minute there, wait a minute there
Hold it, stop! Let me get this clear
(That's all there ever is) oh yeah yeah yeah?
(That's all there ever was) yes, yes. ha ha ha.
(The same for everyone) Oh yes. yes. yes.
You see I know what this is, I know
What's going on here, this is just the difference between . . .
It's the battle between the body and the soul. The spirit
And what's needed here. . .
What I intend to do now is I'm going to punish my body.
I'll punish the body to believe in the soul, I will punish
my body, until I believe in my soul."
