,Artist,Title,Track_id,Year,Lyrics
147,Mott The Hoople,Marionette,TRYTDMA128F92F27A3,1974,"No puppet, no liar, won't bend my lips to wire - No
Don't pressurize me so
Don't gamble, with my life, or you won't live to do it twice
Oh take some good advice from me
And let the wires rock

All dressed in black so nobody sees you
Smile in the wings, tell me I please you
Call me a king and watch for the wordworm to choke me

And you're like a giraffe, the performance is poor
Watch the audience laugh as my head hits the floor
When I'm broken in half you still reach for the floor
STOP!

I've had enough of this
The pantomime's reversed
I need -you feed
I greed - you bleed

Marionette - I ain't one yet
Teacher's pet - Well you'd better forget it
Marionette - I ain't one yet
Teacher's pet - Go check your stocks and shares

And when the coffin comes make sure there's room for two

You lied - I led
I died -You're dead

Marionette - I ain't one yet
Teacher's pet - You'd better forget it
Marionette - I ain't one yet
Teacher's pet - go check your product

A traitor, deceiver, a groovy disbeliever I thought
A puppet was a thing cheap-taught - No way
Creator, conceiver, romantic love receiver - caught

""Who are you""
""The nerve""
I wanna get out, I wanna get out, I wanna get out, I wanna get out, I wanna get
Out, AHHHHH!

Oh he wanna play chords to the chick on the street
He wanna play words to a world that don't speak
He wanna play people who play hide 'n' seek when they don't talk

He wanna play a riff to the man with the wires
He wanna play lead but his hand's getting tired
He just wanna play but don't know how to say - STOP

OK, the show's been fun
But my wood's begun to warp
They won -I'm done
New one - begun

Marionette - I did my best
Teacher's pet - It just couldn't last
Marionette - Get me out of this mess
Teacher's little pet - It happened so fast
Marionette - Now I need a rest
Teacher's pet - Where's my sanity gone - Mother?
Marionette - I did my best
Teacher's little pet - I'm just like all the others

They gambled, with my life
And now I've lost my will to fight
Oh God these wires are so tight....
I'm just a marionette."
148,Gasolin',Stakkels Jim,TRMZJQV128F92DD0E8,1974,"Der lød en stille hvisken,
Og tiden gik i stå
Den dag, de stilled bilerne
Og gik bort på må og få.

Nu vandrer de på sletterne
Og stammens gamle mænd,
De synger op til stjernerne:
Lad det aldrig ske igen.

På gaden i den døde by
Der sidder Stakkels Jim,
I nattens mørke drømmer han
Om den tid, der var engang.

""En dag tog pokker pludselig ved menneskene,
De forlod deres store byer og deres fabrikker
Og deres flotte biler.
Og gik ud på sletten og sagde,
La' os begynde helt forfra igen.
Men tilbage i den døde by,
Der sidder der en mand som ikke kan glemme den tid
Og det er ham som de kalde Stakkels Jim.""

Nu vandrer de på sletterne
Og stammens gamle mænd,
De synger op til stjernerne:
Lad det aldrig ske igen."
149,Camilo Sesto,Madre,TRKNRII128F429F63E,1974,"Ay madre... ay madre
siempre cerca y siempre lejos
ay madre... ay madre
no te olvido porque te quiero

Te hablo como amigo
yo no tengo a quién darle
el cariño que desde niño 
tú me regalaste

Me acostumbré tanto a ti
que cuando estoy con alguien
quiero que sea como
y como tú no hay nadie

Eres...
eres mujer de alma grande
mujer hecha de amor

Eres...
eres mujer de mi padre
y como mujer y amiga 
la mejor, la mejor...

Y aunque mi vida es joven
alguna vez me siento viejo
y en la hoguera de mis sueños
yo voy quemando mi tiempo

Eres...
eres mujer de alma grande
mujer hecha de amor

Eres...
eres mujer de mi padre
y como mujer y amiga 
la mejor, la mejor...

Y aunque mi vida es joven
alguna vez me siento viejo
y en la hoguera de mis sueños
yo voy quemando mi tiempo

Ay madre...
ay madre ... 
ay madre ..."
150,Syreeta,Spinnin' And Spinnin',TRDXEVQ128F146E2D2,1974,"Spinnin' and spinnin' and spinnin' around
Painting the town I'm never coming down
Spinnin' and spinnin' and spinnin' around
I'm out on the town I'm never coming down

Got a life I wanna live
A man will shower me with expensive gifts
And of course there's his love
I don't want to be, I don't want to be
Just another feather in a cap you see
So if you offer me know that I want to be

Just spinnin' and spinnin' and spinnin' around
Painting the town I'm never coming down
Spinnin' and spinnin' and spinnin' around
Out on the town I'm never coming down

Not that I want everything
Just a few of those little precious things
That there's smiles in my eyes
I don't want to be, I don't want to be
Just another toy that is ruined
So I'm flying free, know that I'm wild

And I'll be spinnin' and spinnin'
And spinnin' around

Give me one or two compliments
Tell me that my love is heaven sent
And that living is free
Free enough to go everywhere
Just to drop a dime and we're in the air
Yes of course there is love
Wonder how much I'll see"
151,John Fahey,Boodle AM Shake,TRDHCTA128F9316AD6,1974,"Boodle am, boodle am, boodle am, boodle am, boo
Toodle am, toodle am, toodle am, toodle am, too

I know this song, it don't mean a doggone thing
All you got to do is that good old Charleston swing
And sing
Boodle am, boodle am, boodle am, boodle am, boo
Toodle am, toodle am, toodle am, toodle am, too"
152,Linda Ronstadt,You Can Close Your Eyes,TRCYDEU128F1456FA1,1974,"written by James Taylor
© Country Road Music Inc/ Blackwood Music Inc

Well the sun is slowly sinking down
The moon is surely rising
This old world must still be spinning 'round
And I still love you

So close your eyes
You can close your eyes it's alright
I don't know no love song
I can't sing the blues anymore
But I can sing this song
You can sing this song when I'm gone

Well it won't be long before another day
We're gonna have a good time
No one's gonna take that time away
And you can stay as long as you like

So close your eyes
You can close your eyes it's alright
I don't know no love song
I can't sing the blues anymore
But I can sing this song
You can sing this song when I'm gone

So close your eyes
You can close your eyes it's alright
I don't know no love song
I can't sing the blues anymore
But I can sing this song
You can sing this song when I'm gone"
153,Betty Davis,They Say I'm Different,TRKHFDL128F4285278,1974,"They say I’m different cause I’m a piece of sugar cane
Sweet to the core that’s why I got rhythm
My great grandma didn’t like the foxtrot
Nah, instead she’d spit her snuff and boogie to Elmore James


They say I’m different cause I eat chitlins
I can’t help it I was born &amp; raised on’em, that’s right
Every mornin’ I’d have to slop the hogs
And they’d be gettin’ off humpin’ to John Lee Hooker

They say I’m different cause I’m a piece of sugar cane
And when I kick my legs, I got rhythm
My great grandpa was a blues lover
He’d be rockin’ his moonshine to B.B. King and Jimmy Reed, rock on now…

And that’s why they say I’m different
And that’s why they say I’m strange

I’m talkin bout Big Momma Thornton
Lightning Hopkins
Howling Wolf
Albert King
Chuck Berry (x3)
When I was sweet sixteen

And that’s why they say I’m different
And that’s why you think I’m strange

I’m talkin bout T-Bone Walker
(I get my) Muddy Waters
Leadbelly
Sonny Terry
Brownie Mcghee
Son House and Freddie King

Bessie Smith (x2)
Oh Hey
Bo Diddley have you heard

That’s why they say I’m different
That’s why they say I’m strange
That’s why they say I’m funky
Little Richard wow you sure showed ‘em you sure could sing
Alright alright

Robert Johnson (X3)
He played the blues for me

That’s why
And that’s why
And that’s why they say I’m different…

That’s why
And that’s why
And that’s why they say I’m strange…

That’s why
And that’s why
And that’s why they say I’m funky…"
154,Charley Pride,All His Children,TRRZDHM128F428D4E5,1974,"When you're standing alone 
With the mountains and the sea 
Where the arms of the world are opened wide 
Where the truth is as plain as the falling rain 
And as sure as the time and the tide 

You know we're all his children 
His next of kin that's the way it's began 
No matter where you're going or where you've been 
You are part of the family of men 

When you walk down the road and the sun is on your side 
With the sweet river breeze for your face 
Though you don't hear a sound as you look around 
Everything sort of fall into place 

You know we're all his children 
His next of kin that's the way it's began 
No matter where you're going or where you've been 
You are part of the family of men"
155,Cat Stevens,Ghost Town,TRJUNAD128E07900B6,1974,"Come on lets go down
Everybodys waiting for us
Down at the ghost town
Bill Bailey said he'd be around
If Mrs. G. Robinson would just put
That bad Havana down

Lovely Queen Anne Boleyn
Learning new tricks from the Great Houdini Wo Wo
Now thats the way she's gonna make it Wo Wo

Come on
Come on lets go down
Everybody's waiting for us
Down at the boom town
O. Redding &amp; Washington
Chico and Harpo and Karl are
In the Kitchen with mum

Buster Keaton and King Tut
Are waiting for Disney to wake up Wo Wo
Now that's the way
No that ain't the way he's gonna make it"
156,Sly & The Family Stone,Small Talk,TRCZGXP128F42BCEB4,1974,"It's the way you sound
The reason that you know yeah
It's the way you get down
I can tell you really are it

Small talk how you doing there
Small talk how you doing boy
Small talk whatcha doing there
Oooh, small talk uh-huh

Small talk, small talk
Small talk, small talk

Get on down small talk
I like you small talk
Uh-uh-ooh small talk

Don't let him cry
Don't let him cry
Small talk
Don't let them cry
Don't you let any body cry small talk

Don't let them cry
Don't you let that big boy cry small talk"
157,Earth Wind & Fire,Devotion,TRUDKCK128EF365E09,1974,"Through devotion
Blessed are the children
Praise the teacher
That brings true love to many

Your devotion
Opens all life's treasures, yeah
And deliverance
From the fruits of evil

So our mission
To bring a melody
Ringin' voices, woo hoo
Sing sweet harmony

For you here's a song
To make your day brighter
One that will last you long
Through troubled days

Giving your heart, ooh
The light to brighten
Oh, oh, oh, all of the dark 
That falls in your way

You need devotion
Bless the children, whoa
Deliverance 
From the fruits of evil

In everyone's life
There's a need to be happy
Let the sun shine
A smile your way

Open your heart
Feel a touch of devotion
Maybe this song
Will help uplift your day
Make a better way

You need devotion
You need devotion
Bless the children
Deliver from the fruits of evil

You need devotion
You need devotion
Bless the children
Why don't you bless the children
Deliver from the fruits of evil

You need devotion
You need devotion
Bless the children"
158,Commodores,Young Girls Are My Weakness,TRQMFLB128E07941F0,1974,"Young girls are my weakness
Young girls are my weakness
I just like their sweetness
Young girls are my weakness

Hey girls let's mess around
I wanna party with you on the town
Some girls really make me swing
There ain't nothin' like a pretty young thing

Young girls are my weakness
I just like their sweetness

Young girls are really mellow
You don't believe me then just try this fellow
(I know what to say when they call me on the phone)
You call me back when your dad leaves home

Young girls you make me move
Young girls you set the groove
Young girls sweet as honey
Young girls take all my money

(pretty girl what ya gonna do?)
I just wanna get me hands on YOU

Hey girls let's mess around
I wanna party with you on the town
some girls really make me swing
There ain't nothin' like a pretty young thing 

Young girls are my weakness
I just like their sweetness

Young girls you make me move
Young girls you set the groove
Young girls sweet as honey
Young girls take all my money

Young girls are my weakness
I just like their sweetness
Young girls are my weakness
I just like their sweetness"
159,The Doobie Brothers,Daughters Of The Sea (LP Version),TRFCNIC128F4233CF7,1974,"Autumn breeze blowin' to the east
Shift of breeze upon a sea of peace
Hear them call, can't you hear them sing
Hear them call, how their voices ring
Dizzy dancin', golden ladies
Misty eyes that cannot fool
Silver shoreline waves come crashin'
To the end of all of you 

Like a spider weavin' silken nets
Fingers move, swaying silhouettes
Hear them call, can't you hear them sing
Hear them call, how their voices ring
Spinning, turning, moonlit madness
'Round the fire burnin' bright
I can see it risin' higher
Lightin' up the starry night 

Hear them call, can't you hear them sing
Hear them call, how their voices ring
Hear them call, can't you hear them sing
Hear them call, how their voices ring"
160,Los Pasteles Verdes,El Reloj,TRSRKEC12903CB3B98,1974,"Reloj, no marques las horas

por que voy a enloquecer,

ella se ira para siempre

cuando amanezca otra vez.

----

No mas, nos queda esta noche

para vivir nuestro amor,

y tu tic tac me recuerda

su irremediable dolor.

----

Reloj deten tu camino

por que mi vida se apaga,

ella es la estrella que alumbra mi ser

yo sin su amor no soy nada.

----

Deten el tiempo en tus manos

haz de esta noche perpetua,

para que nunca se vaya de mi

para que nunca amanezca."
161,Big Star,Daisy Glaze,TROYLHS12903D0024A,1974,"I'm driving alone
Sad about you
Not going home
What's to do
You better not leave me here
Better not leave me here
Ooh I want you here
How can you leave me here.

I lie in a stream
And floating fine
Receiving things
In my beautiful mind
Sometimes oh sometimes
Sometimes oh sometimes
Lover yes I am
Lover you know I am.

Now I'm in a bar
That's got to be where they are
Going to dance in the bar
They're going to fight on the floor
Faster than I can see.

Now I gonna score
Make for the door
Who is this whore ?
Soon be beggin drags.

And I'm thinking Christ
Nullify my life.

You're going to die
You gonna decease."
162,Thin Lizzy,Frankie Carroll,TRPTFLT128F145A9B8,1974,"Frankie Carroll
He got drunk last night
I tried my best to help him
But he wound up in a fight
And his missy got him
She said, ""Frankie, it's all right""
""Frankie won't do you wrong""

Frankie Carroll
He beat his kids last night
""I don't like you kids shouting""
""Shut up now, I don't care who's wrong or right""
And his missy got him
She said, ""Frankie, I'll keep the kids quiet""
Frankie, Frankie, what's wrong?

Frankie Carroll
He fell to bed last night
And his head hung off of the pillow
And his eyes were closed shut tight
And his missy she got up
And turned out the light
Frankie, Frankie, what's wrong?

Frankie Carroll was with a woman last night"
163,Steve Harley & Cockney Rebel,Mr. Soft,TRPHCYU128EF345FA9,1974,"Harley

Mr. Soft, turn around and force the world
To watch the things you're going through
Oh, Mr. Soft, believe everything they tell you
And be dammed if they'll thank you.
 
You paint everything so cruel
Coming on like Mr. Cool
Paint your face and shut the gate
No one's coming home till late, ooh-la!

Don't you know ?  Life gets tedious enough 
Without this extra grudge to bare
You, so slow, shift your ideas, make your mind up 
In a jiffy, let's be fair.

We'll all be taking off tonight
Turn off your eyes and shut the light
You're the most, you're so unreal
We'd all be dead without your spiel, ooh-la, ooh, take it!

Ooh!

Oh, Mr. Soft, go to town and bring the dawn in
In the morning on your way
Mr. Soft, put your feet upon the waters
And play Jesus for the day.

You begin to hear them mumble
Spot the Starman, rough-and-tumble 
Fight the good fight, sling your axe 
Watch the speaker lead the packs, ooh, here we go, we go!"
164,J.J. Cale,Precious Memories,TRJIFMS128F145AB6A,1974,"Hell, I travel on life's pathways
Know not what the years may hold
Hell, I've wandered, oh, grows fonder
Precious memories flood my soul

Precious memories, how they linger
How they ever flood my soul
In the stillness of the midnight
Precious, sacred scenes unfold

Precious memories, how they linger
How they ever flood my soul
In the stillness of the midnight
Precious, sacred scenes unfold"
165,Blue Oyster Cult,Astronomy,TRVSNLC128F4264D59,1974,"The clock strikes twelve and moondrops burst 
Out at you from their hiding place 
Like acid and oil on a madman's face 
His reason tends to fly away   
Like lesser birds on the four winds 
Like silver scrapes in May 
And now the sand's become a crust 
And most of you have gone away

Come Susie dear, let's take a walk 
Just out there upon the beach 
I know you'll soon be married 
And you'll want to know where winds come from   
Well it's never said at all 
On the map that Carrie reads 
Behind the clock back there you know 
At the Four Winds Bar   

Hey!  Hey!  Hey!  Hey!

Four winds at the Four Winds Bar 
Two doors locked and windows barred 
One door to let to take you in 
The other one just mirrors it

Hey!  Hey!  Hey!  Hey!

Hellish glare and inference 
The other one's a duplicate 
The Queenly flux, eternal light 
Or the light that never warms  
Or the light that never, never warms 
Or the light that never
Never warms 
Never warms
Never warms

The clock strikes twelve and moondrops burst 
Out at you from their hiding place 
Miss Carrie nurse and Susie dear 
Would find themselves at Four Winds Bar

It's the nexus of the crisis 
And the origin of storms 
Just the place to hopelessly 
Encounter time and then came me 

Hey!  Hey!  Hey!  Hey!

Call me Desdinova
Eternal light 
These gravely digs of mine 
Will surely prove a sight 
And don't forget my dog
Fixed and consequent

Astronomy...a star
Astronomy...a star
Astronomy...a star
Astronomy...a star

Imaginos version
Note: The spoken intro by Stephen King appears on the single only, not on the album version

(Spoken by Stephen King):
Imaginos, performed by Blue Oyster Cult...A bedtime story for the children of the damned.
From a dream world paralleling our Earth in time and space, the Invisible Ones have sent an agent who will dream the dream of history.  With limitless power, he becomes the greatest actor of the 19th century. Taking on many disguises, he places himself at pivotal junctures in history, continually altering its course and testing our ability to respond to evil.
His name...is Imaginos.

The clock strikes twelve and moondrops burst 
Out at you from their hiding place 
Like acid and oil on a madman's face 
Reason tends to fly away   
Like lesser birds on the four winds 
Like silver scrapes in May 
Now the sand's become a crust 
And most of you have gone away

Come, Susie dear, let's take a walk 
Just out there upon the beach 
I know you'll soon be married 
And you'll want to know where wind comes from   
Well it's never said at all 
On the map that Carrie reads 
Behind the clock back there you know 
At the Four Winds Bar   

Hey!  Hey - Hey!
Hey!  Hey - Hey!
Hey!  Hey - Hey!
Hey!  Hey - Hey!

Four doors at the Four Winds Bar 
Two doors locked and windows barred 
One door to let to take you in 
The other one just mirrors it

Hey!  Hey - Hey!
Hey!  Hey - Hey!
Hey!  Hey - Hey!
Hey!  Hey - Hey!

Hellish glare and inference 
The other one's a duplicate 
The Queenly flux, eternal light 
Or the light that never warms  
Or the light that never, never warms 
Or the light that never...
Never...
Never...
Never...
Never warms

The clock strikes twelve and moondrops burst 
Out at you from their hiding place 
Miss Carrie nurse and Susie dear 
Find themselves at Four Winds Bar

It's the nexus of the crisis 
And the origin of storms 
Just the place to hopelessly 
Encounter time and then came me 

Hey!  Hey - Hey!
Hey!  Hey - Hey!
Hey!  Hey - Hey!
Hey!  Hey - Hey!

Call me Desdinova
Eternal light (light)
These gravely digs of mine 
Will surely prove a sight 
And don't forget my dog
Fixed and consequent

Hey!  Hey - Hey!
Hey!  Hey - Hey!
Hey!  Hey - Hey!
Hey!  Hey - Hey!

Hey!  Hey - Hey!
Hey!  Hey - Hey!
Hey!  Hey - Hey!
Hey!  Hey - Hey!

Hey!  Hey - Hey!
Hey!  Hey - Hey!
Hey!  Hey - Hey!
Hey!  Hey - Hey!

Astronomy...a star
Astronomy...a star
Astronomy...a star
Astronomy...a star

A star!"
166,Ry Cooder,Ditty Wah Ditty,TRILDWF128F933FDFE,1974,"(Arthur Blake) 

There's a great big mistery 
And it sure is worrying me 
It's a ditty wah ditty 
Mister ditty wah ditty 
I wished somebody would tell me what ditty wah ditty means 

I went out and walked around 
Somebody yelled, ""Now who's in town ?"" 
Mister ditty wah ditty 
Mister ditty wah ditty 
I wished somebody would tell me what ditty wah ditty means 

Some little girl 'bout four-feet-four 
Said, ""Come on, papa, and gimme some mo'"" 
Your ditty wah ditty 
Your ditty wah ditty 
I wished somebody would tell me what ditty wah ditty means 

I went to church, put my hat on the seat 
A lady sat on it and said, ""Daddy you sho' is sweet"" 
Mister ditty wah ditty 
Mister ditty wah ditty 
I wished somebody would tell me what ditty wah ditty means 

I said, ""Sister, I'll soon be gone 
Just give me that thing that you're sitting on"" 
My ditty wah ditty 
Mister ditty wah ditty 
I wished somebody would tell me what ditty wah ditty means 

Then I got put outta the church 
'Cause I talked about ditty wah ditty too much 
Mister ditty wah ditty 
Mister ditty wah ditty 
I wished somebody would tell me what ditty wah ditty means"
167,Joni Mitchell,Woman Of Heart And Mind (Live LP Version),TRJUQXK128F428D803,1974,"I am a woman of heart and mind
With time on her hands
No child to raise
You come to me like a little boy
And I give you my scorn and my praise
You think I'm like your mother
Or another lover or your sister
Or the queen of your dreams
Or just another silly girl
When love makes a fool of me

After the rush when you come back down
You're always disappointed
Nothing seems to keep you high
Drive your bargains
Push your papers
Win your medals
Fuck your strangers
Don't it leave you on the empty side
I'm looking for affection and respect
A little passion
And you want stimulation-nothing more
That's what I think
But you know I'll try to be there for you
When your spirits start to sink

All this talk about holiness now
It must be the start of the latest style
Is it all books and words
Or do you really feel it?
Do you really laugh?
Do you really care?
Do you really smile
When you smile?
You criticize and you flatter
You imitate the best
And the rest you memorize
You know the times you impress me most
Are the times when you don't try
When you don't even try"
168,The Who,Long Live Rock,TRTHBCT128E078F151,1974,"Down at the Astoria the scene was changing
Bingo and rock were pushing out X-rating
We were the first band to vomit in the bar
And find the distance to the stage too far
Meanwhile it's getting late at ten o'clock
Rock is dead they say
Long live rock

Long live rock, I need it every night
Long live rock, come on and join the line
Long live rock, be it dead or alive

People walk in sideways pretending that they're leaving
We put on our makeup and work out all the lead-ins
Jack is in the alley selling tickets made in Hong Kong
Promoter's in the pay box wondering where the band's gone
Back in the pub the governor stops the clock
Rock is dead, they say
Long live rock

Long live rock, I need it every night
Long live rock, come on and join the line
Long live rock, be it dead or alive

Landslide, rocks are falling
Falling down 'round our very heads
We tried but you were yawning
Look again, rock is dead, rock is dead, rock is dead

The place is really jumping to the high-watt amps
'Til a 20-inch cymbal fell and cut the lamps
In the blackout they dance right into the aisle
And as the doors fly open even the promoter smiles
Someone takes his pants off and the rafters knock
Rock is dead, they say
Long live rock, long live rock, long live rock

Long live rock, long live rock, long live rock
Long live rock, long live rock, long live rock

Long live rock, I need it every night
Long live rock, come on and join the line
Long live rock, be it dead or alive"
169,Los Pasteles Verdes,Recuerdos de Una Noche,TRPWTJP12903CADA0F,1974,"Quiero, recordar esta noche,

momentos, que no volveran,

y hacer, de aquellos poemas,

tristes, como una oracion.

----

Una oracion, que tiene mucho amor,

como el que yo, te tuve alguna vez,

tanto amor, que no puedo explicar,

por que ya, no estas aqui.

----

Junto a mi, como ayer en mis brazos,

mirando el cielo, la obscuridad,

y asi estoy, recordando, tu amor."
170,John Denver,Back Home Again,TRCZEZF12903CBAB30,1974,"There's a storm across the valley
Clouds are rolling in
The afternoon lies heavy
On your shoulders
There's a truck out on the four lane
A mile or more away
And the whining of his wheels
Just makes it colder

He's an hour away from riding
On his prayers up in the sky
And ten days on the road
Are barely gone
Like a fire softly burning
Supper's on the stove
It's the light in your eyes
That keeps him warm

Hey it's good to be back home again
Sometimes this old farm
Feels like a long lost friend
Yes, and hey it's good to be back home again

There's all the news to tell him
How you've spent your time
And what's the latest thing the neighbors say
And your mother called last Friday
Sunshine made her cry
And you felt the baby move just yesterday

Hey it's good to be back home again
Sometimes this old farm
Feels like a long lost friend
Yes, and hey it's good to be back home again

And all the time that I can lay this tired old body down
To feel your fingers feather soft upon me
The kisses that I live for 
The love that lights my way
The happiness that living with you brings me

It's the sweetest thing i know of
Just spending time with you
It's the little things that make a house a home
Like a fire softly burning, supper's on the stove
And it's the light in your eyes that makes me warm

Hey it's good to be back home again
Sometimes this old farm
Feels like a long lost friend
Yes, and hey it's good to be back home again
I said hey it's good to be back home again..."
