,Artist,Title,Track_id,Year,Lyrics
111,Julie London,Moments Like This,TRDRCFB128F145D5B3,1956,"Moments like this make me thrill through and through
Careless moments like this close to you
Nonchalantly we dine and we dance
And my heart seems to melt in your glance

Moments like this with the soft lights aglow
And I long for your kiss though I know
I'd be just one of all your affairs
But at moments like this, who cares

I'd be just one of all your affairs
But at moments like this, who cares."
112,Julie London,I'll Remember April,TRDKSVE12903CC9CED,1956,"This lovely day will lengthen into evening,
We'll sigh good-bye to all we've ever had,
Alone where we have walked together,
I'll remember April and be glad

I'll be content, you loved me once in April,
Your lips were warm, and love and spring were new,
But I'm not afraid of autumn, and her sorrow,
For I'll remember,
April and you!

The fire will dwindle into glowing ashes,
For flames and love live such a little while
I won't forget, but I won't be lonely,
I'll remember April, and I'll smile"
113,Kitty Wells,Whose Shoulder Will You Cry On,TRRRORA128F933440F,1956,"Once you were my life and breath
And you rode your free horse to death
Oh you trifled around too much
Then you lost your loving touch

Now whose shoulder will you cry on
You didn't love me all alone
'Cause you can't love and do me wrong
I don't trust you no more
So go knock on another's door
And whose shoulder will you cry on

Just let those hot tears burn your eyes
They're just payments on the line
That made a wreck of me
From that chain I've been set free
Now whose shoulder will you cry on

You didn't love me all alone..."
114,Kitty Wells,I've Kissed You My Last Time,TRFALCX12903CA748A,1956,"Down the road of love I see sign after sign that tells me you're no longer mine
But a heart full of love is a heart sad and blind
I love you so and it hurts me to know that I've kissed you my last time

Every sign that I see tells me you're not for me
But I cherrish thoughts of days gone by
I'll be your slave till I'm in my grave
I love you so and it hurts me to know that I've kissed you my last time

I have searched everywhere but there's nothin' can compare
With the thrill of your kiss that once was mine
But now your kiss is so cold don't know what the future holds
I love you so and it hurts me to know that I've kissed you my last time"
115,Kitty Wells,Making Believe,TRQEDLF12903CA9213,1956,"Making believe that you still love me
It's leaving me alone and so blue
But I'll always dream
Still, I'll never own you
Making believe
It's all I can do

Can't hold you close 
When you're not with me
You're somebody's love
You'll never be mine
Making believe
I'll spend my lifetime 
Loving you
Making believe

Making believe that I never lost you
But my happy hours I find are so few
My plans for the future will never come true
Making believe
What else can I do?

Can't hold you close
When you're not with me
You're somebody's love
You'll never be mine
Making believe
I'll spend my lifetime 
Loving you
Making believe"
116,Kitty Wells,Release Me,TRSPMQU128F146FD30,1956,"Please release me
Let me go
I don't love you anymore

To live together is a sin
Release me 
And let me love again

I have found a new love dear
And I'll always want him near
His lips are warm
While yours are cold

Release me darling
Let me go

Oh please release me
Let me go..."
117,Lena Horne,Stormy Weather,TRWOKJB12903CA9625,1956,"Don't know why
There's no sun up in the sky,
Stormy weather,
Since my man and I ain't together,
Keeps rainin' all the time.

Life is bare,
Gloom and misery everywhere,
Stormy weather,
Just can't get my poor self together,
I'm weary all the time, the time.
So weary all the time.

When he went away, the blues walked in and met me,
If he stays away, old rocking chair will get me,
All I do is pray the Lord above will let me
Walk in the sun once more.

Can't go on,
All I have in life is gone,
Stormy weather,
Since my man and I ain't together,
Keeps rainin' all the time.
Keeps rainin' all the time.

I walk around, heavy-hearted and sad,
Night comes around, I'm still feelin' bad,
Rain pourin' down, blindin' every hope I had,
This pitterin', patterin', beatin' and spatterin' drives me mad!
Love, love, love, love!
This misery is just too much for me!

Can't go on,
Everything I had is gone,
Stormy weather,
Since my man and I ain't together,
Keeps rainin' all the time,
Keeps rainin' all the time."
118,Lena Horne,From This Moment On,TRQFJHD128F930587F,1956,"From this moment on
You for me, dear
Only two for tea, dear
From this moment on

From this lucky day
No more blue songs
Only hoop-de-doo songs
From this moment on

Oh, you've got the love I need so much
Got the skin I love to touch
Got the arms to hold me tight
Got the sweet lips to kiss me goodnight

From this moment on
You and I, dear
We'll be ridin' high, dear
Every care is gone
From this moment on

You've got the love I need so much
Got the skin I love to touch
Got the arms to hold me tight
You've got the sweet lips to kiss me
And kiss me and kiss me and kiss me and

From this moment on
You and I, babe
We'll be ridin' high, babe
Every care is gone

From
This
Moment
On"
119,Lena Horne,"Summertime (From ""Porgy and Bess"")",TRZAXHQ128F4289D59,1956,"Summertime
And the livin' is easy
Fish are jumpin'
And the cotton is high

Oh your daddy's rich
And your ma is good lookin'
So hush little baby
Don't you cry

One of these mornings
You're going to rise up singing
And you'll spread your wings
And you'll take to the sky

Till that morning
There ain't nothing can harm you
With daddy and mammy
Standing by

One of these mornings
You're going to rise up singing
And you'll spread your wings
And you'll take to the sky

But till that morning
There ain't nothing can harm you
With daddy and mammy
Standing, standing by"
120,Lena Horne,Mad About The Boy,TRIQJPY128F4280AB2,1956,"Mad about the boy, 
It's pretty funny, 
But I'm mad about the boy; 
He has a gay appeal that makes me feel 
There's maybe something sad about the boy. 

Walking down the street, 
His eyes look out at me from people that I meet; 
I can't believe it's true, but when I'm blue, 
I some strange way, I'm glad about the boy. 

I'm hardly sentimental, 
Love isn't so sublime, 
I have to pay my rental and I can't afford to waste much time. 

If I could employ 
A little magic that would finally destroy 
This dream that pains me and enchains me, but I can't, 
Because I'm mad about the boy! 

I'm hardly sentimental, 
Love isn't so sublime, 
I have to pay my rental and I can't afford to waste much time. 

If I could employ 
A little magic that would finally destroy 
This dream that pains me and enchains me, but I can't, 
Because I'm mad about the boy! 
Mad about the boy!"
121,Lena Horne,Tomorrow Mountain,TRNEQHE128F4289D57,1956,"Just across Tomorrow Mountain
There's a happy city, they say
Where the people are grand and time is planned
So it's Christmas everyday

'Neath the scotch and soda fountain
There's a treat in store for us guys
Under cigarette trees, we'll take our ease
While the cops fan off the flies

There you will be a lucky sinner
With no conscience for your guide
Each horse you pick will be a winner
And the doors of every bank are open wide

Far across Tomorrow Mountain
There's a life that's fancy and free
On a platinum street we'll plant our feet
It's the land that's fair to see
Won't you hurry there with me?

Just across Tomorrow Mountain
Every girl is Queen of the May
And the kitchens, I'm told are lined with gold
And there ain't no bills to pay

Can't you cross that distant mountain
Where it rains Chanel No.5?
And the gutters, I think are paved with mink
And the diamond bushes thrive

Pigs trot around already roasted
Won't you have a slice of ham?
Marshmallows bloom, already toasted
And the clouds are made of marmalade and jam

Can't you see Tomorrow Mountain?
Can't you watch it glimmer and glow?
It's a wonderful town that's upside down
And it's full of easy dough
Won't you pack your bags and go?"
122,Line Renaud,Mister Banjo,TRGYTNL128F9306318,1956,"Oh, Mister Banjo, le bateau est parti !
Oh, Mister Banjo, sur le Mississippi !
Tout le monde rit, tout le monde est gai
Et pour les faire danser, tu vas leur jouer
Oh oh, Mister Banjo, ton rythme le plus chaud
{x2}

Oh, Mister Banjo, tu es un vieux malin
Oh, Mister Banjo, qui connais tout très bien.
Si tu joues pour Bill, si tu joues pour Joe
C'est parce que tu sais qu'il faut faire danser
Oh oh, Mister Banjo, les filles à marier

Oh oh, Mister Banjo ! Oh oh, Mister Banjo !

Si tu joues pour Bill, si tu joues pour Joe
C'est parce que tu sais qu'il faut faire danser
Oh oh, Mister Banjo, les filles à marier

Oh, Mister Banjo, regarde donc ce soir !
Oh, Mister Banjo, regarde ton pouvoir !
Si t'arrêtais soudain de jouer
Je peux t'affirmer que l'on n'entendrait
Oh, Mister Banjo, que le bruit des baisers

Oh oh, Mister Banjo ! Oh oh, Mister Banjo !

Si t'arrêtais soudain de jouer
Je peux t'affirmer que l'on n'entendrait
Oh oh, Mister Banjo, que le bruit des baisers

Oh, Mister Banjo, le bateau va gaiement
Oh, Mister Banjo, à la New-Orléans.
Et lorsque la fête sera finie,
Parce que le soleil chassera la nuit,
Oh oh, Mister Banjo, tu iras dans ton étui

Oh oh, Mister Banjo ! Oh oh, Mister Banjo !

Oh oh, Mister Banjo, tu iras dans ton étui
Hey!"
123,Little Richard,Rip It Up,TRMQYYM128F427004B,1956,"Well, it's Saturday night and I just got paid,
Fool about my money, don't try to save,
My heart says go go, have a time,
Saturday night and I'm feelin' fine,

I'm gonna rock it up, I'm gonna rip it up,
I'm gonna shake it up, gonna ball it up,
I'm gonna rock it up, and ball tonight.

Got me a date and I won't be late,
Picked her up in my 88,
Shag on down by the union hall,
When the joint starts jumpin' I'll have a ball,
I'm gonna rock it up, ...

'Long about ten I'll be flying high,
Walk on out unto the sky,
But I don't care if I spend my dough,
'Cause tonight I'm gonna be one happy soul,
I'm gonna rock it up, ..."
124,Little Richard,Long Tall Sally,TRGUGQW12903CD4B33,1956,"Gonna tell Aunt Mary 'bout Uncle John
He claims he has the misery
But he has a lot of fun
Oh baby
Yes baby
Wooh baby
Havin' me some fun tonight, yeah

Well, long tall Sally
She's really sweet
She got everything that Uncle John need
Oh baby
Yes baby
Wooh baby
Havin' me some fun tonight, yeah

Well, I saw Uncle John with bald head Sally
He saw Aunt Mary comin'
And he jumped back in the alley
Oh baby
Yes baby
Wooh baby
Havin' me some fun tonight, yeah

Well, long tall Sally
She's built for speed
She got everything that Uncle John need
Oh baby
Yes baby
Wooh baby
Havin' me some fun tonight, yeah

Well, I saw Uncle John with bald head Sally
He saw Aunt Mary comin'
And he jumped back in the alley
Oh baby
Yes baby
Wooh baby
Havin' me some fun tonight, yeah

We gonna have some fun tonight
Have some fun tonight, wooh
Have some fun tonight
Everything's all right
Have some fun
Have me some fun tonight"
125,Little Richard,The Girl Can't Help It,TRGVCJR128F92F0A54,1956,"She can't help it, the girl can't help it
She can't help it, the girl can't help it

If she walks by, the men folks get engrossed
(She can't help it, the girl can't help it)
If she winks an eye, the bread slice turn to toast
(She can't help it, the girl can't help it)

If she got a lot of what they call the most
(She can't help it, the girl can't help it)
The girl can't help it, she was born to please
(She can't help it, the girl can't help it)

And if she's got a figure made to squeeze
(She can't help it, the girl can't help it)
Won't you kindly be aware, the girl can't help it
(The girl can't help it)

If she mesmerizes, every mother's son
(She can't help it, the girl can't help it)
If she's smiling, beefsteak become well done
(She can't help it, the girl can't help it)

She makes grandpa feel like twenty one
(She can't help it, the girl can't help it)
The girl can't help it, she was born to please
(She can't help it, the girl can't help it)

And if I go to her on bended knees
(She can't help it, the girl can't help it)
Won't you kindly be aware, that I can't help it
(I can't help it)

Because I'm hoping, obviously
That some day, the answer would be
The girl can't help it, she's in love with me
(She can't help it, the girl can't help it)

If she walks by, the men folks get engrossed
(She can't help it, the girl can't help it)
If she winks an eye, the bread slice turn to toast
(She can't help it, the girl can't help it)

She got a lot of what they call the most
(She can't help it, the girl can't help it)
The girl can't help it, she was born to please
(She can't help it, the girl can't help it)

And if she's got a figure made to squeeze
(She can't help it, the girl can't help it)

I'm hoping, obviously
That some day, the answer would be
The girl can't help it, she's in love with me
(She can't help it, the girl can't help it)"
126,Little Richard,Slippin' and slidin',TRNHJTK128F93496F6,1956,"Slippin' and a-slidin'
Peepin' and a-hidin'
Been told a long time ago.

Slippin' and a-slidin'
Peepin' and a-hidin'
Been told a long time ago.

Baby I've been told
Baby You've been bold
I won't be your fool no more.

Oh Big conniver
Nothin' but a jiver
Done got hip to your jive.

Oh Big conniver
Nothin' but a jiver
Done got hip to your jive.

Slippin' and a-slidin'
Peepin' and a-hidin' 
won't be your fool no more.

Slippin' and a-slidin'
Peepin' and a-hidin'

Oh Malinda
She's a solid sender
You know you better surrender

Oh Malinda
She's a solid sender
You know you better surrender

Slippin' and slidin'
Peepin' and hidin' 
won't be your fool no more."
127,Little Richard,Ready Teddy,TRTPQOS128F932F8A8,1956,"Ready, set, go man go,
I got a girl that I love so,

I'm ready, ready, ready teddy,
I'm ready, ready, ready teddy,
I'm ready, ready, ready teddy,
I'm ready, ready, ready to rock 'n' roll.

Going to the corner, pick up my sweetie pie,
She's my rock 'n' roll baby, she's the apple of my eye,

I'm ready, ready, ready teddy,
I'm ready, ready, ready teddy,
I'm ready, ready, ready teddy,
I'm ready, ready, ready to rock 'n' roll.

All the flat top cats and the dungaree dolls,
Are headed for the gym to the sock hop ball,
The joint is really jumpin', the cats are going wild,
The music really sends me, I dig that crazy style,

I'm ready, ready, ready teddy,
I'm ready, ready, ready teddy,
I'm ready, ready, ready teddy,
I'm ready, ready, ready to rock 'n' roll.

Going to the corner, pick up my sweetie pie,
She's my rock 'n' roll baby, she's the apple of my eye,

I'm ready, ready, ready teddy,
I'm ready, ready, ready teddy,
I'm ready, ready, ready teddy,
I'm ready, ready, ready to rock 'n' roll.

All the flat top cats and the dungaree dolls,
Are headed for the gym to the sock hop ball,
The joint is really jumpin', the cats are going wild,
The music really sends me, I dig that crazy style,

I'm ready, ready, ready teddy,
I'm ready, ready, ready teddy,
I'm ready, ready, ready teddy,
I'm ready, ready, ready to rock 'n' roll.

Gonna kick off my shoes, roll up my faded jeans,
Grab my rock 'n' roll baby, pour on the steam,
I shuffle to the left, I shuffle to the right,
Gonna rock 'n' roll to the early, early night,

I'm ready, ready, ready teddy,
I'm ready, ready, ready teddy,
I'm ready, ready, ready teddy,
I'm ready, ready, ready to rock 'n' roll."
128,Little Walter,Who,TRBZZCJ12903CA777B,1956,"Too late, too late, too late
I'm tired of your deceivin'
And I can't stand your creepin', I'm gone
I'm tired of your deceivin'
And I can't stand your creepin', I'm gone

Too late, too late, too late
Tired of all the fussin'
And I can't stand your cursin', I'm gone
Tired of all the fussin'
And I can't stand your cursin', I'm gone

Gee, you know I love you
I don't know just why
Thought the whole world of you
But today I say bye bye, bye bye

Too late, too late, too late
Can't stand your cookin'
And you ain't good-lookin', I'm gone
Can't stand your cookin'
And you ain't good-lookin', I'm gone

Gee, you know I love you
I don't know just why
Thought the whole world of you
But today I say bye-bye, bye-bye

Too late, too late, too late
Can't stand your beatin'
And I know you been cheatin', I'm gone
Can't stand your beatin'
And I know you been cheatin', I'm gone

Can't stand your beatin'
And I know you been cheatin', I'm gone"
129,Little Walter,Take Me Back,TRLOZEY128F93492A7,1956,"Take me back, baby
Baby, try me one mo' time
Take me back, baby
Baby, try me one mo' time

You know I love you, baby
And I'll just keep on hangin' around

In love wit' ya' baby
Before I learned to call yo' name
I was in love wit' ya' baby
Before I learned to call yo' name

Now, I am sorry we can't get together
I'm a fool, I don't understand

No matter where I go
I can't get you off-a my mind
No matter where I go
Can't get you outta my mind

Now, an you keep me worried and bothered
Stay cool all the time

So goodbye, baby
Baby, if you call it gone
So goodbye, baby-hey
Baby, if you call it gone

I know it's goin' to worry
Hope it don't last too long"
130,Little Willie John,Fever,TRMXOWU128F931D8D5,1956,"You never know how much I love ya
Never know how much I care
When you put your arms around me
I get a feelin' that's so hard to bear
You give me fever

When you kiss me
Fever when you hold me tight
Fever (fever, burn through) in the mornin'
An' fever all through the night

Listen to me, baby 
Hear ev'ry word I say
No one could love you the way I do
'Cause they don't know how to love you my way
You give me fever

When you kiss me
Fever when you hold me tight
Fever (fever, burn through) in the mornin'
An' fever all through the night

Bless my soul, I love you
Take this heart away 
Take these arms I'll never use
An' just believe in what my lips have to say
You give me fever

When you kiss me
Fever when you hold me tight
Fever (fever, burn through) in the mornin'
Fever all through the night

Sun lights up the daytime
Moon lights up the night
My eyes light up when you call my name
'Cause I know you're gonna treat me right
You give me fever

When you kiss me
Fever when you hold me tight
Fever (fever, burn through) in the mornin'
An' fever all through the night

Umm-mmm-mmm-mm-mmm-mm
Umm-umm-umm-um-um
Umm-mmm-mmm-mm-mmm-mm
Umm-umm-umm-um-um."
131,Little Willie John,Need Your Love So Bad,TRCTNHQ128F92FA33F,1956,"Need some one's hands to help me through the night
Need some one's arms to hold and squeeze me tight
'Cause when the night begins and I'm at an end
That's when I need your love so bad

Need your sweet voice to whisper in my ear
Need your gentle fingertips babe to wipe away my tears
Cause when the lights are low and it's time to go
That's when I need your love so bad

Why don't you give it up
And bring it all back home to me baby
Write it on a piece of me paper
So it can be read to me
Tell me that you love me
Cause you're allmost driving me mad
Oh, because I need, I need your love so bad

Need your sweet voice to help me through the night
You don't have to worry baby
Cause you know everything is gonna be all right
When the lights are low and it's time to go
That's when I need your love so bad

Why don't you give it up
And bring it all back home to me baby
Write it on a piece of me paper
So it can be read to me
Tell me that you love me
Cause you're allmost driving me mad
Oh, because I need, I need your love so bad

Need your sweet lipos to help me through the night
You don't have to worry baby
Cause you know everything is gonna be all right
Listen to my plea bring it to me

Because I need your love so bad"
132,Little Willie John,All Around the World,TRBMFFE12903CD8DBB,1956,"Well, if I don't love you baby
Grits ain't groceries, eggs ain't poultry
And Mona Lisa was a man

All around the world I'd-a rather be a fly
I'll lite on my baby n' stay with her 'till I die
With a toothpick in my hand, I'd dig a ten foot ditch
And run through the jungle fightin' lions with a switch

'Cause you know I love you, baby 
Yes, you know I love you, baby
Well, if I don't love you, baby
Grits ain't groceries, eggs ain't poultrys
And Mona Lisa was a man

All around the world I got blisters on my feet
Tryin' to find my baby n' bring her home with me
You better run into me baby and be convinced
If you don't run into me, woman, you ain't got no sense

'Cause you know I love you, baby 
Well, you know I love you, baby
Well, if I don't love you, baby
Grits ain't groceries, eggs ain't poultrys
And Mona Lisa was a man

All around the world, I never will forget
Lost all my money, my woman and my pet
I got to have you baby, settle for nothin' less
Give up all my goodtime girls an' set'd for happiness

'Cause you know I love you, baby
Well, you know I love you, baby
Well, you know I want you, baby
Yes, your smilin' face is my heaven in life

Well, you know I love you, baby 
Yes, you know I love you, baby
Ooh-ooh, you know I love you, baby
Yeah, you know I love you, baby

Well, if I don't love you, baby
Grits ain't groceries
Eggs ain't poultrys
Mona Lisa was a man."
133,Louis Armstrong,Mack The Knife,TRCGJOA128F42827DE,1956,"Oh, the shark, babe, has such teeth, dear
And he shows them pearly white
Just a jackknife has old MacHeath, babe
And he keeps it, ah, out of sight
Ya know when that shark bites with his teeth, dear
Scarlet billows start to spread
Fancy gloves, oh, wears old MacHeath, babe
So there's never, never a trace of red

On the sidewalk on Sunday mornin', don't you know
Lies a body just oozin' life
And someone's sneakin' round the corner
Could that be our boy Mack the Knife?

From a tugboat, down by the river dontcha know
Where a cement bag's just a'droopin' on down
That cement's there, it's there for the weight, dear
Five'll get ya ten old Macky's back in town
Now d'ja hear 'bout Louie Miller? He disappeared, babe
After drawin' out all his hard-earned cash
And now MacHeath spends, he spends just like a sailor
Could it be our boy's done somethin' rash?

Now Jenny Diver, ho, Sukey Tawdry
Ooh, Miss Lotte Lenya and old Lucy Brown
Oh, the line forms on the right, babe
Now that Macky's back in town

I said Jenny Diver, whoa, Sukey Tawdry
Look out to Miss Lotte Lenya and old Lucy Brown
Yes, that line forms on the right, babe
Now that Macky's back in town
Look out, old Macky's back!!"
134,Louis Armstrong,When It's Sleepy Time Down South,TRCHBKZ128F93395C3,1956,"Pale moon shining on the fields below
Folks are crooning songs soft and low
Needn't tell me so because I know
It's sleepy time down south

Soft winds blowing through the pinewood trees
Folks down there like a life of ease
When old mammy falls upon her knees
It's sleepy time down south

Steamboats on the river a coming or a going
Splashing the night away
Hear those banjos ringing, the people are singing
They dance til the break of day, hey

Dear old southland with his dreamy songs
Takes me back there where I belong
How I'd love to be in my mammy's arms
When it's sleepy time way down south

Dear old southland with his dreamy songs
Take me back there where I belong
How I'd love to be in my mammy's arms
When it's sleepy time down south
Sleepy time down south"
135,Louis Prima,Oh_ Marie (2002 Digital Remaster),TRXZLKU128F1462813,1956,"Oh Marie (Oh Marie)
Oh Marie (Oh Marie)
In your arms I'm longin' to be (Longin' to be)
Baby (Baby)
Tell me you love me (Tell me you love me)
Kiss me once while the stars shine above me (Shine above me)
Hey Marie (Hey Marie)
Oh Marie (Oh Marie)
In your arms I'm longin' to be (Longin' to be)
Oh baby (Oh baby)
Tell me you love me (Tell me you love me)
Hey Marie (Hey Marie)
Hey Sammy, come here boy"
136,Louis Prima,Buona Sera,TRKKRBY12903C94D84,1956,"Buona sera, signorina, buona sera
It is time to say goodnight to Napoli
Though it's hard for us to whisper, buona sera
With that old moon above the Mediterranean sea
In the mornin' signorina we'll go walkin'
When the mountains help the sun come into sight
And by the little jewelry shop we'll stop and linger
While I buy a wedding ring for your finger

In the meantime let me tell you that I love you
Buona sera, signorina, kiss me goodnight
Buona sera, signorina, kiss me goodnight

Buona sera, signorina, buona sera
It is time to say goodnight to Napoli
Though it's hard for us to whisper, buona sera
With that old moon above the Mediterranean sea
In the mornin' signorina we'll go walkin'
When the mountains help the sun come into sight
And by the little jewelry shop we'll stop and linger
While I buy a wedding ring for your finger

In the meantime let me tell you that I love you
Buona sera, signorina, kiss me goodnight
Buona sera, signorina, kiss me goodnight

And by the little jewelry shop we'll stop and linger
While I buy a wedding ring for your finger

In the meantime let me tell you that I love you
Buona sera, signorina, kiss me goodnight
Buona sera, signorina, kiss me goodnight"
137,Martin Denny,Similau,TRWVEQT12903CB2421,1956,"(I similau, I similau, I similau, I similau)

Spirit in the wood beat the hollow cane
Spirit in the wood take away the pain
Make the body ripe and alive again

I similau
(I similau, I similau)

Spirit in the heart make the blood flow fast
Spirit in the heart make the beauty last
Keep the hope alive when the youth go past

I similau
(I similau, I similau)

When my lover comes upon the scene
Drop a petal from the tree
Fling the mountain up into the sky
Fill the river with the sea

Spirit in the wood let the hollow cane
Echo in the afterglow
Waiting for the flame to burn again

I similau
(I similau, I similau)"
