,Artist,Title,Track_id,Year,Lyrics
0,Acker Bilk / Leon Young String Chorale,Sentimental Journey,TRXAQXB128F147774B,1961,"I'm gonna take a Sentimental Journey,
Gonna set my heart at ease.
Gonna make a Sentimental Journey,
To renew old memories.

I got my bags, I got my reservations,
Spent each dime I could afford.
Like a child in wild anticipation,
Long to hear that, ""All aboard!""

Seven, that's the time we leave at seven.

I'll be waitin' up at heaven,
Countin' every mile of railroad track, that takes me back.

I never knew my heart could be so yearny.
Why did I decide to roam?
I'm gonna take that Sentimental Journey,
Sentimental Journey home.
Sentimental Journey."
1,April Stevens,Teach Me Tiger,TREAMGW12903CF9507,1961,"Hi Tiger

Teach me tiger how to kiss you... wah wah wah wah wah
Show me tiger how to kiss you... wah wah wah wah wah
Take my lips, they belong to you...
But teach me first, teach me what to do...

Touch me tiger when I'm close to you wah wah wah wah wah
Help me tiger I don't know what to do wah wah wah wah wah
I know that you could love me to
But show me first, show me what to do
This is the first love, that I have ever known
What must I do to make you my very own.. ?

Teach me tiger how to tease you wah wah wah wah wah
Tiger, tiger I wanna squeeze you wah wah wah wah wah
All of my love I will give to you
But teach me TIGER... or I'll teach you

Tiger... Tiger... Tiger..."
2,Ben E. King,Stand by Me,TRWCWXU12903CD9321,1961,"When the night has come
And the land is dark
And the moon is the only light we'll see
No, I won't be afraid
Oh, I won't be afraid
Just as long as you stand
Stand by me

So darlin’, darlin'
Stand by me, oh, stand by me
Oh, stand, stand by me
Stand by me

If the sky that we look upon
Should tumble and fall
Or the mountain should crumble to the sea
I won't cry, I won't cry
No, I won't shed a tear
Just as long as you stand
Stand by me

And darlin', darlin'
Stand by me, oh, stand by me
Oh, stand now, stand by me
Stand by me

Darlin', darlin'
Stand by me, oh, stand by me
Oh, stand now, stand by me
Stand by me
Whenever you're in trouble, won't you stand by me?
Oh, stand by me
Won't you stand now?
Oh, stand, stand by me
When all of our friends is gone"
3,Ben E. King,This Magic Moment,TRZIVQY12903CEA102,1961,"This magic moment
So different and so new
Was like any other
Until I kissed you

And then it happened
It took me by suprise
I knew that you felt it too
By the look in your eyes

Sweeter than wine
Softer than the summer night
Everything I want I have
Whenever I hold you tight

This magic moment
While you lips are close to mine
Will last forever
Forever til the end of time

Oh...
Oh...
Mm...

Sweeter than wine
Softer than the summer night
Everything I want I have
Whenever I hold you tight

This magic moment
While your lips are close to mine
Will last forever
Forever til the end of time

Oh...
Magic moment...
Magic moment...
Magic moment..."
4,Ben E. King,Perfidia (LP Version),TRTJWJH128F427599F,1961,"To you
My heart cries out ""Perfidia""
For I find you, the love of my life
In somebody else's arms

Your eyes are echoing ""Perfidia""
Forgetful of the promise of love
You're sharing another's charms

With a sad lament my dreams are faded like a broken melody
While the gods of love look down and laugh
At what romantic fools we mortals be

And now, I know* my love was not for you
And so I take it back with a sigh
Perfidious one, Goodbye

With a sad lament my dreams are faded like a broken melody
While the gods of love look down and laugh
At what romantic fools we mortals be

And now, I know* my love was not for you
And so I take it back with a sigh
Perfidious one, goodbye
Goodbye"
5,Ben E. King,Amor,TRJEJNV12903CFE8ED,1961,"Amor, Amor, Amor,
This word so sweet
That I repeat
Means I adore you.
Amor, Amor, My love,
Would you deny
This heart that I
Have placed before you?
I can't find another word with meaning so clear;
My lips try to whisper sweeter things in your ear.
But somehow or other nothing sounds quite so dear
As this soft caressing word I know.

Amor, Amor, My love,
When you're away,
There is no day
And nights are lonely.
Amor, Amor,
My love, Make life divine,
Say you'll be mine
And love me only.

Amor,
Amor,
Amor,
Naci de t,
Naci de m,
De la esperanza.
Amor,
Amor,
Amor,
Naci de Dios,
Para los dos,
Naci del alma.
Sentir que tus besos anidaron en m,
Igual que palomas mensajeras de luz.
Saber que mis besos se quedaron en t,
Haciendo en tus labios la seal de la cruz.
Amor,
Amor,
Amor,
Naci de t,
Naci de m,
De la esperanza.
Amor,
Amor,.
Amor,
Naci de Dios,
Para los dos,
Naci del alma."
6,Bill Evans Trio,Waltz For Debby,TRTKBUC128F932845E,1961,"In her own sweet world
Populated by dolls and clowns
And a prince and a big purple bear

Lives my favorite girl,
Unaware of the worried frowns
That we weary grown ups all wear

In the sun she dances to silent music,
Songs that are spun of gold
Somewhere in her own little head

One day all too soon
She'll grow up and she'll leave her dolls
And her prince and her silly old bear

When she goes they will cry
As she whispers ""Good-bye.""
They will miss her I fear
But then so will I"
7,Bill Monroe,Kentucky Waltz,TRGZZGV12903C98676,1961,"We were waltzing that night in Kentucky 
'Neath the beautiful harvest moon
And I was the boy who was lucky
But it all ended too soon

As I sit here alone in the moonlight
I can see your smiling face
And I long once more for your embrace
In that beautiful Kentucky waltz"
8,Bill Monroe,Footprints In The Snow,TRCEDPF12903CE4BBF,1961,"Now some folks like the summertime when the they can walk about
Strolling through the meadow green it's pleasant there no doubt
But give me the wintertime when the snow is on the ground
For I found her when the snow on the ground

I traced her little footprints in the snow
I found her little footprints in the snow
I bless that happy day when Nellie lost her way
For I found her when the snow was on the ground

I dropped in to see her there was a big round moon
Her mother said she just stepped out but would be returning soon
I found her little footprints and I traced them in the snow
I found her when the snow was on the ground

Now she's up in heaven she's with the angel band
I know I'm going to meet her in that promised land
But every time the snow falls it brings back memories
For I found her when the snow was on the ground"
9,Bill Monroe,Blue Moon of Kentucky,TRITCPF128F930A6D1,1961,"Blue moon of Kentucky keep on shinin'
Shine on the one whose gone and proved untrue
Blue moon of Kentucky keep on shinin'
Shine on the one whose gone and left me blue

It was on a moonlit night
The stars were shining bright
They whispered from on high
Your love has said goodbye

Blue moon of Kentucky keep on shinin'
Shine on the one gone and said goodbye!"
10,Billy Fury,Halfway To Paradise,TRMYHNL128F932529A,1961,"I want to be your lover
But your friend is all I've stayed
I'm only halfway to paradise
So near, yet so far away

I long for your lips to kiss my lips
But just when I think they may
You lead me halfway to paradise
So near, yet so far away, mmm

Bein' close to you is almost heaven (heaven)
But seein' you can do just so much
It hurts me so to know your heart's a treasure (treasure)
And that my heart is forbidden to touch, so

Put your sweet lips close to my lips
And tell me that's where they're gonna stay
Don't lead me halfway to paradise
Mmm, so near, yet so far away

Oh, oh, oh so near, yet so far away
Mmm, so near, yet so far away"
11,Blind Gary Davis,Twelve Gates to the City,TROXVDI12903C9C1BA,1961,"Oh, what a beautiful city
Oh, what a beautiful city
Oh, what a beautiful city
Twelve gates to the city, hallelujah
And it's oh, what a beautiful
Oh
Oh Lord, what a beautiful city
Twelve gates to the city, hallelujah
There's three gates in the East
There's three gates in the West
There's three gates in the North
There's three gates in the South
That makes twelve gates to the city, hallelujah
And it's oh, what a beautiful
Oh
Oh Lord, what a beautiful city
Twelve gates to the city, hallelujah
Oh Lord, what a beautiful city
Oh
Oh Lord, what a beautiful city
Twelve gates to the city, hallelujah
If you see my dear old mother
Won't you do this favor for me
Won't you please tell my mother
To meet me in Galilee
Well, it's twelve gates to the city, hallelujah
Oh Lord, what a beautiful
Yeah
Oh Lord, what a beautiful
Twelve gates to the city, hallelujah
God Almighty!
What you talkin' 'bout?
Oh, Lordy
Whoo!
Oh Lord, what a beautiful
Whoa!
Oh Lord, what a beautiful city
Twelve gates to the city, hallelujah
Oh Lord, what a beauty
Whoa!
Oh Lord, what a beauty
Twelve gates to the city, hallelujah"
12,Bob Gibson,Trouble In Mind (LP Version),TRQNDIV128F4236EF9,1961,"Trouble in mind, I'm blue
But I won't be blue always,
'Cause that sun is gonna shine in my back door someday.

Now all you men's the same
But now I'm old enough to change my name.
Lord, that sun's gonna shine in my back door someday.

I'm gonna lay my head
On that lonesome railroad line
And let the 2:19 ease my troubled mind.

You,ve been a mean and evil woman
You sure treat me unkind
I'm gona be your hare hearted daddy
I'm gonna make you loose your mind

Trouble in mind, I'm blue,
But I won't be blue always.
Child, that wind's gonna come and blow my blues away!"
13,"Bobby ""Blue"" Bland",Two Steps From The Blues,TRQQNCG128F424C42E,1961,"One month from the day I first met you
Your promises proved to be untrue
So step by step, I've been a fool
Now I'm just two steps from the blues

The reason we didn't get along
Was telegrams and telephone
One brings bad news, the other rendezvous
That keeps me two steps from the blues

Here is a chance to be loved or be lonely
My heart awaits your call
I know it's better to have loved and lost
Than never have loved at all

So, darling, let's try to make amends
And if it should fail, let's try and try again
Oh, it makes no difference what you say or do
I'm so forgiving, I'm so forgiving
And I can't go on living two steps from the blues"
14,"Bobby ""Blue"" Bland",St. James Infirmary,TRYMSMR128F424C42F,1961,"I went down to St. James Infirmary 
And I heard my baby moan. 
And I felt so broken hearted. 
She used to be my very own.
 
I tried so hard to keep from crying. 
My heart felt just like lead. 
She was all that I had to live for. 
Oh, I wish it was me instead. 

Now she's gone, she's gone and may God bless her 
Wherever she may be. 
She can search this wide world over 
Oh, but she'll never find a man like me. 
She's gone, she's gone... 
She's gone."
15,Bobby Bland,Little Boy Blue,TRXXFRQ128F92D1391,1961,"When I thought I was so high above you
You were so good to me
Even though you knew I didn't love you
You were still good to me

And when it used to make me happy to see you cry
You were so good to me and that's no lie

You used to call me, ""Bobby, Little Boy Blue""
You said, ""Blow your horn baby, Little Boy Blue""
You used to call me ""Bobby, Bobby""
So nice to me baby, oh yes, you were

I remember, baby, when you cried all night long
I know now, darling, that I was doing you wrong
If I had a million dollars I'd give you every, a-every dime
Just to hear you call me, ""Bobby"", one more time

You used to call me B O B B Y, B O B B Y
""Bobby"", you called me 'Bobby""'
Oh, it used to sound so good, oh yeah
You don't know how much I miss you lady, yeah, yeah

If you'd just give me one more chance, darling
Yeah, let me hear you call me ""Bobby""
Yeah, yeah, yeah, yeah, yeah, baby
You don't know how much I love you"
16,Brian Hyland,Let Me Belong To You,TRMEBVL128F92D3815,1961,"Make me your slave
Tie me down, make me behave
Let me belong to you

Make me be true
Tell me what I can do
Let me belong to you

I don't wanna be free
Like a wave on the sea
No place special to go
But toss to and fro

Oh make me your own
Never never leave me alone
Make all my dreams come true
Let me belong to you

Make me your slave
Tie me down, make me behave
Let me belong to you

I don't wanna be free
Like a wave on the sea
No place special to go
But toss to and fro

Oh make me your own
Never never leave me alone
Make all my dreams come true
Let me belong to you"
17,Brook Benton,Thank you pretty baby,TRMQUHE128F9335B80,1961,"I want to thank you, pretty baby, for givin' your love to me
I want to thank you, pretty baby, for givin' your love to me
My heart was locked up till you came and set it free

I'm gonna love you, pretty baby, love you till the end of time 
And I-I-I-I-I'm gonna love you, pretty baby, love you till the end of time
I wanna thank your folks for making you so divine

Thank you    for your loving ways
Mmm-ooh-ooh-ooh-ooh thank you 'cause you've been so kind
I'm gonna take my time and just thank you, honey
Because you're mine, all mine, all mine

I'm gonna kiss you in the morning and kiss you in the evening, too
And I-I-I-I-I'm gonna kiss you in the morning, kiss you in the evening, too
I'm gonna spend my life loving no one but you
I'm gonna spend my life loving no one but you"
18,Brook Benton,So Many Ways,TRHZXKN12903CE3975,1961,"Your lips on mine are soft as dew
Your kiss is so divine
Your eyes are like the skies of blue
And stars that brightly shine

Your voice is sweet like violins
And warm like summer days
I love you, I love you, I love you
In oh, oh, so many, many ways

Your touch is like a breath of spring
You give life to my soul
To me, sweetheart, you're everything
I ever hoped to hold

A smile from you lights up my heart
And brightens all my days
And I just love you, I love you, I love you
In oh, oh, so many, many ways

If words could say how much I care
My dear, you'd be amazed
That I love you, I love you, I love you
In oh, oh so many so many ways"
19,Brook Benton,Shadrack,TRHVMCJ128F9304DDE,1961,"(Shadrack, Meshach, Abednego!)
(Shadrack, Meshach, Abednego!)

Now there were three children from the land of Israel
(Shadrack, Meshach, Abednego!)
Ah, they took a little trip to the land of Babylon
(Shadrack, Meshach, Abednego!)
And ol' Nebudchanezzer was the king of Babylon
(Shadrack, Meshach, Abednego!)
So they took a lot of gold, and made 'em an idol
(Shadrack, Meshach, Abednego!)

And they told everybody 'when you hear the music of the clarinet,'
They told everybody 'when you hear the music of the flute,'
'Now listen, children, when you hear the music of the horn,'
'Ah, you gotta bow down and worship the idol!'
(Shadrack, Meshach, Abednego!)

Ah, but the children of Israel would not bow down!
(Shadrack, Meshach, Abednego!)
'We ain't goin' to bow to no golden idol!'
(Shadrack, Meshach, Abednego!)
No, you couldn't fool the children with the golden idol!
(Shadrack, Meshach, Abednego!)

So the king cast the children in the fiery furnace
(Shadrack, Meshach, Abednego!)
He heaped on coal and red-hot brimstone, the Good Book say
(Shadrack, Meshach, Abednego!)
Even made it seven times hotter than it oughtta be!
(Shadrack, Meshach, Abednego!)
Now they burned up the soldiers that the king had put there
(Shadrack! Meshach, Abednego!)
Oh, Shadrack! Meshach, Abednego!

Um hmm, then the Good Lord called an angel,
Gave him a couple of wings.
He said 'go down there through the middle of the furnace
and begin to coolin' the flames.'
And those children got so happy, 
they went struttin' right through the fire.
And this lot they had them talkin' about the power of the gospel.
(Shadrack, Meshach, Abednego!)

Oh, Shadrack! Meshach, Abednego!!!"
20,Brook Benton,Think Twice,TRIFPBT12903C945C2,1961,"You don't know how much you hurt me
When you broke our precious vows
But I can't stop loving you
I know it's too late to turn back now

Though I said, ""Go on, be happy, bless you, child""
I thought you could guess somehow
My secret heart was saying
""Man, it's too late to turn back now""

Was I a fool from the start
Building castles in the skies?
Or did I just dream I saw
Heaven shining in your eyes?

If you knew how much I love you, yes, I do
Oh, my darling, your heart would bow
Mmm, yes, you'd know, you'd know why I have said
""It's too late to turn back now""

(Too late to turn back now)
Yes, I love you
(Too late to turn back now)"
21,Brook Benton,The Ties That Bind,TRPQAYK128F9304DE4,1961,"Knowing you stand by me through good and bad
Makes all the difference in my life
And day by day, sweetheart, I find
These are the ties that bind
The little things you do that please me so
Aww, the way you always understand
When simple joys bring peace of mind
These are the ties that bind
You're all I need to see me through
Can I say more than this, my love?
I live just for your kiss, my love
I live just for your kiss, my love
Forever and a day, my love will live
Mmm, the flame of love will never die
So heart and soul please say you're mine
Held by the ties that bind
(These are the ties that bind)"
22,Brook Benton,For my baby,TRPSQQM128F9335BA7,1961,"When you see me smile
I'm smilin' for my baby
When you hear me sigh
I'm sighin' for my baby
When I step out as sharp as a tack
The girls whistle but I never whistle back
'Cause everything I do
I do it for my baby

And every time I dream
I dream about my baby
And every time I scheme
I'm schemin' for my baby
I know my baby, she's never hard to find
Because she's always on my mind
And everything I do
So help me, I do it for my baby

My baby, she's somethin' else
Let me tell you, she's fine
I'm glad I belong to her
And she's mine all mine

Everything I make
I make it for my baby
And every dime I take
Oh I just take 'em for my baby
Now when you see us strollin' down the avenue
You just keep your eyes off you know who
Cause everything I do, you know I do it for my baby
When you see me walking alone
I'm tryin' to make it to my baby
When you hear me singin' a song
I'm just singin' for my baby"
23,Buddy Holly,That's What They Say,TRZKJZO128F935016A,1961,"There comes a time for everybody 
when true love will come your way 
there comes a time for everybody 
that's what they tell me - that's what they say 

I didn't hear them say a word of when that time will be 
I only know that what they say 
has not come true for me 

You just keeping waiting and love will come your way 
that's what they tell me - that's what they say"
24,Carla Thomas,A Love Of My Own  (Single/LP Version),TRNQYDA128F423DEB9,1961,"I look at the mountain, I look at the sun
I look at everything Mother Nature has done
Then I wanna know
Why can't I find a love of my own

I look at the skyline, I look at the trees
I look at the moonlight, I feel the soft breeze
Then I wanna know
Why can't I find a love of my own

Love, how I've waited for you
But it looks like you'll never come
So I sit down, sit down and think the thing over
Is it something I've done?

I look at the flowers in fullest bloom
I should be happy but I'm filled with gloom
'Cause I wanna know
Why can't I find a love of my own

'Cause I wanna know
Why can't I find a love of my own"
25,Carla Thomas,Gee Whiz (Look At His Eyes),TRLTXXN128F92F1379,1961,"Gee whiz, look at his eyes
Gee whiz, how they hypnotize
He's got everything a girl could want
Man, oh, man, what a prize, oohoo

Gee whiz, he's all the joy
Gee whiz, I could find in a boy
He's awful nice, it's paradise
I hope I'm not he's decoy

Heaven up above knows how much
I love that gentle soul
Angels sing of a love like this
I hope our love will grow and grow

Oh, gee whiz, I love that guy
Gee whiz, my, my, oh my
There are things we could do
I could say I love you
But all I can say is gee whiz"
26,Charles Brown,Please Come Home For Christmas,TRLHMKS12903CBF791,1961,"Bells will be ringing the glad, glad news
Oh, what a Christmas to have the blues
My baby's gone, I have no friends
To wish me greetings once again

Choirs will be singing Silent Night
Christmas carols by candlelight
Please, come home for Christmas
Please, come home for Christmas
If not for Christmas, by New Year's night

Friends and relations send salutations
Sure as the stars shine above
This is Christmas, yes, Christmas, my dear
The time of year to be with the one you love

Then won't you tell me, you'll never more roam
Christmas and New Year's will find you home
There'll be no more sorrow, no grief and pain
'Cause I'll be happy, happy once again


Ooh, no more sorrow, no grief and pain
'Cause I'll be happy, Christmas once again"
27,Chet Atkins,Jingle Bell Rock,TRPCBVZ128F92F8D2A,1961,"Jingle bell, jingle bell
Jingle bell, jingle bell rock

Jingle bell, jingle bell, jingle bell rock
Jingle bells swing and jingle bells ring

Jingle bell, jingle bell, jingle bell rock
Jingle bells chime in jingle bell time
Dancin' and prancing in jingle bell square
In the frosty air

Jingle, jingle bell rock
That's the jingle bell
Jingle bell, jingle bell
Jingle bell, jingle bell rock"
28,Chubby Checker,Limbo Rock,TRMPHKF128F934A7BC,1961,"Every limbo boy and girl
All around the limbo world
Gonna do the limbo rock
All around the limbo clock
Jack be limbo, Jack be quick
Jack go unda limbo stick
All around the limbo clock
Hey, let's do the limbo rock

Limbo lower now
Limbo lower now
How low can you go?

First you spread your limbo feet
Then you move to limbo beat
Limbo ankolimboneee,
Bend back like a limbo tree
Jack be limbo, Jack be quick
Jack go unda limbo stick
All around the limbo clock
Hey, let's do the limbo rock

La la la 56 + (instead of instrumental break)

Get yourself a limbo girl
Give that chick a limbo whirl
There's a limbo moon above
You will fall in limbo love
Jack be limbo, Jack be quick
Jack go unda limbo stick
All around the limbo clock
Hey, let's do the limbo rock

Don't move that limbo bar
You'll be a limbo star
How low can you go?
( whistle for the rest of the song )"
29,Chubby Checker,Pony Time,TRGJOKD128F934A7AE,1961,"It's pony time, get up
(Boogety, boogety, boogety, boogety shoo)

Hey now everybody
(Boogety, boogety, boogety, boogety shoo)
In the union hall
(Boogety, boogety, boogety, boogety shoo)
It's pony time
(Boogety, boogety, boogety, boogety shoo)
When ya hear this call
(Boogety, boogety, boogety, boogety shoo)

So get with it
Don't quit it
Get up
(Boogety, boogety, boogety, boogety shoo)

Do the pony with your partner
(Boogety, boogety, boogety, boogety shoo)
With a big boss line
(Boogety, boogety, boogety, boogety shoo)
Well anyway ya do it
(Boogety, boogety, boogety, boogety shoo)
You're gonna look real fine
(Boogety, boogety, boogety, boogety shoo)

So get with it
Don't quit it
Get up
(Boogety, boogety, boogety, boogety shoo)

Now ya turn to the left when I say gee
You turn to the right when I say haw
Now gee, ya ya baby
Now haw
Oh baby, oh baby, pretty baby
Do it baby, oh baby, oh baby
(Boogety, boogety, boogety, boogety shoo)

Gonna see little Suzie
(Boogety, boogety, boogety, boogety shoo)
You know she lives next door
(Boogety, boogety, boogety, boogety shoo)
She's doin' the pony
(Boogety, boogety, boogety, boogety shoo)
She's takin' the floor
(Boogety, boogety, boogety, boogety shoo)

Eeea ah, so get with it
Don't quit it
Come on
(Boogety, boogety, boogety, boogety shoo)

Do the pony with your partner
(Boogety, boogety, boogety, boogety shoo)
Oh in a big boss line
(Boogety, boogety, boogety, boogety shoo)
But anyway you do it
(Boogety, boogety, boogety, boogety shoo)
You're gonna look just fine
(Boogety, boogety, boogety, boogety shoo)

So get with
Don't quit it
Get up.  Eeeaaah

Now you turn to the left when I say gee
You turn to the right when I say haw
Now gee, ya ya little baby
Now haw, ya
Oh baby, oh baby, pretty baby
Do it baby, oh baby, oh baby
(Boogety, boogety, boogety, boogety shoo)"
30,Chuck Berry,Thirteen Question Method,TRYOFPR128F148BDCB,1961,"The 'thirteen question method' is the one to use
The 'thirteen question method' is the one to use
The 'thirteen question method' is the one
To use when you want to go have some fun
The 'thirteen question method' is the one to use


Question number one: let's have some fun
Question number two is: what to do ?
Question number three is: will you dine and dance with me?
Question number four: out the door?

Question number five: I want you to know jive
Question number six: how long to get fixed ?
Question number seven: should I pick you up at a quarter to eleven?
Question number eight: is it a date ?

(guitar solo)

Question number nine is: where to dine ?
Question number ten: can we get in?
Question number eleven: it'll be just like heaven
Question number twelve when we're by ourselves

The 'thirteen question method' is the one to use
The 'thirteen question method' is the one to use
The 'thirteen question method' is the one
To use when you want to go have some fun
The 'thirteen question method' is the one to use"
31,Cliff Richard & The Shadows,The Young Ones,TRCQMVZ12903CCE9ED,1961,"The young ones,
Darling we're the young ones,
And young ones shouldn't be afraid.

To live, love
While the flame is strong,
For we won't be the young ones very long.

Tomorrow,
Why wait till tomorrow,
Tomorrow sometimes never comes.
Love, me,
There's a song to be sung
And the best time is to sing while we're young.

Once in every lifetime
Comes a love like this.
I need you and you need me.
Oh my darling can't you see.
Young dreams
Should be dreamed together,
Young hearts shouldn't be afraid.
And some day when the years have flown
Darling, this will teach the young ones of our own.
The young ones
Darling, we're the young ones
The young ones
Darling, we're the young ones."
