,Artist,Title,Track_id,Year,Lyrics
44,Letzte Instanz,Gebranntes Kind,TRIKQAD128F92EA581,1999,"Auf dem Bauch das kleine Wesen
Liebe schlägt in sein Gesicht
Es will nur von der Wärme leben
Weicht von der Mutters Seite nicht

Auf den Knien das kleine Wesen
Für die Welt ist es nicht bereit
Es hat schon eigene Gedanken
Doch Mutter gibt ihm Sicherheit

Bald ist es aufrecht das kleine Wesen
Kann schon auf seinen Füßen stehen
Es sieht den kalten Hals der Mutter
Und muß jetzt eigne Wege gehen

Im kalten Nass das kleine Wesen
Nicht mehr ganz klein und doch nicht groß
Hat noch die Neugier in den Augen
Will doch zurück in Mutters Schoß

Kein Weg zurück zu Mutter Erde
Der rechte Weg bleibt unerkannt
Gebranntes Kind im Schoß aus Asche
Die Kälte raubt ihm den Verstand

Jahre später es wird ein Mann
Der seine Mutter ganz innig liebt
Losgelöst vom Leib der Mutter
Er findet nichts, was Wärme gibt

Auf allen Vieren das kleine Wesen
Von Kopf bis Fuß mit Angst beschmiert
Es will zurück zum Bauch der Mutter
Weil es sonst ohne Wärme friert

Kein Weg zurück zu Mutter Erde
Der rechte Weg bleibt unerkannt
Gebranntes Kind im Schoß aus Asche
Die Kälte raubt ihm den Verstand"
45,Bicycle Thief,Everyone Asks,TRUQSEV128F9306860,1999,"Everyone asks 
Well everyone calls and asks 
Am I over you yet? 
And I tell them yes 
It's been almost a year 
It'll be a year this November 
And life is so strange, yeah 
Life can be so unbearable 

Why do I always 
Call your name 
If it doesn't stop 
I'll go insane 
I just know 

I still have our dog 
I just tell him you're 
Gone for awhile 
And nothing has changed 
I still have our 
Same old place 
And I can't stop my mind 
From wondering why 
Is it something I did 
Is it something that 
I deserve 

Why do I always call your name… 

Well I've never thought 
Of life without you 
And I'm not gunna start 
I never thought 
I'd be without you 

I can still see your face 
I remember  
The way you move 
And it's just not fair 
I'm just so lost 
Without you 
I still miss you so 
I can't let you go 
What kind of god is this 
To take someone like you 
From me 

Why do I always call your name… 

Why do I always call…"
46,Fifteen,Liberation II,TRJWPJZ128F932098E,1999,"This is not another song about two dysfuntional people in love with each other.
And how it's just too bad they're so willing to abuse each other.
And gladly accept it from the other.
This is not a song about how it all came to an end.
And how I hope that you'll still be my friend.
Cause I don't.
And how we can't wait to get back together.
Cause it would only prove our cowardous so we must take in this thought deep.
We're all alone.
Cause there's five billion people in this world.
Maybe if you keep on trying...
You'll find the one that's just right.
I bet you'll make it through the night.
Maybe you'll find the one that's just right.
Your problems will end and you won't have to hide.
Once you've slept with everyone and it still doesn't work out, maybe you'll find the problem on the inside.
See this is a song about a boy and a girl.
Fell in love and ended the real world.
They had complementary platters from mom and dad.
But it wasn't a compromise at all.
It was perjury, it was injury, it was abuse.
It was life.
You know I have to agree it's great to say ""I love you.""
Maybe first we should find out what it means.
Cause there's five billion people in this world.
Maybe if you keep on trying...
You'll find the one that's just right.
I bet you'll make it through the night.
Maybe you'll find the one that's just right.
Your problems will end and you won't have to hide.
Once you've slept with everyone and it still doesn't work out, maybe you'll find the problem on the inside.
I've been scared of changing cause I've built my life around you.
Time makes you bolder, even children grow older.
And I'm getting older too.
Yea, I'm getting older too."
47,Tom Cochrane,Willie Dixon Said,TRNKGUI128F145CB92,1999,"Junkyard pilot and his sidekick derelict
Blactop halle bop microbus news do you get it?
Dialect comes so slick that you can't predict the news
Water it down like butternut blues

Black smoke's lightening comin' up the trees
Wrap it up nice put a bow round it please
Telly myself again and again and again
Get out of this son - state of mind we're in
Like Willie Dixon said got to find me a place
To clear my head

Halle bop, halle bop I said
Gonna halle bop me gonna hail me a cab
Like Willie Dixon said got to find me a place
To clear my head
Halle bop, halle bop I said
Gonna halle bop me gonna hail me a cab

Justice lies somewhere behind...between
The have nots and the plasticine lies
Black spit twilight holograph scene

Conjured up images of apocalypse steam
Words never spoken wait on the lips
On the door step of a woman's millenium hips
Big bang wash clothes delirium
Nostradamus' imposter and one last run

Haze falls away revealing dreams
Like writing a letter to myself it seems
Garage sales, paper trails, e-mails
Junk mail there for the plans that fail

God I miss you, I miss you real bad
The only thing real that I've ever had
Halle bop, halle bop I said
Gonna halle bop me gonna hail me a cab

Haze falls away revealing dreams
Like writing a letter to myself it seems
Garage sales, paper trails, e-mails
Junk mail there for the plans that fail"
48,8stops7,Satisfied (Album Version),TRYWMVF128F931BC85,1999,"Should I be safe at home
A stronger man who really should know
Better than to reach the edge and
try to fight this on my own

Can I be something I have yet
to see in my close friends
They've all lost their heads
And it's bringing me down
to the place where I'm supposed to...be
Responsibly...for now

Chorus:
I want it, I need it, just one more to Satisfy
Can't help it, feel nothing and nothing feels right

Should I be safe at home
I relapse quicker than you could know
My past compulsions breed convulsions
A sorry scene unfolds

Can I be weak when I'm stable
Strong in the cradle
Strung out in a fable 
Where the hero gets saved
I've tried this before
Routines and rewards
What's gonna change

(Chorus)

I tried to find , inside, something civilized
Stolen, borrowed, bought
Any remnants of a man
Tookon too much too soon too afraid to fight
Struggled lost and won just to realize that I can't understand

I want it I need it
I want it I need it
Just one more, just one more
Just one more to satisfy
Like nothing will
Like nothing will
Like nothing will
Like nothing will
Like,,,

Puzzled missing pieces
They don't fit in
Cant help it
Feel nothing
Feel nothing"
49,U-God,Rumble,TRHLWSD128F92FCBCE,1999,"(U-God)
Tshhh
Countdown...
Are you ready? Are you mad inside?
Got you strapped down to your seats
Outta the doorway, bullets ripped, full clip
God speed, approach follow my lead
Firewinds gust, empire crush
Full thrust, fall in the hole, roll wit the rush
Untouchable chunk of ?air, wax and soul?
Soundwaves slay out the back, ?cave? smoke
My belly-full prance dance, avalanche quote
Down slope, elegant as Fantasia
Killer whale tale inhale, black male from Asia
All out the wood works, hood shirts and wizards
No match, unhatch, the rap is rigid
In the shaft, shotty cop, hip hop to the limit
Nightwatch, pad mark 
Sparks spin a quake nuclear blast, heavy on the cash
Gimmie what it takes NOW!!

Chorus (U-God) 2x
RAGE ROCK ROLL FIGHT
BRAWL FALL RUMBLLLLLLEEE!!!

(Letha Face)
The diabolic witty, dialect's darker than Gotham City
Wit the possibility to stop your walkin ability
God forgive me, spark enemies wit pistol grips
The missile tip's impact hit you so hard, you shit through your dick
Official scripts strikes when physical hits
You physical bitch, watch for the imperial blitz, serious shit
Submit, subject to the wreck wartone, and thought poems
Liver than WWF Warzone
Walk upon ? tracks, bodies collapse
Rap for lottery stacks, shatter like when pottery cracks
Logical facts from the terror dome
Spill from the guts, trail to you ?puss? from where you bust
In God you now entrust
Dog you like hound and mutts, Pound Pups get sound struck
Clown what? You'll get drowned in the cut
While crowd round up

Chorus 2x

(Inspectah Deck)
Aiyyo yo
I spit bars
Travellin tremendous speed measurin far
Been bustin satellites circlin Mars
Verbal onslaught, bring forth physical force
Of a hundred wild niggas piled in a Trojan Horse
Thought method, set it on generic mic ethic
Professional neck shit, left foes beheaded
This music, is mind control like computer chips
Been doin this for numerous years, refuse to lose it
Wit turbo tactics, maneuver like a trained soldier
Hall of Fame flame thrower, take game, it's game over
Ayatollah, high roller nine totter
Mind controller, 2009 time folder
My coalition, bring the demolition
Wu-blade decision, slate the competition, wit no intermission
Spittin hazardous darts, up front like Rosa Parks
Makin million men march

Chorus 2x

(Method Man)
Yo, who got next? Meth got next
I chin check, all these MC's line em up god, I go Jihad
Declare holy war, it be hard to dip and dodge
Police squads tryin to bogart, we rip and rob
The boulevard ain't safe for your kids, that's how it is
In the ghetto, we ain't scared to death, but scared to live
So Goldy, mosey to the spot, get that moldy
Rusty-ass .38 Special, niggas owe me
Slowly I turn, face the one and only
Naughty By Nature, I Do My Dirt All By My Lonely
Ask Pretty Tony, when I got a bitch I keeps a bitch
36 Chambers, Enter at your own risk
Take that watch off and tuck your necklace
City never sleeps, streets is restless
Rap style'll slave you, when you least expect it
Pull the plug on your respirator, leave you breathless
Wu-Tang forever and a day, better warn your boys
I deploy battleship rap, seek and destroy

Chorus 2x"
50,The Kovenant,Sindrom,TRAYZPW128F4268D08,1999,"He is the prophet of the space age, intrepid seducer
A nightmare to some, a revelation to others
Scrutinized and labeled, He keeps on smiling
Loving what it feeds on, the flame grows higher
He's the prophet of the new desire
He's got the flesh and alien fire
Mankind is just a whore always wanting more
As the flames grow higher and higher
JOIN THE TRANCE THE FORCE IS GROWING
The centre cannot hold
JOIN THE DANCE THE FORCE IS FLOWING
We control the vertical
He is the prophet of the space age, the invisible worm
A beauty to some, but a beast to others
It's a hate adventure, and everyone is invited
So we celebrate the greatest of sins
He is the prophet of the new desire
He's got the flesh and alien fire
Mankind is just a whore always wanting more
As the flames grow higher and higher
JOIN THE TRANCE THE FORCE IS GROWING
The centre cannot hold
JOIN THE DANCE THE FORCE IS FLOWING
We control the vertical
God is nothing more than me
God is nothing more than me
God is nothing more than me
God is nothing more than me
He is the prophet of the space age, intrepid seducer
A nightmare to some, a revelation to others
Scrutinized and labeled, He keeps on smiling
Loving what it feeds on, the flame grows higher
JOIN THE TRANCE THE FORCE IS GROWING
The centre cannot hold
JOIN THE DANCE THE FORCE IS FLOWING
We control the vertical"
51,Crash Test Dummies,Just Shoot Me_ Baby,TRVKSPJ128F932A3BF,1999,"Take off your mink coat, take off your muff
Get on the table and show us your stuff
Right here next to me
I'm a fat old man, sweatin' and huffin'
A gin in my hand and your pretty little muffin
Right here next to me

Just don't feed me with no tube
Or change my dirty diaper
If I'm back at mommy's boob
Call in the frickin' snipers
And just shoot me, baby

Stuff me in the cracks, Stuff me
In the toilet, sweetie, put me in the trash
But be next to me
Send me to my room, hold me down 
And spank me, use the wooden spoon
But be next to me

Just don't feed me with no tube
Or change my dirty diaper
If I'm back at Mommy's boob
Call in the frickin' snipers
And just shoot me, baby

Dip me in the river
You'll never wash my dirt away 
Rip out my liver, baby
But be next to me

Just don't feed me with no tube
Or change my dirty diaper
If I'm back at Mommy's boob
Call in the frickin' snipers
And just shoot me, baby"
52,Dance Hall Crashers,Setting Sun,TRFPAZD128F4234020,1999,"There was a boy and he thought himself quite special
Somehow important and confidently able
He didn't care if your face got under his foot
As long as he didn't stop to have to look

He had a chest for the trophies that he'd stolen
He shined them every morning on his way in
And even he really started to believe it
Rationalizing that they were meant for him

But I know that you're not the king of the setting sun
I know what you are and have done
And that crown you found is gonna leave on your head a big green ring
You're not the king of the setting sun
I know what you have not done
And you're gonna burn in hell

He sometimes wondered if he was just trash
He felt guilty one day, but it passed
And after that he convinced even himself
That everyone loved him and no one else

But I know that you're not the king of the setting sun
I know what you are and have done
And that crown you found is gonna leave on your head a big green ring
You're not the king of the setting sun
I know what you have not done
And you're gonna burn in hell

Thinking back, you smiled at how you'd come this far
And how the idiots had bought into what you told them you are
Now hold really still and hope that they don't see
That you're one big vacancy

But I know that you're not the king of the setting sun
I know what you are and have done
And that crown you found is gonna leave on your head a big green ring
You're not the king of the setting sun
I know what you have not done
And you're gonna burn in hell"
53,Suicidal Tendencies,I Ain't Like You,TRVNVVZ128F4268BA2,1999,"(Muir)

Too much time on my hands
Too much salt in my wounds
Too much pain in my heart
Too many things to regret
I've been thinking
The cause of my confession
I've been thinking
The cause of my oppression
I've been thinking
What's causing my depression
I've been thinking
Because of my depression
Won't do that change again
Continuous lies never end

I'd hate myself if I thought like you
I'd have to hate myself to do the things you do
Cause I ain't like you
I ain't like you

Too much getting no where
Too much waiting to see
Too many lies have been told
Too many things thought in my head
I've been thinking
The cause of my confession
I've been thinking
The cause of my oppression
I've been thinking
What's causing my depression
I've been thinking
Because of my depression
Stand up small hypocrite
Your full of lies your full of shit

I hate myself sometimes that's true
But I can't hate myself enough to be like you

I ain't like you
I ain't like you
I ain't like you
I ain't like you

Dirty job rearrange
Smoke it up just taken change
I can not hate myself
I can not hate myself enough to be like you"
54,Dynamite Boy,Charmed,TRMODXM128F429AE50,1999,"What should I say
To show you I felt the same
What can I do to make you see the proof?
Now all my angst
Is gone and I give my thanks
To whatever you see that brought you back to me
And everyday looks bright
Cuz now a familar sight is standing right next to me
And I'm no longer sad
You know that you drove me mad
you are the one that I adore
I never wanted you to leave
The things I said I didn't mean
I never told you so
I never thought you'd go
My life is meaningful again
You're in my arms, you're my best friend
I never told you though, I never thought you'd go
What do I know
Not much so I guess I'll go
and pretend that everything is all okay
what did I do when I left my heart with you
and I never even asked to have it back
chorus
and I never want to do what you wanna do
and I never wanna go where you wanna go
and I never wanna see"
55,Modern Talking,Don't Let Me Down,TRFLQYX128F42852D6,1999,"Oh please, believe baby, oh it's just a sad sad memory 
Oh please, believe baby, oh I swear that I'm not blind to see 
Oh you broke my heart, and I mean what I say 
I tell you, I swear you, I love you 
Oh don't tear apart, baby please stay 
I tell you, I'll swear you 
Baby I love you it's true 

Oh baby don't let me down 
Oh baby don't fool around 
Oh baby don't stop, my love is hot 
Take me oh take me tonight 

Oh please, believe baby, we're closer to heaven, it's true 
Oh please, believe baby, there's no me oh babe without you 
I'm calling your name, and I mean what I say 
I tell you, I swear you, I love you 
My love is a flame, oh show me the way 
I tell you, I'll swear you 
Baby I love you, it's true 

Oh baby don't let me down 
Oh baby don't fool around 
Oh baby don't stop, my love is hot 
Take me oh take me tonight 
Oh baby don't let me down 
Oh baby don't fool around 
Oh baby don't stop, my love is hot 
Take me oh take me tonight 

Don't play a game with me-That's unfair, you'll see 
Oh don't be so scared-Baby please dare 
Don't be so scared of my love"
56,Screeching Weasel,Bark Like a Dog,TROAUCS128F429CD95,1999,they say that i'm insane i don't play their little games the crazy weasel doesn't ever leave his house creeps around his apartment watches tv on the couch he's total wacked it's just that i've had my fill cheap easy answers kill try to be a good punk if you're for real it won;t feel right you'll end up feeling like a hypocrite a sucker a fucking fool i'm true to myself go where i want hang out in places worth my time i'm true to myself be where i want love the people worth my fucking time are you worth my fucking time 'cause i'm all right yeah i'm all right
57,Bicycle Thief,Tennis Shoes,TRQUCJJ128F930685B,1999,"Sun was comin' up on New Orleans
When I opened my eyes
It was another perfect morning
I didn't know where I was
Or where I was going
For most of my life
If there was a chance to fuck it up
Well I did
Yeah I did
Well I did
A ridiculous existence
Now I'm looking back
All kinds of thoughts come to me
But all I can think is
I'm sorry
Well I'm sorry

And let the truth be known
I've got to walk around
In my own tennis shoes
The truth be known
I've had to learn to live
In this world on my own
Let the truth be known
Nobody showed me
How it's supposed to go
Let the truth be known
I've learned to walk around
In my own tennis shoes

Look at me now
It's pretty hard to believe it
That pitiful boy
You can barely see him
I don't beg nothing from no one
Mow my lawn on the weekends
Just a regular guy now
From the gutters of New Orleans
And I'm happy
Yeah I'm happy

And let the truth be known"
58,Infa Riot,Punch The Air With Glory,TRJBICM128F92F2B75,1999,"I tried to say
Observed your point
I could not understand
Those Dancing girls will get us killed

Punch the air
You've failed your best
Now dance your worst
Now dance your death

We've got the blues on their behalf
God help us all
God help the mass
Punch the air there's nothing left
Punch the air with glory glory

Cuckoo cuckoo is their land
We've got the blues on their behalf
No more fever hits the land
God help us all you've had your laugh"
59,Jessica Simpson,My Wonderful,TRUYEDK128F4261A45,1999,"""A time when I was down and out
No lovin in my life
this angel came and brought about
a meaning of some right
Took my dark and lonely days
Into the light
With his loving ways

He's my wonderful
Everything a girl could want
to love
And all I need
Yes he's my wonderful
Must have been sent from
up above
Just for me

Gotta have him close
to me
Each and every night
To give me that security
Of dreaming in delight
Love has got a grip on me
Oh so tight
Hope he never lets go

He's my wonderful
Everything a girl could want
to love
And all I need
Yes he's my wonderful
Must have been sent from
up above
Just for me

Cause I don't ever want to be free
From this love and care that
most people will never see
And at night I pray
That I'll have my way
And enjoy love for eternity

He's my wonderful
Everything a girl could want
to love
And all I need
Yes he's my wonderful
Must have been sent from
up above
Just for me

No one can ever do for me
The things he does cause

He's my wonderful
Everything a girl could want
to love
And all I need
Yes he's my wonderful
Must have been sent from
up above
Just for me"""
60,Cadallaca,Fake Karaoke Machine,TRNSMQC128F9326AC7,1999,"(one two three four)
I never understood if you wanted me that way
Although i asked a hundred million times
You know the song the one for me
You never sang that song
You never sang that song for me
You never sang another note

And later on my wits(?) work on and i couldn't even cry
The feeling left as quickly as it came
I never sang the one for you, i never sang that one
I never sang that one for you, i never sang...
And now you're gone

Tonight the words upon the screen exactly what i mean
But i dont know if you will ever see"
61,Coal Chamber,Entwined (Album Version),TRUIPGW128F4275583,1999,"Could we please shut our mouths for a while?
For only just a while... I could take it
And if we could lay alone for a while
For only just a while... I could take it

[Chorus 1]
You have made me alright, complete again
Always willing to break down my will again
I intend to render my sensibilities,
Have all gone mad...
You tend to talk about the better things
Then let's move on to better things
I'm using all my sensibilities

Would you please assume that face?
The one that you make at me
And if we could make love for a while
For only just a while... God, I need it... I need it

[Chorus 1]  (alt: ""Have all gone wild..."")
[Chorus 2]:
If we could get caught in the moment...
Get caught in the moment...
Our senses run dry  (repeat)

I would sacrifice myself for you
I'd sacrifice myself for you...

[Chorus 2]  (alt: 2nd line twice)
...If we could ...and if we could, (x3)
...But you are ...Entwined

[Chorus 2]  (x2)"
62,Joe Cocker,Love To Lean On,TRZAZMF128F145F5CE,1999,"You can make your point, I can disagree
But it will not change what you mean to me
Did it go too far, are we to the edge
Is there some way I can talk you down from the ledge
We can turn away from each other Or we can turn it back around

Maybe I’m wrong, maybe you’re right
Baby don't let this wounded pride drive a wedge between us
Wherever we go, whatever we do
I know we'll never make it through
If we try to stand alone we need love to lean on

We can make some changes, we can make this work
We can fix what's broken, we can heal the hurt
Take a new direction, now it's up to us
What we do in anger we can do in love
'Cause anything that's worth the having
Is worth fighting for

Maybe I’m wrong, maybe you’re right
Baby don't let this wounded pride drive a wedge between us
Wherever we go, whatever we do
I know we'll never make it through
If we try to stand alone
We need love to lean on, love to lean on
On and on and on, love to keep us strong."
63,Emma Shapplin,Fera Ventura,TRWARTD128F145DDDE,1999,"Quai eghezza di lauro?
Non è quai il mio destino...
Quai veghezza di mirto?
Indierto mi rivolgo....

'L dubbio m'assale
'L dubbio m'assale
Non ti rimembra
Disiata forma?

'L dubbio m'assle

'L dubbio m'assle

Non spero pieta

Canzone de mai fera ventura
When you break/When you cry/When you ache/ In the night
Sai come nulla qua gi dura
When you're blinded by fear/Don't you die/I'll be here
Qual luce e qual nove beltate
When you're lost/In the rain/And it's winter again
Che dhiede di nostr' instabli fede?
In your cloud full of tears/Don't you drown/ I'll be near

Senti, stradia fenice!
lo parlo per ver dire...
Senti, cosa gentile!
'L cor, conscientia mi punge

Dolce tormento
Dolce tormento
Anche 'l mondo trema...

Cazone de mia fera ventura
Said come nulla qua gi dura
Qual luce e qual nove beltate
Che chided di nostr' instabli fede?

Cazone de mia ferv ventura
Said come nulla qua gi dura
Qual luce e qual nove beltate
Che chiede dal mio stato vile?

Qui reve de couronne de laurier?
Tel n'est pas nom destin
Qui reve de courenne de myrthe?
Je prefere regarder en moi-meme

Le doute m'assaille
As-tu tout oblié, ô forme aimée?
Le doute m'assaille
Je n'espere meme pas de pitie

Chasons de ma crelle aventure
Yois comme ici rien ne dure
Ni la lumière, ni la beauté nouvelle
Et que reste-t-il de nos serments fragiles?

Exoute, sirène impure!
Je ne parle que pour dire la vérité
Ecoute, douce apparition
Mom coeur me blesse 'âme...

O, doux tournment
Mème le monde tremble

Chanson de ma creulle aventure
Vois comme ici ren ne dure
Ni la lumière, ni la beauté Nouvelle?
Et que reste-t-il de nos serments fragiles?

Chanson de ma creulle aventure
Vois comme ici ren ne dure
Ni la lumière, ni la beauté Nouvelle?
Et que reste-t-il de nos serments fragiles?"
64,Tiles,Ambition (bonustrack),TRWEUNG12903CF9B51,1999,"It takes us far
It can make us what we are
A nagging voice
Or conscious choice
Driving you to excel

It's what we heed
Responding to personal need
Through clouds of doubt
Things we can't figure out
Incentive as a new day arrives

It’s not always there
Sometimes hidden
It’s not always fair
Sometimes forbidden
Press on with resolution
The challenge won - ambition"
