,Artist,Title,Track_id,Year,Lyrics
0,Fats Waller,I'm Gonna Sit Right Down And Write Myself A Letter,TRFYPZC12903CD12AA,1973,"I'm gonna sit right down and write myself a letter
And make believe it came from you
I'm gonna write words, oh, so sweet
They're gonna knock me off my feet
A lotta kisses on the bottom
I'll be glad I got 'em

I'm gonna smile and say ""I hope you're feeling better""
And close ""with love"" the way you do
I'm gonna sit right down and write myself a letter
And make believe it came from you

Gonna smile and say ""I hope you're feeling better""
And close ""with love"" the way you do
I'm gonna sit right down and write myself a letter
And make believe, make believe, make believe it came from you"
1,David Essex,Rock On,TRDMWQO12903C99C8D,1973,"Hey, kid, rock 'n' roll, rock on
Ooh, my soul
Hey kid, boogie, too, did ya?
Hey, shout, summertime blues
Jump up and down in my blue suede shoes
Hey, kid, rock 'n' roll, rock on

And where do we go from here?
Which is a way that's clear?
Still looking for that blue jean baby queen
Prettiest girl I've ever seen
See her shake on the movie screen, Jimmy Dean
(James Dean)

And where do we go from here?
Which is the way that's clear?
Still looking for that blue jean baby queen
Prettiest girl I ever seen
See her shake on the movie screen, Jimmy Dean
Jimmy Dean

Rock on
Rock on
Rock on
Hey, kid, rock 'n' roll, rock on
Rock on
Hey, kid, rock 'n' roll, rock on
Rock on
Hey, kid, rock 'n' roll, rock on
Rock on
Hey, kid, rock 'n' roll, rock on
Rock on
Hey, kid, rock 'n' roll, rock on
Rock on
Hey, kid, rock 'n' roll, rock on
Rock on
Hey, kid, rock 'n' roll, rock on
Rock on
Hey, kid, rock 'n' roll, rock on"
2,Nazareth,Razamanaz,TRFDEVW12903CD9988,1973,"We've got to get it together
You bring the wine, we'll bring the weather
We haven't come to be clever
Let's make it now 'cause this could be never
We're gonna razamataz ya tonight
We're gonna razamanaz ya all night
Razamataz, razamataz, up on your feet
Let's see ya dance, dance, dance.

Now that we've come to a showdown
We won't allow you a second to slow down
The moment has come to deliver
You as the taker, and we as the giver
We're gonna razamataz ya tonight
We're gonna razamanaz ya all night
Razamataz, razamataz, up on your feet
Let's see ya dance, dance, dance.

All of the world loves a raver
We're playin' for ravers who savour the flavour
You all appear calm and collected
Razamanazin' you never expected
We're gonna razamataz ya tonight
We're gonna razamanaz ya all night
Razamataz, razamataz, up on your feet
Let's see ya dance, dance, dance.

We're gonna razamataz ya tonight
We're gonna razamanaz ya all night
Razamataz, razamataz, up on your feet
Let's see ya dance, dance, dance."
3,Eric Clapton,Little Wing,TRPOCPJ128E079394D,1973,"Well she's walking through the clouds
With a circus mind that's running 'round.
Butterflies and zebras, fairy tales,
That's all she ever thinks about.

When I'm sad she comes to me
With a thousand smiles she gives to me free.
Said, ""It's all right, take anything you want,
Anything you want, anything.""

Well she's walking through the clouds
With a circus mind that's running 'round.
Butterflies and zebras, fairy tales,
That's all she ever thinks about.

When I'm sad she comes to me
With a thousand smiles she gives to me free.
Said, ""It's all right, take anything you want,
Anything you want, anything.""

Fly on, little wing."
4,Fairport Convention,The Hexhamshire Lass,TROJYPF128E078FCDF,1973,"Away with the buff and the blue
And away with the cap and feather
I want to see my lass who lives in Hexhamshire
Off with the  . . .  and over the moss and the mire
I want to see my lass who lives in Hexhamshire
Her father loves her well, her mother loves her dearer
I love them better than them both but, man, I can't get near her
Off with the  . . .  and over the moss and the mire
I want to see my lass who lives in Hexhamshire
If only I could be lying there aside her
While I must bide here, my arms'll be denied her
Off with the  . . .  and over the moss and the mire
I want to see my lass who lives in Hexhamshire
Her skin is like the silk and her hair is like the silver
Her breasts are deep and cool, they'll warm when I get near her
Off with the  . . .  and over the moss and the mire
I want to see my lass who lives in Hexhamshire
Ah, this love of mine, oh, this love, I am weary
Sleep I can't get none for thinking of my dearie
Off with the  . . .  and over the moss and the mire
I want to see my lass who lives in Hexhamshire
Away with the ?gilded? shield and away with the cap and feather
I want to see my lass who lives in Hexhamshire
Away with the buff and the blue
Away with the cap and feather
I want to see my lass who lives in Hexhamshire
Off with the  . . .  and over the moss and the mire
I want to see my lass who lives in Hexhamshire"
5,Tanya Tucker,Would You Lay With Me (In A Field Of Stone),TRIAVTH128F426FFC5,1973,"Would you lay with me
In a field of stone
If my needs were strong
Would you lay with me

Should my lips grow dry
Would you wet them dear
In the midnight hour
If my lips were dry

Would you go away to another land
Walk a thousand miles through the burning sand
Wipe the blood away from my dieing hands
If I give myself to you

Will you bathe with me 
In the stream of life
When the moon is full
Will you bathe with me

Will you still love me
When I'm down and out
In my time of trial
Will you stand by me

Would you go away to another land
Walk a thousand miles through the burning sand
Wipe the blood away from my dieing hands
If I give myself to you

Would you lay with me
In a field of stone
Should my lips grow dry
Would you wet them dear
Would you bathe with me
In the stream of life
Would you still love me
When I'm down and out"
6,Buddy Holly / The Fireballs,Slippin' And Slidin',TRENFKU128F93501F1,1973,"Slippin' &amp; a-slidin' - peepin' and a-hidin' 
been told a long time ago 
slippin' &amp; a-slidin' - peepin' and a-hidin' 
been told a long time ago 
I've been told baby you've been bold 
I won't be you're fool no more 

Oh my Linda, she's a solid sender 
know you better surrender 
oh my Linda, she's a solid sender 
know you better surrender 
slippin' &amp; a-slidin' - peepin' &amp; a-hidin' 
I won't be you're fool no more 

Oh big conniver - nothin' but a child 
I done got hip to your jive 
oh big conniver - nothin' but a child 
I done got hip to your jive 
slippin' &amp; a-slidin' - peepin' &amp; a-hidin' 
I won't be you're fool no more"
7,Tim Buckley,Peanut Man,TRLIAFH128F42514C9,1973,"Drops of persperation johnny 
Coming over me hey buddy 
Pour another glass of cola 
Pass it to me 

Round of coca cola 
Add some sweet potato to it 
You know everybody wants to get a peanut butter heart 

Drops of persperation johnny 
Coming over me hey buddy 
Pour another glass of cola 
Pass it to me 

Round of coca cola 
Add some sweet potato to it 
You know everybody wants to get a peanut butter heart 

Im looking through you 
Yes i can 
And that should do you 
Peanut man 

Im looking through you 
Yes i can 
And that should do you 
Peanut man 

Lots of perseperation 
Coming over me 
Pour another cola 
Pass it to me 

Im looking through you 
Yes i can 
And that should do you 
Peanut man 

Im looking through you 
Yes i can 
And that should do you 
Peanut man"
8,Aerosmith,Movin' Out,TRJBYPZ128F42832C5,1973,"We all live on the edge of town
Where we all live ain't a soul around
People start a-comin' all we do is just a-grin
Said we gotta move it out 'cause the city's movin' in
I said we gotta move it out 'cause the city's movin' in

Tell me who you know and I'll tell ya who to
Go see my friend, he'll set you free
Tell me what you need and maybe I can go too
No one knows the way but maybe me
Nobody goes there, nobody shows where
Nobody knows where you can find me, yeah

Good mornin' glory, hallelujah to ya
What is the story?
And what's been goin' through ya?
Livin' like a king off the fat of the land
Workin' like a dog in a rock and roll band

We're movin', we're getting out
We're movin', without a doubt
We're movin', we're goin' far
We're movin', oh, yes we are

'Cause nobody goes there, nobody shows there
Nobody knows where you can find me
Nobody knows there, nobody shows there
Nobody knows where you can find me
No, no no no no, it's all comin' down on you, yeah
Now now now oh

Level with God and you're in tune with the universe
Talk with yourself and you'll hear what you wanna know
Gotta rise above 'cause below it's only gettin' worse
Life in time will take you where you wanna go

Yeah, where you wanna go?
Where you wanna go?
Where you going?
Where you going?
Where you going?
Ah ah ah ah ah ahhhh, oh oh, come on

Good mornin' glory, hallelujah to ya
What is the story?
And what's been goin' through ya?
Livin' like a king off the fat of the land
Workin' like a dog in a rock and roll band

We're movin', we're getting out
We're movin', without a doubt
We're movin', we're goin' far
We're movin', oh, yes we are, 'cause

Nobody knows where, nobody shows where
Nobody knows where you can find me
Nobody knows where, nobody shows where
Nobody knows where you can find me

Well, down and down, 'round and down
Better catch your mama so you know where I'm goin'

We all live on the edge of town
Where we all live ain't a soul around
People start a-comin' all we do is just a-grin
Said we gotta move it out 'cause the city's movin' in
I said we gotta move it out 'cause the city's movin' in, hey"
9,Paul McCartney / Wings,My Love,TROFVDQ12903CFB792,1973,"And when I go away
I know my heart can stay with my love
It's understood
It's in the hands of my love
And my love does it good
Whoa whoa-whoa whoa, whoa whoa-whoa whoa
My love does it good

And when the cupboard's bare
I'll still find something there with my love
It's understood
It's everywhere with my love
And my love does it good
Whoa whoa-whoa whoa, whoa whoa-whoa whoa
My love does it good

Whoa-whoa, I love, oh-whoa, my love
Only my love holds the other key to me
Oh-whoa, my love, oh-oh, my love
Only my love does it good to me

Whoa whoa-whoa whoa, whoa whoa-whoa whoa
My love does it good

Don't ever ask me why
I never say goodbye to my love
It's understood
It's everywhere with my love
And my love does it good, whoa
Whoa whoa-whoa whoa, whoa whoa-whoa whoa
My love does it good

Whoa-whoa, I love, oh-whoa, my love
Only my love does it good to me
Whoa-whoa-whoa-whoa-whoa-whoa, whoa-whoa whoa"
10,The Fleetwoods,(He's) The Great Imposter,TRLKUYF128F427CC16,1973,"Well, I went and lost her
To the great imposter
I stood and watched her fall
Couldn't help her at all

Poetry, so sweet, has her at his feet
She thinks she's the one but he has just begun
All her friends they just watch her
For they know the great imposter

Don't she know he's on a stage
It's not real, it's just a play
And he's playing a part
That is soon to break her heart

Oh, can't she see tomorrow's misery?
Soon she'll learn her fate but it will be too late
All her friends they just watch her
For they know the great imposter

Poetry, so sweet, has her at his feet
She thinks she's the one but he has just begun
All her friends they just watch her
For they know the great imposter

And she's soon to join the roster
For they know the great imposter
And she's soon to join the roster
For they know the great imposter
And she's soon to join the roster"
11,Billy Joel,The Ballad Of Billy The Kid,TRGPDTS128F92EA514,1973,"From a town known as Wheeling, West Virginia
Rode a boy with a six-gun in his hand
And his daring life of crime
Made him a legend in his time
East and West of the Rio Grande

Well, he started with a bank in Colorado
In the pocket of his vest, a Colt he hid
And his age and his size
Took the teller by surprise
And the word spread of Billy the Kid

Well he never travelled heavy
Yes, he always rode alone
And he soon put many older guns to shame
And he never had a sweetheart
And he never had a home
But the cowboys and the ranchers knew his name

Well he robbed his way from Utah to Oklahoma
And the law just could not seem to track him down
And it served his legend well
For the folks they love to tell
'Bout when Billy the Kid came to town

Well, one cold day a posse captured Billy
And the judge said, ""String 'im up for what he did.""
And the cowboys and their kin
Like the sea came pourin' in
To watch the hangin' of Billy the Kid

Well he never travel'ed heavy
Yes, he always rode alone
And he soon put many older guns to shame
Well he never had a sweetheart
But he finally found a home
Underneath the Boot Hill grave that bears his name

From a town known as Oyster Bay, Long Island
Rode a boy with a six-pack in his hand
And his daring life of crime
Made him a legend in his time
East and West of the Rio Grande"
12,Marie Osmond,Paper Roses,TRTZIBX128F9326F35,1973,"I realized the way your eyes deceived me
with tender looks that I mistook for love
So take away the flowers that you gave me
And send the kind that you remind me of
Paper Roses
Paper Roses
Oh how real those roses seem to be
But they're only imitation,
Like you imitation love for me
I thought that you would be a perfect lover
You seemed so full of sweetness at the start
But like a big red rose that's made of paper
There isn't any sweetness in your heart
Paper Roses
Paper Roses
Oh how real those roses seem to be
But they're only imitation like you imitation love for me"
13,Demis Roussos,My Friend The Wind,TRTTCHQ128F1477601,1973,"My friend the wind will come from the hills 
When dawn will rise, he'll wake me again 
My friend the wind will tell me a secret 
He shares with me, he shares with me 

My friend the wind will come from the north 
With words of love, she whispered for me 
My friend the wind will say she loves me 
And me alone, and me alone 

I'll hear her voice and the words 
That he brings from Helenimou 
Sweet as a kiss are the songs of Aghapimou 
Soft as the dew is the touch of Manoulamou 
Oh oh oh 

We'll share a dream where I'm never away from Helenimou 
Blue are the days like the eyes of Aghapimou 
Far from the world will I live with Manoulamou 
Oh oh oh 

My friend the wind go back to the hills 
And tell my love a day will soon come 
Oh friendly wind you tell her a secret 
You know so well, oh you know so well 

I'll hear her voice and the words 
That he brings from Helenimou 
Sweet as a kiss are the songs of Aghapimou 
Soft as the dew is the touch of Manoulamou 
Oh oh oh 

La la la .... Helenimou 
La la la .... Aghapimou 
La la la .... Manoulamou"
14,Michael Stanley,Rosewood Bitters,TRJDIPG128F4267C02,1973,"Too long on the road, my friend
Too long between rides
Too long between homes again
Too long without someone by my side

And Lord, there's something 'bout a sad song
that helps to ease the pain...
Here I am, Lord, just singing up a storm
and I'm all alone again...

Too much going down today
just can't take it in
Too much running 'round today
can't tell you where I've been

Seems that just like singing in the only thing to do
only thing to help me pass the time
Songs are just like ladies--can't forget them when you're through
and they're always on your mind...

(CHORUS:)
And the rosewood bitters
Help me meet the sunshine in the morning
And the rosewood bitters
Help me through the night
When I feel blue

Too few stop to pass the time
Guess that's how it goes
So sure that there's much more than this
when really no one knows

And easing into midnight
as the bitters pass around
crying in my beer
Singing someone else's troubles
help to ease your own
Goodnight, Irene, my dear...

(CHORUS)"
15,Redbone,Come And Get Your Love,TRPAMDW128F92F15C1,1973,"Hail (hail)
What's the matter with your hair? Yeah
Hail (hail)
What's the matter with your mind and your sign? And a, oh, oh, oh-a
Hail (hail)
Nothing the matter with your head baby, find it, come on and find it
Hail
With it, baby, 'cause you're fine, and you're mine, and you look so divine

Come and get your love
Come and get your love
Come and get your love
Come and get your love

Hail (hail)
What's the matter with you? Feel right
Don't you feel right baby?
Hail, oh yeah
Get it from the main vine, all right
I said a-find it, find it
Go on and love it if you like it, yeah
Hail (hail)
It's your business, if you want some, take some
Get it together, baby

Come and get your love
Come and get your love
Come and get your love
Come and get your love

Come and get your love, come and get your love, come and get your love now
Come and get your love, come and get your love, come and get your love now
Come and get your love, come and get your love, come and get your love now
Come and get your love, come and get your love, come and get your love now

Come and get your love
Come and get your love
Come and get your love
Come and get your love

Hail (hail)
What's the matter with you? Feel right
Don't you feel right baby?
Hail, oh yeah
Get it from the main vine, all right

La, la, la, la, la, la (Come and get your love)
La, la, la, la, la, la (Come and get your love)
La, la, la, la, la, la (Come and get your love)
La, la, la, la, la, la (Come and get your love)
La, la, la, la, la, la, la, la, la (Come and get your love)
La, la, la, la, la, la, la, la, la (Come and get your love)
La, la, la, la, la, la, (Come and get your love)
La, la, la, la, la, la, la, la, la (Come and get your love)"
16,America,Wind Wave (Album Version),TRSMZOV128F1477DBF,1973,"Sometimes when I'm down on my luck, feelin' dizzy 
My mind reels back to those days in the city 
When early in the morning take a trip, it's so pretty 
I could never understand why it wasn't so grand 

I got a hankerin' for a wind wave 
I got it through and through 
I got a hankerin' for somethin' home made 
It's got to be brand new 

Early in the morning when the sun comes up 
I'm gonna grab a fishin' pole and a sleepin' bag roll 
Head out for the land of the dumb but the pretty 
I won't stay long but you never know 

I got a hankerin' for a wind wave 
I got it through and through 
I got a hankerin' for somethin' home made 
It's got to be brand new 

I got a hankerin' for a wind wave 
I got it through and through 
I got a hankerin' for somethin' home made 
It's got to be brand new 

Sometimes when I'm down on my luck, feelin' dizzy 
My mind reels back to those days in the city 
Sometimes when I'm down on my luck, feelin' dizzy 
My mind reels back to those days in the city 
Sometimes when I'm down on my luck, feelin' dizzy 
My mind reels back to those days in the city ..."
17,Gregg Allman,Queen Of Hearts,TRKZTAU128F42137C7,1973,"Once I was glad,
Always happy never sad,
And every day
Felt like Sunday
And although things were slow
Never seemed to have no dough
Somehow, I never once got lonely
Ya' see the fact is more or less
You're gamblin' with your own happiness
And most all your would-be friends
Turn out so phony

Oh but times they change
And I'm through the rains
And I'm seein' the Queen of Hearts
Don't know where to start
Or how to stop

And after things have come and gone
Left me feelin'
That I've done so wrong
Oh, I've spent so much time
Feelin' guilty
And as I watch you sit across the room
Beautiful as the flowers bloom
Living it just one day
Oh brother you're gonna come back
To find me gone

I love you Queen of Hearts
Tell me not to stop
Just tell me where
To start
Where now baby
Tell me where to start

And after all that we've been through
I find that when I think of you
A warm soft wind runs
Through and through
And in my heart
There's only you
And I will always keep on trying
To gather this strange peace of mind
Without it there'd be
Lonely me and
Oh darlin' lonely you

I love you Queen of Hearts
Don't tell me when to stop
Tell me when to start

I love you queen of Hearts
Tell me not to stop
Just tell me where
To start"
18,Judee Sill,The Phoenix (Remastered LP Version),TRRLEBX128F4233E80,1973,"The sun was red, and the fires were roarin'
Stars aligned and the webs were spun
I coulda sworn I heard my spirit soarin'
Guess I'm always chasin' the sun
Hopin' we will soon be one
Until it turns around to me, then I try to run...
On phosphorous wings the phoenix floated
The fires froze and the sea was hushed
And when I tried to speak, the sun imploded
And the war will wage in my guts
Till the Devil bites the dust,
I never say him losin' a race, but I think he must...
The great storm raged and the power kept growin'
Dragons rose from the land below
And even now I wonder where I'm goin'
Ever since a long time ago
I've tried to let my feelings show
I'd like to think I'm bein' sincere, but I'll never nnow..."
19,James Gang,Rather Be Alone With You (AKA Song for Dale) (Album Version),TRQZYXE128F932B013,1973,"Your sister's comin' over
She got something on her mind
I just don't understand it
We have never got the time

Now, don't be nervous
If I seem upset	
I can handle it and yet	
I'd rather be alone with you 
I'd rather be alone with you

Walk a little faster
I got your mama on the phone
What a sense of timing
When you need to be alone

Hang a sign out
Telling everyone
We'll be gone for quite awhile
I'd rather be alone with you
I'd rather be alone with you

Ooh ooh ooh, ooh ooh ooh-ee
Ooh ooh ooh, ooh ooh ooh-ee
Ooh ooh ooh, ooh ooh ooh-ee
Ooh ooh ooh"
20,Art Garfunkel,Woyaya,TRKZINR128F9335BF8,1973,"We are going, heaven knows where we are going,
We'll know we're there.
We will get there, heaven knows how we will get there,
We know we will.

It will be hard we know
And the road will be muddy and rough,
But we'll get there, heaven knows how we will get there,
We know we will.

We are going, heaven knows where we are going,
We'll know we're there."
21,Albert Hammond,The Peacemaker,TROIGAG12903CD0A2D,1973,"Get out, damn it
Close the door, don't slam it
Let me be alone a while
To give my nerves a rest

Whatever you do I love you
No matter what you do I love you
And I want to run out after you
But I don't know what's best

If you will take good care of me
I'll be your caretaker
You'll be the maker of the peace
I'll be the peacemaker

You will take good care of me
Then I'll be your caretaker
You'll be the maker of the peace
I'll be the peacemaker

Hours later
I hear the key in the front door
We look each other in the eye
A timid sorry pair

There's a little more conversation
A little more conversation
A battle's lost and a war is won
I think we've cleared the air

You will take good care of me
I'll be your caretaker
You'll be the maker of the peace
I'll be the peacemaker

If you will take good care of me
Then I'll be your caretaker
You'll be the maker of the peace
I'll be the peacemaker

You will take good care of me
Then I'll be your caretaker
You'll be the maker of the peace
I'll be the peacemaker

You will take good care of me
Then I'll be your caretaker
You'll be the maker of the peace
I'll be the peacemaker"
22,Iggy & The Stooges,I Need Somebody,TRZFNUM12903D097B0,1973,"But I am your crazy driver
Honey I'm sure to steer you 'round
I am dying in any story
I'm only living when I sing this song, just the same, baby 

I need somebody, baby
I need somebody, too
I need somebody, baby
Just like you, just like you
Just like you

But I'm losing all my feelings
And I'm running out of friends
You know you lied to me in the beginning, baby, and now you're gonna try to bring me
Try to bring me to the end, but shit, I still don't mind it

I need somebody, baby
I need somebody, too
I need somebody, baby
Just like you, just like you
Just like you

Well now it's time to leave this signal
The interference is too strong
Yeah I got my reputation
Ride them airwaves not too long

I need somebody, baby
I need somebody, too
I need somebody, baby
Just like you, just like you
Just like you

Somebody
Somebody
Somebody

'Cause I bleed
'Cause I bleed
'Cause I bleed
'Cause I bleed

Somebody, yeah
Somebody

Just like you
Just like you"
23,Hues Corporation,Rock The Boat,TRPCNEC128F92D3EEC,1973,"So I'd like to know where you got the notion
Said I'd like to know where you got the notion
To rock the boat, don't rock the boat baby
Rock the boat, don't tip the boat over
Rock the boat, don't rock the boat baby
Rock the boat

Ever since our voyage of love began
Your touch has thrilled me like the rush of the wind
And your arms have held me safe from a rolling sea
There's always been a quiet place to harbor you and me

Our love is like a ship on the ocean
We've been sailing with a cargo full of love and devotion

So I'd like to know where you got the notion
Said I'd like to know where you got the notion
To rock the boat, don't rock the boat baby
Rock the boat, don't tip the boat over
Rock the boat, don't rock the boat baby
Rock the boat

Up to now we sailed through every storm
And I've always had your tender lips to keep me warm
Oh I need to have the strength that flows from you
Don't let me drift away my dear, when love can see me through

Our love is like a ship on the ocean
We've been sailing with a cargo full of love and devotion

So I'd like to know where you got the notion
Said I'd like to know where you got the notion
So I'd like to know where you got the notion
Said I'd like to know where you got the notion

To rock the boat, don't rock the boat baby
Rock the boat, don't tip the boat over
Rock the boat, don't rock the boat baby
Rock the boat, ooh

Rock the boat, rock on with yo bad self
Rock the boat, rock on with yo bad self
Rock the boat, rock on with yo bad self
Rock the boat, rock on with yo bad self

Rock the boat
Rock the boat
Rock the boat
Rock the boat"
