,Artist,Title,Track_id,Year,Lyrics
26,Drowning Pool,Sermon,TRLNLRD12903CCC9F8,1999,"Rrrroah, Go!...
Where was God when I needed a friend?
And where was God when I came to an end?
Where was God when I lost my mind?
Where was God when I couldn't find?

I don't wanna' be up or down
Don't wanna' be up or down
Don't wanna' be up or down
I don't wanna' be up or down

Where was love when I felt like hate?
Where was hate when I felt like love?
Where were you when you said you'd be there?
Where was the fear, when I said I was scared?

I don't wanna' be up or down
Don't wanna' be up or down
I don't wanna' be up or down
I don't wanna' be up or down... Why?

Tell me what you believe, (Tell me what you believe)
I'll tell you what you should see (I'll tell you what you should see)
I don't know who to trust (Tell me what you believe)
My heart is filled with disgust

['breathing'... ""Speak""]
['breathing'... ""Speak""]
['breathing'... ""Speak""]
... Whoa!

I can't take this now!...

Tell me what you believe (Tell me what you believe)
I'll tell you what you should see (I'll tell you what you should see)
I don't know who to trust (Tell me what you believe)
My heart is filled with disgust (I'll tell you what you should see)
Tell me what you believe (Tell me what you believe)
Tell me what you believe... Ahh-ah...

Ahh-ah-ah-ohh... Oh-ohh-oh... Ahh-ah-ah-ohh

""Ladies and Gentlemen...""
""May I have your attention?""
""Are you ready for the joke?"" ['laughter']
""Are you ready for the great deception!?""

God! (Tell me what you believe) God!
God! (Tell me what you believe) God!
Whoah! (Tell me what you believe)
Aahh-ah (Tell me what you believe) Ahh-ahh-ah-ah
Aahh-ah (Tell me what you believe) Ahh-ahh-ah-ah
Aahh-ah (Tell me what you believe) Ahh-ahh-ah-ah
Aahh-ah... Ahh-ahh-ah-ah...
Aahh-ah... Ahh-ahh-ah-ah...

""Ladies and Gentlemen tell me what you believe"" played backwards"
27,The Mad Capsule Markets,Island,TRZLDEV128F428C964,1999,"Like an island's sunshine I'm showered
Today is going to be an extra off day
Like an island's sunshine I'm showered
Somehow feel like being lazy today
Get a beer,I think I need some cheer me up
Make a toast to the fluffy clouds in this sky
Low cure stressed out
Ringing bell crumble snatching my time
Time to get busy but I won't keep it up
Then tomorrow comes up some like this again!
It makes me dizzy my head swims in the air"
28,Burning Airlines,I Sold Myself In,TRGQRUX128F4274FE6,1999,"A 2 p.m. morning
I'm greeting
The end of meaning
Open my mind
Just a crack and
Look what crawls in
Now I'm trying to keep my head
Above your dead pool
Deep end

I sold myself in
In on the joke of the spin
But this burned-in cynical grin
Is fading again
Turning the hooks
To catch nothing
I'm let off
You live in your head
And love no one
At all
Spotlit marks for your
Self-styled, comic book
Sharpshooter
Blind spots before
I sold myself in
In on the joke of the spin
Now this burned-in cynical grin
Is fading again

Peeling those tired eyes
To steal and refine
Some sleek pitch line
Wide of the mark
Pressed to define
Connect the dots
Line by line

I sold myself in
In on the joke of the spin
Now this burned-in cynical grin
Is fading again"
29,Toy-Box,What About,TREOFTS128F92DD8C3,1999,"First time now, baby, when I saw your face
I knew for a fact that it was a love-you case
I was drawn to you like bee seeking honey
It was all about the love, not all about the money

You were an easy rider
I was a sneaky spider
Caught you in my net, ha, just like that
Cause baby you know what, this is where it's at

If I could tell you 
How much I really care for you
If I could show you 
How far I really go
Cause to you I belong

So what about the times when I hold you tight?
And what about the days, what about the nights?
What about the truth, what about the lies?
And what about a kiss before a goodbye
Before a goodbye?

Hey, you looking this good just has to be a crime
So sitting and waiting is a waste of time
Things are getting better, forget about the weather
The only real thing is you and me together

Come let us do the twist and shout
Love is what it's all about
Same old, same old hunt and chase
I'm coming right at you, in your face

If I could tell you 
How much I really care for you
If I could show you 
How far I really go
Cause to you I belong

So what about the times when I hold you tight?
And what about the days, what about the nights?
What about the truth, what about the lies?
And what about a kiss before a goodbye
Before a goodbye?

So what about the times when I hold you tight?
And what about the days, what about the nights?
What about the truth, what about the lies?
And what about a kiss before a goodbye
Before a goodbye?"
30,Kind of Like Spitting,At Your Convenience,TRULYIS128F428FA62,1999,"There's only two ways out of here, through my window or through my door.  I can say what you need to hear, but I don't think that I ought to anymore.  Its not unnatural to feel like you lost it all.  I was kissing your eyelids when I should have been in college and it felt so wrong.  And I want you to fail, I hope you figure it out.  There's more than one side to things, more than one reason to get out.  But I could never say no, I could never leave alone.  We both to chose to live this way, seek the new ones, burn the old ones.  And of course there's not much in the way of conversation.  So here's a new one, burn the old one.  You can leave your stereo on, as you cross the threshold into your new life.  Take a long step over me, as you walk out into your new life."
31,Texta,Gescheitert,TRSWTXZ12903CD0ABF,1999,"Dadadada
Dadadada
Dadadada
(Denn man verbraucht die Leute, die an einen glauben)

Huckey
Ich hätte nie gedacht, dass so was möglich sein kann, 
aber jetzt weiß ich es, und ich zweifle nicht mehr daran.
Einen Großteil der Leute kannst du immer vergessen, 
die würden alles aufgeben, für ein Zimmer und was zu essen. 
Sie schmeißen ihre Ideale weg und hinken Parolen hinterher, 
steigen blind in die Falle und vor Schreck sehen sie das, was sie wollen nicht mehr.
Sie wären zu Allem bereit, auch wenn´s zu weit geht, 
und planen die Hinrichtung, folgen denen wo´s leicht geht 
und drehen ihre Fahnen je nach Windrichtung. 
Und wenn das so ist, dann können wir´s gleich bleiben lassen, 
denn wenn das deine Freunde sind, wie müssen dich erst deine Feinde hassen? 
Und dann kommst du mit schlechten Slogans und viel Geschrei, 
aber bei deiner Revolution war plötzlich keiner dabei, 
und wenn ich dir so zuschau, dann fress ich einen Besen mit samt der Putzfrau, 
wenn du jemals ernst gemeint hast was du sagtest, dachtest und tatest. 
Das Glück auf das du wartest kommt nicht von selbst, 
und die Leute haben begonnen in die falsche Richtung zu laufen, 
denn das was wir wollen, ist oft nicht das was wir wirklich brauchen. 
„Das weiß ich auch inzwischen“, hör ich dich durch deine Zähne zischen, 
„die Drogen logen und die Revolution haben wir verschoben, aber glaub mir sie passiert!“ 
„Ach, ich glaub dir gar nichts, egal was wird.“
„...und wo warst du? Warum bist du nicht dabei gewesen?„
„Ich war zu Hause, Texte schreiben und Bücher lesen, 
denn das ist keine Reise auf einem Traumschiff. 
Wichtig ist, dass du mit den richtigen down bist, 
sonst bekommst du den blauen Brief von den Kriegssüchtigen, 
berühmt und berüchtigten Verfechtern einer ohnehin fragwürdigen Ideologie.“
Deine Revolution verreckte im Wohnzimmer und passierte natürlich nie.

Skero
Was ist bloß passiert mit deinem Revoluzergeist? 
Auf einmal willst du Sicherheit wie Embrios im Mutterleib. 
Glaub nicht, dass ich deinen Weg unterschreib.
Geprägt von Futterneid, es tut mir Leid. 
Alles was du angekündigt hast, fand nicht statt 
und jeder der dir vertraut hat wurde abgefuckt. 
Nur ein Hampelmann springt auf, wenn man die Fäden spannt 
und Veränderung kommt nicht über Nacht, sondern lebenslang.

Flip
Ich steh nicht auf Monopole, Monologe, die neueste Modedroge. 
Monotones Gefasel bringt mich schon lang in Rage. 
Ist das Leben nur Fassade, frage mich: „Wo sind die Grenzen?“
Dass jeder sich am nächsten steht, scheint Grundprinzip des Menschen. 
Denk nach: Benutzt du nicht auch einen Schutzschild, 
härter als Asphalt, damit alles abprallt? 
Natürlich weißt du, dass weltweit viel falsch rennt. 
Drum bist du Abfall-Trenner, Geld an Dritte-Welt-Länder-Spender, 
bist nur ein Blender, änderst Tatsachen und Fakten,
tarnst dein wahres Ich und verschanzt dich hinter Masken 
und Images so seicht wie Gequatsche in Talkshows. 
Je lauter alle schreien, desto mehr werden sie wortlos und wertlos, 
der Schmerz ist groß, den ich empfinde. 
Manche Dinge im Leben hören oft nur Taube und sehen nur Blinde. 
Ich will keine Kriegslist, keine Fallen. keine Täuschungsmanöver,
keine Hippies die nichts schnallen, keine falschen Erlöser, 
keine braven Ehemänner, die heimlich ihre Töchter ficken, 
keine Abtreibungsgegner, die ihre Söhne in den Krieg schicken, 
keine schicken Häschen, die sich am Häuschen ihr Näschen pudern, 
keine frustrierten Looser, die über gescheiterte Revolutionen sudern. 
Brech lieber auf zu neuen Ufern, als zu alten Ideen, 
denn nur in verkalkten Gehirnen bleibt die Zeit ewig stehen.

Skero
Was ist bloß passiert mit deinem Revoluzergeist? 
Auf einmal willst du Sicherheit wie Embrios im Mutterleib. 
Glaub nicht, dass ich deinen Weg unterschreib.
Geprägt von Futterneid, es tut mir Leid. 
Alles was du angekündigt hast fand nicht statt 
und jeder der dir vertraut hat wurde abgefuckt. 
Nur ein Hampelmann springt auf wenn man die Fäden spannt 
und Veränderung kommt nicht über Nacht sondern lebenslang.

(Denn man verbraucht die Leute, die an einen Glauben)"
32,EDGUY,Land Of The Miracle,TRMSBZU128F421BAFB,1999,"Blinded by the fire and the sorrow of the day,
I come knocking at your door to dry the tears away,
The eventide is calling me to take a look into your eyes,
Pull me on and make me mesmerized!

Riding on the wings of light,
Dreaming dreams and holding tight:
Leaving all my sorrow far behind,
Your eyes are the gate

To the land of the miracle
Where our love can make us fly, make us fly,
In the land of the miracle,
We can find a reason why and how we can fly.

Open up the book up madness read the page of life!
Who's the one to tell you what to do and how to rise?
And if the stars would fall one day I'd climb up the sky
To put them back for you to save your smile.

Riding on the wings of light,
Dreaming dreams and holding tight:
Leaving all my sorrow far behind,
Your eyes are the gate

To the land of the miracle
Where our love can make us fly, make us fly,
In the land of the miracle,
We can find a reason why and how we can fly.

To the land of the miracle
Where our love can make us fly, make us fly,
In the land of the miracle,
We can find a reason why and how we can fly.

... take a look into the book of fantasy and poetry
And you will see: what you can feel is everything
You need to heal your crying mind, the soul behind
And everything that you may find inside your head...

... A million years have passed away to make us head
For the decay and to unlearn just what we yearn 
For all day long: right to be strong and stick to
Our ideals, are they for real and do we just have lost the thread?...

... I believe in miracles they happen every day,
In your arms a dream comes true for me...

... I believe in miracles they happen every day,
In your arms a dream comes true for me...

... I believe in miracles they happen every day,
In your arms a dream comes true for me..."
33,Jim Cuddy,Disappointment,TRLOFLR128F14A919C,1999,"Disappointment
Gets to me so easily.
I tell myself that nothing's wrong
But nothing's like it used to be.
I walk down streets where I've been before

But they're not the same to me anymore.
Big moon rising
Shining through my window pane.
I get up to put my clothes on
I lose my nerve I'm back again.
Something holds me from behind
Moves in like a fog every time.

Well I'm sorry I just can't seem
To get it back again.
I'm falling on my face a lot.
I don't know who to blame.

Do you remember
The room we shared on Grand St.
We'd lie there in the afternoons
Drifting in and out of sleep.
Let our minds just float away
Nowhere to be and nothing much to say.

Well I'm floating around in space
Nothing holds me in.
I know I always call you up
When I'm in trouble again.

I've watched
As dreams have come and gone.
I try to change
I'm still my father's son.
Now I wait
I wait and let it come.
Let it come.

Disappointment
Gets to me so easily.
A crowded room and smoky lights
Used to be enough for me.
Now my patience is wearing thin
To wake up from this dream I'm living in.

I'm sorry I just can't seem
To get it back again.
I'm falling on my face a lot.
There is no one here to blame.

I've watched
As dreams have come and gone.
I try to change
I'm still my father's son.
Now I wait
I wait and let it come.
Let it come"
34,Coalesce,Jesus In the Year 2000 / Next on the Shit List,TRWDRDP128F4258776,1999,"Out of the way, John's coming through and you're next on the shit list.
In memory of the man, who taught me how to live.
When the chips were down, and the barrel was loaded.
Oh, John. Master (peace brick) thief.
How can we ever forget you?
Everything we did you did bigger.
And you could bring the kid out of anyone of us.
And I will never understand what you thought you were doing.
You didn't have to go out like that, John.
You didn't have to do that. We love you."
35,Celtas Cortos,Pajarico,TRYLBXQ128E0795DE9,1999,"Hoy me cambio de vida
Como lo hice ayer mismo y anteayer
Voy a empezar de cero
Y en La Habana te espero tomando ron
Siempre est la esperanza amor
Acechando en la esquina del corazn
De una vida en la playa, baile, hierba y ron

Y la luna, que esta noche nos fa otra vez ms
Nos invita a otro trago de libertad
La esencia de la risa

Y la luna, que esta noche nos fa otra vez ms
Nos ofrece la mano pa' escapar
Y a gozar de la vida

Vida para beber
Vida para jugarla y apostar
Vida para gastar
Sin contraindicaciones
Pa' gozar

Otro ro que se re del fro en el corazn
Qu subidn de son
Que ataque de anarqua en el corazn

Y la luna, que esta noche nos fa otra vez ms
Nos invita a otro trago de libertad
La esencia de la risa

Y la luna, que esta noche nos fa otra vez ms
Nos ofrece la mano pa' escapar
Y a gozar de la vida

Que si sale la luna
Me dir que te robe el corazn
O lo tomo prestado
O tu me lo regalas sin condicin
O me quedo en tu puerta
O te invito a mi cama
Y a una cancin
Colorn colorado
Y el cuento se ha acabado ya me voy

Me voy"
36,Stroke 9,Letters,TRFMXLQ128F14A2D80,1999,"You're leaving me here, dear
Alone with all your letters
You're letting it go, no
Like innocence and feathers
You're putting it down
Sounds slipping into songs
You're leaving me here, dear
Alone with all my wrongs
You're pulling away
Pray you're making the right choice
You're pulling away
Stay and listen to my voice
To my voice

Sooner or later you will long
When you wake you will see
Sooner or later all the songs
That make you shake will be by me
Sooner or later all the throngs of feelings
We used to appreciate will come rushing back

You're thinking about
How you thought you knew me better
You're looking around town
And wondering how I met her
You're pulling away
Pray you're making the right choice
You're pulling away
Stay and listen to my voice
To my voice

Sooner or later all the throngs of feelings
we used to appreciate will come rushing back
When you wake you will see

Don't wake me as you leave
Don't make me believe I have a chance in hell
Don't tell me what I know too well
Don't wake me

As you're leaving me here, dear
Alone with all your letters
Don't let go of your innocence and feathers
Now I find every sound reminds me of our song
Since you left me here, dear
Alone with all my wrongs
With my wrongs

Sooner or later, I'll be gone
When you wake you will see
Sooner or later all the songs
That make you shake will be by me
Sooner or later all the throngs of feelings
We used to appreciate will come rushing back
When you wake up you will see.

Sooner or later, 
All the throngs of feelings 
We used to appreciate will come rushing back.. 
when you wake you will see
don't wake me if you leave you'll come rushing back to me."
37,Geri Halliwell,G.A.Y.,TRZBNFH128F425AE32,1999,"What would I do if I was you?
I'd come out and say what I'd wanna do
I'd be a man you'd never be
So why don't you get up and groove with me?

Give it up, give it out
Let it run, let it shout
Stayin' alive to survive
Being pretty
Feeling chic, like a freak
You won't jump to the beat
Let your young hearts run free

CHORUS:
Everybody c'mon let's get G-A-Y, G-A-Y (Oooh, ooh, ooh)
Throw out bad times kiss yourself and say goodbye, G-A-Y

What would you do if you were me?
Are you ready to face what you wanna be?
Enough is enough when it's just too long
So get up and go out and get it on

Give it up, give it out
Let it run, let it shout
Stayin' alive to survive
Being pretty
Feeling chic, like a freak
You won't jump to the beat
Let your young hearts run free

CHORUS

G-A-Y
Good As You
G-A-Y
Good As You

CHORUS x 3

C'mon everybody
C'mon everybody
Kiss yourselves goodbye"
38,God Dethroned,The Execution Protocol,TRAISRD128F934AF45,1999,"Death breathes down my neck. The sword will soon decide. Who was right and who
was wrong. Jesus saves, but death prevails. The execution protocol. The
inquisitions deatch call. The execution protocol. Is it God's decision after
all? I look at you, you're my saviour. Bow my head as I kneel. You're the one
I fear most. You're the one who wields the sword. The execution protocol. The
inquisitions deatch call. The execution protocol. Is it God's decision after
all? Persecution mania of heretics. I climb the stairs to the scaffold. Blind
my eyes so I can't see. The grin on your disgusting face. You're a tool of
God's inferior race. The inquisitions deatch call. The execution protocol. Is
it God's decision after all?

(lead - Jens)"
39,Dolly Parton,Train_ Train,TRULRPW128F92E7190,1999,"Train, train 
Gonna take him on out of this town 
Train, train 
Gonna take him on out of this town 
Yeah, that man I'm in love with 
Lord, he's Memphis bound 
He's leavin' here 
Like a raggedy old coat 
Oh, he's leavin' me 
That no good so-and-so 
Yeah, that man I'm in love with 
Lord, he wants to go 
Let him go 
Good-bye, good-bye 
I'll find myself another man 
Good-bye, good-bye 
I'll find myself another man 
You take that night train to Memphis 
Me, I'll make new plans 
Take that night train to Memphis 
Oh leave while you can"
40,Pedro Abrunhosa,Sombra,TRYHVDJ128F934721B,1999,"Eu e tu como loucos
Feitos donos da estrada,
Procurando o destino
Entre o tudo e o nada.
Sem saber ler o céu
Ou o mapa rasgado,
Engolimos sinais
Em sinal de pecado.
Vozes velozes
Levando a melhor,
São loucos que vivem
Na paz do motor.
Há canções pela rádio
Que te fazem voar,
Piruetas perfeitas
Enganando o radar!

Sei de um lugar para ti
Onde há lugar para mim,
E razões para me esconder.
Sou dono do deserto
E de todo o bar aberto
Onde insisto em me perder.

Dim, dim, dim,
Dom, dom, dom, X 2
É o som da tua sombra
Presa dentro de mim.

Eu e tu como loucos
Vagueando no pó,
Descobrindo nos outros
Quem mais está só.
Sentados na lua,
Onde o vento vagueia,
Cinquenta infelizes
Pedindo boleia.
Encostados na berma
Entre o céu e o chão,
Abraçados à terra,
Perdendo a razão.
Correndo o asfalto
Como rios no monte,
Somos feras sem dono,
Somos o horizonte!

Sei de um lugar para ti
Onde há lugar para mim,
E razões para me esconder.
Sou dono do deserto
E de todo o bar aberto
Onde insisto em me perder.

Refrão

Tens a paranóia do silêncio.
Tenho um medo que é imenso
De acordar e não te ver.
Presa por quereres a liberdade,
E essa história da saudade
Com que insistes em te defender.
Anda, insulta-me agora!
Está na hora de sentires a minha pele.
Sou como um lobo, o fogo que goza,
Raposa que cruza
O teu sonho mais fiel.

Sei de um lugar para ti
Onde há lugar para mim
E razões para me esconder.
Sou dono do deserto
E de todo o bar aberto
Onde insisto em me perder.

Refrão

Pedro Abrunhosa - Voz, piano, teclados.
Paulo Pinto - Guitarras, guitarra acústica.
Alexandre Almeida - Guitarra, melodia das cordas.
Cláudio Souto - Teclados, analógicos, piano, coro.
João André - Baixo, coro.
Alexandre Frazão - Bateria.
Orlando Costa - Percussões.
Leonardo Reis - Percussões.
Ivãzinho - Percussões.
Charles Mutter - Violino.
Emily Davis - Violino.
Yuko Inone - Viola.
Paulo Moura - Coro."
41,E.G. Daily,All I Want,TROIUKB128F930EA97,1999,"Say, hear your troubles got
you feelin' down?
All your faith is gone,
Oh, know the damage
broken hearts can do
But things will change,
You're not alone,
Though it's hard for you to believe,
Lift your head,
Take my hand,
I'll dry your eyes and
gotta keep on tryin'

All I want is for you to know,
I'll be there, I won't let you go,
Carry you, set your on your way,
Heal your wings help you
fly, I will be there

You don't have to take it alone

You with your heavy heart,
come rest your head,
I'll comfort you,
Oh, know it seems the
hard times never end,
Things will change,

(things will change)
You're not alone, (not alone)
Though it's hard for you to believe,
Lift your head, (lift your head)
Take my hand, (take my hand)
I'll dry your eyes and
gotta keep on fightin'

All I want is for you to know,
I'll be there, I won't let you go,
Carry you, set your on your way,
Heal your wings help you
fly, I will be there

Don't forget I'm always there

No need to take it alone,
Don't take it alone,
Don't take it,
Gonna be right there,
No need to take it alone,
Don't take it alone,
Don't take it alone again

All I want is for you to know,
I'll be there, I won't let you go,
Carry you, set your on your way,
Heal your wings help you
fly, I will be there

Don't forget I'm always there

No need to take it alone,
Don't take it alone,
Don't take it,
Gonna be right there,
No need to take it alone,
Don't take it alone,
Don't take it alone again"
42,Crazy Town,Only When I'm Drunk,TRAUDHX128F930826E,1999,"i get drunk and i stumble to the phone.
and conjure up a bitch to bone
when i'm alone.
fucked up, tore back.
i need to take a piss.
only when i'm drunk,
i sing a song like this.
my grandma and your grandma...
...sittin by the fire.
hold on, turn that beat off.
na, keep it going.
crazy town, yo y'all just not knowin'.
i get drunk and start talking more shit.
and when i got a gun in my hand,
you better get...
...out  'cause my brain
just ain't what it used to be.
forget trying to rationalize,
cover your eyes.
i get...(uh!)...damn i'm drunk
i need a chunk. no better yet.
a hunk of that funk.
i get...(uh!)...damn i'm drunk
i need a chunk. no better yet.
a hunk of that funk.
yeah, i'm good, bad, dope.
i'm freaky fresh.
i make hip-hop fans say ""yes, yes"".
crazy's comin' thru.
you know we're gonna blow up.
hold up. wait.
i think i'm gonna throw up.
na, false alarm.
i'm getting all the ladies with my cool charm.
when i get drunk,
i might even call my daddy a punk.
yeah, but only when i'm drunk.

CHORUS:
yeah, only when i'm drunk.
only when i'm drunk.
yeah, only when i'm drunk.
it happens only when i'm drunk.
it goes, one for the chronic.
two for the amnesia.
i'm that crazy white boy
with the drinks in the freezer.
bust a one out, two out.
blitz type of rapper
that will get out of your seat
quicker than a car jocker.
sippin' colt forty fever
when i'm coolin' with my people.
got hos in east columbus.
like i'm Billy D. Rico.
'cause i move like i'm smooth.
like i'm harry belafonte.
lookin' for them suckers
that jumped my homey. Le Le.
all up in this bitch
with the gin and tonqueray.
drink like Mr. Wendal.
smoke bud like Dr. Dre.
but that's 'cause i'm old enough
to do that type of shit.
god damn. i gotta piss.
i pass the mic to Mr. Shift.
i get drunk and can't nobody
whoop me.
i'm trippin'
it must be that brew that that i was sippin'
kickin' in.
guess i shouldn't have mixed it with the gin.
'cause when i'm laying on my back,
i can feel the room spin.
one too many, i rekon.
feelin' i got to hurl any second.
want to get up but can't move.
feels like i'm stuck in a groove.
what the fuck was i trying to prove.
i got a knack for downin' four-o's.
all the hos know them doobie bros.
people call me shift
i keep a fifth in my trunk.
i might fuck an ugly bitch,
but only when i'm drunk.

CHORUS
yeah, one two, one two.
only when i'm drunk."
43,Nicolas Bacchus,Gros gland,TRUNATT12903D013D5,1999,"L'autre soir à la téloche
J'ai entendu un gros gland
J'y aurais bien mis une taloche
Mais y s'planquait derrière l'écran
M'a tellement mis la colère
Que j'aime mieux le prévenir
S'y vient traîner ici peuchère
Risque de se faire occire 

Mais le gros gland n'a qu'un oeil
Il ne voit que d'un seul côté
Il ne s'aperçoit même pas
Que les coups vont bientôt tomber
Qu'on en a marre de sa sale gueule
Qu'y commence à nous gaver
Et qu'il figure déjà
Parmi les espèces menacées.
Nous prend vraiment pour ses enfants
Y voudrait bien nous faire croire
Qu'on est un peu plus méchant
Quand on est un peu plus noir
Que tous les juifs sont des traîtres
Que tout est d'la faute aux melons
Y peut bien aller s'faire mettre
On n'est quand même pas si cons.

Refrain
Pour croire que tout irait mieux
Si on virait les immigrés
Y faut être un sacré boeuf
Et encore un boeuf pas bien futé
Si vraiment on est trop nombreux
Si on n'a plus rien à bouffer
C'est gros gland et tous ses noeuds
Qu'il faudrait charteriser 
Refrain
Quand il allait à l'école
Ou torturait en Algérie
C'était déjà pas très drôle
Les filles ne voulaient pas de lui
Depuis lors rien n'a changé
Il est toujours aussi gerbant
Il est toujours aussi LAID
Il est toujours aussi GLAND.

Refrain
Fin cosmopolite et pluriculturelle."
