,Artist,Title,Track_id,Year,Lyrics
62,Frank Sinatra,How Could You Do A Thing Like That To Me? (1999 Digital Remaster),TRJMXWR128F1461697,1961,"Writer(s): Glenn/Roberts 


Baby you went and broke your faithful, promise
How could you do a thing like that, to me
Didn't I give you everything, I'd promised
How could you do a thing like that, to me

Never thought - you'd be untrue
When my back - (it) was turned on you

If someone gave me all the world (the whole wide world), to hurt you
I wouldn't do a thing like that, to you
(No mam - I wouldn't (couldn't) do a thing like that, to you)
(So how could you do a thing like that, to me)"
63,Gary U.S. Bonds,Quarter To Three,TRIOIHT128F92F2E01,1961,"Don't you know that I danced, I danced till a quarter to three
With the help, last night, of Daddy G.
He was swingin on the sax like a nobody could
And I was dancin' all over the room.
Oh, don't you know the people were dancin' like they were mad,
it was the swingin'est band they had, ever had.
It was the swingin'est song that could ever be,
It was a night with Daddy G.
Let me tell you now,
I never had it so good
Yeah and I know you never could
Until you get hip with that jive
And take a band like the Church Street Five.
Oh don't you know that I danced,
I danced till a quarter to three
With the help last night of Daddy G.
Everybody was as happy as they could be
And they were swingin with Daddy G.
Blow Daddy!
Let me tell you now,
I never had it so good
Yeah and I know you never could
Until you get hip with that jive
And take a band like the Church Street Five.
Oh don't you know that I danced,
I danced till a quarter to three
With the help last night of Daddy G.
He was swingin on the sax like a nobody could,
and I was dancin all over the room
Oh don't you know the
Dance, do bee wa dah
Dance, do bee wah dah
You can dance, do bee wah dah,
You can dance, dance, dance"
64,Gary U.S. Bonds,School Is Out,TRTYOWS128F935FDB5,1961,"A-one, a-two, a-one two three four
No more books and studies
And I can stay out late with my buddies
I can do the things that I want to do
'Cause all my exams are through
I can root for the Yankees from the bleachers
And don't have to worry 'bout teachers
I'm so glad that school is out
I could sing and shout!

(School is out) Everybody's gonna have some fun
(School is out) Everybody's gonna jump and run
(School is out) Come on people don't you be late
(School is out)
I just got time to take my girl out on a date
School is out at last
And I'm so glad I passed
So everybody come and go with me!
We're gonna have a night with Daddy Go Daddy!

That's great!
Let's celebrate!
With a little bit of soul now!
Oh yeah!
The party's here!

(School is out) Everybody's gonna have some fun
(School is out) Everybody's gonna jump and run
(School is out) Come on people don't you be late
(School is out)
I just got time to take my girl out on a date
School is out at last
And I'm so glad I passed
So everybody come and go with me!
We're gonna have a night with Daddy Go Daddy!

(School is out) Everybody's gonna have some fun
(School is out) Everybody's gonna jump and run
(School is out) Come on people don't you be late
(School is out)
I just got time to take my girl out on a date
School is out at last
And I'm so glad I passed
So everybody come and go with me!
We're gonna have a night with Daddy Go Daddy!"
65,Gene Chandler,Duke of Earl,TRRQDQV128F42246F1,1961,"Duke, Duke, Duke, Duke of Earl
Duke, Duke, Duke of Earl
Duke, Duke, Duke of Earl
Duke, Duke, Duke of Earl
Duke, Duke, Duke of Earl
Duke, Duke, Duke of Earl
Duke, Duke, Duke of Earl

As I walk through this world
Nothing can stop the Duke of Earl
And you, you are my girl
And no one can hurt you, oh, no

Yes, I
Oh, I'm gonna love you
Oh, oh
Come on, let me hold you, darlin'
'Cause I'm the Duke of Earl
So, yeah, yeah, yeah, yeah

And when I hold you
You'll be my Duchess, Duchess of Earl
We'll walk through my dukedom
And a paradise we will share

Yes, I 
Oh, I'm gonna love you
Oh, oh
Nothing can stop me now
'Cause I'm the Duke of Earl
So, yeah, yeah, yeah, yeah

Ooh ooh ooh ooh ooh
Ooh ooh ooh ooh ooh
Oh, oh, oh, oh
Ooh ooh ooh ooh ooh
Ooh ooh ooh ooh ooh
Oh, oh, oh

Well, I
Oh, I'm gonna love you
Oh, oh
Nothing can stop me now
'Cause I'm the Duke of Earl
So, yeah, yeah, yeah, yeah

Ooh ooh ooh ooh ooh
Ooh ooh ooh ooh ooh
So, oh, oh, oh, oh
Ooh ooh ooh ooh ooh"
66,Gene Pitney,Town Without Pity,TRZJIGI12903CD8859,1961,"When you're young and so and love as we
And bewildered by the world we see
Why do people hurt us so
Only those in love would know
What a Town Without Pity can do..

If we stop to gaze upon a star
People talk about how bad we are...
Ours is not an easy age
We're like tigers in a cage
What a Town Without Pity can do..

The young have problems Many problems
We need an understanding heart..
Why don't they help us, try to help us
Before this clay and granite planet falls apart...

Take these eager lips and hold me fast..
I'm afraid this kind of joy can't last
How can we keep love alive
How can anything survive
When these little minds tear you in two..
What a town Without Pity can do..

How can we keep love alive
How can anything survive
When these little minds tear you in two..
What a town Without Pity can do.."
67,Gladys Knight And The Pips,Operator,TRYSCAV128F92F871B,1961,"Ohhhh, Ohhhh, 
Operator, are you sure
That line is busy all this time
Won't you please dial the numer
Operater, dial the number
I've got to reach that baby of mine

I've got to tell him that I'm sorry
For the things I've said
Sorry as I can be
So won't you please dial the numer
Operator, dieal the numer
And see if you can get him to talk to me
Ohhhh

I wonder who he's talking to for so long
I hope he hasn't found
Found somebody new
Oh won't you please cut it
Because it's an emergency
And tell my baby
Tell my baby forgive me

I've got to tell him that I'm sorry
For the things I've said
Sorry as I can be
So won't you please dial the numer
Operator, dieal the numer
And see if you can get him to talk to me
Ohhhh"
68,Hank Thompson,I Gotta Have My Baby Back,TRHSYSB128F429FB55,1961,"Baby baby I miss you so very much
It hurts me baby I just gotta I gotta have my baby back
Well I can't eat can't sleep because I miss my sweet baby sweet 
I just gotta yes I gotta I gotta have my baby back

Alone in a tavern people all around laughing and dancing paintin' the town
Jukebox is playing songs about you songs with memories making me blue
Oh baby come on home without my baby I just couldn't go on
I just gotta yes I gotta I gotta have my baby back
[ guitar ]
Alone in a tavern..."
69,Hank Thompson,John Henry (Live),TRFQEBT128F429FED2,1961,"John Henry was just a little bitty boy
No bigger than the palm of your hand
His mammy looked down at John Henry and say
Johnny you're gonna be a steal drivin' man Lord lord
Johnny you're gonna be a steal drivin' man

John Henry he said to his Captain Captain I wanna hear you sing
I'll swing forty-nine pounds from my hips on down
I like to hear that cold steel ring Lord Lord I like to hear that cold steel ring
[ guitar ]
John Henry had a little woman and her name was Polly Ann
John Henry he got sick and he had to go to bed
But Polly drove the steel like a man Lord Lord Polly drove the steel like a man

John Henry went to the tunnel to drive steam hammer by his side
Well he beat that drill till the end of the tunnel
Laid down his hammer and he cried Lord Lord laid down his hammer and he cried
[ guitar - steel ]
John Henry drove the steel on that mountain till his hammer caught on fire
And the last words we heard John Henry say
Cool drink of water before I die Lord Lord a cool drink of water before I die

Well they took John Henry to the graveyard stuck him six feet under the sand
Everytime the freight train that go puffin' by
They say there lies a steel drivin' man Lord Lord yonder lies a steel drivin' man"
70,Hank Thompson,I Dreamed Of An Old Love Affair,TRQHJIT128F429FB44,1961,"Just like old times you were here last night and gone was my worry and care
When I awoke I knew then that I had dreamed of an old love affair
I was alone in the darkness my dear many dreams ago you left me there
Sunlight told me you were gone and I had dreamed of an old love affair
[ fiddle - piano - steel ]
I've been so lonely since you've been gone I loved you with all of my heart
Heaven was mine when you smiled last night and said that we'd take a new start
Life seems so empty and useless my dear if it's sun or rain I just don't care
Sunlight told me you were gone and I had dreamed of an old love affair"
71,Hank Thompson,Orange Blossom Special (Live),TRZHJYD128F429FED0,1961,"ORANGE BLOSSOM SPECIAL
Writer Ervin T. Rouse

Look a-yonder comin'
Comin' down that railroad track
Hey, look a-yonder comin'
Comin' down that railroad track
It's the Orange Blossom Special
Bringin' my baby back
Well, I'm going down to Florida
And get some sand in my shoes
Or maybe Californy
And get some sand in my shoes
I'll ride that Orange Blossom Special
And lose these New York blues
""Say man, when you going back to Florida?""
""When am I goin' back to Florida? I don't know, don't reckon I ever will.""
""Ain't you worried about getting your nourishment in New York?""
""Well, I don't care if I do-die-do-die-do-die-do-die.""
Hey talk about a-ramblin'
She's the fastest train on the line
Talk about a-travellin'
She's the fastest train on the line
It's that Orange Blossom Special
Rollin' down the seaboard line"
72,Hank Thompson,Just A Little While,TRSSHVC128F429FB54,1961,"Oh tonight each happy moment that I ever spent with you
Brightens up my mem'ries of the past
Then I remember that dark moment when we said our last goodbye
To a love we knew could never last

Just a little while just a little while
Just a little while ago when love was new
Our romance now has faded but there's nothing I'd have traded
For the precious little while of loving you
[ guitar - steel - fiddle ]
With your picture here before me I pretend that you're still mine
And I still can hear you say I love you so
And the time that seems just like a million years since I lost you
Was really just a little while ago
Just a little while..."
73,Hank Thompson,Steel Guitar Rag,TRVBSMZ128F429FED6,1961,"STEEL GUITAR RAG
Writer Leon McAuliffe

Been runnin' around, seen many a town, and maybe you'll find I'm the kind of guy that brags. But listen to me and see if you don't agree No melody rolls like that old steel guitar rag And when they slide that thing, along those strings It sounds so doggone heavenly, you can hear the Angels sing And when you stomp your feet, your heart will beat, A rhythm to the old steel guitar rag Break or bridge: You may be kind choosy, 'bout the kind of songs you hear, You maybe like them blusey, makes you cry right in your beer, But if you want a song that's bound to dry away your tears, Make happy your soul with that old steel guitar rag."
74,Hank Thompson,I'll Step Aside (Live),TRVYVTD128F429FECF,1961,"I'll step aside for you if you don't want me
I'll step aside for you if you don't care
I'm not the one to cling to a broken promise
I'll step aside for someone else somewhere

I'll step aside for you if you don't want me
I'll step aside for you and you alone
And when I'm gone just promise you'll remember
That I was once your darling all your own
[ steel - guitar ]
Before you go please answer this one question
As you gaze into my tear dimmed eyes
Cannot be true you never cared about me
And all those things you told were just lies
I'll step aside for you if you don't want me..."
75,Hank Thompson,My Old Flame,TRDXYHD128F429FB56,1961,"You'll be sorry in a little while my friend
When your new love has come to an end
Let me warn you for heartaches to prepare
I know my friend cause my old flame is your new love affair
It hurts to see you take her from my side
And I know you think that she'll become your bride
But she'll break your heart and leave you standing there
I know my friend cause my old flame is your new love affair
[ steel - fiddle ]
It's so hard to know I'm just her used to be
And she's telling you the things she told to me
You'll be sorry that you ever learn to care
I know my friend cause my old flame is your new love affair
Now you become a prisoner of her charms
But love can grow so cold that once was warm
Then your romance will vanish in the air
I know my friend cause my old flame is your new love affair"
76,Hank Thompson,I Keep Meeting Girls Like You,TRKNXKQ128F429FB53,1961,"I KEEP MEETING GIRLS LIKE YOU
(Hank Thompson - Bud Auge)
« © '60 Brazos Valley Music »

I used to dream I don't dream anymore I don't believe that dreams come true
Paint through me a curve but I don't deserve to keep me in girls like you
I used to think that someday I would choose the one to love my whole life through
But I'm never chooser I wind up as a loser I keep meeting girls like you
We laugh and cry then say goodbye our love was just a passing thing
A love that's wrong can't linger long but how many heartaches can it bring
Maybe I'll get wise and open up my eyes and play the game just like they do
I guess I'll get to be just like my company if I keep meeting girls like you
We laugh and cry..."
77,Harry Belafonte,Jump In The Line,TRGFZTL128F42A31A1,1961,"Shake, shake, shake, Senora, shake your body line
Shake, shake, shake, Senora, shake it all the time
Work, work, work, Senora, work your body line
Work, work, work, Senora, work it all the time

My girl's name is Senora
I tell you friends, I adore her
And when she dances, oh brother!
She's a hurricane in all kinds of weather

(Jump in the line, rock your body in time) OK, I believe you!
(Jump in the line, rock your body in time) OK, I believe you!
(Jump in the line, rock your body in time) OK, I believe you!
(Jump in the line, rock your body in time) Whoa!

Shake, shake, shake, Senora, shake your body line, whoa!
Shake, shake, shake, Senora, shake it all the time
Work, work, work, Senora, work your body line
Work, work, work, Senora, work it all the time

You can talk about Cha Cha
Tango, Waltz, or the Rumba
Senora's dance has more title
You jump in the saddle
Hold on to de bridle

(Jump in the line, rock your body in time) OK, I believe you!
(Jump in the line, rock your body in time) Rock your body, child!
(Jump in the line, rock your body in time) Somebody, help me!
(Jump in the line, rock your body in time) Whoa!

Shake, shake, shake, Senora, shake your body line
Shake, shake, shake, Senora, shake it all the time (Whoa)
Work, work, work, Senora, work your body line (Yep)
Work, work, work, Senora, work it all the time

Senora, she's a sensation
The reason for aviation
And fellas, you got to watch it
When she wind up, she bottom, she go like a rocket

(Jump in the line, rock your body in time) OK, I believe you!
(Jump in the  line, rock your body in time) Hoist those guns a little higher!
(Jump in the line, rock your body in time) Up the chimney!
(Jump in the line, rock your body in time) Whooooa!

Shake, shake, shake, Senora
Shake your body line
Work, work, work, Senora
Work it all the time
Dance, dance, dance, Senora
Dance it all the time
Work, work, work, Senora
Work it all the time

Senora dances Calypso
Left to right is the tempo
And when she gets the sensation
She go up in the air, come down in slow motion

(Jump in the line, rock your body in time) OK, I believe you!
(Jump in the line, rock your body in time) Somebody, help me!
(Jump in the line, rock your body in time) OK, I believe you!
(Jump in the line, rock your body in time) Whooooa!

Shake, shake, shake, Senora, shake your body line
Shake, shake, shake, Senora, shake it all the time
Work, work, work, Senora!"
78,Harry Belafonte,Angelina,TRPBTSJ128F42A3168,1961,"Angelina, Angelina, please bring down your concertina
And play a welcome for me cause I'll be coming home from sea

Yes its so long since Ive been home
Seems like theres no place to roam
Well I've sailed around the Horn
I've been from San Jose up to Baffin Bay
And I've rode out many a storm

Angelina, Angelina, please bring down your concertina
And play a welcome for me cause I'll be coming home from sea

Well I've heard the bawdy tunes
I've been in honky tonk saloons
I took my liquor by the vat
Well I stayed on call for a rousing brawl
Home was where I hung my hat

Angelina, Angelina, please bring down your concertina
And play a welcome for me cause I'll be coming home from sea

Now I've courted many a girl
I've been in ports all around the world
But my rambling days are done
I've been from Curacao up to Tokyo
And I've found theres only one

And she is Angelina, Angelina, please bring down your concertina
And play a welcome for me cause I'll be coming home from sea"
79,Helen Shapiro,You Don't Know,TRQHXRM128F4264D2A,1961,"Woah, woah, woah, oh yeah, yeah, yeah
Woah, woah, woah, oh yeah, yeah, yeah
All though I love you so
Oh you don't know
You don't know just how I feel
For my love I daren't reveal
I am so, I'm so afraid
You might not care

Every time you pass me by
Oh you don't know, you don't know
What I go through
Seeing someone else with you
Oh I wish the one with you, were me
But you don't know

I would tell you, if I believed
That you might care some day
But until then I'll never give this away

So a secret it must stay
And you don't know, you don't know
How hard to bear
Is this one way love affair
For it breaks my heart to be in love
When you don't know

I would tell you, if I believed
That you might care some day
But until then I'll never give this away

So a secret it must stay
And you don't know, you don't know
How hard to bear
Is this one way love affair
For it breaks my heart to be in love
When you don't know
Woah, woah, oh yeah, yeah, yeah
Woah, woah, woah, oh yeah, yeah, yeah"
80,Henry Mancini & His Orchestra,Moon River,TRRQFMD128F429F3C9,1961,"Moon River,
Wider than a mile:
I'm crossin' you in style
Some day.
Old dream maker,
You heart breaker,
Wherever your goin',
I'm goin' your way:
Two drifters,
Off to see the world,
There's such a lot of world
To see.
We're after the same
Rainbow's end
Waitin' round the bend,
My huckleberry friend,
Moon River
and me."
81,Howlin' Wolf,Wang Dang Doodle,TRVJWJS128F92F6542,1961,"Tell Automatic Slim
Tell Razor Totin' Jim
Tell Butcher Knife Totin' Annie
Tell Fast Talking Fanny
We gonna pitch a ball
A down to that union hall
We gonna romp and tromp till midnight
We gonna fuss and fight till daylight
We gonna pitch a wang dang doodle
All night long
All night long
All night long
We gonna pitch a wang dang doodle
All night long

Tell Kudu-Crawlin' Red
Tell Abyssinian Ned
Tell ol' Pistol Pete
Everybody gonna meet
Tonight we need no rest
We really gonna throw a mess
We gonna to break out all of the windows
We gonna kick down all the doors
We gonna pitch a wang dang doodle
All night long
All night long
All night long
All night long
We gonna pitch a wang dang doodle
All night long

Tell Fats and Washboard Sam
That everybody gonna to jam
Tell Shaky and Boxcar Joe
We got sawdust on the floor
Tell Peg and Caroline Dye
We gonna have a time
When the fish scent fill the air
There'll be snuff juice everywhere
We gonna pitch a wang dang doodle
All night long
All night long
All night long
We gonna pitch a wang dang doodle
All night long"
82,Howlin' Wolf,Back door man,TRDMUJZ128F92FB7DA,1961,"I am a back door man
I am a back door man
Well, the men don't know
But the little girls understand

When everybody's tryin' to sleep
I'm somewhere making my midnight creep
Yeah, in the morning the rooster crow
Something tell me I got to go

I am a back door man
I am a back door man
Well, the men don't know
But little girls understand

They take me to the doctor, shot full o' holes
Nurse cried, please save the soul
Killed him for murder, first degree
Judge wife cried, let the man go free

I am a back door man
I am back door man
Well, the men don't know
But little girls understand

Stand out there, cop's wife cried, don't take him down
Rather be dead, six feets in the ground
When you come home, you can eat pork and beans
I eats mo' chicken any man seen

I am back door man
I am back door man"
83,Howlin' Wolf,Down In The Bottom,TROADOY128E078F598,1961,"Well now, baby meet me in the bottom, bring me my running shoes
Well now, baby meet me in the bottom, bring me my running shoes
Well, I'll come out the window, I won't have time to lose.

When you see me streaking by, please don't be late
When you see me streaking by, please don't be late
Well, when you see me moving, though my life is at stake

Well, I hope you'll see me, when I come streaking by
Well, I hope you'll see me, when I come streaking by
She got a bad old man, you know I'm too young to die

I got to leave here. Get caught in there"
84,Ike & Tina Turner,I Idolize You,TRBJVRP128F14674B7,1961,"If you want some loving,
That I can give to you.
And if you want some hugging,
Said I can hug some, too.

All I want, baby, now
Is some thought of you

And just a little of your affection,
You know, will see me through.

'cause you know that you are my man,
And I want you to forever be mine.
I idolize you (yes, she idolize you)"
85,Ike And Tina Turner,A Fool In Love,TRPOJCK128F92FDCD9,1961,"Oh, there's something on my mind;
Won't somebody please, please tell me what's wrong?

You're just a fool, you know you're in love (What you say?);
You've got to face it to live in this world (Hey, hey, hey, hey, hey... whoa, hey hey...)
You take the good along with the bad;
Sometimes you're happy, and sometimes you're sad (One more time...)
You know you love him, you can't understand (Tell me bout it!)
Why he treats you like he do, when he's such a good man...

Listen! He's got me smiling when I should be ashamed;
Got me laughing when my heart is in pain;
Oh now, I must be a fool,
But I'll do anything he wants me to...
Now how come?

You're just a fool, you know you're in love; (Tell me one more time...)
You've got to face it to live in this world... (Hey, hey hey, hey, hey... whoa, hey, hey...)
You take the good along with the bad;
Sometimes you're happy, and sometimes you're sad... (One more time...)
You know you love him, you can't understand (Tell me bout it!)
Why he treats you like he do, when he's such a good man...

Listen! Without my man, I don't wanna live;
You think I'm lying, but I'm telling you like it is:
He's got my nose open, and that's no lie,
And I, I'm gonna keep him satisfied!
Now how come...

You're just a fool, you know you're in love; (Tell me how come...)
You've got to face it to live in this world... (Hey, hey, hey, hey, hey... whoa! Hey, hey...)
You take the good along with the bad;
Sometimes you're happy, and sometimes you're sad (One more time...)
You know you love him, you can't understand (Tell me bout it!)
Why he treats you like he do when he's such a good man...

Listen! Ways of action speaks louder than words;
The truest saying that I ever heard...
I trust my man in all that he do,
And I'll, and I'll do anything he wants me to do!
Now how come?

You're just a fool, you know you're in love; (Tell me one more time...)
You've got to face it to live in this world... (Hey, hey, hey, hey, hey... whoa! Hey, hey...)
You take the good along with the bad;
Sometimes you're happy, and sometimes you're sad (Tell me one more time...)
You know you love him, you can't understand (Ooh...)
Why he treats you like he do, when he's such a good man...

(Tell me...)
Doo doo, doo, doo (Tell me one more time...)
Doo doo, doo, doo (Hey, hey, hey, hey, hey... yeah! hey, hey)
Doo doo, doo, doo (One more time!)
Doo doo, doo, doo (Ooh...)
Doo doo, doo, doo..."
86,Jacques Brel,Madeleine,TRMPXES128F42B7608,1961,"Ce soir j'attends Madeleine
J'ai apporté du lilas
J'en apporte toutes les semaines
Madeleine elle aime bien ça
Ce soir j'attends Madeleine
On prendra le tram trente-trois
Pour manger des frites chez Eugène
Madeleine elle aime tant ça
Madeleine c'est mon Noël
C'est mon Amérique à moi
Même qu'elle est trop bien pour moi
Comme dit son cousin Joël
Ce soir j'attends Madeleine
On ira au cinéma
Je lui dirai des: ""Je t'aime""
Madeleine elle aime tant ça

Elle est tellement jolie
Elle est tellement tout ça
Elle est toute ma vie
Madeleine que j'attends là

Ce soir j'attends Madeleine
Mais il pleut sur mes lilas
Il pleut comme toutes les semaines
Et Madeleine n'arrive pas
Ce soir j'attends Madeleine
C'est trop tard pour le tram trente-trois
Trop tard pour les frites d'Eugène
Et Madeleine n'arrive pas
Madeleine c'est mon horizon
C'est mon Amérique à moi
Même qu'elle est trop bien pour moi
Comme dit son cousin Gaston
Mais ce soir j'attends Madeleine
Il me reste le cinéma
Je lui dirai des: ""Je t'aime""
Madeleine elle aime tant ça

Elle est tellement jolie
Elle est tellement tout ça
Elle est toute ma vie
Madeleine qui n'arrive pas

Ce soir j'attendais Madeleine
Mais j'ai jeté mes lilas
Je les ai jetés comme toutes les semaines
Madeleine ne viendra pas
Ce soir j'attendais Madeleine
C'est fichu pour le cinéma
Je reste avec mes: ""Je t'aime""
Madeleine ne viendra pas
Madeleine c'est mon espoir
C'est mon Amérique à moi
Sûr qu'elle est trop bien pour moi
Comme dit son cousin Gaspard
Ce soir j'attendais Madeleine
Tiens le dernier tram s'en va
On doit fermer chez Eugène
Madeleine ne viendra pas

Elle est tellement jolie
Elle est tellement tout ça
Elle est toute ma vie
Madeleine qui ne viendra pas

Demain j'attendrai Madeleine
Je rapporterai du lilas
J'en rapporterai toute la semaine
Madeleine elle aimera ça
Demain j'attendrai Madeleine
On prendra le tram trente-trois
Pour manger des frites chez Eugène
Madeleine elle aimera ça
Madeleine c'est mon espoir
C'est mon Amérique à moi
Tant pis si elle est trop bien pour moi
Comme dit son cousin Gaspard
Demain j'attendrai Madeleine
On ira au cinéma
Je lui dirai des: ""Je t'aime""
Madeleine elle aimera ça"
