,Artist,Title,Track_id,Year,Lyrics
0,Leroy Hutson,Give This Love A Try,TRKZFOD128F1473B75,1974,"You are my everything
My summer, my winter
Fall and the spring

For you, I'll surely try
Cause you make me pull the love inside

So give this love a try girl
Let me tell you why, girl
Cause youre the one that I've been waiting for

So think it over, don't be rash
Don't let this let this good love pass
Why won't you give me a try

You love me, you know I love you
And every hour, that undying love I'll brew

I'll never, never make you cry
And the good times
And the bad times
I'll be standing by

So, give this love a try girl
Let me tell you why, girl
'cause youre the one that I've been waiting for

So, think it over, don't be rash
Don't let this let this good love pass
Why won't you give me a try

So, think it over, don't be rash
Don't let this let this good love pass
Why won't you give me a try

Whoo (So give this love a try girl
Let me tell you why, girl
Cause youre the one that I've been waiting for)
You oughta think it over (So give this love a try girl
Let me tell you why, girl
Cause youre the one that I've been waiting for)
Love, Love, Love
You oughta Give this love a try"
1,Argent,Thunder And Lightning,TRMWHGM128F9341D87,1974,"There are times when you feel so good
That the only way to move is down
You're feeling fine, looking like a king
Then you turn around and you're painted like a clown.

Nights you feel you're about to win
The gold in your pocket turns to tin.

Thunder, lightning, striking again and again and again and again
Thunder and lightning striking me down.

You play the game and you just can't lose
And you're walking with your feet off the ground
Every ball seems to hit the net
Every penny that you save becomes a pound.

Just when you find peace of mind
Just look around and what do you find?

Thunder (thunder, thunder, thunder) lightning (lightning, lightning, lightning)
Striking (striking, striking, striking) again and again and again and again 
Thunder and lightning striking me down.

Well you play the game and you just can't lose
And you're walking with your feet off the ground
Every ball seems to hit the net
Every penny that you save becomes a pound.

Just when you find peace of mind
Just look around and what do you find ?

Thunder (thunder, thunder, thunder) lightning (lightning, lightning, lightning)
Striking (striking, striking, striking)  again and again and again and again
Thunder and lightning striking me down.

Thunder (thunder, thunder, thunder) lightning (lightning, lightning, lightning)
Striking (striking, striking, striking)  again and again and again and again
Thunder and lightning striking me down."
2,George McCrae,I Get Lifted,TRVTCRA128F429F027,1974,"Sittin' here together, baby we're all alone
Now I can tell ya, girl, you turn me on
I get lifted up hi-high - hi-high
I get lifted up hi-high - hi-high

Bring out the lovin', lovin' desire, baby
You got the match, oh that lights the fire
I get lifted up hi-high - hi-high
I get lifted up hi-high - hi-high

Mama-mama, mama-mama
Mama-mama, mama-mama

I get lifted up hi-high - hi-high
I get lifted up hi-high - hi-high

Mama-mama, mama-mama
Mama-mama, mama-mama

Sittin' on the corner, waiting for your love light..."
3,Dan Fogelberg,There's A Place In The World For A Gambler,TRTYRYF128F931D470,1974,"There's a place in the world
For a gambler
There's a burden that only
He can bear
There's a place in the world
For a gambler,

And he sees
Oh, yes he sees...
And he sees
Oh, yes he sees...

There's a song in the heart
Of a woman
That only the truest of loves
Can release.
There's a song in the heart
Of a woman.

Set it free
Oh, set it free
Set it free
Oh, set it free
Set it free
Oh, set it free.

There's a light in the depths
Of your darkness
There's a calm at the eye
Of every storm.
There's a light in the depths
Of your darkness.

Let is shine
Oh, let it shine
Let is shine
Oh, let it shine
Let is shine
Oh, let it shine.

Let it Shine"
4,Bob Dylan,Forever Young,TRQNYMS128F426A501,1974,"May God bless and keep you always,
May your wishes all come true,
May you always do for others
And let others do for you.
May you build a ladder to the stars
And climb on every rung,
May you stay forever young,
Forever young, forever young,
May you stay forever young.

May you grow up to be righteous,
May you grow up to be true,
May you always know the truth
And see the lights surrounding you.
May you always be courageous,
Stand upright and be strong,
May you stay forever young,
Forever young, forever young,
May you stay forever young.

May your hands always be busy,
May your feet always be swift,
May you have a strong foundation
When the winds of changes shift.
May your heart always be joyful,
May your song always be sung,
May you stay forever young,
Forever young, forever young,
May you stay forever young."
5,Barclay James Harvest,Paper Wings,TRYFNQU128F4238316,1974,"His crazy frame against the dawn
His hungry leap and ragged fall
A suicidal perch is now laid bare
To searching eyes and empty stares 
A fearful silence hits the crowd
The air hangs heavy with the sound
Of useless wings against the morning sky
As paper yields before their eyes 

Oh, can you see him now?
A broken man without a dream
Oh, can you hear him now?
A futile laugh above the screams"
6,Willie Hutch,Give Me Some Of That Good Old Love,TRHVSBB128F148D243,1974,"Coochie coochie ahh
Coochie coochie ahh

Ah baby, give me
(Give me)
Give me some of that good old love sugar, sugar
(Gimme, gimme, gimme, gimme, gimme, gimme, gimme)

Oh baby, give me
(Give me)
Well
Give me some of that good old love
(Gimme, gimme, gimme, gimme, gimme, gimme, gimme)
Yeah, yeah

Oh, let me make you feel fine
'Cause loving you just blows my mind, yeah
The love I feel for you girl is true
So let me, let me, let me, let me, oh baby
Let me make love to you, you, you, you, you

Oh baby, give me
(Well, sure sugar)
Give me some of that good old love, yeah, yeah
(Gimme, gimme, gimme, gimme, gimme
Gimme, gimme, gimme, gimme)
'Caues baby, lovin' you is all I need

(Gimme, gimme, gimme, gimme, gimme
Gimme, gimme, gimme, gimme)
Yee, yee, yee baby, yeah
(Gimme, gimme, gimme, gimme, gimme
Gimme, gimme, gimme, gimme)

Well
(Gimme, gimme, gimme, gimme, gimme, gimme)
Give me your soul
(Gimme, gimme, gimme)
(Gimme, gimme, gimme, gimme, gimme, gimme)
Give me your soul
(Gimme, gimme, gimme)

Give me your soul
Give me your soul
Well, give me your soul
Give me your soul

Oh, let me make you feel fine
'Cause loving you just blows my mind
This love I feel for you girl is true
So let me, let me, let me, let me, oh baby

Let me make love
(Let me make love)
To you, you, you, you, you
(Let me make love)

Oh baby, give me, sure sugar
Give me some of that good old love
Well
(Gimme, gimme, gimme, gimme, gimme
Gimme, gimme, gimme, gimme)

Oh baby, give me, ooh
(Give me)
Give me some of that good old loving girl
(Gimme, gimme, gimme, gimme, gimme
Gimme, gimme, gimme, gimme)

Darling give me
(Give me)
Oh, now baby, give me
(Gimme, gimme, gimme, gimme, gimme
Gimme, gimme, gimme, gimme)
Oh woman, give me
(Give me)

Give me some of that good old loving girl
(Gimme, gimme, gimme, gimme, gimme
Gimme, gimme, gimme, gimme)
Ohh baby, give me
(Give me)

Oh baby, won't you give me girl
(Gimme, gimme, gimme, gimme, gimme
Gimme, gimme, gimme, gimme)
Ohh baby
(Give me)
Oh, give me some of that good old love"
7,KC And The Sunshine Band,Do It Good,TRHJAXS128F930A088,1974,"Baby, turn it loose
Let me have it, give it to me
Baby, turn it loose
Don't be lonely, two times three

Just do it
Come on and do it
Ha, do it good
Alright

Let it out, give me love and affection
Send me in the right direction
Love, there's nothing to it
Come on, come on, come on, come on, come one
You can do it

Ow do it, ow do it
Do it good
Alright
Come on do it
Come on come on do it
Ha do it good
Oh ah ow

Ow do it
Come on and do it
Do it good, alright

Baby, I know you can do it
Just do it good, oh
Lay some lovin', some lovin' on me
Just do it good
Do it good

Come on come on come on baby
Do it good
Come on come on come on baby
Do it good
Come on come on come on baby
Do it good
Come on come on come on baby
Do it good
Come on come on come on baby
Do it good"
8,Mott The Hoople,Walking With A Mountain,TRDCDEH12903CB152E,1974,"A mountain train's coming down the track
She ain't wasting time
She's carrying me cause I'm going back
Right to the Delaware line
She knows well I ain't been anywhere
Because I crawl back every time to her
Walkin' with a mountain
Walkin' with a mountain

Troubles and tears
I'll take it in years
I left so many behind
I may be a train rearranged
Who knows what I'll find
But everything's better in my life I know
I can face any grades that I'm on
Walkin' with a mountain
Walkin' with a mountain
(alright)
(hey hey hey)

(oh) I'm walkin' with a mountain
Walkin' with a mountain
When she talks to me I know she sees
Where I'm heading to
She sits winks takes it all in
Just admires the view
And if I had a choice in life
I'd take that mountain for my wife
I'm walkin' with a mountain
Walkin' with a mountain
Walkin' with a mountain
Walkin' with a mountain
Walkin' with a mountain
Walkin' with a mountain
Walkin' with a mountain
Walkin' with a mountain
Jumping Jack Flash it's a gas
Jumping Jack Flash it's a gas
Jumping Jack Flash it's a gas
Jumping Jack Flash it's a gas
Jumping Jack Flash it's a gas
Jumping Jack Flash it's a gas"
9,Mac Davis,Stop And Smell The Roses,TRUCINT128F4267CA0,1974,"Hey Mister
Where you going in such a hurry
Don't you think it's time you realized
There's a whole lot more to life than work and worry
The sweetest things in life are free
And there right before your eyes
You got to Stop and Smell the roses
You've got to count your many blessings everyday
You're gonna find your way to heaven is a rough and rocky road
If you don't Stop and Smell the roses along the way
Before you went to work this morning in the city
Did you spent some time with your family
Did you kiss your wife and tell her that she's pretty
Did you take your children to your breast and love them tenderly
You got to Stop and Smell the roses
You've got to count your many blessings everyday
You're gonna find your way to heaven is a rough and rocky road
If you don't Stop and Smell the roses along the way
Did you ever take a walk through the forest
Stop and dream a while among the trees
Well you can look up through the leaves right straight to heaven
You can almost hear the voice of God
In each any every breeze
You got to Stop and Smell the Roses
You've got to count your many blessings everyday
You're gonna find your way to heaven is a rough and rocky road
If you don't Stop and Smell the Roses along the way
You got to Stop and Smell the roses
You've got to count your many blessings everyday
You're gonna find your way to heaven is a rough and rocky road
If you don't Stop and Smell the roses along the way"
10,Uriah Heep,So Tired,TRJTSRI12903CB26E2,1974,"Well, I've been on the road
For a year or more
And I've done a lot of things
I never did before
Now I want everyone
To listen to my song
And you can tell me
When you've heard it
If you think I'm wrong

'cause I'm so tired
Of everybody staring at me
Yes, I'm so tired
And I'm so uninspired
Please help me

Well I've seen 'em rise
And I've seen 'em fall
And I use to think that
I was having a ball
But I was kiddin' myself
For a long long time
But now I got myself a spoon


And I'm feeling fine

But I'm so tired
Of everybody staring at me
Yes, I'm so tired
And I'm so uninspired
Won't you please help me

Where can you go
Where can you go
When there is no one
To show a guiding light
What did you say
What did you say
Have you been thinking about me
Day and night

'cause I'm so tired
Of everybody staring at me
And I'm so, so tired
I'm so uninspired
Please help me
Won't you please me ..."
11,Otis Rush,All Your Love,TRHLLPW12903CE64CD,1974,"All your love I miss lovin'
All you kisses I miss kissin'
All your love I miss lovin'
All your kisses I miss kissin'
Since I met you, baby
I never knew what I was missin'

All your love, pretty baby
That I got in store for you
All your love, pretty baby
That I got in store for you
When I tell ya, pretty baby
Ya gotta say you love me, too

All your lovin', pretty baby
All your lovin', pretty baby
All your lovin', pretty baby
All your lovin', pretty baby
When I first met ya, baby
I never knew what I was missin'"
12,Tim Buckley,Down in the Street,TRDFPEZ128F934569A,1974,"Down in the street
There's a gunshot warnin'
Here comes that blue parade
Ready to save the day;
Down in the street
There's a whole block burning
Shout out for rent control
I ride the gang patrol;
Oh it's just another sign
That summer's comin',
City wars and flash floods and tornados,
Festivals for rock and roll season
Beach talk baseball and a handy houshold hymns;

Yes it's true in the U.S. of A.
There's lots of room at the top,
Oh but you can't sit down,
On, no you can't sit down
And don't you know that boudoir
Looks just a ball and chain
Oh, no you can't sit down

All through the night
You hear gunshot warnings
This time it wasn't you,
Paid your dues;

All through the night
You hear the city moaning
But be a tomcat prowling
Baby, your stomach's growling;
Oh, it's just another sign 
That summer's comin',
City wars and flash floods and tornados,
Festivals for rock and roll season
Beach talk baseball and a handy household hymns;"
13,Thin Lizzy,It's Only Money,TRIZEGI128F428102D,1974,"You don't believe in love
You don't believe in hatred
Put your money in the bank
It's the only way to save it

You try to make a buck
But you haven't made a penny
You need a little luck
But you know you won't get any

You don't believe in God
You don't believe in glory
You've got a brother in the clinic
Tells the same kind of story

If he had another life
You'd know what would be waiting
If you had another soul
He could sell it all to Satan

It's only money
It's only money
It's only money

You don't believe in war
You don't believe in Jesus
Got a sister in New York
You know how she pleases

Walking the streets
On the south side of the city
Trying to make ends meet
Isn't that a pity

For money"
14,Uriah Heep,The Easy Road,TRLUNET128F9308DEB,1974,"If you're looking for a place
You can fly together
And you're really afraid of
What you're leaving behind
Take the easiest road
But take care my brother
For you'll never find peace
With a troubled mind

Far better to love each other
Than to worry so deeply
¡®bout the place you're in
And far better to kiss her softly
Than lookin' back on a love
You'll never have again



Time's as fickle as
The sky in winter
And two hearts always
Were better than one
Love has the wings
Of a tireless angel
She'll stay beside you
Till the day is done

La la la la la ...

You'll never have again
No no no, never again
You'll never have again"
15,Abba,Ring_ Ring,TRHMZUX128E078F274,1974,"I was sitting by the phone
I was waiting all alone
Baby, by myself I sit and wait and wonder about you

It's a dark and dreary night
Seems like nothing's going right
Won't you tell me, honey, how can I go on here without you?

Yes, I'm down and feeling blue
And I don't know what to do, oho

Ring, ring, why don't you give me a call?
Ring, ring, the happiest sound of them all
Ring, ring, I stare at the phone on the wall

And I sit all alone impatiently
Won't you please understand the need in me?

So, ring, ring, why don't you give me a call?
So, ring, ring, why don't you give me a call?

You were here and now you're gone
Hey, did I do something wrong?
I just can't believe that I could be so badly mistaken

Was it me or was it you?
Tell me, are we really through?
Won't you hear me cry and you will know that my heart is breaking

Please forgive and then forget
Or maybe darling better yet, oho

Ring, ring, why don't you give me a call?
Ring, ring, the happiest sound of them all
Ring, ring, I stare at the phone on the wall

And I sit all alone impatiently
Won't you please understand the need in me?

So, ring, ring, why don't you give me a call?
So, ring, ring, why don't you give me a call?

Oho, ring, ring, why don't you give me a call?
So, ring, ring, why don't you give me a call?
Oho, ring, ring, why don't you give me a call?"
16,Tom Waits,Shiver Me Timbers,TRQLHCR128F422F688,1974,"Leavin' my family I'm leavin' all my friends
My body's at home but my heart's in the wind
Where the clouds are like headlines on a new front page sky
My tears are salt water and the moon's full and high

And I know Martin Eden's is gonna be proud of me
And many before me who've been called by the sea
To be up in the crow's nest singin' my say
Shiver me Timbers I'm a sailin' away

The fog's liftin' and the sand's shiftin' and I'm driftin' on out
And ol' Captain Ahab he got nothin' on me
So come on and swallow me don't follow me I'm travelin' alone
Blue water's my daughter an' I'm skippin' like a stone

And please call my misses tell her not to cry
My goodbye is written by the moon in the sky
And nobody knows me I can't fathom my stayin'
And shiver me timbers I'm a sailin' away
The fog's liftin' and the sand's shiftin' and I'm driftin' on out
And ol' Captain Ahab he got nothin' on me
So come on and swallow me don't follow me I'm travelin' alone
Blue water's my daughter an' I'm skippin' like a stone

And I'm leavin' my family I'm leavin' my friends
My body's at home but my heart's in the wind
Where the clouds are like headlines on a new front page sky
And shiver me timbers I'm a sailin' away"
17,Smokey Robinson,Virgin Man,TRZPIQW128F930AA21,1974,"Can you love a virgin man
Can you love a virgin man

When I'm with my friends
And the man talk begins
And they brag about all the love they've known
I sit in the corner all alone
The best thing I can do is listen
The most I've done is just some kissin'

Can you love a virgin man (baby)
Can you love (really love) a virgin man

How come people say
Lady virgin that's OK
But when the conversation turns around
Virgin man they always put him down
People say he must be ""funny""
He ain't had a taste of honey

Can you love a virgin man (baby)
Can you love a virgin man
Can you love a virgin man
Can you love a virgin man

My gift of love has never been unwrapped
My well of love it still remains untapped (oh baby)

Can you love a virgin man (baby)
Can you love (really love) a virgin man
Can you (really) love a virgin man (baby)

How come people say
Lady virgin that's OK
But a man who is a man
Ain't supposed to be that way
No no no no no no

Can you love a virgin man (baby)
Can you love a virgin man
(wonder what my friends would do if they only knew)
Can you love a virgin man
(I've been saving all my love for you, you)
Can you love a virgin man

They say making love's an art
In which each man should take part
By the time he reaches twenty one
Making love is something that he should have done
It ain't like I've never wanted to
But it's easier to think than it is to do

Can you (really) love a virgin man (baby)
Can you (really) love a virgin man
Can you love a virgin man
Can you love a virgin man
Can you love a virgin man
Can you love a virgin man"
18,Mott The Hoople,Born Late '58,TRSWMBJ12903CB150F,1974,"Baby took me out last night
Got a little cadillac bite.
Shook me about - inside out
Didn't get home 'till light.

She's a grower, a goer - you gotta get to know her
No chooser, a cruiser - you turn around she'll lose you

Burned out as the light turned green
Smoke-screened off her rail.
He didn't see me comin' but he shoulda saw me runnin'
Faster than the U.S. mail.

She's a speeder, a leader
You're really gotta meet her
You see her, she thrills you, you look at her she'll kill you.

Listen, fella, baby don't you sell her
Don't you try and steal her away
Hush, man logs in her dam
Think you better fade away

Detonator, jail-baiter - a radar radiator
She'll annoy ya, destroy ya - she'll bring ya down in fire
Create her, mistreat her - no use tryin' to beat her
Admit it, she's greater, shame you weren't born later."
19,Leonard Cohen,Chelsea Hotel #2,TRQMFAU128F4272EFA,1974,"I remember you well in the Chelsea Hotel
You were talking so brave and so sweet
Giving me head on the unmade bed
While the limousines wait in the street
Those were the reasons and that was New York
We were running for the money and the flesh
And that was called love for the workers in song
Probably still is for those of them left

Ah, but you got away, didn't you babe?
You just turned your back on the crowd
You got away, I never once heard you say
I need you, I don't need you
I need you, I don't need you
And all of that jiving around

I remember you well in the Chelsea Hotel
You were famous, your heart was a legend
You told me again you preferred handsome men
But for me you would make an exception
And clenching your fist for the ones like us
Who are oppressed by the figures of beauty
You fixed yourself, you said: ""Well never mind
We are ugly but we have the music""

And then you got away, didn't you babe?
You just turned your back on the crowd
You got away, I never once heard you say
I need you, I don't need you
I need you, I don't need you
And all of that jiving around

I don't mean to suggest that I loved you the best
I can't keep track of each fallen robin
I remember you well in the Chelsea Hotel
That's all, I don't even think of you that often"
20,Ronnie Milsap,Pure Love,TRLOEWP128F42482AC,1974,"Pure love, baby it's pure love
Milk and honey and Captain Krunch and you in the morning
Pure love baby it's pure love
Ninety-nine and forty-four one hundreds percent pure love
Pure love You're the picture of pure love
Ninety-nine and forty-four one hundreds percent pure love

I wake up with sunshine (sunshine)
Laying beside me
And bluebirds singing right outside my window
Soft warm kisses (kisses)
Say good morning
Then I get breakfast in bed
You know you make me so happy (make me so happy with)

Pure love, baby it's pure love
Milk and honey and Captain Krunch and you in the morning
Pure love You're the picture of pure love
Ninety-nine and forty-four one hundreds percent pure love
Ninety-nine and forty-four one hundreds percent pure love
Ninety-nine and forty-four one hundreds percent pure lov-ov-ove"
21,Lynyrd Skynyrd,Call Me The Breeze,TRNLITC128E078F694,1974,"Call me the breeze
I keep blowin' down the road
Well, now they call me the breeze
I keep blowin' down the road
I ain't got me nobody
I don't carry me no load

Ain't no change in the weather
Ain't no changes in me
Well, there ain't no change in the weather
Ain't no changes in me
And I ain't hidin' from nobody
Nobody's hidin' from me
Oh, and that's the way it's supposed to be

Well, I got that green light baby
I got to keep movin' on
Well, I got that green light baby
I got to keep movin' on
Well, I might go out to California
Might go down to Georgia, I don't know

Well, I dig you Georgia peaches
Makes me feel right at home
Well, now I dig you Georgia peaches
Makes me feel right at home
But I don't love me no one woman
So, I can't stay in Georgia long

Well, now they call me the breeze
I keep blowin' down the road
Well, now they call me the breeze
I keep blowin' down the road
I ain't got me nobody
I don't carry me no load
Ooh Mr. Breeze"
22,LaBelle,Lady Marmalade,TRMJCVV12903D057BD,1974,"Hey sista, go sista, soul sista, go sista
Hey sista, go sista, soul sista, go sista

He met Marmalade down in old New Orleans
Struttin' her stuff on the street
She said, 'ey 'ello, hey Joe, you wanna give it a go? mm, mm?

Guiche Cuiche ya ya da da
Guiche Guiche ya ya here
Mocha chocalata ya ya
Creole Lady Marmalade

Voulez vous coucher avec moi, ce soir
Voulez vous coucher avec moi

Sat in her boudoir while she freshened up
That boy drank all that magnolia wine
On the black satin sheets where he started to freak

Guiche Cuiche ya ya da da
Guiche Guiche ya ya here
Mocha chocalata ya ya
Creole Lady Marmalade

Voulez vous coucher avec moi, ce soir
Voulez vous coucher avec moi

Hey, hey, Hey!

Feel her skin, feelin' silky smooth
Color of cafe au lait
Made the savage beast inside roar until he cried:
More, more, more

Now he's back home doin' 9 to 5
Livin' his grey flannel life
But when he turns off to sleep, old memories keep
More, more, more

Guiche Cuiche ya ya da da
Guiche Guiche ya ya here
Mocha chocalata ya ya
Creole Lady Marmalade

Voulez vous coucher avec moi, ce soir
Voulez vous coucher avec moi
Voulez vous coucher avec moi, ce soir
Creole Lady Marmalade

Voulez vous coucher avec moi, ce soir
Voulez vous coucher avec moi
Voulez vous coucher avec moi, ce soir
Voulez vous coucher avec moi

Voulez vous coucher avec moi, ce soir
Voulez vous coucher avec moi
Voulez vous coucher avec moi, ce soir
Voulez vous coucher avec moi. mm'hmm

Guiche Guiche ya ya da da
Guiche Guiche ya ya here
Mocha chocalata ya ya
Guiche Guiche ya ya da da da da"
23,Camilo Sesto,Isabel,TRWCEYN128F429F626,1974,"Dormías envuelta
entre tus sueños y tu piel
tu alma desnuda 
me habló sin querer...

El calor de tu alcoba
me dijo 'quédate...'
te tomé entre mis brazos 
y le di vida a tus sueños...

Isabel, Isabel...
y en mis brazos 
fuiste mujer

Isabel, Isabel...
lo que yo daría 
por tenerte otra vez

Duró poco tiempo
quién sabe por qué
abriste tus alas 
cuando probaste la miel

Sin querer queriendo 
te llevaste mi fe
y mi orgullo te llora 
donde quiera que estés

Isabel, Isabel...
tú que en mis brazos
fuiste mujer...

Isabel, Isabel..
lo que yo daría 
por tenerte otra vez...

Pero olvidar 
no es tan fácil 
como llorar...

Quiero romper
este silencio a placer
porque olvidar 
no es como llorar...

Isabel, Isabel...
y en mis brazos 
fuiste mujer

Isabel, Isabel...
lo que yo daría 
por tenerte otra vez"
