,Artist,Title,Track_id,Year,Lyrics
234,Sparks,Angst In My Pants,TRYKNBQ12903CB726F,1982,"I hope it doesn't show
It'll go away
It's just a passing phase
It'll go away

You can dress nautical
Learn to tie knots
Take lots of Dramamine
Out on your yacht

But when you're all alone
And nothing bites
You'll wish you stayed at home
With someone nice

But when you think you made it disappear
It comes again, ""Hello, I'm here.""
And I've got angst in my pants

You can be smart as hell
Know how to add
Know how to figure things
On yellow pads

Answer so no one knows
What you just said
But when you're all alone
You and your head

What's the computer say, it's mumbling now
It says, ""Hey, Joe."" It's spelled it out
And you've got angst in your pants
You've got angst in your pants

(But when you think)
But when you think you've made it disappear
You're sure you made it disappear
And you've still got angst in your pants

I hope it doesn't show
It'll go 'way
It's just a passing phase
It'll go 'way

I hope it doesn't show
It'll go 'way
Give it a hundred years
It won't go 'way

And I've got angst in my pants
I've got angst in my pants
I've got angst in my pants
I've got angst in my pants

I've got angst in my pants
I've got angst in my pants
I've got angst in my pants
I've got angst in my pants"
235,Karla Bonoff,Wild Heart Of The Young,TRKNJCB128F4267DA2,1982,"These days when I take a look behind, 
I think about you and all that time.
We were as one,
kids on the run.

CHORUS
I loved you like I'll never love another,
With the wild heart of the young
But it took until now to uncover.
Oh, if I'd only known it then

You spoke of the dream we made come true
I remember how I looked up to you.
It was there in your touch
You knew so much.

CHORUS

Well, they watched while you broke all the rules,
And everyone thought I was your fool.
But I paid the price
Never even thought twice

CHORUS

If I thought about all the loves
I knew I know they'd all fade except for you.
And someday you'll see how much you taught me."
236,Dexys Midnight Runners,Come On Eileen,TRSMLZI12903CC830E,1982,"Come on, Eileen
Come on, Eileen

Poor old Johnnie Ray
Sounded sad upon the radio
Moved a million hearts in mono
Made our mothers cry
Sang along, who'd blame them?

You're grown (You're grown up)
So grown (So grown up)
Now I must say, more than ever (Come on, Eileen)
Toora-loora-toora-loo-rye-ay
And we can sing just like our fathers

Come on, Eileen, oh, I swear (Well he means)
At this moment, you mean everything
With you in that dress, my thoughts (I confess)
Verge on dirty
Ah, come on, Eileen

Come on, Eileen

These people 'round here
Were beaten down, eyes sunk in smoke, dried faces
So resigned to what their fate is

But not us (No, never)
No, not us (No, never)
We are far too young and clever (Remember)
Go toora-loora-toora-loo-rye-ay
Eileen, I'll hum this tune forever

Come on, Eileen, oh, I swear (Well he means)
Ah, come on, let's take off everything
That pretty red dress, Eileen (Tell him yes)
Ah, come on, let's
Ah, come on, Eileen
That pretty red dress, Eileen (Tell him yes)
Ah, come on, let's
Ah, come on, Eileen, please

(Come on, Eileen, too-loo-rye-ay
Come on, Eileen, too-loo-rye-ay, toora-toora-too-loora)
Now you are grown, and now you have shown, oh, Eileen
(Come on, Eileen, too-loo-rye-ay
Come on, Eileen, too-loo-rye-ay, toora-toora-too-loora)

You're grown (Said, come on, Eileen, these things they are real)
So grown (And I know how you feel)
Now I must say more than ever
Things 'round here will change

(Come on, Eileen, too-loo-rye-ay
Come on, Eileen, too-loo-rye-ay, toora-toora-too-loora)
I said toora-loora-toora-loo-rye-ay
(Come on, Eileen, too-loo-rye-ay
Come on, Eileen, too-loo-rye-ay, toora-toora-too-loora)

Come on, Eileen, oh, I swear (Well he means)
At this moment, you mean everything
With you in that dress, my thoughts (I confess)
Verge on dirty
Ah, come on, Eileen

Come on, Eileen, oh, I swear (Well he means)
At this moment, you mean everything
(In that dress) Whoa, my thoughts (I confess)
Well, they're dirty
Come on, Eileen

Come on, Eileen, whoa-oh-oh (Well he means)
Oh-ho-ho-ho (Everything)
Ah come on, Ah come on"
237,Taco,Singin' In The Rain,TRFBSSZ128F149B024,1982,"My God
You fly thousands of miles to get some sun, and it's rainin' cats and dogs!
Typical tropical
I go on vacation, and Mother Nature gives up on me
Yeah, what a lady
Thanks for at least sendin' it down pre-heated! 
Doesn't seem to bother the natives, though
Back home it gets no one laughin'
And here they even sing to it
Must be some voodoo rain chant or somethin'
Hmph!
And it sure sounds familiar
Ah, well

I'm singin' in the rain, just singin' in the rain
What a glorious feeling, I'm happy again
I'm laughin' at clouds so dark up above
The sun's in my heart and I'm ready for love
Let the stormy clouds chase, everyone from the place
Come on with the rain, got a smile on my face
I walk down the lane with a happy refrain 
I'm singin', just singin' in the rain 

Let it rain all day

I'm singin' in the rain, just singin' in the rain
What a glorious feeling, I'm happy again
I'm laughin' at clouds so dark up above
The sun's in my heart and I'm ready for love
Let the stormy clouds chase, everyone from the place
Come on with the rain, got a smile on my face
I walk down the lane with a happy refrain  
I'm singin' and dancin' in the rain 

Let it rain all day

I'm singin' in the rain, just singin' in the rain
What a glorious feeling, I'm happy again
I'm laughin' at clouds so dark up above
The sun's in my heart and I'm ready for love
Let the stormy clouds chase, everyone from the place
Come on with the rain, got a smile on my face
I walk down the lane with a happy refrain 
I am singin' and dancin' just getting wet in the rain 

Let it rain all day

Buckets of sunshine that bring me your love
Buckets of sunshine that bring me your love
Let it rain all day
I love the rainy day
We got sunshine, everyday"
238,Francesco De Gregori,Rollo & His Jets,TRTHMCT128F42A910C,1982,"Se potessi questa sera
ascolterei volentieri
Rollo con gli amici suoi,
come ai tempi che le radio
funzionavano a valvole
e i bambini eravamo noi.

In un programma dalle sette
alle sette e venti,
andava in onda tutti i lunedì,
si intitolava se ricordo bene,
""Il discobolo"" o giù di lì.

Una musica tutta chitarra e batteria,
l'altoparlante faceva 'crok'
ed il più grande dei nostri amici
quelle canzoni le chiamava rock.

Se potessi questa sera
ascolterei volentieri
Rollo con i suoi Jets
e quel bassista mezzo messicano
soprannominato ""Chicco di caffè"".

E il chitarrista con quel nome strano
ma chi se lo dimentica più?
Con quel suo stile sudamericano,
ma che ogni tanto svisava blues.

Una musica tutta chitarra e batteria
con il rullante che faceva 'toc'
ed il più esperto dei nostri amici
quelle canzoni le chiamava rock.

Se potessi questa sera
ascolterei volentieri
Rollo, qualche novità,
è un po' di tempo che non si sentiva
ma questa sera
è ritornato qua.

Con un programma che ci porta
attraverso il mare,
fino all'America
e pure più in là,
le nere vele di una nave a vapore
da consegnare alla posterità.

Una musica tutta chitarra e batteria
con il rullante che faceva 'toc'
ed il più esperto dei nostri amici
quelle canzoni le chiamava rock."
239,Bad Religion,Pity (Album Version),TREOQYX128F931BF7A,1982,"I show pity on the human race
On the ignorant plenty who devote their lives
To an icon that they've never known

I show pity on eons past
When early man started the first civilization
And human aggression was born

I show pity on the future to come
When the government system will be omnipotent
And we'll be worse off
Than we are now

Pity, pity, on the billions of ignorant people
Pity, pity, on the masses of aggression
Pity, pity, on the future centuries to come
On the billions of ignorant people
On the future centuries to come
On the masses of aggression

It's all a matter of looking at the past
It's all a question, are we gonna last?
If we endure the aggression that's inside all of us
We'll wipe out our own species and thus
The world

Pity
Pity on
On the masses of aggression
On the billions of ignorant people
On the future centuries to come
On the masses of ignorant people
On the future centuries to come"
240,Adam Ant,Goody Two Shoes,TRMRNWA128F92DF770,1982,"With the heartbreak open
So much you can't hide
Put on a little makeup, makeup
Make sure they get your good side, good side

If the words unspoken
Get stuck in your throat
Send a treasure token, token
Write it on a pound note, pound note

Goody two, goody two, goody goody two shoes
Goody two, goody two, goody goody two shoes

Don't drink, don't smoke, what do you do?
You don't drink, don't smoke, what do you do?
Subtle innuendos follow
There must be something inside

We don't follow fashion
That'd be a joke
You know we're going to set them, set them
So everyone can take note, take note

When they saw you kneeling
Crying words that you mean
Opening their eyeballs, eyeballs
Pretending that you're Al Green, Al Green

Goody two, goody two, goody goody two shoes
Goody two, goody two, goody goody two shoes

Don't drink, don't smoke, what do you do?
You don't drink, don't smoke, what do you do?
Subtle innuendos follow
Must be something inside

No one's gonna tell me
What's wrong and what's right
Or tell me who to eat with, sleep with
Or that I've won the big fight, big fight

Look out or they'll tell you
You're a ""Superstar""
Two weeks and you're an all-time legend
I think the games have gone much too far

If the words unspoken
Get stuck in your throat
Send a treasure token, token
Write it on a pound note, pound note

Don't drink, don't smoke, what do you do?
You don't drink, don't smoke, what do you do?
Subtle innuendos follow:
Must be something inside, he's hidin'

Don't drink, don't smoke, what do you do?
Ya don't drink, don't smoke, what do you do?
Subtle innuendos follow:
Must be something inside, he's hidin'

Don't drink, don't smoke, what do you do?
Ya don't drink, don't smoke, what do you do?
Subtle innuendos follow:
Must be something inside, he's hidin'

Don't drink, don't smoke, what do you do?
Ya don't drink, don't smoke, what do you do?
Subtle innuendos follow:
Must be something inside, he's hidin'

Don't drink, don't smoke, what do you do?
Ya don't drink, don't smoke, what do you do?
Subtle innuendos follow:
Must be something inside"
241,The Cure,The Figurehead,TRFIARV128E0788E50,1982,"Sharp and open, leave me alone, and sleeping less every night
As the days become heavier and weighted, waiting in the cold light
A noise, a scream tears my clothes, as the figurines tighten
With spiders inside them and dust on the lips of a vision of Hell
I laughed in the mirror for the first time in a year

A hundred other words blind me with your purity
Like an old painted doll in the throes of dance, I think about tomorrow
Please let me sleep, as I slip down the window
Freshly squashed fly, you mean nothing
You mean nothing

I can lose myself in Chinese art and American girls
All the time, lose me in the dark, please do it right
Run into the night, I will lose myself tomorrow
Crimson pain, my heart explodes
My memory in a fire
And someone will listen, at least for a short while

I can never say no, I can never say no to anyone but you

Too many secrets, too many lies
Writhing with hatred
Too many secrets, please make it good tonight
But the same image haunts me in sequence, in despair of time
I will never be clean again
I touched her eyes, pressed my stained face
I will never be clean again
Touch her eyes, press my stained face
I will never be clean again
I will never be clean again
I will never be clean again
I will never be clean again"
242,Talk Talk,Candy (1997 Digital Remaster),TRBZXEI128F425A752,1982,"This sure is some kind of party
It's so useful
Surrounds my life with excuses
For what I choose to lose
And my name
Doesn't look the same to me 
And inside
Don't you know I feel so bad

Candy,
When I tried to turn away
To feel new again
My emotion cost me pain
Did I look the same
When I think about the times
That I laughed away the idea you'd cheat me
But look again
What do you say 'That's my name'

AND I HOPE THAT I'VE KEPT YOU AMUSED
TO WIPE THAT SPIT RIGHT OFF MY BOOTS
And when I'm home and thinking in the dark
I hope that none of this has had to go too far

When it gets too late
To see me any other way
And it gets so hard to hold on
To everything that I want so bad"
243,The Blasters,Marie Marie,TRHGMFM12903CBD51D,1982,"Marie Marie
Playing guitar on the back porch
I sit in my car
Why is she so sad
Marie Marie

Marie Marie
It's so lonely in these farmlands
Please come with me
To the bright lights downtown
Marie Marie

I said, ""Hey, pretty girl
Don't you understand
I just want to be your loving man""

Marie Marie
The sun is down in the corn fields
The evening is dark
And you sing so sad
Marie Marie

Marie Marie
I got two weeks in back pay
There's gas in my car
And your folks say I must go
Marie Marie

I said, ""Hey, pretty girl
Don't you understand
I just want to be your loving man""

Marie Marie
Playing guitar on the back porch
I leave in my car
While you sing so sad
Marie Marie"
244,Little River Band,Happy Anniversary,TRJRGSC128F932A8E3,1982,"Happy anniversary, baby
Got you on my mind
Happy anniversary, baby
Got you on my mind

I'm so happy for you baby
Now that you've found somebody new
I see it in your eyes
Lord, it's no surprise
What he can do for you

But when I look back baby
When I look back to what we had
And I know I'm countin' good times
But there were just as many bad

And so I wish you
Happy anniversary, baby
Got you on my mind
Happy anniversary, baby
Got you on my mind

There's a lesson here to learn 
When your baby ups and leaves you
Carry on, don't feel concerned 
Even though you're so much in love
You need a little help from above, oh

Happy anniversary, baby
Got you on my mind
Happy anniversary, baby
Got you on my mind

Oh, ain't no foolin' with you baby
Only the words are hard to find
You got me tremblin' at the knees
Answer won't you please
Before I lose my mind

This is our fifth year, baby
And it feels like I'm in jail, Lord
I'm holding on to this card
Can't seem to get it in the mail
And the card reads

Happy anniversary, baby
Got you on my mind
Happy anniversary, baby
Got you on my mind

Ooh yeah, happy anniversary, baby
Got you on my mind
Ah yeah, happy anniversary, baby
Got you on my mind

Oh, have a happy anniversary
'Cause I've got you on my mind
Always on my mind

Happy anniversary
Happy anniversary"
245,Articles Of Faith,What We Want Is Free,TRKJCCK128F4244590,1982,"I don't need no credit rating
Mass production market slaving
I won't spend my life behaving
To the monopolies

If in time I cease to function
Blame it on a bad deduction
All I see is prime corruption
And the monopolies

They sell me sort
Shatter my ambition
They buy me out
That's the wrong description
They buy me off
I've no ammunition
That's what they want for me

But what we want
Is free
What we want
Is free
What we want
Is free
What we want
Is free

I don't need no mass production
Demographic ground reductions
Obsolescence market functions
The monopolies

I don't need no loan investment
Floating bonds or sales engagement
I won't spend my life in payment to
The monopolies

They sell me sort
Shatter my ambition
They buy me out
That's the wrong description
They buy me off
I've no ammunition
That's what they want for me

But what we want
Is free
What we want
Is free
What we want
Is free
What we want
Is free

I won't spend my life behaving
Say I'm wrong for disobeying
All your shit is so degrading
I won't spend my life behaving

What we want
Is free
What we want
Is free..."
246,Ultravox,Reap The Wild Wind,TRERVEE128F422D83A,1982,"Reap the wild wind
Reap the wild wind

Reap the wild wind
Reap the wild wind

A finger points to show a scene (take my hand, take my hand)
Another face where mine had been (take my hand, take my hand)
Another footstep where I once walked (take my hand)
Take it all

You take my hand and give me your friendship
I'll take my time and send you my slow reply
Give me an inch, and I'll make the best of it
Take all you want and leave all the rest to die

Reap the wild wind

A footprint haunts an empty floor (take my hand, take my hand)
A fading coat that I once wore (take my hand, take my hand)
Oh, a desolation where I once lived

I have seen in times gone by
I have felt
A different shadow on the wall
A stranglehold on a certain feeling

You take my hand and give me your friendship
I'll take my time and send you my slow reply
Give me an inch, and I'll make the best of it
Take all you want and leave all the rest to die

Reap the wild wind
Reap the wild wind

You take my hand and give me your friendship
I'll take my time and send you my slow reply
Give me an inch, and I'll make the best of it
Take all you want and leave all the rest to die

Reap the wild wind"
247,The B-52's,Nip It In The Bud,TRYRIIL128F14961E8,1982,"Oh Wo Oh Nip it in the bud
No Wo Oh Nip it in the bud
Oh Wo Oh I say 'Froze you'
No Wo Oh Nothin' I can do
Can't, oh oh, can't give it in Ho Oh Oh Woooah
Wo Oh Oh Nip it in the bud
Wo Oh Oh Nip it in the bud
You lock me out, you lock me out, huh
Lock me out, ah, lock me out
Nip it in the bud, I don't know
Give it a shove, hey hey
Head 'em up, head 'em up
Move 'em out, move 'em out, hooah
I'm no fool!
Ain't got no place to go
I don't know, I don't care
If you just go on and get me there
Oh, I don't want to ruffle your feathers
I don't care if you don't go
I'll just go do and beware ho oh ho oh

Nip it in the bud Wo Oh Oh
Give it a shove
Hey you gotta head 'em up, move 'em out hooah
Ahhhh, come take me away
Say, come take me away
Nip it in the bud..."
248,The Roches,Losing True (Album Version),TRBEIBI12903CC4C7B,1982,"(by Margaret A. Roche)


I'm losin' you
fading from view

aging and aching and raging and faking I'm

losin' you
losin' true

last time I saw you I wanted to paw you
not to destroy you now I just annoy you I'm

losin' too
accusin' you

when I first met you I failed to get you
now that I let you come through I forget who I'm 

losin' out
cruisin' about

the knight of shining armor doesn't do her any favors

make no mistake when mystiquing a make I'm

losin' you
choosin' to"
249,Donald Fagen,Green Flower Street (Album Version),TRKVAUI128F9340B1C,1982,"Uptown
It's murder out in the street
Uptown
It's murder out in the street
That's where I found my mandarin plum
That's where you'd be if you found one

Where the nights are bright
And joy is complete
Keep my squeeze on Green Flower Street

Since May
There's trouble most every night
Where once we danced our sweet routine
It reeks of wine and kerosene

Where the nights are bright
And joy is complete
Keep my squeeze on Green Flower Street

There's a special place for lovers
One we understand
There where neon bends in daylight sky
In that sunny room she soothes me
Cools me with her fan
We're drifting
A thousand years roll by

Lou Chang
Her brother he's burning with rage
Lou Chang
Her brother he's burning with rage
I'd like to know what's on his mind
He says hey buddy you're not my kind

Where the nights are bright
And joy is complete
Keep my squeeze on Green Flower Street"
250,Laura Branigan,Maybe I Love You (LP Version),TROTLZG12903CBDF7C,1982,"(Trevor Veitch/Greg Mathieson/Alan Sorrenti)

Maybe I love you, maybe I don't
Maybe I'll need you and maybe, baby, I won't
I guess I don't take the time
To let you know what's on my mind
Maybe I've been blind

Maybe I'm crazy, maybe I'm sane
Maybe I need to go away, start over again
But if I went away
I'd be afraid I should have stayed
Maybe I'm afraid that maybe I love you

And believe me when I tell you
It's because of all the things you say and do
That help me make it through
I need you
But when I try to say goodbye
I realize I won't know what to do
If I don't have you

Maybe I love you, baby I do
I guess I loved you
The first time I saw you
And when I don't take the time
To let you know what's on my mind
I know that I'm too damn blind
But baby I love you

Maybe I love you, maybe I don't
Maybe I'll need you and maybe, baby, I won't
I guess I don't take the time
To let you know what's on my mind
Maybe I've been blind, but maybe I love you
I love you"
251,Dave Edmunds,Dear Dad,TRYEWBH128F92CF192,1982,"Dear Dad, don't get mad,
What I'm asking for
Is by the next semester
Can I get another car ?
This one here is sick'ning
On a wide dual road.
I might as well be walking
As to drive this old Ford.

Almost everyntime I try
To go and pass a truck,
If I ain't goin' down hill,
Dad, Im, out of luck.
And even if I get by,
It's still a rugged risk,
The way this old Ford
Keep a hitting and miss.

Last week when I was driving
On my way to school,
I almost got a ticket
'Bout a freeway traffic rule.
It's now a violation
Driving under forty-five,
And if I push to fifty,
This here Ford will nosedive.

Dad, I'm in great danger
Out here trying to drive.
This Ford wiggles
When I'm approaching forty-five/
I have to nurse it along
Like a little suffering pup,
And cars whizzing by me,
Dad, look like I'm backing up.

She just don't have the appetite
For gas somehow,
And Dad, I got both carburetors
Hooked up on it now.
I tried to hook another
To see if I'd do a little good,
But ain't no place to put it
'Less I perforate the hood.

So Dad, send the money,
See what I can see,
Try to find a Cadillac,
Sixty-two or three.
Just something that won't worry us
To keep it on the road.
Sincerely, your loving son,
Henry Junior Ford."
252,Phil Collins,Don't Let Him Steal Your Heart Away,TRGVZVG128E0783D4B,1982,"You were lonely and you needed a friend
And he was there at the right time with the right smile
Just a shoulder to lean on
Someone to tell you it'll all work out all right 

Don't let him steal your heart away
No, don't let him steal your heart away
Don't let him steal your heart away
No, don't let him steal your heart away 

You can look at him the way you did me
And hold him close say you're never letting go
But any fool can see you're fooling yourself
But you ain't fooling me 

So don't let him steal your heart away
No, don't let him steal your heart away 

And don't pack my suitcase, I'll be back
And don't take my pictures off of the wall
Oh, did you hear me?
Don't let him change a thing 'cause I'll be back
Just tell him to pack his things and get out of your life
And just give me one more chance
I'll show you I'm right, I'm right 

'Cos I've been thinking and I know it was me leaving you lonely
But hoping you could be strong
But can you look at me straight
Tell me what else can I do but say I was wrong? 

So don't let him steal your heart away
No, don't let him steal your heart away 

Well he's gonna try to make it work for you
Make you think your whole life's been leading to this
But whatever you do
Think about me, oh! and don't be fooled by his kiss 

And don't let him steal your heart away
Please, don't let him steal your heart away 

And don't pack my suitcase, I'll be back
And don't take my pictures off of your wall
Oh, did you hear me?
Don't let him change a thing 'cause I'll be back
Just tell him to pack his things and get out of your life
And just give me one more chance
I'll show you I'm right
You know I'm right 

'Cause you were lonely and you needed a friend
And he was there at the right time with the right smile
Just a shoulder to lean on
Someone to say don't you worry it'll all be alright
But he's no good for you
He'll make you think your whole life's been leading to this
And whatever you do
Think about me, oh, and don't be fooled by his kiss"
253,Commodores,Oh No,TRNNVOD128F425FB94,1982,"I want you to want me
I'm going crazy knowing he will be your lover tonight
And when he comes, I'll let you go
I'll just pretend as you walk out the door

Oh no
I can't sleep
Oh no
I'm going crazy with love
Over you

I need you to need me
I want to hold you but you're holding someone else in your arms
When I close my eyes I see your face
I'm just not sure how much my heart can erase

Oh no
I can't think, ooh
Oh no
I'm going crazy with love
Over you

Oh, honey
Oh, sugar

Oh no
I can't sleep anymore baby
Oh no
I can't think anymore baby
Oh no
I'm going crazy with love
Over you"
254,Ben Watt,Some Things Don't Matter,TRFQJMO128F4289BB2,1982,"This boy, breezes in from the South Wells.  This boy, sees his days in the Middle East.  This boy, eased his way up the silver turns, but what is that, when this boy, he needs love, he needs love.

This boy, thought he had found his girl.  This boy, ought to have kept that girl.  This boy, caught up in the wheels of fate, this boy deserves, oh this boy, he needs love, an everlasting love.  He needs love.  Oh this boy, he knows, how to feel, the blood in his heart runs strong as ?, this boy only knows what's real, so give him love, an everlasting love.  Give him love.  Oh this boy, he's got a, heart of gold and gold's the most precious thing, you could ever hold and if his heart is made of that, what ? ? be told, just give him love, an everlasting love.  Give him love.

This boy, breezes in from the, South Wells.  This boy, sees his days in the Middle East.  This boy, eased his way up the silver turns but what is that this boy deserves, oh he needs love, an everlasting love.  Give him love.  Oh give it to him, he needs it now, an everlasting, everlasting, everlasting, everlasting love"
