,Artist,Title,Track_id,Year,Lyrics
47,Bob Dylan,Mr. Tambourine Man,TRBUJSA128F4267284,1965,"Hey, Mr. Tambourine Man, play a song for me
I'm not sleepy and there is no place I'm going to
Hey, Mr. Tambourine Man, play a song for me
In the jingle-jangle morning I'll come followin' you

Though I know that evening's empire
Has returned into sand
Vanished from my hand
Left me blindly here to stand but still not sleeping

My weariness amazes me
I am branded on my feet
I have no one to meet
And the ancient empty street's too dead for dreaming

Hey, Mr. Tambourine Man, play a song for me
I'm not sleepy and there is no place I'm going to
Hey, Mr. Tambourine Man, play a song for me
In the jingle-jangle morning I'll come followin' you

Take me on a trip upon your magic swirling ship
My senses have been stripped, my hands can't feel to grip
My toes too numb to step
Wait only for my boot heels to be wandering

I'm ready to go anywhere, I'm ready for to fade
Into my own parade
Cast your dancing spell my way
I promise to go under it

Hey, Mr. Tambourine Man, play a song for me
I'm not sleepy and there is no place I'm going to
Hey, Mr. Tambourine Man, play a song for me
In the jingle-jangle morning I'll come followin' you

Though you might hear laughing spinning, swinging madly across the sun
It's not aimed at anyone
It's just escaping on the run
And, but for the sky, there are no fences facing

And if you hear vague traces of skipping reels of rhyme
To your tambourine in time
It's just a ragged clown behind
I wouldn't pay it any mind
It's just a shadow you're seeing that he's chasing

Hey, Mr. Tambourine Man, play a song for me
I'm not sleepy and there is no place I'm going to
Hey, Mr. Tambourine Man, play a song for me
In the jingle-jangle morning I'll come followin' you

Then take me disappearing through the smoke rings of my mind
Down the foggy ruins of time, far past the frozen leaves
The haunted, frightened trees, out to the windy beach
Far from the twisted reach of crazy sorrow

Yes, to dance beneath the diamond sky with one hand waving free
Silhouetted by the sea, circled by the circus sands
With all memory and fate driven deep beneath the waves
Let me forget about today until tomorrow

Hey, Mr. Tambourine Man, play a song for me
I'm not sleepy and there is no place I'm going to
Hey, Mr. Tambourine Man, play a song for me
In the jingle-jangle morning I'll come followin' you"
48,Chad & Jeremy,From A Window,TRDVTRC128F9302907,1965,"Lennon-McCartney

Late yesterday night
I saw a light shine from a window
And as I looked again
Your face came into sight
I couldn't walk on
Until you'd gone from your window
I had to make you mine
I knew you were the one

Oh, I would be glad just to have a love like that
Oh, I would be true and I'd spend my life with you

So meet me tonight
Just where the light shines from a window
And as I take your hand
Say that you'll be mine tonight"
49,Billy J Kramer & The Dakotas,Trains And Boats And Planes,TROFTRE128F427B63B,1965,"Trains and bloats and planes are passing by
They mean a trip to Paris or Rome
For someone else but not for me
The trains and the boats and planes
Took you away, away from me

We were so in love and high above
We had a star to wish upon
Wish and dreams come true, but not for me
The trains and the boats and planes
Took you away, away from me

You are from another part of the world
You had to go back awhile and then
You said you soon would return again
I'm waiting here like I promised to
I'm waiting here, but where are you

Oh...oh...trains and boats and planes took you away
But every time I see him I pray
And if my prayer can cross the sea
The trains and the boats and planes
Will bring back you back, back home to me, whoa...oh...

Mmm...mmm...mmm...mmm...mmm...
Mmm...mmm...mmm...mmm...
Mmm...mmm...mmm...mmm...mmm...mmm...mmm...mmm...
Mmm...mmm...mmm...mmm...mmm...
Mmm...mmm...mmm...
The trains and the boats and planes
Will bring you back, back home to me, whoa, whoa

Mmm...mmm...mmm...mmm...mmm...
Mmm...mmm...mmm...mmm...
Mmm...mmm...mmm...mmm...mmm...mmm...mmm...mmm...
Mmm...mmm...mmm...mmm...mmm...
Mmm...mmm...mmm..."
50,Jr. Walker & The All Stars,(I'm A) Road Runner,TRACADD128F9312BDA,1965,"Money, who needs it?
Just to live my life free and easy
Put the toothbrush in my hand
And let me be travelin', man
'Cause I'm a roadrunner, baby

I'm a roadrunner, baby
Can't stay in one place too long
I'm a roadrunner, baby
Mess with me and I'll be gone

You can love me if you wanna
But I do declare
If I get restless
I've gotta move somewhere
I'm a roadrunner, baby

Can't find my home (no!)
And I love the life I live
And I'm gonna live the life I love 
Roadrunner, baby 

Don't a-want no woman
Just have me bound 
Got to be free, baby
To roam around

All my life I've been like this
If you love me, it's your own risk
When the dust hit my shoes
I got the urge to move

Said, I'm a roadrunner, baby
Just keep on, keepin' on
Yeah!
And I live the life I love
And I'm gonna love the life I live
Yes, I'm a roadrunner, baby."
51,Marianne Faithfull,Come And Stay With Me,TRPNDTA128F42480BD,1965,"I'll send away all my false pride
And I'll forsake our love my lies.
Yes, I'll be as true, as true can be
If you'll come and stay with me.

Lovers of the past I'll leave behind,
There'll never be another on my mind.
I'll do all I can so you'll feel free
If you'll come and stay with me.

The promises I made most faithfully,
I'll keep still, should you decide to leave.
I'll try and see that you have all you need
If you come and stay with me.

We'll live a life no one has ever known,
But I know you're thinking that I'm hardly grown.
But O thank God, at last and finally
I can see you're gonna stay with me.

But O thank God, at last and finally
I can see you're gonna stay with me."
52,The Shangri-Las,The Train From Kansas City,TRWCWAR128F93462F7,1965,"(Baby, baby
Please believe me
I would never never do anything to hurt you)
 
Baby, baby
Please believe me
I would never never do anything to you
To make you blue
 
But yesterday I
Got this letter
From a boy I loved
Before I ever knew you,
Before I even knew you
 
And the train from Kansas City
Is coming into town
The train from Kansas City (is a comin')
Nothing I can do can make it turn around
 
Baby, baby
Please don't worry
Nothing in this world could tear us apart
We'll never, never part
 
So wait right here
And I will hurry
I'll be back in the time it takes to break a heart
I gotta break his heart
 
Yes, the train from Kansas City
Is coming into town
The train from Kansas City (is a comin')
Nothing I can do can make it turn around
 
Well, I never answered his letter
I just couldn't tell him that way (oh yeah)
No, I never answered his letter
'Cause I didn't know what to say
 
Now I'm going down to the station
He'll be there at ten after two (ooh yeah)
I'll show him the ring on my finger
I don't know what else I can do
 
Oh, the train from Kansas City
Is coming into town
The train from Kansas City
Nothing I can do can make it turn around
 
Here comes the train
Here comes the train
Here comes the train"
53,The Byrds,She Don't Care About Time,TRKKVGK128F427F8FC,1965,"Hallways and staircases everyday to climb
To go up to my white walled room out on the end of time
Where I can be with my love for she is all that is mine
And she'll always be there my love don't care about time
I laugh with her cry with her hold her close she is mine
The way she tells me of her love and never is she trying
She don't have to be assured of many good things to find
And she'll always be there my love don't care about time

Her eyes are dark and deep with love her hair hangs long and fine
She walks with ease and all she sees is never wrong or right
And with her arms around me tight I see her all in my mind
And she'll always be there my love don't care about time
And she'll always be there my love don't care about time"
54,The Lovin' Spoonful,Sportin' Life,TRMVEXF128F429288B,1965,"I'm gettin' tired of runnin' round
Believe I'll get married and I'll settle down
Because this old night life, this mean old sportin' life,
You know it's killin' me.

And I got a letter from my home
And most of my good friends, they are dead and gone.
And it makes me worry, no need to wonder
About the times to come.

And Mother used to fall on her knees and pray
And these are the very words she did say.
She said, ""Oh Johnny, my lovin' Johnny,
Won't you please change your ways?""

I've been a gambler and a cheater, too.
But now it's come my, my time to lose.
Because this old night life is holdin' the best hand
And what can I do?

And I'm gettin' tired of runnin' round
Believe I'll get married and I'll settle down
Because this old night life, ooh it's a bad life,
And it's killin' me."
55,The Temptations,What Love Has Joined Together,TRMQPHH128E0792D17,1965,"It would be easier to take the wet from water or the dry from sand 
Than for anyone to try to separate us or stop us from holding hands, 'cause... 

I love you, I love you from the bottom of my heart 
And what love has joined together, what love has joined together 
Can nobody take it apart 
It would be easier to take the cold from the snow or the heat from fire 
Than for anyone to take me love from you 'cause you're my heart's desire, ... 

I love you, I love you from the bottom of my heart 
And what love has joined together, what love has joined together 
Can nobody take it apart 

Even if they separate us 1000 miles apart 
We will still be together in each other's hearts 
It would be easier to change all the seasons of the year 
Than for anyone to change the way I feel about you; I love you dear 

I love you, I love you from the bottom of my heart 
And what love has joined together, what love has joined together 
Can nobody take it apart 

It would be easier to take the wet from water or the dry from sand 
Than for anyone to try to separate us or stop us from holding hands, 'cause... 

It would be easier to take the wet from water or the dry from sand 
Than for anyone to try to separate us or stop us from holding hands, 'cause..."
56,The Strangeloves,(I Can't Get No) Satisfaction,TRVBPUY128F426C54A,1965,"I can't get no satisfaction
I can't get no satisfaction
Though I try
And I try
And I try
And I try
I can't get no
I can't get no

When I'm drivin' in my car
And a man comes on the radio
Tellin' me more and more
About some useless information
Supposed to fire my imagination
I can't get no
No-no-no
Hey-hey-hey
That's what I say

I can't get no satisfaction
I can't get no satisfaction
Though I try
And I try
And I try
And I try
I can't get no
I can't get no

When I'm watching my TV
And a man comes on and tells me
Just how white my shirts should be
Well he can't be a man 'cause he doesn't smoke
The same cigarettes as me
I can't get no
No-no-no
Hey-hey-hey
That's what I say

I can't get no satisfaction
I can't get no girl reaction
Though I try
And I try
And I try
And I try
I can't get no
I can't get no

When I'm riding 'round the world
And I'm doin' this and I'm signin' that
And I'm tryin' to make some girl
I tell ya, baby better get back the very next week
'Cause you see I'm on a losin' streak
I can't get no
No-no-no
Hey-hey-hey
That's what I say
Hey-hey-hey 
That's what I say

I can't get no
I can't get no
Satisfaction
No satisfaction
No satisfaction
No satisfaction"
57,Lightnin' Hopkins,Last Night I Lost The Best Friend I Ever Had,TRDMTYI128F428AA14,1965,"Last night I lost the best friend I'll ever have
Last night I lost the best friend I'll ever have
You know I went in to talk to poor mother about it
She said, ""Son, that's too black bad"" (?)

She said, ""That's a warning to you,
You should fall down on you knees and pray""
She said ""That's a warning, that is a warning to you, son, 
You should fall down on your knees and pray""
She said, ""you should ask the good lord to forgive you
For be living this old reckless way""

And I holler (unintelligible)

Every morning, I'm talking about the break of day
Early morning, I'm talking about the break of day
You know that's when I looks over on the pillow
Where that little girl, she used to lay

I call her, but she couldn't answer me."
58,The Supremes,Back In My Arms Again,TRKWDYE128F1474B30,1965,"All day long I hear my telephone ring
Friends calling giving their advice
From the boy I love I should break away
'Cause heartaches he'll bring one day

I lost him once through friends' advice
But it's not gonna happen twice
'Cause all advice ever gotten me
Was many long and sleepless nights

Ooh!
But now he's back in my arms again
Right by my side
I got him back in my arms again
So satisfied

It's easy for friends to say let him go
But I'm the one who needs him so
It's his love that makes me strong
Without him I can't go on

This time I'll live my life at ease
Being happy lovin' whom I please
And each time we make romance
I'll be thankful for a second chance

Ooh!
'Cause he's back in my arms again
Right by my side
I got him back in my arms again
So satisfied
Ooh!

How can Mary tell me what to do
When she lost her love so true?
And Flo, she don't know
'Cause the boy she loves is a Romeo

I listened once to my friends' advice
But it's not gonna happen twice
'Cause all advice ever gotten me
Was many long and sleepless nights

Ooh!
I got him back in my arms again
Right by my side
I got him back in my arms again
So satisfied

Ooh!
I'm satisfied, yeah
So satisfied
I'm satisfied
I'm satisfied"
59,Righteous Brothers,Unchained Melody,TRDCOOG128F42596E1,1965,"Oh, my love
My darling
I've hungered for your touch
A long, lonely time

And time goes by so slowly
And time can do so much
Are you still mine?

I need your love
I need your love
God speed your love to me

Lonely rivers flow to the sea, to the sea
To the open arms of the sea
Yes, lonely rivers sigh, ""Wait for me, wait for me
I'll be coming home, wait for me""

Oh, my love
My darling
I've hungered, hungered for your touch
A long, lonely time

And time goes by so slowly
And time can do so much
Are you still mine?

I need your love
I need your love
God speed your love to me"
60,The Animals,I'm Going To Change The World,TRNQDKW128E07824EC,1965,"There's one thing I've got to say
There's got to be some changes made
No more black or white
No more left or right
I'm gonna change the world, baby
I'm gonna change the world, yeah!
I'll switch the wrong to right (her on to right ?)
You can bet your life, baby, bet your life

Hold you far (cool your fire ?) and listen mister
Don't cause no trouble for my brother and sister
Why don't you look me in the face
Either that or leave my place
I'm gonna change the world, baby
I'm gonna change the world, waah yeah!
I'll switch the wrong to right (her on to right ?)
You can bet your life, baby, bet
your life, my life yeah!

Forget about what your folks told you
Make up your mind just what you wanna do
Just accept people for what they are
Or this old world won't get very far
I'm gonna change the world, baby
I'm gonna change the world, oh yeah!
I'll switch the wrong to right (her on to right ?)
You can bet your life, bet your life

You can bet your life, just bet your life
Well (..?)
There's gotta be some changes made
I'm gonna change this world
I'm gonna change this world, waah yeah"
61,Elmore James,I Can't Stop Lovin' You,TRHPQTK12903CB56E7,1965,"I can't stop lovin', my baby tonight
No I can't stop lovin', my baby tonight
Don't matter what I do, she don't treat me right
I left my baby, this mornin' soon
I left my baby, this mornin' soon
I didn't come back home, till in the afternoon
Ooh baby, you know I'm all alone
Yes baby, you know I'm all alone

And no lovin', now my baby's gone
Ooh baby, take a walk with me
Yes darlin', come on and walk with me
I'll make you as happy, as any girl can be
Ooh baby, you know I'm all alone
Yes baby, you know I'm all alone
And no lovin', now my baby's gone"
62,Barbara Lewis,Hello Stranger,TRKORFP128F934AA47,1965,"(Shoo-Bop Shoo-Bop, my baby)
(Shoo-Bop Shoo-Bop)
Hello stranger
(Ooh) It seems so good to see you back again
How long has it been? 
(Ooh it seems like a mighty long time)
(Shoo-Bop Shoo-Bop, my baby)
(Ooh) It seems like a mighty long time

Ohh, I'm I'm I'm I'm I'm so glad
(Ooh) You stopped by to say hello to me 
Remember that's the way it used to be
Ooh, it seems like a mighty long time
Shoo-Bop Shoo-Bop, my baby
Ooh, it seems like a mighty long time

(Shoo-Bop Shoo-Bop, my baby)
(Shoo-Bop Shoo-Bop, my baby) Ohh..
(Shoo-Bop Shoo-Bop, my baby) 
(Shoo-Bop Shoo-Bop, my baby) Ahh yes I'm so glad
(Shoo-Bop Shoo-Bop, my baby)
(Shoo-Bop Shoo-Bop, my baby) You're here again
(Shoo-Bop Shoo-Bop, my baby)

Ohh, If you're not gonna stay
(Ooh) Please don't tease me
Like you did before
Because I still love you so
(Ooh) Although
It seems like a mightly long time
(Shoo-Bop Shoo-Bop, my baby)
(ooh) It seems like a mighty long time

(Shoo-Bop Shoo-Bop, my baby) Ohh,
(Shoo-Bop Shoo-Bop, my baby) Ohh my my my my
(Shoo-Bop Shoo-Bop, my baby)
(Shoo-Bop Shoo-Bop, my baby)
(Shoo-Bop Shoo-Bop, my baby) I'm so happy 
(Shoo-Bop Shoo-Bop, my baby)
(Shoo-Bop Shoo-Bop, my baby) That you're here at last
(Shoo-Bop Shoo-Bop, my baby)
(Shoo-Bop Shoo-Bop, my baby) Ohh..."
63,Jackson C. Frank,Blues Run The Game,TRSDZYX128F92EC488,1965,"Catch a boat to England, baby,
Maybe to Spain,
Wherever I have gone,
Wherever I've been and gone,
Wherever I have gone
The blues are all the same.

Send out for whisky, baby,
Send out for gin,
Me and room service, honey,
Me and room service, babe,
Me and room service
Well, we're living a life of sin

When I'm not drinking, baby,
You are on my mind,
When I'm not sleeping, honey,
When I ain't sleeping, mama,
When I'm not sleeping
Well you know you'll find me crying.

Try another city, baby,
Another town,
Wherever I have gone,
Wherever I've been and gone,
Wherever I have gone
The blues come following down.

Living is a gamble, baby,
Loving's much the same,
Wherever I have played,
Wherever I throw them dice,
Wherever I have played
The blues have run the game.

Maybe tomorrow, honey,
Someplace down the line,
I'll wake up older,
So much older, mama,
Wake up older
And I'll just stop all my trying.

Catch a boat to England, baby,
Maybe to Spain,
Wherever I have gone,
Wherever I've been and gone,
Wherever I have gone
The blues are all the same."
64,The Rolling Stones,(I Can't Get No) Satisfaction,TRSAIQH128F9309BFA,1965,"I can't get no satisfaction
I can't get no satisfaction
'Cause I try and I try and I try and I try
I can't get no, I can't get no

When I'm drivin' in my car
And a man comes on the radio
He's tellin' me more and more
About some useless information
Supposed to fire my imagination
I can't get no, oh no, no, no
Hey, hey, hey, that's what I say

I can't get no satisfaction
I can't get no satisfaction
'Cause I try and I try and I try and I try
I can't get no, I can't get no

When I'm watchin' my TV
And a man comes on and tells me
How white my shirts can be
But he can't be a man 'cause he doesn't smoke
The same cigarettes as me
I can't get no, oh no, no, no
Hey, hey, hey, that's what I say

I can't get no satisfaction
I can't get no girl reaction
'Cause I try and I try and I try and I try
I can't get no, I can't get no

When I'm ridin' 'round the world
And I'm doin' this and I'm signin' that
And I'm tryin' to make some girl
Who tells me, ""Baby better come back maybe next week
'Cause you see I'm on a losin' streak""
I can't get no, oh no, no, no
Hey, hey, hey, that's what I say

I can't get no
I can't get no
I can't get no
Satisfaction
No satisfaction
No satisfaction
No satisfaction
I can't get no"
65,Mercedes Sosa,El Cachapecero,TRWAGJQ128F427ED38,1965,"Algo se mueve en el fondo
Del Chaco Boreal
Sombras de bueyes y carro
Buscando el confín,
Lenta mortaja de luna
Sobre el cachapé;
Muerto el gigante del monte
En su viaje final.
¡Vamos... Tigre... Toro...
Chispa... Guampa...!

Y va encendiendo la floresta
El chicotazo al estallar
Y es una música crujiente
Por la agreste soledad.
Camino y carro van marchando
Y al rodar van despertando
En el hombre
Todo un mundo de ilusión.

Cuelga una víbora enroscada
Por el techo vegetal
En el peligro del pantano
Las pezuñas en tropel
Y un túnel verde va llevando
Dos pupilas encendidas
Sobre el tronco de la vida
Rumbo al sol...
¡Vamos... Tigre... Toro...
Chispa... Guampa...!"
66,The Animals,How You've Changed,TRJRCLN128E078E08A,1965,"Oh, how I've loved you
Since the day you first told me your name
Yes, I have loved you
Thinking you all the while felt the same
Ohhh, how I've loved you
But your kisses don't taste the same
Oh, how I've loved you
Since the day I first walked you from school
Yes, I have loved you
Breaking all of loves precious rules
You know I still love you 
Even though I feel like a fool...

Oh, how I've loved you
Since the day you first told me your name
Yes, I have loved you
Thinking you all the while felt the same
And I, I still love you
Even though I know you've changed"
67,Judy Collins,The Coming Of The Roads (LP Version),TRWDTTX128F147EE6F,1965,"Now that our mountain is growing
With people hungry for wealth
How come it's you that's a-going
And I'm left all alone by myself?

We used to hunt the cool caverns
Deep in our forest of green
Then came the road and the tavern
And you found a new love it seems

Once I had you and the wild wood
Now, it's just dusty roads
And I can't help from blamin' your going
On the coming, the coming of the roads

Look how they've cut all to pieces
Our ancient poplar and oak
And the hillsides are stained with the greases
That burned up the heavens with smoke

You used to curse the bold crewmen
Who stripped our earth of its ore
Now, you've changed and you've gone over to them
And you've learned to love what you hated before

Once I thanked God for my treasure
Now like rust it corrodes
And I can't help from blamin' your goin'
On the coming, the coming of the roads"
68,Bobby Vinton,Long Lonely Nights,TRSJRFK128F427F24C,1965,"Long, long and lonely nights
I cry my eyes out over you
Wond'ring if I did right
And why you left me with a broken heart

Oh, long, long and lonely nights
Oh, how I miss you, my dear
Please, please, come back to me
How I wish you were here

As I go along my lonely way I visualize your face
When I pass through (yeah!) my doorway
What's left for me to face?

Oh, long, long and lonely nights
I guess you're never coming home
Long, long and lonely nights
Ever since you've been gone

As I go along my lonely way I visualize your face
When I pass through (yeah!) my doorway
What's left for me to face?

Oh, oh, oh, long, long and lonely nights
I guess you're never coming home
Long, long and lonely nights
Ever since you've been gone

Please, please, come back to me
You've been gone too long"
69,The Zombies,Kind of Girl,TROPGGD128F93359E1,1965,"The kind of girl 
Who says to me
She doesn't want my love
Is not the kind of girl
That you tell me
I should be thinking of

But more of that another day
I've found another child
To share with me
All of the pleasures that you've enjoyed

But don't you think
That you're forgiven
For taking her away
For if it hadn't been
For your deceit
I'd be holding her today 

You think you've got everything, 
Just because you hold her
In your arms, and squeeze her tight
Don't you understand that she 
Runs away with anyone who happens in her sight, oh

You can see how hot she is
You'd think you're very wise
But she will run away from you
Before you realize

You think you've got everything, 
Just because you hold her
In your arms, and squeeze her tight
Don't you understand that she 
Runs away with anyone who happens in her sight, oh

You can see how hot she is
You'd think you're very wise
But she will run away from you
Before you realize (ohoh)
She's gone, She's gone"
70,Connie Smith,Once A Day,TRPMRZN12903CAAEF7,1965,"When you found somebody new I thought I never would
Forget you for I thought then I never could
But time has taken all the pains away
Until now I'm down to hurtin' once a day

Once a day all day long and once a night from dusk till dawn
The only time I wish you weren't gone
Is once a day every day all day long

I'm so glad that I'm not like a girl I knew one time
She lost the one she loved then slowly lost her mind
She sat around and cried her life away
Lucky me I'm only crying once a day

Once a day all day long and once a night from dusk till dawn
The only time I wish you weren't gone
Is once a day every day all day long
Once a day every day all day long"
71,The Supremes,Little Bright Star,TRDXYHU128F146401A,1965,"Little bright star keep shining

When he was born long ago on Christmas night
Above his head a little star was shining bright
The wise men followed that light above.

Little bright star lead us today to his love
Little church bells keep ringing
Little church bells keep ringing.

Little church bells ringing out at Christmas time
Reminding us that the star of love still shines
Not just at Christmas but every day.

Little bright star, you're there to show us the way
Little bright star keep shining
Little bright star keep shining.

Oh little star shining over every land
Just keep on glowing so the world can understand
The joy of Christmas comes from within.

Little bright star, please keep on shining for all means
Keep on shining, keep on shining
Little bright star keep shining
Keep on shining, keep on shining."
