,Artist,Title,Track_id,Year,Lyrics
0,"Arthur ""Big Boy"" Crudup",Look On Yonder Wall,TRLTEAF128F42640B1,1960,"Darling, look on yonder's wall
Hand me down my walking cane
Yes, look on yonder's wall
Hand me down my walking cane
I got to find me another woman
Baby, yonder comes your man
Darling, I know your man he went to war
I believe he fared mighty tough
Don't know how many men he killed
But I believe he killed enough

Ah do I love you, baby
And I love you for myself
Fooling around now with you, babe
I can't get nobody else

Yes, now that's all right
All right for you
That's all right, baby
Any way you do"
1,Ben E. King,Spanish Harlem,TRRGETS12903D03916,1960,"There is a rose in Spanish Harlem
A red rose up in Spanish Harlem
It is the special one, it's never seen the sun
It only comes out when the moon is on the run
And all the stars are gleaming
It's growing in the street
Right up through the concrete
But soft and sweet and dreaming

There is a rose in Spanish Harlem
A red rose up in Spanish Harlem
With eyes as black as coal
That looks down in my soul
And starts a fire there and then I lose control
I have to beg your pardon
I'm going to pick that rose
And watch her as she grows in my garden

I'm going to pick that rose
And watch her as she grows in my garden

(There is a rose in Spanish Harlem)
La la la, la la la, la la la la
(There is a rose in Spanish Harlem)
La la la, la la la, la la la la
(There is a rose in Spanish Harlem)"
2,Bo Diddley,Roadrunner,TRBWDWT128F92F5BBE,1960,"I'm a road runner honey
Beep! Beep!
I'm a road runner honey
And you can't keep up with me
I'm a road runner honey
And you can't keep up with me
Come on, let's race
Baby baby, you will see
Here I come
Beep! Beep!

Move over honey
Let me by
Move over baby
Let this man by
I'm gonna show you baby, look out your head
Gonna put some dirt in your eye
Here I go!
Oh yea, how am I doin?
Beep! Beep!

Take my hand baby
I'm gonna prove to you that I'm a road running man
I wanna show you something
That I'm the fastest in the land
Now let me by
Beep! Beep!

Oh yea, you said you's fast
But it don't look like you gonna last
Goodbye! I've got to put you down
I'll see you some day
Baby, somewhere hangin' around"
3,Bo Diddley,Nursery Rhyme,TRFVLOB128F92F691B,1960,"My sister's name is Puudin' Tame,
They asked if she would stay the same,
My brother's name is Little Jack Horner,
My mama asked to watch to heat warm them.

Sister told papa when he got home,
Papa, papa, he sassed and moaned,
Papa looked at brother, far in his eyes,
Brother started on thr handjive.

He called sister, and he called mom,
Said, ""Look here, look here, what's this going on?""
Everybody had a real surprise,
But brother had tears in his eyes.

Brother's so scared he couldn't walk,
Papa's afraid he could not talk."
4,Bo Diddley,She's Alright,TRUJEFE128F92F6923,1960,"I wanna tell you about my little girl,
Her name is Millie-Lu,
She's alright...she's alright,
She's alright...she's alright.

Sugar baby...sugar baby,
Sweedy dee...sweedy dee,
Baby, baby, sugar, sugar.

Baby, oh I love you so,
I'll never let you go,
You alright in my room,
You alright at my table,
You alright when we're walkin' down the street,
The love in you and me, just can't be beat.

Baby, baby,
Baby, baby.

Hold it everybody,
I wanna tell ya 'bout this little girl,
I don't think ya getting the message straight,
I wanna tell you, she's alright,
She make me feel.
She make me feel, so good, so good,
Sure 'nuff, sure 'nuff,
Babe, hold my hand,
Babe, hold my hand,
I can't stand up by myself,
I can't stand up without your help."
5,Bo Diddley,I Love You So,TRLUMJX128F92F691F,1960,"Oh, I, I, I, baby, I love you so,
You know, you know, I love you so.

All my life I been lovin' you,
Sometimes I wonder, baby, what you're gonna do.
You told me honey, that our love's unreal,
I can't be with you 'cos you won't be filled.
You keep tellin' all our closest friends,
That you were with me from the very beginin',
I, I, yeah, I love you so.

In the morning, it's alright,
In the evening, it's still alright,
In the night, it's alright,
Where you be, it's still alright.
I, I, love you"
6,Brenda Lee,Dynamite,TRWFLMW128F92D3531,1960,"You're dynamite!
You're dynamite!

Dynamite! hey, baby when you kiss it's
Dynamite! hey, baby when you hug and hold me tight
I just explod like dynamite
If I might do all that things I'd love to do tonight
Then I would love you dear with all my might
Because you're dynamite

You do such big attraction chain reaction things to me
They ought make you wear sign of danger T.N.T.

Love me right
Hey,baby let's make history tonight 
The power of one hour of love's delight
Just knocks me out like dynamite

You do such big attraction chain reaction things to me
They ought make you wear sign of danger T.N.T.

Love me right
Hey,baby let's make history tonight 
The power of one hour of love's delight
Just knocks me out like dynamite"
7,Brenda Lee,Sweet Nothin's,TRAZYPQ128F1456A06,1960,"(whispering) Uh huh, Honey
(whispering) Alright

My baby whispers in my ear (pst pst pst)
Mmmm sweet nothin's
He knows the things I like to hear (pst pst pst)
Mmmm sweet nothin's
Things he wouldn't tell
Nobody else
Secret baby
I keep 'em to myself
Sweet nothin's
Mmmm sweet nothin's

We walk along hand in hand
Mmmm sweet nothin's
Yeah, we both understand
Mmmm sweet nothin's
Sittin' in the classroom trying to read my book
My baby give me that special look
Sweet nothin's
Mmmm sweet nothin's

Ah, sittin on my front porch (pst pst pst)
Mmmm sweet nothin's
Well, do I love you? Of course (pst pst pst)
Mmmm sweet nothin's
Mama turned on the front porch light
Sayin', ""Come in darlin', that's enough for tonight""
Sweet nothins
Mmmm sweet nothin's
Sweet nothins
Mmmm sweet nothin's

Sweet nothins"
8,Brenda Lee,I'm Sorry,TRAONAP128F145672D,1960,"I'm sorry, so sorry
That I was such a fool
I didn't know
Love could be so cruel
Oh-oh-oh-oh-oh-oh-oh-yes

You tell me mistakes
Are part of being young
But that don't right
The wrong that's been done

(I'm sorry) I'm sorry
(So sorry) So sorry
Please accept my apology
But love is blind
And I was too blind to see

Oh-oh-oh-oh-oh-oh-oh-yes

You tell me mistakes
Are part of being young
But that don't right
The wrong that's been done
Oh-oh-oh-oh-oh-oh-oh-yes

I'm sorry, so sorry
Please accept my apology
But love was blind
And I was too blind to see

(Sorry)"
9,Brenda Lee,That's All You Gotta Do,TRPJVET128F92DE5CE,1960,"Anytime you're feeling low
And you got no place to go
You don't have to be blue
Here's all you gotta do

Call me on the telephone
Tell me that you're all alone
And I'll come a runnin' to you
Baby thats all you gotta do

All you gotta do when you're lonesome
Is to call on me
And I'll come a runnin' to you
As a fast as I can

I'll love and squeeze you uh huh huh
I'll try to please you
Cause baby I want you to be my lovin' man

I've been waiting for the chance
Needing you to start a romance
And if you feel the same way too
Here's all you gotta do

Tell me just a how you feel
Tell me that your love is real
And I'll give my heart to you
Baby thats all you gotta do

All you gotta do when you're lonesome
Is to call on me
And I'll come a runnin' to you
As a fast as I can

I'll love and squeeze you uh huh huh
I'll try to please you
Cause baby I want you to be my lovin' man

I've been waiting for the chance
Needing you to start a romance
And if you feel the same way too
Here's all you gotta do

Tell me just a how you feel
Tell me that your love is real
And I'll give my heart to you
Baby thats all you gotta do"
10,Brian Hyland,Itsy Bitsy Teenie Weenie Yellow Polka Dot Bikini,TRPYKTG128F42264DE,1960,"Bop bop bop bop bopopopopopopop

She was afraid to come out of the locker
She was as nervous as she could be
She was afraid to come out of the locker
She was afraid that somebody would see

Two three four
Tell the people what she wore

It was an itsy bitsy teenie weenie yellow polka dot bikini
That she wore for the first time today
An itsy bitsy teenie weenie yellow polka dot bikini
So in the locker, she wanted to stay

Two three four
Stick around we'll tell you more
Bop bop bop bop bopopopopopopop

She was afraid to come out in the open (badadup)
And so a blanket around her she wore (badadup)
She was afraid to come out in the open (badadup)
And so she sat, bundled up on the shore (badadup)

Two three four
Tell the people what she wore

It was an itsy bitsy teenie weenie yellow polka dot bikini
That she wore for the first time today
An itsy bitsy teenie weenie yellow polka dot bikini
So in the blanket, she wanted to stay

Two three four
Stick around we'll tell you more
Bop bop bop bop bopopopopopopop

Now she's afraid to come out of the water
And I wonder what she's gonna do
Now she's afraid to come out of the water
And the poor little girl's turning blue

Two three four
Tell the people what she wore

It was an itsy bitsy teenie weenie yellow polka dot bikini
That she wore for the first time today
An itsy bitsy teenie weenie yellow polka dot bikini
So in the water, she wanted to stay

From the locker to the blanket
From the blanket to the shore
From the shore to the water
Guess there isn't any more"
11,Brian Hyland,Rosemary,TRLQULG128F92D3813,1960,"Rosemary, Rosemary, please take my hand
And walk with me through Lovers' Land
Rosemary, Rosemary, by stars above
I vow right now, you'll have my love

You are like an angel dressed in white, so heavenly
You can answer all my prayers tonight by loving me
Rosemary, Rosemary, please say you're mine
So I can love you all the time

You are like an angel dressed in white, so heavenly
You can answer all my prayers tonight by loving me
Rosemary, Rosemary, please say you're mine
So I can love you all the time

So I can love you all the time"
12,Brook Benton,The Same One,TRPHUFC128F92D623C,1960,"The same one you said you needed
The same one who needed you
That same one is lonely
Please mend the heart you've broken in two

The same one you played a game with
The same one who gave his all
That same one is begging
Completely at your beck and call

Although you're fickle-hearted
But darling, I will forgive
'Cause I knew the day we parted
Without you I could not live

The same one you played a game with
The same one who gave his all
That same one is waiting
Completely at your beck and call

The same one, the same one
The same one, the same one
I'm the same one
The same one, the same one"
13,Brook Benton,I Don't Know Enough About You,TRJYPNU128F1498992,1960,"I know a little bit
About a lot of things
But I don't know enough about you
Just when I think you're mine
You try a different line and
Baby, what can I do?

I read the latest news
No buttons on my shoes
Baby, I'm confused about you
You've got me in a spin and
What a spin I'm in
Cause I don't know enough about you

Jack-of-all-trades, master of none
And isn't it a shame
I'm so sure that you'd be good for me
If you'd only play my game

You know I went to school and
I'm nobody's fool
That is to say until I met you
You've got me in a spin and
What a spin I'm in
Cause I don't know enough about you

I know a bit about biology
A little more about psychology
I'm a little gem in geology
But I don't know enough about you"
14,Buddy Holly,Learning The Game,TRZPVNK128F14768E9,1960,"Hearts that are broken and love that's untrue 
these go with learning the game 

When you love her and she doesn't love you 
you're only learning the game 

When she says that you're the only one she'll ever love 
then you find that you are not the one she's thinking of 

Feeling so sad and you're all alone and blue 
that's when you're learning the game"
15,Buddy Holly,True Love Ways,TRTQWAT128F42596D8,1960,"Just you know why
Why you and I
Will by and by
Know true love ways

Sometimes we'll sigh
Sometimes we'll cry
And we'll know why
Just you and I
Know true love ways

Throughout the days
Our true love ways
Will bring us joys to share
With those who really care

Sometimes we'll sigh
Sometimes we'll cry
And we'll know why
Just you and I
Know true love ways

Throughout the days
Our true love ways
Will bring us joys to share
With those who really care

Sometimes we'll sigh
Sometimes we'll cry
And we'll know why
Just you and I
Know true love ways"
16,Chubby Checker,The Twist,TRCVKUZ12903CB4DE0,1960,"Come on baby
Let's do the twist
Come on baby
Let's do the twist
Take me by my little hand
And go like this

Ee-yah twist
Baby, baby twist
Ooh yeah, just like this
Come on little miss and do the twist

My daddy is sleepin'
And mama ain't around
Yeah, daddy just sleepin'
And mama ain't around
We're gonna twisty twisty twisty
Till we tear the house down

Come on and twist
Yeah, baby twist
Oooh yeah, just like this
Come on miss and do the twist
Ee-yah

('Round and 'round and 'round and 'round)
('Round and 'round and 'round and 'round)

Yeah, you should see my little sis
You should see my my litlle Sis
She really knows how to rock
She knows how to twist

Come on and twist
Yeah, baby twist
Oooh yeah, just like this
Come on little miss and do the twist

('Round and 'round and 'round and 'round)
('Round and 'round and 'round and 'round)

Yeah, rock on now
Yeah, twist on down
Twist
('Round and 'round and 'round)"
17,Chubby Checker,Toot,TRVXMJM128F429D858,1960,"My babys got the cutest little
Yeah she really got the greatest little
Oooo Oooo
She picks me up at night I hear her
She takes me out a ride with her

She's got a motor scooter
With a little rubber tooter
And I fall to the ground
When I hear that sound

Be careful when you hear that little
Oh Yeah
She dont know how to steer that little
And though I really love her little
Oooo Oooo
I've gotta run for cover from her

She's got a little scooter
With a little rubber tooter
And I fall to the ground
When I hear that sound

She said that if you love me true
Ar ya gotta love my tooter too
No matter what I say about it
I can't live with it and I can't live without it

You know I really hate that little
Someday I'm gonna break that little
And though she drives me crazy with her
Oooo Oooo
I've gotta take my baby with her

She's got a motor scooter
With a little rubber tooter
And I fall to the ground
When I hear that sound
Yeah

Umm my babys got the cutest little
Yeah she really got the greatest little
Oooo Oooo
She picks me up at night I hear her
Yeah
She takes me out a ride with her

She's got a motor scooter
With a little rubber tooter
And I fall to the ground
When I hear that sound"
18,Chuck Berry,Too Pooped To Pop,TRHPFKN128F4271255,1960,"Casey is an old man who wants to be a teen
He goes to all the dances and they call him cha-cha king
He cha-chas when the band is playin' rock and roll
He tries to keep in time but the beat leaves him cold. 

Because he's too pooped to pop, too old a soul
Hips gettin' weaker when he tries to do the stroll
And every time his feet get to go in one way
Here comes a new dance and it's goin' to stray.

Chicks told Casey, You better move man,
This is only a one night stand
Casey wasn't in time but he was dancin' awhile
Till a cramp caught his leg and he had to change his style. 

Because he's too pooped to pop, too old a soul
Hips gettin' weaker when he tries to do the stroll
And every time his feet get to go in one way
Here comes a new dance and it's goin' to stray.

Because he's too pooped to pop, too old a soul
Hips gettin' weaker when he tries to do the stroll
And every time his feet get to go in one way
Here comes a new dance and it's goin' to stray.

Casey finally learned to do the hoochie koo
This might have been fine back in '22
Now, I'm gonna give you fellows just a little tip
If you wanna keep your girl you'd better get hip
Or, you'll be too pooped to pop, too old a soul
You hips are gettin' weaker when you'll try to do the stroll
And every time your feet gettin' to go in one way
Here comes a new dance you'll be left to stray."
19,Chuck Berry,I Got To Find My Baby,TRISHUB128F1456A67,1960,"I'm gonna search this town
From door to door
The love I crave
I can't find no more

I got to find my baby
I declare, I wouldn't lie
I ain't had no real good loving
Since that girl said goodbye

Hmm, you know I hate to see the sun
Hurry to the west
'Cos I know my whole life
Will be in a solid mess

I got to find my baby
I declare, I wouldn't lie
I ain't had no real good loving
Since that girl said goodbye

Yes, l ever since she said
That we were through
I've been nervous
And shook up too

I got to find my baby
I declare, I wouldn't lie
I ain't had no real good loving
Since that girl said goodbye

Yes, I don't care if it's the last thing
I ever do in my life
I'm gonna find that little girl
And make her my wife

I got to find my baby
I wouldn't lie
I ain't had no real good loving
Since that girl said goodbye"
20,Chuck Berry,Broken Arrow,TRTNEKF128F148BDD2,1960,"Cochise's warriors on a mountain side
(I ain’t never doing that again)
Met up with Geronimo’s enemy tribe
(I ain’t never doing that again)
There was a broken arrow here and a bloody arrow there
A head broken, back busted, bones bloody bloody bones
Cochise met up with Geronimo’s tribe
(I ain’t never doing that again).

Sent my lady downtown to shop
(I ain’t never doing that again)
She evidently didn’t know when to stop
(I ain’t never doing that again)
With a mink stole here and a chinchilla there
A here fur, there fur, fur where I don’t know
Sent my lady downtown to shop
(I ain’t never doing that again).

I bet all I had on a hearsay sure shot
(I ain’t never doing that again)
The horse started walking because the sun got hot
(I ain’t never doing that again)
I had a bill lying here and a bill lying there
A home bill, gas bill, all but a dollar bill
I bet all I had on a hearsay sure shot
(I ain’t never doing that again)."
21,Cliff Richard And The Shadows,I Love You,TRKRMTD128F145D521,1960,"Your love means more to me than 
All the apples hanging on a tree and
Like those apples, our love will grow because I - 
I love you.

Your love means more to me than 
All the fishes swimming in the sea and
Like those fishes, my heart begins to swim because I - 
I love you.

I love you, I want you for my own.
I need you near to me 
More than anyone could ever know.

Your love means more to me than 
All the loves I've ever had before, so,
Please believe what I say because I -
I love you

I love you

I love you, I want you for my own.
I need you so much more - 
More than anyone could ever know.

Everyone knows one and one makes two,
I'm the one and the other one's you, so,
Let's get together and you will see how much I - 
I love you
Let's get together and you will see how much I - 
I love you"
22,Dean Martin,I've Grown Accustomed To Her Face,TRJCBGS128F14689B3,1960,"I've grown accustomed to her face
She almost makes the day begin
I've grown accustomed to the tune she whistles night and noon
Her smiles, her frowns, her ups and downs
Are second nature to me now
Like breathing out and breathing in
I was serenely independent and content before we met
Surely I could always be that way again and yet
I've grown accustomed to her looks, accustomed to her voice
Accustomed to her face

She's second nature to me now
Like breathing out and breathing in
I'm very grateful she's a woman and so easy to forget
Rather like a habit one can always break and yet
I've grown accustomed to the trace of something in the air
Accustomed to her face"
23,Don Gibson,Sweet Dreams,TRWMHGH128F4291F7C,1960,"Sweet dreams of you every night I go through
Why can't I forget you and start my life anew
Instead of having sweet dreams about you
You don't love me it's plain I should know you'll never wear my name
I should hate you the whole night through instead of having sweet dreams about you
Sweet dreams of you..."
24,Don Gibson,Release Me,TRAQVCT12903CD7F32,1960,"Release me darling let me go I don't love you anymore
To live together is a sin release and let me love again
Oh I have found a new love dear and I'll always want her near
Her lips are warm while yours are cold release me darling let me go
Please release me let me go I don't love you anymore
To live together is a sin release and let me love again
Please release me let me go..."
25,Don Gibson,You Win Again,TRSDQWK12903CD7EF5,1960,"The news is out all over town that you've been seen a runnin' round
I know that I should leave but then I just can't go you win again
This heart of mine could never see what everybody knew but me
Just trusting you was my great sin what can I do you win again
I'm sorry for your victim now cause soon his head like mine will bow
He'll give his heart but all in vain and someday say you win again
You have no heart you have no shame you take true love and give the blame
I guess that I should not complain I love you still you won again"
26,Eddie Cochran,Lonely,TRPHFLH128E0789628,1960,"Lonely (lonely), lonely (lonely)
Lonely is the man, who walks alone
And lonely is the man, who has no home
And lonely, lonely, lonely am I
I am so lonely, wish I could die (lonely)
I asked the Lord up above (lonely)
What is this thing, mortals call love
And why can't I have one of my own
I am so lonely, so all alone

Lonely is the bird, without a tree
And lonely is the sailor, without the sea
I asked the Lord up above (lonely)
What is this thing, mortals call love
And why can't I have one of my own
I am so lonely, so all alone"
27,Ella Fitzgerald,White Christmas,TRHMMDW12903CC95F2,1960,"I'm dreaming of a white christmas,
just like the ones I used to know
Where the treetops glisten and children listen
to hear sleigh bells in the snow

I'm dreaming of a white christmas,
just like the ones I used to know
Where the treetops glisten and children listen
to hear sleigh bells in the snow

I'm dreaming of a white christmas,
with every christmas card I write
May your days be merry and bright,
and may all your christmases be white

I'm dreaming of a white christmas,
just like the ones I used to know
May your days be merry and bright,
and may all your christmases be white

I'm dreaming of a white christmas,
with every christmas card I write
May your days be merry and bright,
and may all your christmases be white

May your days be merry and bright,
and may all your christmases be white

And may all your christmases be white (All your christmases be white)
And may all your christmases be white (All your christmases be white)
And may all your christmases be
(All your christmases be white)
(All your christmases be white)"
28,Ella Fitzgerald,Sleigh Ride,TRHQJFL128F92DEB92,1960,"Just hear those sleigh bells jingling, ring, ting, tingling, too
Come on, it's lovely weather for a sleigh ride together with you
Outside the snow is falling and friends are calling, ""Yoo hoo""
Come on, it's lovely weather for a sleigh ride together with you

Giddy yap, giddy yap, giddy yap, let's go, let's look at the show
We're riding in a wonderland of snow
Giddy yap, giddy yap, giddy yap, it's grand, just holding your hand
We're gliding along with a song of a wintery fairyland

Our cheeks are nice and rosy and comfy, cozy are we
We're snuggled up together like two birds of a feather would be
Let's take that road before us and sing a chorus or two
Come on, it's lovely weather for a sleigh ride together with you

Giddy yap, giddy yap, giddy yap, let's go, let's look at the show
We're riding in a wonderland of snow
Giddy yap, giddy yap, giddy yap, it's grand, just holding your hand
We're gliding along with a song of a wintery fairyland

Our cheeks are nice and rosy and comfy, cozy are we
We're snuggled up together like two birds of a feather would be
Let's take that road before us and sing a chorus or two
Come on, it's lovely weather for a sleigh ride together with you

Sleigh ride together with you
Sleigh ride together with you
Sleigh ride together with you"
29,Ella Fitzgerald,Stairway To The Stars,TRYGXVS12903C9E15C,1960,"Let's build a stairway to the stars
And climb that stairway to the stars
With Love beside us
To fill the night with a song
We'll hear the sound of violins
Out yonder where the blue begins
The moon will guide us 
As we go drifting along.

Can't we sail away on a lazy daisy petal
Over the rim of the hills?
Can't we sail away on a little dream
Settle high on the crest of a thrill?

Let's build a stairway to the stars
A lovely lovely stairway to the stars
It would be heaven
To climb to heaven with you

Let's build a stairway to the stars
And climb that stairway to the stars
Yes we're climbing
Climbing to that stairway to the stars
Stars, stars, stars
The sound of violins
Way out yonder where the blue begins
The moon will guide us 
As we go drift drift drifting along

Can't we sail away on a lazy daisy petal 
Over the rim of the hills?
Can't we sail away on a little dream
Settle high on the crest of a thrill?

Keep building the stairway to the stars
A lovely stairway to the stars
It would be heaven 
Heaven to climb with you."
30,Ella Fitzgerald / Louis Armstrong / Ray Brown / Herb Ellis / Oscar Peterson / Buddy Rich,Moonlight In Vermont,TRHBVXT128F930836B,1960,"Pennies in a stream
Falling leaves, a sycamore
Moonlight in Vermont

Icy finger waves
Ski trails on a mountain side
Snowlight in Vermont

Telegraph cables, they sing down the highway
And travel each bend in the road
People who meet in this romantic setting
Are so hypnotized by the lovely

Evening summer breeze
Warbling of a meadowlark
Moonlight in Vermont

You and I and
Moonlight in Vermont"
