,Artist,Title,Track_id,Year,Lyrics
53,Ella Fitzgerald / Louis Armstrong / Herb Ellis / Oscar Peterson / Ray Brown / Buddy Rich,Under A Blanket Of Blue,TRFTQAR128F149336C,1956,"Under a blanket of blue
Just you and I beneath the stars
Wrapped in the arms of sweet romance
The night is ours

Under a blanket of blue
Let me be thrilled by all your charms
Darling, I know my heart will dance
Within your arms

A summer night's magic
Enthralling me so
The night would be tragic
If you weren't here to share it my dear

Covered with heaven above
Let's dream a dream of love for two
Wrapped in the arms of sweet romance
Under a blanket of blue"
54,Elvis Presley,Blue suede shoes,TRWYSCL128F93545CF,1956,"Well, it's a-one for the money
Two for the show
Three to get ready now go, cat, go
But don't you 
Step on my blue suede shoes
Well you can do anything 
But lay off o' my blue suede shoes

Well you can knock me down
Step in my face
Slander my name all over the place
Well do anything that you wanna do
But uh-uh honey, lay off o' them shoes
And don't you 
Step on my blue suede shoes
Well you can do anything 
But lay off o' my blue suede shoes

Let's go, cats!
Oh, walk the dog!

Well you can burn my house
Steal my car
Drink my liquor from an old fruit jar
Well do anything that you wanna do
But uh-uh honey, lay off o' my shoes
And don't you 
Step on my blue suede shoes
Well you can do anything 
But lay off o' my blue suede shoes

Rock it!

Well it's a-one for the money
Two for the show
Three to get ready now go, go, go
But don't you 
Step on my blue suede shoes
Well you can do anything 
But lay off o' my blue suede shoes

Well it's blue blue, blue suede shoes
Blue blue, blue suede shoes, yeah
Blue blue, blue suede shoes, baby
Blue blue, blue suede shoes

But you can do anything 
But lay off o' my blue suede shoes"
55,Elvis Presley,I Got A Woman,TRGMRXR128F9358BDD,1956,"Well, I got a woman way cross town
She's a-good to me, oh-oh yeah
Say, I got a woman way cross town
She's good to me, oh yeah

She give me money when I'm in need
Yeah she's a kind, a kind of friend indeed 
I got a woman way cross town
She's good to me, oh-oh yeah

She saves her lovin' 
Early in the morning just for me oh-oh yeah
She saves her lovin early in the morning just for me, oh yeah

She saves her lovin just for me 
Yeah you know she love me so tenderly
I got a woman way cross town
She's a-good to me, oh-oh yeah

She's there to love me both day and night
No groans or fusses, just treats me right
Never running in the streets
Leaving me alone
She knows a woman's place
Right there now in the home

I got a woman way cross town
She's a-good to me, oh-oh yeah
Say, I got a woman way cross town
She's good to me, ooh yeah

Well she's my baby, don't you understand
I I I I I'm her loving man
I got a woman
Way cross town
She's a-good to me, oh-oh yeah

And don't you know she's alright
She's alright, she's alright

I got a woman
Way over town
Good to me, yeah yeah"
56,Elvis Presley,Don't Be Cruel,TRGUIHT128F933116F,1956,"You know I can be found
Sitting home all alone
If you can't come around
At least please telephone
A-don't be cruel to a heart that's true

Baby, if I made you mad
For something I might have said
Please, let's forget the past
The future looks bright ahead
A-don't be cruel to a heart that's true
I don't want no other love
A-baby, it's still you I'm thinking of, mm

Don't stop thinking of me
Don't make me feel this way
Come on over here and love me
You know what I want you to say
A-don't be cruel to a heart that's true
Why should we be apart?
I really love you, baby, cross my heart

Let's walk up to the preacher
And let us say ""I do""
Then you'll know you'll have me
And I'll know that I'll have you
A-don't be cruel to a heart that's true
I don't want no other love
A-baby, it's still you I'm thinking of

A-don't be cruel to a heart that's true
Don't be cruel to a heart that's true
I don't want no other love
A-baby, it's still you I'm thinking of"
57,Elvis Presley,Hound Dog,TRHPYCA12903CB15F3,1956,"You ain't nothin' but a hound dog
Cryin' all the time
You ain't nothin' but a hound dog
Cryin' all the time
Well, you ain't never caught a rabbit
And you ain't no friend of mine

When they said you was high classed
Well, that was just a lie
Yeah, they said you was high classed
Well, that was just a lie
Yeah, you ain't never caught a rabbit
And you ain't no friend of mine

You ain't nothin' but a hound dog
Cryin' all the time
You ain't nothin' but a hound dog
Cryin' all the time
Well, you ain't never caught a rabbit
And you ain't no friend of mine

When they said you was high classed
Well, that was just a lie
Yeah, they said you was high classed
Well, that was just a lie
Well, you ain't never caught a rabbit
And you ain't no friend of mine

When they said you was high classed
Well, that was just a lie
You know, they said you was high classed
Well, that was just a lie
Yeah, you ain't never caught a rabbit
And you ain't no friend of mine

You ain't nothin' but a hound dog
Cryin' all the time
You ain't nothin' but a hound dog
Cryin' all the time
Well, you ain't never caught a rabbit
You ain't no friend of mine"
58,Elvis Presley,Long Tall Sally,TRCQPQG12903CCF19E,1956,"Gonna tell Aunt Mary about Uncle John
He claim he got married but he havin' lots of fun
Oh baby, hey baby, whoo-oo baby
Havin' me some fun tonight

Well long tall Sally - she's built sweet
She got everything - that Uncle John need
Oh baby, hey baby, whoo-oo baby
Havin' me some fun tonight

Well I saw Uncle John - with bald headed Sally
He saw Aunt Mary comin' and he ducked back in the alley
Oh baby, hey baby, oo baby
Havin' me some fun tonight

Well long tall Sally - she's - built sweet
She got everything - that Uncle John need
Oh baby, hey baby, whoo-oo baby
Havin' me some fun tonight

You know I saw Uncle John - with bald headed Sally
He saw Aunt Mary comin' and he ducked back in the alley
Oh baby, hey baby, oo baby
Havin' me some fun tonight

Go
I'm gonna have some fun tonight - have some fun tonight
Have some fun tonight - everything's all right
Have some fun - have me some fun tonight"
59,Elvis Presley,Love Me,TRBPAYG128F429381C,1956,"Treat me like a fool
Treat me mean and cruel
But love me

Break my faithful heart
Tear it all apart
But love me

If you ever go
Darling, I'll be oh, oh so lonely
I'll be sad and blue
Crying over you, dear only

I would beg and steal
Just to feel your heart
Beatin' close to mine

Well, if you ever go
Darling, I'll be oh so lonely
I'll be sad and blue
Crying over you, dear only

I would beg and steal
Just to feel your heart
Beatin' close to mine

Well, if you ever go
Darling, I'll be oh so lonely
Beggin' on my knees
All I ask is please, please love me
Oh yeah"
60,Elvis Presley,My Baby Left Me,TRACAGS128F4246062,1956,"Yes my baby left me,
Never said a word.
Was it something I done,
Something that she heard?

My baby left me,
My baby left me.
My baby even left me,
Never said a word.

Now I stand at my window,
Wring my hands and cry.
I hate to lose that woman,
Hate to say goodbye.

You know she left me,
Yes, she left me.
My baby even left me,
Never said a word.

Baby, one of these mornings,
Lord, it won't be long,
You'll look for me and,
Baby, and daddy he'll be gone.

You know you left me,
You know you left me.
My baby even left me,
Never said a word.

Now, I stand at my window,
Wring my hands and moan.
All I know is that
The one I love is gone.

My baby left me,
You know she left me.
My baby even left me,
Never said a word."
61,Elvis Presley,Love Me Tender,TRAPULX12903CDE273,1956,"Love me tender, love me sweet
Never let me go
You have made my life complete
And I love you so

Love me tender, love me true
All my dreams fulfill
For my darlin', I love you
And I always will

Love me tender, love me long
Take me to your heart
For it's there that I belong
And we'll never part

Love me tender, love me true
All my dreams fulfill
For my darlin', I love you
And I always will

Love me tender, love me dear
Tell me you are mine
I'll be yours through all the years
Till the end of time

Love me tender, love me true
All my dreams fulfill
For my darlin', I love you
And I always will"
62,Elvis Presley,Blue Moon,TRPJXRU128F92C2DF0,1956,"Blue moon
You saw me standing alone
Without a dream in my heart
Without a love of my own

Blue moon
You knew just what I was there for
You heard me saying a pray for
Someone I really could care for

Blue moon
You saw me standing alone
Without a dream in my heart
Without a love of my own

Blue moon
Without a love of my own"
63,Elvis Presley,First In Line,TREFNYB128F42AC098,1956,"When they gave out eyes like diamonds
That would shame the stars that shine
My darlin' my darlin'
You were the first in line
When they gave out lips like honey
That hold a new thrill every time
My darlin' my darlin'
You were the first in line

There may be others 
that know you longer
Who pledge their hearts to you
But there's no other 
could love you stronger
Any stronger than I do
Don't refuse me, say you'll choose me
I'm yours, oh please be mine
My darlin' say I'm your darlin'
The first, and the last in line"
64,Elvis Presley,I'm Counting On You,TRSHLVX12903CA7A03,1956,"All the words that I'll ever know
Still could not say
How much I need you so
In every way

I go roam and you guide me
And only you can do
Hold my hand, stand beside me
I'm counting on you

I'm counting on you, dear
From the dawn of each day
To always come through, dear
In your kind, lovin' way

If you'd knew just how deeply
I feel things you do
Then you'd know how completely
I'm counting on you

I'm counting on you, dear
From the dawn of each day
To always come through, dear
In your kind, lovin' way

If you'd knew just how deeply
I feel things you do
Then you'd know how completely
I'm counting on you"
65,Fats Domino,Poor Me,TRWVBOO12903CB38BB,1956,"Woke up this mornin' feelin' low
Where my loved one used to live, she ain't there no more

Poor me, why such bad luck put on me
Poor me, I'm living in misery

What I'm gonna do is hard to tell,
I'm not gonna kill myself, though I might as well

Poor me, why such bad luck put on me
Poor me, I'm living in misery

All I do, all day long
Fall down on my knees and pray
She'll come back home

Poor me, why such bad luck put on me
Poor me, I'm living in misery

All I do, all day long
Fall down on my knees and pray
She'll come back home

Poor me, why such bad luck put on me
Poor me, I'm living in misery"
66,Fats Domino,Honey Chile,TRWXAZN128F426D7B5,1956,"You will never win wonderful charm
But I love to hold ya in my arms
Only you can fill me like you do
So hold let kiss for a long, long while
You know why I love you honey chile

I love to hear you whisper low
You know, you really thrill me so
Only you can fill me like you do
So please don't put me on that shelf
You know, I can not help myself

I am happy as a baby boy
You ain't nothin' but a bundle of joy
Only you can fill me like you do
Bend your legs and pigeon toes
You know why I love you goodness knows

You will never win wonderful charm
But I love to hold ya in my arms
No one can fill me like you do
So hold let kiss for a long, long while
You why I love you honey chile

I am happy as a baby boy
You ain't nothin' but a bundle of joy
Only you can fill me like you do
Bend your legs and pigeon toes
You know I love you goodness knows"
67,Fats Domino,When My Dreamboat Comes Home,TRGNFGB128F145AEDA,1956,"When my dreamboat comes home
And my dream no more will roam
I will meet you and I'll greet you
When my dreamboat comes home

Moonlit waters will sing
On that tender love youl bring
We will be sweethearts, yes forever

When my dreamboat comes home

When my dreamboat comes home
And my dream no more will roam
I will meet you and I'll greet you
When my dreamboat comes home

Moonlit water will sing
Of the tender love you'll bring
We will be sweethearts, yes forever
When my dreamboat comes home."
68,Fats Domino,Blue Monday,TRHYYZX128F1459663,1956,"Blue Monday how I hate Blue Monday
Got to work like a slave all day
Here come Tuesday, oh hard Tuesday
I'm so tired got no time to play

Here come Wednesday, I'm beat to my socks
My gal calls, got to tell her that I'm out
'Cause Thursday is a hard workin' day
And Friday I get my pay

Saturday mornin', oh Saturday mornin'
All my tiredness has gone away
Got my money and my honey
And I'm out on the stand to play

Sunday mornin' my head is bad
But it's worth it for the time that I had
But I've got to get my rest
'Cause Monday is a mess"
69,Fats Domino,My Heart is in Your Hands,TRCUFWM128F92F4C70,1956,"I had it all planed just for you
But you broke my planes in two
What can I do
When something wrong with you

I had my heart in your hands
You broke my heart is your shame
What can I do
When something wrong with you

Is this the way it had to be
Why such bad luck fall on me
What can I say what can I do
When something wrong with you

I had my heart in your hands
You broke my heart ain't that a shame
What can I do
When something wrong with you

Is this the way it had to be
Why such bad luck fall on me
What can I say what can I do
When something wrong with you

I had it all planed just for you
You broke my planes in two
What can I do
When something wrong with you"
70,Fats Domino,Ain't That A Shame,TRZVDQR12903CB38B5,1956,"You made me cry
When you said, ""goodbye""

Ain't that a shame?
My tears fell like rain.
Ain't that a shame?
You're the one to blame.

You broke my heart
When you said we'll part

Ain't that a shame?
My tears fell like rain.
Ain't that a shame?
You're the one to blame

Oh well, goodbye
Although I'll cry.

Ain't that a shame..."
71,Fats Domino,Careless Love,TRSEKGC12903CAB349,1956,"Love oh love oh careless love
Can't you see what careless love done to me
It made me wrong and leave my happy home
It was love oh love oh careless love

It tied me to your apron string
It tied me to your apron string
You said that you love me
And it didn't mean a thing
It was love oh love oh careless love

Love oh love oh careless love
Can't you see what careless love done to me
It made me wrong and leave my happy home
It was love oh love oh careless love

It tied me to your apron string
It tied me to your apron string
You said that you love me
And it didn't mean a thing
It was love oh love oh careless love"
72,Fats Domino,Please Don't Leave Me,TRDYJKF12903CB38A4,1956,"Hoo-ooo-ooo
Hoo-ooo-ooo
Hoo-ooo-ooo
Hoo-ooo-ooo
Woo-woo-woo
Woo-woo-woo

Woo-woo-woo-woo-woo-woo
Woo-woo-woo-woo-woo-woo
Woo-woo-woo-woo-woo-woo
Woo-woo-woo-woo-woo-woo
Woo-woo-woo-woo-woo-woo
Woo-woo-woo-woo-woo-woo

Please don't leave me
Baby, please don't go
Please don't leave me
Baby, please don't go
Well, if you go 'way and leave me
Gee, you gonna hurt me, so



Yes, I love you, baby 
Gonna tell all the world I do
Yes, I love you, baby
Gonna tell all the world I do
Well, if you go away and leave me
Don't know what I'm going to do

Woo-ooo-ooo
Woo-ooo-ooo
Woo-ooo-ooo
Woo-ooo-ooo
Woo-oo

Woo-woo-woo-woo-woo
Woo-woo-woo, woo-woo-woo
Woo-woo-woo-woo-woo
Woo-woo-woo-woo-woo
Woo-woo-woo-woo-woo

Woo-ooo-ooo-ooo."
73,Fats Domino,So Long,TROROBA12903C95107,1956,"So long
Don't know where I'm going
but so long
You know you've done me wrong
So long
Because I know I'm all gone

Goodbye
Please tell me why
Goodbye
You always make me cry
Oh why
Why you never statisfied

So long
I'm all packed up and on my way
So long
You need me some old sunny day
So long
This time… I'm going to stay"
74,Frank Sinatra,South Of The Border,TRBPXYA12903CFD240,1956,"South of the border, down Mexico way
That's where I fell in love when the stars above came out to play
And now as I wander, my thoughts ever stray
South of the border, down Mexico way

She was a picture in old Spanish lace
Just for a tender while, I kissed the smile apon her face
'Cause it was fiesta and we were so gay
South of the border... Mexico way

Then she sighed as she whispered ""manana""
Never dreaming that we were parting
And I lied as a whispered ""manana""
'Cause our tomorrow never came

South of the border, I jumped back one day
There in a veil of white by the candle light she knelt to pray
The mission bells told me that I mustn't stay
South of the border... Mexico way


The mission bells told me (ding-dong) that I must not stay
Stay south of the border, down Mexico way"
75,Frank Sinatra,Love Is Here To Stay (1998 Digital Remaster),TRQIQTS128F145D214,1956,"It's very clear, our love is here to stay.
Ahhh, not for a year. But, ever and a day.
The radio and the telephone and the movies that we know,
may just be passin' fancy's anytime they go...

Uh, but uh, wait a minute darlin'. Our love is here to stay.
Ahhh, together we're - Mmm hmm - we're goin' a long, long way
In time The Rockies may crumble - Gibralter may tumble.
They're only made of clay.
But, our love is here to stay...


But, Ooooh my dear, our love is here to stay.
Ahhh, together we're - goin' a long, long way.
In time The Rockies may crumble and that Gibralter may tumble.
They'e only made of clay.
But, our love is here to stay.
(You better believe it darlin'. I'm tellin' you like it 'eye ess.' Oh!)
Our love is here to stay..."
76,Frank Sinatra,From Here To Eternity,TRLFGEI128F145BCFB,1956,"You vowed your love
From here to eternity
A love so true,
It never would die

You gave your lips
Gave them so willingly
How could I know
Your kiss meant goodbye?

Now I'm alone
With only a memory
My empty arms
Will never know why...

Though you are gone
This love that you left with me
Will live from here to eternity.

Now I'm alone
With only a memory
My empty arms
Will never know why...

Though you are gone
This love that you left with me
will live...
From here to eternity."
77,Frank Sinatra,Anything Goes,TRELSQH12903CCC590,1956,"Writer(s): Cole Porter 


In olden days a glimpse of stocking 
Was looked on as something shocking
Now heaven knows, anything goes

Good authors too who once knew better words
Now only use four letter words writing prose
Anything goes

The world has gone mad today
And good's bad today
And black's white today
And day's night today
When most guys today that women prize today 
Are just silly gigolos

So though I'm not a great romancer
I know that you're bound to answer
When I propose, anything goes"
78,Frank Sinatra,Pennies From Heaven,TRKUTMX12903C94FFF,1956,"Every time it rains, it rains
Pennies from heaven
Don't you know each cloud contains
Pennies from heaven
You'll find your fortune falling all over the town
Make sure that your umbrella is upside down
Trade them for a package sunshine and flowers
If you want the things you love
You must have showers
So when you hear it thunder dont run under a tree
There'll be pennies from heaven for you and me

Band Break

Trade ithem for a package of sunshine and flowers
If you want the things you love
You must have showers
So when you hear it thunder
Don't run under a tree
There'll be pennies from heaven for you and me"
79,Frankie Laine,Answer Me,TRRSTBY128F424D84B,1956,"ANSWER ME.

ANSWER ME OH MY LOVE
JUST WHAT SIN HAVE I BEEN GUILTY OF
TELL ME HOW I CAME TO LOSE YOUR LOVE
PLEASE ANSWER ME MY LOVE

YOU WERE MINE YESTERDAY
I BELIEVED THAT LOVE WAS HERE TO STAY
WON'T YOU TELL ME WHERE I'VE GONE ASTRAY
PLEASE ANSWER ME MY LOVE

IF YOU'RE HAPPIER WITHOUT ME
I'LL TRY NOT TO CARE
BUT IF YOU STILL THINK ABOUT ME
PLEASE LISTEN TO MY PRAYER

YOU MUST KNOW I'VE BEEN TRUE
WON'T YOU SAY THAT WE CAN START ANEW
IN MY SORROW NOW I TURN TO YOU
PLEASE ANSWER ME MY LOVE."
80,Frankie Laine,Hey Joe!,TROAUGF128F932E181,1956,"Hey Joe
Where'd you find that pretty girly
Wher'd you get that jolly dolly
How'd you make me wish that dish was mine

Hey joe
She's got skin that's creamy dreamy
Eyes that look so lovey dovey
Lips as red as cherry berry wine

Now listen Joe
I ain't no heal
But oh buddy let me tell you how I feel
She's honey she's a sherriff
I am warnin you I'm gonna try to steal
Her from you

Hey Joe
Though we've been the best of friends
This is where that friendship ends
I gotta have that dolly for my own


(backing hey joe)
Musical interlude

(backing hey joe)
Musical interlude

Hey joe
C'mon let's be buddy buddy
Show me your my palsey walsey
Introduce that pretty little chick to me
Hey Joe
Lets quit that hesitatin
Let me at her what's the matter
Your as slow as any Joe can be

Now c'mon Joe I ain't no heal
Let dance with her to see if she is real
She's the cutest girl I 've ever seen
I tell you face to face I mean to steal
Her from you

Hey Joe
We'll be friends until the end
But this looks like the end my friend
I gotta have that dolly for my own
I gotta have that dolly for my own"
81,Frankie Lymon And The Teenagers,Why Do Fools Fall in Love,TRRZFYG128F934DEEF,1956,"Ooooo wah, oooooo wah, ooooo wah, oooooo wah,
Ooooo wah, oooooo wah, Why do fools fall in love

Why do birds sing so gay
And lovers await the break of day?
Why do they fall in love?
Why does the rain fall from up above?
Why do fools fall in love?
Why do they fall in love?

Love is a losing game,
Love can be a shame I
Know of a fool, you see,
For that fool is me!
Tell me why, tell me why?

Why do birds sing so gay
And lovers await the break of day?
Why do they fall in love?
Why does the rain fall from up above?
Why do fools fall in love?
Why do they fall in love?

Why does my heart skip a crazy beat?
For I know it will reach defeat!
Tell me why, tell me why?
Why do fools fall in love?"
82,Frankie Lymon And The Teenagers,I Promise To Remember,TRRSQFT12903CCF9C3,1956,"Oh, oh
I promise to love you
No matter what you do
I want you, I need you
I love you through and through
Oh, oh, oh, oh
I promise to be true

[chorus]
I promise to remember
The meaning of romance
If I've done something wrong
Give me one more chance

Oh, oh, oh, oh
I promise to be true

[verse 1]
Oh, oh, my darling
I have promised
To give you my heart
Oh, darling promise me
We will never part
I know I'm not a king
And I'm not very wise
But something that you must realize"
83,Frankie Lymon And The Teenagers,I'm Not A Know-It-All,TRBJJFF12903CEB5B1,1956,"I'm not a know-it-all
Don't know why the grass is tall
Don't know why there's morning dew
I only know that I love you

I'm not a know-it-all
Don't know why the raindrops fall
Don't know what's beyond the blue
I only know that I love you

With things that are not of you alone
I'm not so wise
But still I could write a book of my own
When I look in your eyes

I'm not a know-it-all
No, I'm not a know-it-all
And yet I'll run to you
The very moment that you call

With things that are not of you alone
I'm not so wise
But still I could write a book of my own
When I look in your eyes

I'm not a know-it-all
No, I'm not a know-it-all
And yet I'll run to you
The very moment that you call

I love you now
You know it all"
84,Frankie Lymon And The Teenagers,I Want You To Be My Girl,TRTVECE12903CCF9B6,1956,"I love you, baby
And I want you to be my girl
Well, come on, baby, let's go downtown
Run, jump, kid around
I love you, baby
And I want you to be my girl

Well, come on, baby, I love you so
I will never, never let you go
Come on, baby, will you treat me nice?
Please, don't put my love on ice
I love you, baby
And I want you to be my girl

Come and take me by the hand
Tell me, I'm your lover man
We'll have fun, just we two
You for me, me for you, oh, oh
I love you, baby
And I want you to be my girl

Well, come on, baby, I love you so
I will never, never let you go
Come on, baby, will you treat me nice
Please, don't put my love on ice
I love you, baby
And I want you to be my girl

Come and take me by the hand
Tell me, I'm your lover man
You for me, me for you
We'll have fun, oh, oh, oh
I love you, baby
And I want you to be my girl

Well, I love you, baby
Love you, baby, love you, baby
I love you, baby
And I want you to be my girl"
85,Frankie Lymon And The Teenagers,I'm Not A Juvenile Delinquent,TRYMIPH12903CEB5C9,1956,"I'm not a juvenile delinquent
No-no-no-no-no-no-no-no
No-no-no-no-no-no-no-no
No-no-no, I'm not a juvenile delinquent
Do the things that's right
And you'll do nothing wrong
Life will be so nice, you'll be in paradise
I know, because I'm not a juvenile delinquent

But listen boys and girls
You need not be blue
And life is what you make of it
It all depends on you
I know, because I'm not a juvenile delinquent

It's easy to be good, it's hard to be bad
Stay out of trouble, and you be glad
Take this tip from me, and you will see
How happy you will be
Oh-oh, boys and girls, this is my story
And I add all of my glory
I know, because I'm not a juvenile delinquent

It's easy to be good, it's hard to be bad
Stay out of trouble, and you be glad
Take this tip from me, and you will see
How happy you will be
Oh-oh, boys and girls, this is my story
And I add all of my glory
I know, because I'm not a juvenile delinquent

No-no-no, I'm not a juvenile"
