,Artist,Title,Track_id,Year,Lyrics
97,Otis Redding,Mr. Pitiful,TRQBJYG12903CD2B03,1965,"They call me Mr. Pitiful
Baby thats my name now, oh
They call me Mr. Pitiful
That's how I got my fame

But people just don't want to understand that
What make a man feel so blue
They call me Mr. Pitiful
'Cause I've lost someone just like you, yeah

The call me Mr. Pitiful
This everybody know now
They call me Mr. Pitiful
'Most everyplace I go

But nobody seems to understand now
How can a man sing such a sad song
When he lost everything
When he lost everything that he had

How can I explain to you?
How somebody can get so very blue, now
How can I tell you about my past?
If all things won't end

Mr. Pitiful
That's my name now
They call me Mr. Pitiful
That's how I got my fame

But nobody seems to understand
Oh what make a man can feel so blue and
They call me Mr. Pitiful
'Cause I'm in love with you

Can I explain to you?
Everything is going wrong
I've lost everything I had
I have to sing this sad song
To get back to her
And I want you and I want you and I want you
And I want you and I wanna tell you that now
That everything is going through my mind
And I wanna sing
And I don't wanna sing this song with you
I gonna sing this song for everybody
'Cause I want them to understand what I talkin' about
I want you to understand what I'm sayin'"
98,Son House,John The Revelator,TRWMBUJ128F426F03B,1965,"Tell me who's that writin', John the Revelator
Tell me who's that writin', John the Revelator
Who's that writin', John the Revelator wrote the book of the seven seals

Now God walked down in the cool of the day, and called Adam by his name
But he refused to answer, 'cause he was naked and ashamed
So, tell me who's that writin', John the Revelator
Tell me who's that writin', John the Revelator
Who's that writin', John the Revelator wrote the book of the seven seals

Now Christ had 12 apostles, and three he laid away
He said ""Watch for me one hour, while I go yonder and pray""

And tell me who's that writin', John the Revelator
Tell me who's that writin', John the Revelator
Who's that writin', John the Revelator wrote the book of the seven seals

Mary Margaret they were there, and they heard every word he said
Said ""Go tell my disciples, I said meet me in Galilee""
And tell me who's that writin', John the Revelator
Tell me who's that writin', John the Revelator
Who's that writin', John the Revelator wrote the book of the seven seals

Who's that writin', John the Revelator
Tell me who's that writin', John the Revelator
Who's that writin', John the Revelator wrote the book of the seven seals"
99,Sam The Sham & The Pharaohs,Wooly Bully,TRNPRVD12903CBF404,1965,"Uno, dos, one, two, tres, quatro
Eh, Wooly Bully
Watch it now, watch it

Matty told Hatty about a thing she saw
Had two big horns and a wooly jaw

Wooly bully, wooly bully (yeah, drive)
Wooly bully, wooly bully, wooly bully

Hatty told Matty, ""Let's don't take no chance
Let's not be L-seven, come and learn to dance

Wooly bully, wooly bully
Wooly bully, wooly bully, wooly bully
Watch it now, watch it, watch it, ah

Yeah
Drive, drive, drive

Matty told Hatty, ""That's the thing to do
Get you someone really to pull the wool with you""

Wooly bully, wooly bully
Wooly bully, wooly bully, wooly bully
Watch it now
You got it"
100,The Yardbirds,For Your Love,TRURYTO128F931C679,1965,"(For your love)
(For your love)
(For your love)
I'd give you everything and more, and that's for sure
(For your love)
I'd bring you diamond rings and things right to your door
(For your love)
To thrill you with delight
I'll give you diamonds bright
There'll be things that will excite
To make you dream of me at night

(For your love)
(For your love)
(For your love)

For your love, for your love
I would give the stars above
For your love, for your love
I would give you all I could

(For your love)
(For your love)
(For your love)
I'd give the moon if it were mine to give
(For your love)
I'd give the stars and the sun 'fore I live
(For your love)
To thrill you with delight
I'll give you diamonds bright
There'll be things that will excite
To make you dream of me at night

(For your love)
(For your love)
(For your love)
(For your love)"
101,Quarteto Em Cy,Agua de Beber,TRLIBGF128F425A015,1965,"Eu quis amar mais tive medo
E quis salvar meu coração
Mas o amor sabe um segredo
O medo pode matar o seu coração

Água de beber
Água de beber camará
Água de beber
Água de beber camará

Eu nunca fiz coisa tão certa
Entrei pra escola do perdão
A minha casa vive aberta
Abri todas as portas docoração

Água de beber
Água de beber camará
Água de beber
Água de beber camará

Eu sempre tive uma certeza
Que só me deu desilusão
É que o amor é uma tristeza
Muita mágoa demais para um coração

Água de beber
Água de beber camará
Água de beber
Água de beber camará"
102,The Spencer Davis Group,Georgia On My Mind,TRFBPPX12903CDD167,1965,"Georgia, oh georgia, no peace I find
It's just an old sweet song, keeps georgia on my mind

Georgia yeah, oh georgia, a song of love
Comes as sweet and clear as moonlight through the pines

Other arms reach out to me, yeah
Other eyes smile tenderly
Still in peaceful dreams I see
The road leads back to you


Oh I said georgia, georgia yeah, a song of love
Comes as sweet and clear as moonlight through the pines

Other arms reach out to me, child (? )
Other eyes smile tenderly
Still in peaceful dreams I see
The road leads back to you

Oh I said georgia, oh oh georgia yeah yeah, a song of love
Comes as sweet and clear as moonlight through the pines, oh my my
I said it's just an old sweet song, keeps georgia on my mind, yeah yeah"
103,Sleepy John Estes,Little Laura Blues,TRTGYQQ12903CD43F4,1965,"Little Laura was a gal, sh' s sixteen
And Jimmy didn't want to listen to her dreams
Little Laura was a dreamer, dreamed 'ost ever't'ing
She's the dreamiest gal, dreamiest gal I ever seen

Now, she dreamed she was goin' with the man next door
She dreamed she was kissin' him, oh, oh, oh
She dreamed she was ridin' [to me] in a automobile
She's the dreamiest gal, dreamiest gal I ever seen

Now, she dreamed she was settin' in the grass by the mill
She dreamed she had taken me from the gal on the hill
Little Laura was a dreamer, most all her dreams fulfill
She's the dreamiest gal, dreamiest gal I ever seen

Now, she dreamed I was huggin' her close to my breast
She told Jimmy that mucha the dream but she wouldn't tell the rest
Li'l Laura was a dreamer, she dreamed just ever't'ing
She's the dreamiest gal, dreamiest gal I ever seen

Now, she dream about lovin' from kisses on down
She's the dreamiest gal for miles around
Little Laura was a dreamer, 'most all her dreams come true
She had a dream about lovin' and she know just what to do"
104,The Animals,For Miss Caulker,TRGIYHD128E0781456,1965,"Well, you've been gone,
For fourteen long days
Yes, you've been gone 
For fourteen long, lonely days
And I'm prayin' to the Lord
Please don't take my love away...

Come back home,
All I want is you
Hey, hey, hey, hey
Hey, Come back home, baby
You know all I want is you
You know you'll never find another boy
To treat you like I used to treat you

Oh baby, 
Baby, why don't you come back home to me
Hey, baby baby,
Why don't you come back home to me

I want you to come back home baby
Baby, please set me free..."
105,Buddy Holly / Bob Montgomery,Flower Of My Heart,TRJPWBY128F934FF43,1965,"Do you think of me darlin' 
while we're many miles apart 
oh please be true to me my darlin' 
for you are the flower of my heart 

Many nights I've sat alone 
and I've worried over you 
but I'll never worry dear 
if your love is true 

Please come back to me my darlin' 
cause I can't live while we're apart 
Please come back to me my darlin' 
for you are the flower of my heart 

Many nights I've sat alone 
and I've worried over you 
but I'll never worry dear 
if your love is true 

Please come back to me my darlin' 
for I can't live while we're apart 
come back - come back to me my darlin' 
for you are the flower of my heart"
106,Chad & Jeremy,My How The Time Goes By,TRTZPVQ128F92D86B2,1965,"Stuart-Alquist

Each time I leave you it's like a lifetime
Love is the reason why
But when I'm here to hold you
My how the times goes by

I dont remember what time the clock said
Don't even want to try
You say it's past your bedtime
My how the time goes by

I know I'm gonna hate it leaving you
Where did the hours fly
I really don't know what I'm gonna do
Oh my, oh my

Kiss me again girl, kiss me and then girl
Kiss me a last goodbye
Wish I could stay forever
My how the time goes by

I know I'm gonna hate it leaving you
Where did the hours fly
I really don't know what I'm gonna do
Oh my, oh my

Kiss me again girl, kiss me and then girl
Kiss me a last goodbye
Wish I could stay forever
My how the time goes by

Wish I could stay forever
My how the time goes
My how the time goes
My how the time goes by"
107,Tom Rush,Windy Bill  (LP Version),TRWPKHF128F14A8CD3,1965,"Traditional

Windy Bill was a Texas man
Well, he could rope, you bet.
He swore the steer he couldn't tie-
Well, he hadn't found him yet.
But the boys they knew of an old black steer,
A sort of an old outlaw
That ran down in the malpais
At the foot of a rocky draw.

This old black steer had stood his ground
With punchers from everywhere ;
So they bet old Bill at two to one
That he couldn't quite get there.
Then Bill brought out his old gray hoss,
His withers and back were raw,
And prepared to tackle the big black brute
That ran down in the draw.

With his Brazos bit and his Sam Stack tree*,
His chaps and taps to boot,
And his old maguey** tied hard and fast,
Bill  swore he'd get the brute.
Now, first Bill sort of sauntered round.
Old Blackie began to paw
Then threw his tail straight in the air
And went driftin' down the draw.

The old gray plug flew after him,
For he'd been eatin' corn;
And Bill, he piled his old maguey
Right round old Blackie's horns.
The old gray hoss he stopped right still;
The cinches broke like straw,
And the old maguey and the Sam Stack tree
Went driftin' down the draw.

Bill, he lit in a flint rock pile,
His face and hands was scratched.
He said he thought he could rope a snake***,
But he guessed he'd met his match;
He paid his bets like a little man
Without a bit of jaw
And 'lowed old Blackie was the boss
Of anything in the draw.

There's a moral to my' story, boys,
And that you all must see.
Whenever you go to tie a snake
Don't tie it to your tree;
But take your dolly welters****
'Cordin' to California law,
And you'll never see your old rim-fire*****
     Go drifting down the draw."
108,Chad & Jeremy,Only Those In Love,TRGTTLZ128F92D86C2,1965,"Stuart-Alquist

Let me tell you of a girl I know
She belonged to me a short while ago
I was happy just to hold her hand
But only those in love would understand

Happiness and joy I never knew
Filled my heart when she came into view
I was living in a wonderland
That only those in love would understand

Why she left me I will never know
How can I go on without her
When I love her so?
I love her so

She was more than all the world to me
Now my world is empty as can be
Everybody sees a lonely man
But only those in love would understand"
109,The Rolling Stones,The Last Time,TRVLQXN128F9309BF5,1965,"Well, I told you once and I told you twice
But you never listen to my advice
You don't try very hard to please me
With what you know it should be easy

Well, this could be the last time
This could be the last time
Maybe the last time
I don't know, oh no, oh no

Well, I'm sorry girl but I can't stay
Feelin' like I do today
There's too much pain and too much sorrow
I guess I'll feel the same tomorrow

Well, this could be the last time
This could be the last time
Maybe the last time
I don't know, oh no, oh no

Well, this could be the last time
This could be the last time
Maybe the last time
I don't know, oh no, oh no

Well I told you once and I told you twice
That someone will have to pay the price
But here's a chance to change your mind
'Cause I'll be gone a long, long time

Well, this could be the last time
This could be the last time
Maybe the last time
I don't know, oh no, oh no

Well, this could be the last time
Well, no no no
Well, no no no
Well, no no no"
110,The Spencer Davis Group,I Can't Stand It,TRFXTXA128F148206F,1965,"I can't stand the pain of love
When you get all the love
I can't stand the pain of life
I can't even stand the shock.
But when I hear you say
That you will go away
And leave me someday

I can't stand it
I can't stand it
I can't stand it
I can't stand it

When you stand close to me
You makes me kind of weak
And when you hold me tight
My poor heart skips a beat
And when I hear you say
That you will go away
And leave me someday

I can't stand it
I can't stand it
I can't stand it
I can't stand it

When you're standin' close to me
You make me kinda weak
And when you hold me tight
My poor heart skips a beat
And when I hear you say
That you will go away
And leave me someday

I can't stand it
I can't stand it
I can't stand it
I can't stand it
I can't stand it"
111,The Shangri-Las,Heaven Only Knows,TROXGLK128F9346301,1965,"I dream about you all the time, yes I do
And I can't sleep at night
(Heaven only knows, mm hmm)
I dream about makin' you mine, yes I do
And of holding you tight
(Heaven only knows, mm hmm)

I've never been sure 'bout a boy before
But I want you to know
(Heaven only knows, mm hmm)
Given you my heart and my soul and my love
'Cause I trust you so
(Heaven only knows, mm hmm)

Heaven only knows that I want you, baby
Every time I see you it drives me crazy
You're the only boy that my heart wants to know
Whoa yeah

Tell me what you want and I'll do it for you
Baby, let me show you that I adore you
Baby, let me go everywhere you go
Whoa yeah

Never been sure 'bout a boy before
But I want you to know
(Heaven only knows, mm hmm)
Given you my heart and my soul and my love
'Cause I trust you so
(Heaven only knows, mm hmm)

Heaven only knows that I want you
(Baby)
Heaven only knows that I need you
(Baby)
Heaven only knows that I love you
(Baby)
Heaven only knows that I want you"
112,Otis Redding,Come To Me,TRFETQK128F423DEFB,1965,"Come to me for I'm lonely
Come to me for I'm lonely, darling
Come to me and be my girl
For I love, love you so

Come to me forget the past
Think of life we have ahead, my my my my baby
Come to me and be my girl
For I love, love, love you so, oh now

Day are getting so lonely, yeah now
Life are getting so blue
Time has come for you and I
To get together and we'll make two, my my my my babe

Come to me for I'm begging
Come to me for I'm begging, darling
Come to me and be my girl
For I love, love, love you so, yeah

Come on now baby
Baby I'm down
Said I'm down my knees, oh
I need me someone, now
Said I need some love
Just to stand right by me, oh
You know that these arms of mine
They have been lonely
Lonely so long
But I know, but I know, I know what my heart needs
I know just what my heart needs"
113,B.B. King,Help The Poor,TRXCFWD128F9335584,1965,"Help the poor
Won't you help poor me
I need help from you baby
Need it desperately
I need you so much
I need your care
Need all the loving baby you can spare
Help the poor
Oh, baby won't you help poor me

Say you will
Say you'll help me on
I can't make it no longer
In this world alone
Baby I'm beggin' with tears in my eyes
For your love don't you realize
I need help 
Oh baby help poor me

You are my inspiration
Baby that's makes be a king
But if you don't come to my rescue
I couldn't ever be anything

Help the poor
Won't you help poor me
Have a heart won't you baby
Listen to my plead
Oh I lost my courage till I found you
You got what it takes baby
To pull me through
Help the poor
Oh baby won't you help poor me

You are my inspiration
Baby that's makes be a king
But if you don't come to my rescue
I couldn't ever be anything

Help the poor
Won't you help poor me
Have a heart won't you baby
Listen to my plead
Oh I lost my courage till I found you
You got what it takes baby
To pull me through
Help the poor
Oh baby won't you help poor me"
114,The Impressions,Woman's Got Soul,TRZBGTP12903D11AFF,1965,"She may not be the best lookin' woman
I ever did see
Nor have the charms of the ladies
Of high society

But the woman's got soul
Worth all money and gold
And all the love that I have belongs
To the woman with soul

Now I'm just a regular fellow
I don't need much
I don't need a Cadillac car
Or diamonds and such

But the woman that I hold
She's got to have soul
And then I'm richer than the richest gold
If the woman's got soul

Well, I don't need a woman
That's got a whole lotta class
Because class in a woman
Don't mean she's gonna last
I need the kind of woman
That when I hold she fits so tight, yeah
Oh, and when she throws it on me
I give in without a fight 

Then I know...the woman's got soul
Worth all money and gold
And then I'm richer than the richest gold
If the woman's got soul
If the woman's got soul
If the woman's got soul
If the woman's got soul
If the woman's got soul"
115,The Turtles,Last Laugh (Stereo),TRLNWUR128F42530AE,1965,"Once I was sad and lonely
I lost my one and only
You would have found someone new
But now I found somebody too
And your love approved untrue now
I got the last laugh on you

Here last last laughs best they say
Now I know that it's true
'Cause I found love, well he broke your heart
Now I got the last laugh on you

You went and put me down
The talk spread around the town
Of how you have found a new guy
But since then true love came my way
And we've set the wedding day
While you sat at home and just cry

Here last last laughs best they say
Now I know that it's true
'Cause I found love, well he broke your heart
Now I got the last laugh on you

I hate to say I said so
And now I'm getting wed
So it's much too late to pretend
But remember as times goes by
If you make another cry
That he'll laugh at you in the end

Here last last laughs best they say
Now I know that it's true
'Cause I found love, well he broke your heart
Now I got the last laugh on you
I got the last laugh on you
I got the last laugh on you"
116,Dusty Springfield,I Wanna Make You Happy,TRUSXEI128F14637FD,1965,"What a nice party
And I know just why I'm feeling so new
'Cause I came along and I found you
 
I wanna make you happy tonight
I wanna make you happy tonight
 
It's just like magic
Dancing with you 
While we're sharing a kiss
Oh, I've been in love
But never, no never, like this
 
I wanna make you happy tonight
I wanna make you happy tonight and every day I live, yeah
I wanna give you all I have to give
Oh, I wanna make you so happy, yeah, oh
 
Yes, I've been in love
But never, no never, like this
I wanna make you happy tonight 
I wanna make you so happy, child
Come on, I wanna make you so"
117,Marvin Gaye,Try It Baby,TRVXMJV128F931B158,1965,"Now you're moving on up, pretty baby 
You're leaving me behind 
Everybody seems to love you 
Ooh, you're doing just fine, fine, fine 

Take away your good looks 
And all your fancy clothes 
I bet you want to try it baby 
And you'll see 
That nobody loves you but me 
Now what do you think about that? 

Hey, Melvin 
Now you tell me that you so busy 
Ooh, baby you ain't got much time 
Oh, how will I remember, babe 
When all your time was mine, mine, mine 

Well move on back cross the track 
Yeah, where you came from 
Yeah, why don't you just try it baby 
And you'll see 
Nobody loves you but me 
Yeah, nobody but me 
Try it 

If you think I'm lying 
Try it 
Try it baby 

Ooh, well move on back cross the track, baby 
Yeah, where you came from 
Come on and try, try it honey, try it baby, try it sweet 
And you'll see 
Nobody loves you but me 
Nobody loves you but me 

Listen, I really want to hold you, pretty baby 
In my arms again 
But I can't get close to you 
For all your love afraid 
But take your name from the bad list 
And tear me your arms through 
Come on and try it baby 
I'm gonna try it sweetheart 
Try it honey 
You'll see, nobody loves you but me 
Nobody but me"
118,The Shangri-Las,The Boy,TRNFLSI128F9346304,1965,"His eyes are the eyes of a boy growing old,
Deep down inside there's a story untold.
He's sad, then he laughs a while,
He looks at me and then he smiles.
I'm in love, I'm in love with that boy.
 
Till I met him, I never thought,
That love could feel this way.
My nights were filled with lonely dreams,
That grew worse with each passing day.
I used to walk the streets at night,
With, really, no place to go.
But loneliness is a part of my past,
A million tears ago.
 
When I stand by his side,
My heart's full of pride.
I look up at his face,
And I know, among giants,
He'll hold his place.
 
So proud, so bold, so strong and I belong.
Do you think that people are being fair,
'Cause they fear we're too young to care?
But I don't care what people say,
My love will grow stronger with each passing day.
 
Oh, oh-oh-oh-oh, I'm in lo-ah-ove.
Oh, oh-oh-oh-oh, I'm in lo-ah-ove.
Oh, oh-oh-oh-oh, I'm in..."
119,Nina Simone,Strange Fruit,TRFRLPN128EF35156E,1965,"Lewis Allen, Sonny White 

Southern trees
Bear strange fruit
Blood on the leaves
And blood at the roots
Black bodies
Swinging in the southern breeze
Strange fruit hangin'
From the poplar trees
Pastoral scene
Of the gallant south
Them big bulging eyes
And the twisted mouth
Scent of magnolia
Clean and fresh
Then the sudden smell
Of burnin' flesh
Here is a fruit
For the crows to pluck
For the rain to gather
For the wind to suck
For the sun to rot
For the leaves to drop
Here is
Strange and bitter crop

As sung by Billie Holiday

Southern trees bear strange fruit,
Blood on the leaves and blood at the root,
Black bodies swinging in the southern breeze,
Strange fruit hanging from the poplar trees.

Pastoral scene of the gallant south,
The bulging eyes and the twisted mouth,
Scent of magnolias, sweet and fresh,
Then the sudden smell of burning flesh.

Here is fruit for the crows to pluck,
For the rain to gather, for the wind to suck,
For the sun to rot, for the trees to drop,
Here is a strange and bitter cry."
120,B.B. King,It's My Own Fault,TRMWDQK128E078E735,1965,"It's my own fault, baby
Treat me the way you wanna do

It's my own fault, baby
Treat me the way you wanna do
Yes when you were loving me, baby (woman)
At that time, little girl, I didn't love you

She used to make her own pay checks
And bring them all home to me
I would go out on the hillside, you know
And make every woman look I see

It's my own fault, baby
Treat me the way you wanna do
Yes when you were loving me, baby (woman)
At that time, little girl, I didn't love you

She said she was gonna leave me
She'd been running around with the boys
She said she was gonna leave me
Gonna be over in Illinois

It's my own fault, baby
Treat me the way you wanna do
Yes when you were loving me, baby (woman)
At that time, little girl, I didn't love you"
121,The Rolling Stones,You Can't Catch Me,TRQBUCV128F931102E,1965,"I bought a brand new airmobile 
It was custom made 
It was a Flight DeVille 
With an outboard motor 
And some hideaway wings 
Push in on the button and you can hear her sing 
Now you can't catch me 
No, baby, you can't catch me 
'Cause if you get too close 
You know I'm gone like a cool breeze 

New Jersey Turnpike in the wee wee hours 
I was rolling slowly 'cause of drizzlin' showers 
Up come a flattop he was movin' up with me 
Then come sailin' goodbye 
In a little old suped up jitney 
I put my foot in my tank and I begin to roll 
Moanin' sirens, was the state patrol 
So I get out my wings and then I blew my horn 
Bye-bye New Jersey I become airborne 

Now you can't catch me 
No, baby you can't catch me 
'Cause if you get too close 
You know I'm gone like a cool breeze 

Flyin' with my baby last Saturday night 
Wasn't no gray cloud floatin' in sight 
Big full moon shinin' up above 
Cuddle up honey be my love 
Sweetest little thing that I ever seen 
I'm gonna name you Mabelline 
Flyin' with all the things set on flight control 
Radio tuned to rock 'n' roll 
Two, three hours passin' by 
Altitude dropped to 505 
Fuel consumption way too fast 
Let's get on home before we run out of gas 

Now you can't catch me 
No baby, you can't catch me 
'Cause if you get too close 
You know I'm gone like a cool breeze"
122,Unit Four Plus Two,Concrete And Clay,TRPWAHH128F9325259,1965,"You to me
Are sweet as roses in the morning
And you to me
Are soft as summer rain at dawn, in love we share
That something rare

The sidewalks in the street
The concrete and the clay beneath my feet
Begins to crumble
But love will never die
Because we'll see the mountains tumble
Before we say goodbye

My love and I will be
In love eternally
That's the way
Mmm, that's the way it's meant to be

All around
I see the purple shades of evening
And on the ground
The shadows fall and once again you're in my arms
So tenderly

The sidewalks in the street
The concrete and the clay beneath my feet
Begins to crumble
But love will never die
Because we'll see the mountains tumble
Before we say goodbye

My love and I will be
In love eternally
That's the way
Mmm, that's the way it's meant to be

The sidewalks in the street
The concrete and the clay beneath my feet
Begins to crumble
But love will never die
Because we'll see the mountains tumble
Before we say goodbye

My love and I will be
In love eternally
That's the way
Mmm, that's the way it's meant to be

And that's the way
That's the way it's meant to be

That's the way
(That's the way it's meant to be)
Whoa, that's the way
That's the way it's meant to be"
