,Artist,Title,Track_id,Year,Lyrics
0,Jimmy Eat World,Ten,TRNFYND128F1456E67,1999,"We left behind the busy crowd
So it seems we slow down
Meet me with a way out through the lies
Nowhere, going nowhere in the fake yellow light

Blame no one, blame no one

The feelings change so fast
Safety scares them away
I can't bring myself to say it, it's my own advice I need
Nowhere and then nowhere, living trapped inside the chase

Blame no one, blame no one (so blame no one, would you look in my eyes and)
Blame no one, blame no one

Our weakness is the same
We need poison sometimes

So take another drink with me

Blame no one, blame no one (so blame no one, could you look in my eyes and)
Blame no one, blame no one"
1,Chely Wright,Rubbin' It In,TRNPPIM128E078F77F,1999,"(Chad Smith)

Last night, I went out with some old friends
I couldn't help but think of you again
Someone was wearing your cologne
What a cruel way to remind me that you're gone.

A couple danced over by the jukebox
Hand in hand, I thought they'd never stop
They played our song again and again
How could anyone be so insensitive.

They're laughing at me, I just know it
As if they knew all along I'd blow it
Everywhere I turn, something reminds me
Of the way things were
I love you, I lost you
I know what a fool I've been
And it seems like the whole world keeps rubbin' it in.

Every time I turn on the T.V.
I come across one of our favorite movies
A love story that ends with a kiss
How'd the cable company get in on this.

I swear I pass you when I'm on the highway
Since when did everyone drive red Chevrolets
It never really is your car
I think some people have taken this a little too far.

They're laughing at me, I just know it
As if they knew all along I'd blow it
Everywhere I turn, something reminds me
Of the way things were
I love you, I lost you
I know what a fool I've been
And it seems like the whole world keeps rubbin' it in.

They're laughing at me, I just know it
As if they knew all along I'd blow it
Everywhere I turn, something reminds me
Of the way things were
I love you, I lost you
I know what a fool I've been
And it seems like the whole world keeps rubbin' it in.

Yeah, it seems like the whole world keeps rubbin' it..."
2,Combat 84,Violence (Re-Mix),TRXYQCS128F92F1B01,1999,"There's rucking in the street and there's blood on your hands
Your'e boozing in the pub and going round in gangs
Cruising round in motors trying to get someone
Kick 'em stab 'em club 'em until the job is done

[Chorus]
There's violence in our town
There's violence all around
There's violence in your town
There's violence all around, around, around

People never learn however much you try
There's violence in your blood so someone's gota die
Cruising round in motors trying to get someone
Kick 'em stab 'em club 'em until the job is done

[Chorus]

Violence [x3]

[Chorus]

Violence [x3]"
3,Deadsy,She Likes Big Words,TRXUCWS128F148AD80,1999,"She comes from the land 
Of Valencian winds 
Deciduous daydream 
Dressage round the bend 
Shes sometimes Miss Maybe 
The mistress of when 
A triptych of new touch 
From heaven to men 

She likes nice cars 
Invincible trends 
She bites the heads off 
Her mutual friends 
We dine at the table 
She sits at the end 
She likes big words 
And playing pretend 

Come now dear boys 
How where to begin 
She's Ursula Major 
Of the prism within 
She's always in parties 
She's plotting to win 
Your sashes of New-Ro 
From psychic to sin 

Let down your void 
Your need to defend 
So pseudo-mendacious 
She's cruel in bed 
You'd think she was precious 
Something like you said 
Cause she's got the secrets 
In which fate depends 
She likes the boys that meet her late by the glen"
4,IZZ,I Get Lost,TRNLXPJ128F422CD85,1999,"I get lost, I get lost
All the time, all the time
Count the cost, what's the cost
To be mine, to be mine

And when you look into my eyes
You have to see through my disguise
For it's to you that this one goes
Never, never will you know"
5,Sisqo,How Can I Love U 2Nite,TRWDRXQ128F148D446,1999,"Tonight
I couldn't wait to get with you
Cause you really turn me on
I had to do you babe
But I knew that you were wrong
Don't stop
The love is feeling good to me
And you have it all
Come give it to me baby
Cuz I know you like to bone

1 - How can I love you 2nite?
When you know that I love somebody else
And I know that you're not mine
How can I love you 2nite?
I know you're not mine

Ooh, yeah, uh listen
All night I wanna give my love to you
Come on take you deep inside
Come on baby let's ride
Ooh girl you feel so tight
Don't cum,baby please wait for me
Just think how wet we're gonna be
Let it rain on me
Ha, so sorry we can't be 
Repeat 1

Listen 
Stand in front of me
So I can see your body
Sexing you is on my mind
But loving me is on your mind
So baby why dont you give yourself to me
I know your not mine
Said I know I shouldn't say it cause I know youur not mine
Said you and and me ,girl its not the way its suppose to be
But I can't help myself ,cause I don't want nobody else

Repeat chours till beat fades!!!
Repeat 1 till end"
6,Diorama,another queen,TRLWSWN128F422AC73,1999,"Systems slaved to secrets
Wisdom unsuspecting quest
Silence holy true old friend of mine
Timid tries to race me down

Another episode of wild complains
Closes chapters of childish struggle inside
Pale naked as now thoughts cannot deny
The purpose of neglecting lies

Withered fairy all my dedication
All my love for you

Believe in the signs I draw on your skin
Secrets now told as final advice

Believe in the signs I draw on your skin
Another queen that will never rise"
7,Dr. Dre / Hittman / Knoc-Turn'al,Bang Bang,TRNMHIF128E078ECC8,1999,"Everywhere I go, all I ever seem to hear is
BANG BANG!! BANG BANG!!
No matter where I go, all I ever seem to see is
BANG BANG!! BANG BANG!!
Everywhere I go, all I ever seem to hear is
BANG BANG!! BANG BANG!!
No matter where I go, all I ever seem to see is
BANG BANG!!

(Dr. Dre)
Everyday it's the same thang, L.A. ain't changed
Niggaz still playa hatin, but Dre ain't changed
I'm just a lot smarter now
cause these niggaz is bangin ten times harder now
Niggaz ringin they ass up in the wrong part of town
Better turn they car around
Rollin the window down (Eminem: Hey can we talk it out?)
(Hitt: NAH GET THE FUCK OUT!)
Johnny got a shotgun
and he ain't even strong enough to cock one
Fuck tryin to job hunt
Niggaz got AK's, niggaz is way crazier
than Dre was back in his N.W.A. days
Niggaz spray strays and shoot without lookin
Niggaz walk by and blast without leavin a footprint
I think the attitudes are twice as worst
It takes half the time to get your life reversed
Always tryin to play Rambo with they ammo
Make a nigga wanna stay in family mode
BANG BANG!! BANG BANG!!

Everywhere I go, all I ever seem to hear is
BANG BANG!! BANG BANG!!
No matter where I go, all I ever seem to see is
BANG BANG!! BANG BANG!!
Everywhere I go, all I ever seem to hear is
BANG BANG!! BANG BANG!!
No matter where I go, all I ever seem to see is
BANG BANG!!

(Knoc-turn'al)
Late nights is full of led that whistles as it goes by
Murder arrives, anytime
Bullets take flight when the fo'-five ignites
Some hearts skip a beat, some get blew out, and every light
put you in the site of youngsters with automatics
Bustin on shit to lay everything down even tourists and non-affiliates
These days, gun play is official with green lights on every block
Know the sign tells you too it's not best to stop
On every corner, Cali niggaz are dumpin
You'll be shakin your soul loose from the box at the coroner's
Makin death not so foreign to ya
Niggaz got Rugers and M-14's with enough,
ammo to leave an armored truck swiss cheese
I've learned to stay away from house parties
I've seen too many go and end up absent without leavin
Ain't no, warm welcomings, my eyes have witnessed the bend in on
Nights that don't sleep, and fireworks until dawn

Everywhere I go, all I ever seem to hear is
BANG BANG!! BANG BANG!!
No matter where I go, all I ever seem to see is
BANG BANG!! BANG BANG!!
Everywhere I go, all I ever seem to hear is
BANG BANG!! BANG BANG!!
No matter where I go, all I ever seem to see is
BANG BANG!!

(Hittman)
Now tell me - what the fuck is this man?
Niggaz doin brothers in worse than the Klan
Can't even stand, in front of your buildin and chill
without yieldin, twelve-year-old children that kill
blood spillin, thugs be illin, unnecessary slugs
fillin the sky, usually drillin the one
that wasn't willin to die, yes sir in the Killing Field
I got my, life preserver
And I'll do my time for murder, these niggaz got the nerve to
question me - bout the colors that I got on?
Now see that red dot on your knot
'Bout to get your whole crew shot on
A Soldier of Fortune, I'm the wrong nigga to plot on
Took him out on the spot before he even got on
my hitlist -- peep this
I cock back, you bow down
Bust round, bloody the ground, retaliation sounds like this

Everywhere I go, all I ever seem to hear is
BANG BANG!! BANG BANG!!
No matter where I go, all I ever seem to see is
BANG BANG!! BANG BANG!!
Everywhere I go, all I ever seem to hear is
BANG BANG!! BANG BANG!!
No matter where I go, all I ever seem to see is
BANG BANG!! BANG BANG!!
Everywhere I go, all I ever seem to hear is
BANG BANG!! BANG BANG!!
No matter where I go, all I ever seem to see is
BANG BANG!! BANG BANG!!
Everywhere I go, all I ever seem to hear is
BANG BANG!! BANG BANG!!
No matter where I go, all I ever seem to see is
BANG BANG!! BANG BANG!!"
8,B*Witched,Red Indian Girl,TRBBPTL128F42784B8,1999,"Met an old man. Miller his name
Met him on a dusty road
Got off the bus. Heard him singing
Sittin' in a rocking chair
I said where you been?
Tell me your story
I'm ready now lets begin
He said

Ooh ooh!
Red indian girl (red indian girl)
I've found her heart in so many places
Ooh ooh!
Red indian girl (red indian girl)
I've seen her smile in so many faces
(Her smile in the sun)
(And her eyes are the moon)

He talket and he talked
For so many hours
I listened to his every word
I sat at his feet and looked in his eyes
And I know what he meant
I tell you What he meant
He said

Ooh ooh!
Red indian girl (red indian girl)
I've found her heart in so many places
Ooh ooh!
Red indian girl (red indian girl)
I've seen her smile in so many faces
(Her smile in the sun)
(And her eyes are the moon)

(Come on, come on, come on)
(her smile is the sun, and her eyes are the moon)

Ooh ooh!
Red indian girl (red indian girl)
I've found her heart in so many places
Ooh ooh!
Red indian girl (red indian girl)
I've seen her smile in so many faces
(Her smile in the sun)
(And her eyes are the moon)

(Come on, Come on)

(Her smile is the sun)
(And her eyes are like the moon)"
9,Jill Phillips,Steel Bars (LP Version),TRTBQCW128E07853CF,1999,"So this is how it feels at the rock bottom of despair
When the house I built comes crashing down
And this is how it feels when I know the man that I say I am
Is not the man that I am when no one's around
This is how it feels to come alive again
And start fighting back to gain control
And this is how it feels to let freedom in
And break these chains that enslave my soul

CHORUS:
I refuse to be locked up in here like a prison cell
Where all I ever get is a meal and four walls
I used to be just fine in here but not anymore
Gonna break through these steel bars

So tell me how it feels when the tables start to turn
And you find yourself at the losing end
Tell me how it feels, you're not welcome here
'Cause I'm tired of pain and I'm tired of sin

CHORUS

I won't let you win
I have no doubt
I don't want you in
So get out, get out

CHORUS

I refuse to be locked up in here like a prison cell
Where all I ever get is a meal and four walls
I used to be just fine in here but not anymore
Gonna break through these steel bars"
10,Agnostic Front,Police State,TRCIQMD128F92EF915,1999,"new york police state 
new york police state 
new york police state 
new york police state 
new york behave you
new york behave you
new york behave you
whaaaaaa 
julaini,juliani,juliani fuck you
juliani,juliani,juliani fuck you

new york police state 
new york police state 
new york police state 
new york police state 
new york behave you
new york behave you
new york behave you
whaaaaaa 
julaini,juliani,juliani fuck you
juliani,juliani,juliani fuck you

new york behave you
new york behave you
new york behave you
whaaaaaa 
juliani,juliani,juliani FUCK YOU TO!"
11,Diana Krall,I Can't Give You Anything But Love,TRJJCRJ128F14A4221,1999,"I can't give you anything but love, baby
That's the one thing I've got plenty of, baby
I dreaming awhile, scheming a while you're sure to find
Happiness and I guess all those things you always pine for

Gee it's nice to see you looking swell, baby
Diamond bracelets Woolworth's doesn't sell, baby
Till the lucky day you know darn well,well baby
I can't give you anything but love"
12,Showaddywaddy,Who Put The Bomp (In The Bomp-A-Bomp-A-Bomp),TRKJHEZ128F92D0CBD,1999,"I'd like to thank the guy
Who wrote the song
That made my baby
Fall in love with me

Who put the bomp
In the bomp bah bomp bah bomp?
Who put the ram
In the rama lama ding dong?
Who put the bop
In the bop shoo bop shoo bop?
Who put the dip
In the dip da dip da dip?
Who was that man?
I'd like to shake his hand
He made my baby
Fall in love with me (yeah!!)

When my baby heard
""Bomp bah bah bomp ""
""Bah bomp bah bomp bah bomp bomp""
Every word went right into her heart
And when she heard them singin'
""Rama lama lama lama""
""Rama ding dong""
She said we'd never have to part
So

Who put the bomp
In the bomp bah bomp bah bomp?
Who put the ram
In the rama lama ding dong?
Who put the bop
In the bop shoo bop shoo bop?
Who put the dip
In the dip da dip da dip?
Who was that man?
I'd like to shake his hand
He made my baby
Fall in love with me (yeah!!)


Each time that we're alone
Boogity boogity boogity
Boogity boogity boogity shoo
Sets my baby's heart all aglow
And every time we dance to
Dip da dip da dip
Dip da dip da dip
She always says she loves me so
So

Who put the bomp
In the bomp bah bomp bah bomp?
Who put the ram
In the rama lama ding dong?
Who put the bop
In the bop shoo bop shoo bop?
Who put the dip
In the dip da dip da dip?
Who was that man?
I'd like to shake his hand
He made my baby
Fall in love with me (yeah!!)"
13,Tiger Army,WereCat,TRYSBCU128F42621DD,1999,"Her pale face rising and I feel a change 
come on in waves 
Blood boils in veins 
Am I reactions or coincidence? 
I'm still coming after you 
A new breed forming--- and the Werecat prowls the night 

Rising 

Hear the mourful cries of the hounds on my trail 
I cannot fail 
Cat out of hell 
Vengeance is mine, the time has come tonight 
Forever falling, bathed in a sea of lunar light"
14,The Juliana Theory,P.S. We'll Call You When We Get There,TRYZXVS128F145C443,1999,"looking back,
alot has changed.
we never thought there'd come a day,
when everything we used to live for
everything we did 
and everything we said could be
away!

now we're left
holding onto dreams.
two small town kids
we're gonna get them.
now it's time,
i see those city lights
i think it's time, time to . . .go!

and we'll come back home,
when we hit the bigtime.
and we'll come back someday.
and we'll come back home,
when we hit the big time.
yeah we'll come back. (x2)"
15,Toxic Narcotic,Politics,TRIXHYG128F92FB1A6,1999,"I hate the politics, causes more problems than it'll ever fix, all this talk about unity, from a bunch of elitists and hypocrites, I hate the politics, punx fighting in their own cliques, throwing rocks and swinging sticks, can't be unity without tolerance, I hate the policy, of uniformed anarchy, if everyone was just like me, we'd lose our sense of identity, can we get this shit together, can we work it out? Or just keep talking shit, and fighting amongst ourselves, breakdown all the politics, and what have you got? Poor versus rich, which side are you on, take your pick, because all this bickering makes me sick, you're full of shit"
16,Sergent Garcia,9 Vidas,TRVMHYK128F1469F40,1999,"Nueve vidas, yo quiero nueve vidas,
Para amarte dia y noche yo quiero nueve vidas,

Si un gato puede tenerlas, yo quiero también quiero vivirlas,
La vida es muy corta yo quiero que me den más.
Que coños hago yo con una sola vida,
Si amor tengo para darte toda la eternidad.
Así que no, no perdamos el tiempo,
Mira, mira nena como yo te quiero,
No, no, no perdamos ni un minuto,
No, no, no perdamos ni un segundo

Yo soy un gato callejero y maullido tras maullido,
Me quedo bajo la ventana para darte la serenata,
Yo no me canso nunca, el sargento es vitamina,
Dame tu amor nenita, yo quiero que me des más,
Más y más, cada día más y más,
Más y más, cada noche más y más,
Y gozaremos de amor los dos durante siglos,
Si amor tengo para darte hasta que estalle el mundo.
Así que no..."
17,2 Minutos,Que Mala Suerte,TRJBTQD128F9322DFC,1999,"Cuando yo te conocite
Te invite a salir:
Vamos a la fiesta
De un amigo
Hay mucho escabio
Y mucho ruido.
Un chabon me deliró
Y un roscazo se comió,
Me echaron de la fiesta
Y me quede sin chica
Y sin cerveza.
Al rato me puse a caminar
En busca de un bar,
Y al rato lo encontré
Y mas de diez cervezas me tome.
Por la vidriera del bar
Veo mi chica y mi amigo pasar
Que van directo a ese hote
Lque esta al frente de este bar.
Pido la cuenta al mozo
No me alcanza para pagar
Yo intento despegar
Y a la seccional voy a dar.
Que mala suerte que tengo yo
Que a esa chica no la pude transar
Mi amigo se la cogio!
Y yo estoy en la seccional
Que mala suerte que tengo yo
Y yo estoy en la seccional
Que mala suerte que tengo yo
Y yo estoy en la seccional
Que mala suerte que tengo yo
Que mala suerte que tenes vos."
18,Johnny Horton,I Got A Hole In My Pirogue,TRSDQKT128F4271E74,1999,"Well, I went out a fishin' to make a little mon
To take to Cajulina so we could have some fun
On the way back, I knocked a hole in my bow
I got a hole in my pirogue, I can't go see my gal

The purtiest sight that you ever have seen
Is a moonlight night down in New Orleans
I'm up the river, just around the bend
I got a hole in my pirogue, I just can't hold it in

Well, Catelina's waitin' with tears in her eyes
Munchin' and a crunchin' on a crawfish pie
I smell a feeling floatin' through the air
I got a hole in my pirogue, I can't go see my Cher

The purtiest sight that you ever have seen
Is a moonlight night down in New Orleans
I'm up the river on around the bend
I got a hole in my pirogue, I just can't hold it in

Yeah I'm here on the bayou, sittin' all alone
With a busted bottom and I can't pole it home
Cajulina's waitin' lonesome as can be
I got a hole in my pirogue, I can't go see my she

The purtiest sight that you ever have seen
Is a moonlight night down in New Orleans
I'm up the river on around the bend
I got a hole in my pirogue, I just can't hold it in"
19,Estopa,Me Falta El Aliento,TRASRVD128F933624A,1999,"Llega el momento me piro
Al filo de la mañana. ¡Qué frío!
Que no me he puesto el sayo
Pero me he puesto como un rayo
Me siento como un esperma esperando
En un tubo de ensayo

Congelado pero vivo
Se rompe el hielo si tiro un suspiro
Que no hay nadie más por la calle
Que yo sólo pienso en canciones
Que una poesia me sale
Porque se me caen los pantalones
Y es que se me escapa el aire

Porque me falta el aliento
La fuerza, la pasta, las ganas de verte
El encanto, la salsa, la luz de mis ojos
Mi as de la manga, tus ojitos rojos
Me faltan, me faltan

Madrugada de hielo
Alguien que se arrastre a ras de suelo
Ya debe entrar el sol
Por tu ventana azul
Y yo en el ascensor
¡Qué cara, que estúpida expresión!
Menos mal que ya no estas tú...

Tengo un reloj que se para
Siempre que tú de mí te separas
Y anoche se paró a las dos
Las dos nos paró a los dos
Que ya no hay tiempo que transcurra
Ni sudor que se me escurra por tu cuerpo
Ahí donde curra mi silencio
Mis manos, mi boca, mis ganas, mis besos
Mi cabeza loca, mi tema, mis sueños
Te digo por qué..."
20,Combat 84,Trouble,TRLWBAF128F92F1AFD,1999,"Do you think your really hard when you scream at each other?
Do you think your really hard ????
Do you think your really hard ????
Dou you think your really hard when you end up dead?

[Chorus]
Screaming at each other
Kicks to the head
Brother against brother
Until you end up dead
[x2]

You prove the papers right by the way you fucking act
You prove the papers right when your sniffing glue
You prove the papers right and that's a sad fact
You end up on the floor beaten black and blue"
21,Nickelback,Worthy To Say,TRTLUWJ128E0782EA4,1999,"They usually come around about 10 o'clock
You can hear them
You can tell them by the way they knock
Somebody said the other one had a badge
Who told ya, Who told ya
How bout if I stay and you run away
Well come on back and try again some other day
Well somebody's gonna do it again
Gonna make me turn against all of my friends
So you better have something damn worthy to say

They're blowin' smoke everywhere around the block
You can smell it
You can tell by the way they talk
Somebody stole five for gasoline
Who told ya, Who told ya

How bout if I stay and you run away
Well come on back and try again some other day
Well somebody's gonna do it again
Gonna make me turn against all of my friends
So you better have something damn worthy to say

I'll never do it again (No I won't)
Lets settle it (We don't)
I can't afford my life cause I'm spending it
Since you got just what you wanted

We never do anything anymore
One on the telephone, one on the door
Somebody said revenge was served sweeter cold
I told ya, I told ya
They're growing dope everywhere around the block
You can smell it you can tell it by the way they talk
Somebody stole five for gasoline
Who told ya, Who told ya

How bout if I stay and you run away
Well come on back and try again some other day
Well somebody's gonna do it again
Gonna make me turn against all of my friends
So you better have something damn worthy to say

I'll never do it again (No I won't)
Let's settle it (We don't)
I can't afford my life cause I'm spending it
Since you got just what you wanted

I'll never do it again (No I won't)
Praise myself (I don't)
I can't afford my life cause I'm spending it
Since you got just what you wanted

What you wanted
What you wanted
What you wanted"
22,Scared Of Chaka,A Lie And A Cheat,TRQQJFP128F9320B38,1999,"No one knows how it got this far
But like the eyes of a strung out star
You're empty, bloodshot,
Black and blue transparent
As the window that you threw yourself through
Your eyes hurt til your money's gone
You got left at the dead end son

Thought you made it to the final day
Now you're gonna have to run away
That's a lie and a cheat
Takin the world

Heart is racing and your head explodes
No one ever gets it no one knows
Evil like a demon out of hell
In a tale you won't live to tell

Now you're saying that you don't know
Why your hands are tied, they're gonna sell you

Thought you made it...

Your head is gone, your feelings lost in a
Deep impact of what is justice?"
23,A*Teens,Halfway Around The World,TRCQVMA128F9354795,1999,"Baby I will soon be leaving
And I know that you are feeling down... down... down...
But every week I'll send a letter
To let you know my love will never change
I promise you I always feel the same

So remember in your heart
Baby when we are apart
There is no need for crying
'cause even if I am

Halfway around the world
That won't stop me from loving you
Halfway around the world
I'll still be feeling the way I do
Now I wanna hold you baby
Cause I'm gonna miss you like crazy
Even if I'm halfway around the world

Baby when the miles are growing
You and I will still be going strong
No matter what your friends are saying
Don't give up on what you´re waiting for
Cause one day I'll be knocking on your door

So remember in your heart
Baby when we are apart
There is no need for crying
Cause even if I am

Halfway around the world
That won't stop me from loving you
Halfway around the world
I'll still be feeling the way I do
Now I wanna hold you baby
Cause I'm gonna miss you like crazy
Even if I'm halfway around the world

If I could you know that I would find a way
To stay for good but I must go now
I wanna hold you baby
'cause I'm gonna miss you like crazy even if I´m

Halfway around the world
That won't stop me from loving you
Halfway around the world
I'll still be feeling the way I do
Now I wanna hold you baby
Cause I'm gonna miss you like crazy
Even if I'm halfway around the world

Ooh yeah

Halfway around the world
That won't stop me from loving you
Halfway around the world
I'll still be feeling the way I do
Now I wanna hold you baby
Cause I'm gonna miss you like crazy
Even if I'm halfway around the world"
24,THE 69  EYES,BE MY SPEED,TRHJFGA128F4278560,1999,"Well I ain't a worried man
But sometimes i need a
helpin' hand 
Maybe men don't know but the lil' girls 
sure understand 
Can't you see now baby I ain't
a worried  man 

I got the appetite to feed
You are everything I need

Well I ain't a worried man
But sometimes I need a
helpin' hand 
Maybe men don't know but the lil' girls
sure understand 
Can't you see now baby I ain't
a worried  man 

I got the appetite to feed
Get me high lil' girl and 
be my speed 
(Repeat)"
25,Quasi,Empty Words,TRMWSUI128F93551D2,1999,"The sun still rises, the moon still shines;
I've seen it over ten-thousand times.
But this may be the year I will disappear.
Come through my window, not through my door;
Leave me a number I can ignore.
Then go tell everyone what we might have done.
&amp; don't mind what you've heard -
It's just an empty word."
