,Artist,Title,Track_id,Year,Lyrics
72,Michel Sardou,Le Cur ,TRQNNDW128F92CB042,1973,"Moi qui suis le jeune curé
De la paroisse abandonnée,
Là-bas, au flanc de la montagne,
Moi qui n'intéresse personne
Pas plus les Cardinaux de Rome
Que mes paroissiens qui se damnent,
Quand je m'ennuie, les soirs d'hiver,
Comme un berger dans son désert,
Je vais coucher dans mon église.

Ah, bon Dieu, si l'on était deux.
Ah, bon Dieu, si l'on était deux.
Pour t'aimer, pour te servir,
On s'rait pas trop de deux.
Ah, bon Dieu, si l'on était deux.

Moi qui suis le jeune curé
De la paroisse abandonnée,
Souvent, je pense à cette femme
Qui partagerait le pain le sel,
Qui m'endormirait avec elle
Et qui protégerait mon âme,
Mais là devant la croix de Dieu,
Ma prière n'atteint pas les cieux.
Je suis tout seul dans mon église.

Ah, bon Dieu, si l'on était deux.
Ah, bon Dieu, si l'on était deux.
Pour t'aimer, pour te servir,
On s'rait pas trop de deux.
Ah, bon Dieu, si l'on était deux.
Accorde-moi cette faveur.
Si tu ne m'entends pas Seigneur,
Demain on fermera ton église.

Ah, bon Dieu, si l'on était deux.
Ah, bon Dieu, si l'on était deux.
Pour t'aimer, pour te servir,
On s'rait pas trop de deux.
Ah, bon Dieu, si l'on était deux."
73,Strawbs,Thank You,TRQDIRV128E0793C4C,1973,"Weaver-Cousins

We thank you for the wind and rain
The sunshine and the flowers
We thank you for the moon and stars
The minutes and the hours.

We live each day as best we can
And wake up with new friends
For when the nights have turned around
The days begin again."
74,Peter Frampton,Lines On My Face,TRQFUXF128F1492353,1973,"Frampton (1973)
Almo Music Corp, Nuages Artists Music, LTD. 
EMI U Catalog Inc. (ASCAP) 


Lines on my head from that one thing she said 
She spoke of strangers that don't sleep two a bed 
Kept on trying, buying time,not waiting on fate 
I somehow got the feeling that I opened my eyes too late 
I saw where you came from 
Called out your name 
But there's no answer
We lived on your doorstep 
I made you my wife but I don't need that 
Lines on my face,while I laugh lest I cry 
Speed city dirt and gritty waving me goodbye 
So many people,my family of friends 
Trying so hard to make me smile untill this heartache mends 
I saw where you came from 
called out your name 
but there's no answer
We lived on your doorstep 
I made you my wife but I don't need that 
Ice in her eyes,frozen tears would never be a surprise 
You can't erase a dream you can only wake me up 
My mind is turning slower,never to accept defeat
It don't matter where I live I still got a house to heat
I saw where you came from 
called out your name 
but there's no answer 
We lived on your doorstep 
I made you my wife but I don't need that"
75,David Bowie,Everything's Alright (1999 Digital Remaster),TRDMXRY128E0782D3D,1973,"Oh, little baby
You know I've been away
Oh, little baby
You know I'll come today
Don't you know that

Everything's alright  (everything's alright)
Everything's alright  
Everything's alright  (everything's alright, babe)
Let me hold your hand and be your loving man  (all night)
Let me hold your hand and be your loving man  (all night)
Let me hold your hand and be your loving man  (all night, alright!)

Oh, little baby
You know I feel so good
Oh, little baby
I never knew I could
And don't you know that

Everything's alright (everything's alright, babe)
Everything's alright
Everything's alright (everything's alright, babe)
Let me give you loving like nobody can (all night)
Let me give you loving like nobody can (all night)
Let me give you loving like nobody can (all night, alright!)

Let me hold your hand and be your loving man 
Let me hold your hand and be your loving man
Let me hold your hand and be your loving man

No, no, no, no, no, that's a-loving you
(Must have been you, I'm gonna all night loving you)
No, no, no, no, no
I'll be good for you

Everything's alright (everything's alright, babe)
Everything's alright
Everything's alright (everything's alright, babe)
Let me give you loving like nobody can (all night)
Let me give you loving like nobody can (all night)
Let me give you loving like nobody can (all night, alright!)

Everything's alright
Everything's alright
Oooh"
76,Dave Van Ronk,Duncan and Brady,TRHNPGN12903CDBDE5,1973,"Well, it's twinkle, twinkle little star
Along came Brady in his 'lectric car
Got a mean look right in his eye
Gonna shoot somebody just to see him die
Well, he been on the job too long

Well, Duncan, Duncan was tending the bar
Along comes Brady with his shiny star
Brady says, Duncan, you are under arrest
And Duncan shot a hole right in Brady's chest
Yes, he been on the job too long

Brady, Brady, Brady, well you know you done wrong
Breaking in here when my game's going on
Breaking down the windows, knocking down the door
And now you're lying dead on the barroom floor
Yes, you been on the job too long

Well, old King Brady was a big fat man
Doctor reached out, grabbed hold of his hand
He felt for his pulse, doctor said
""I believe unto my soul King Brady's dead""
Yes, he been on the job too long

High tailed carriages standing around
Waiting to take King Brady to the burying ground
High tailed carriages, rubber tired hack
Well, they took him to the graveyard
But they didn't bring him back
Yes, he been on the job too long

Well, women all heard King Brady was dead
They go back home and re-rag in red
Come a-slipping and a-sliding and a-shuffling down the street
In their big Mother Hubbards and their stocking feet
He been on the job too long

Well, Brady, Brady, well you know you done wrong
Breaking in here when my game's going on
Breaking down the windows, knocking down the door
And now you're lying dead on the barroom floor
Yes, you been on the job too long"
77,The Pointer Sisters,Yes We Can Can,TREAQDX128F1484C97,1973,"Now's the time for all good men
To get together with one another.
We got to iron out our problems
And iron out our quarrels
And try to live as brothers.
And try to find a piece of land
Without stepping on one another.
And do respect the women of the world.
Remember you all have mothers.
We got to make this land a better land
Than the world in which we live.
And we got to help each man be a better man
With the kindness that we give.
I know we can make it.
I know darn well we can work it out.
Oh yes we can, I know we can can
Yes we can can, why can't we?
If we wanna get together we can work it out.

And we gotta take care of all the children,
The little children of the world.
'cause they're our strongest hope for the future,
The little bitty boys and girls.

We got to make this land a better land
Than the world in which we live.
And we got to help each man be a better man
With the kindness that we give.
I know we can make it.
I know darn well we can work it out.
Oh yes we can, I know we can can
Yes we can can, why can't we?
If we wanna, yes we can can."
78,Danny O'Keefe,Catfish (LP Version),TRGTNSH128F426DEE8,1973,"O'Keefe

Sittin' by the water
Starin' at the stream
Tell me, honey, are there any
Catfish in your dreams

Catfish ain't expensive
Neither is it free
Some folks crazy 'bout it
Others have to leave it be

Suckers and bullheads
Never will do
But a catfish'll show you
A thing or two

If you go down to the bank
So you can flash your bait
If you're lookin' for catfish, mama
You ain't got long to wait

Catfish got whiskers 
And a sweet little grin
But you never can tell
Where a catfish has been 
I'll be your catfish
Any old time
Just call out my name
And drop me your line"
79,Steve Miller Band,The Joker,TRUWCKW12903CA4478,1973,"Some people call me the space cowboy, yeah
Some call me the gangster of love
Some people call me Maurice
'Cause I speak of the pompatus of love

People talk about me, baby
Say I'm doin' you wrong, doin' you wrong
Well, don't you worry, baby, don't worry
'Cause I'm right here, right here, right here, right here at home

'Cause I'm a picker, I'm a grinner
I'm a lover, and I'm a sinner
I play my music in the sun
I'm a joker, I'm a smoker
I'm a midnight toker
I get my lovin' on the run
Woo-hoo, woo-hoo

You're the cutest thing that I ever did see
I really love your peaches, want to shake your tree
Lovey-dovey, lovey-dovey, lovey-dovey all the time
Ooh-wee baby, I'll sure show you good time

'Cause I'm a picker, I'm a grinner
I'm a lover, and I'm a sinner
I play my music in the sun
I'm a joker, I'm a smoker
I'm a midnight toker
I sure don't want to hurt no one

Woo-hoo, woo-hoo

People keep talking about me, baby
They say I'm doin' you wrong
Well, don't you worry, don't worry, no, don't worry, mama
'Cause I'm right here at home

You're the cutest thing I ever did see
I really love your peaches, want to shake your tree
Lovey-dovey, lovey-dovey, lovey-dovey all the time
C'mon baby, and I'll show you a good time"
80,Uriah Heep,Stealin',TRHVQUB12903CB2B3C,1973,"Take me across the water 'cause I need some place to hide
I done the rancher's daughter and I sure did hurt his pride
Haha

Well, there's a hundred miles of desert lies between his hide and mine
I don't need no food and no water, Lord, 'cause I'm runnin' out of time

Fightin', killin', wine and women gonna put me to my grave
Runnin', hidin', losin', cryin', nothing left to save
But my life

Stood on a ridge and shunned religion, thinking the world was mine
I made my break and a big mistake, stealin' when I should have been buyin'

All that fightin', killin', wine and women gonna put me to an early grave
Runnin', hidin', losin', cryin', nothing left to save
But my life, life, life, life, life, life, life, life, life

So I stood on a ridge and shunned religion, thinking the world was mine
I made my break and a big mistake, stealin' when I should have been buyin'
I was stealin' when I should have been buyin'
I was stealin' when I should have been buyin'
Stealin' when I should have been buyin'
Stealin' when I should have been buyin'
Stealin' when I should have been buyin'
Stealin' when I should have been buyin'
Stealin' woo
Stealin' hahaha, yeh
I was stealin' when I should have been buyin'
Stealin', oh yeh yeh yeh yeh yeh
Stealin', oo-oo-oo-oo-oo-oo-oo
Stealin', rock'n'roll, all right
Stealin', rock'n'roll, all right
Stealin' babe, babe
Stealin', should, should, should have been buyin'
Stealin', should, should, should have been buyin'
Stealin', should have, should have, should have been buyin'
Stealin', buying, yeah"
81,Patty Pravo,Morire Tra Le Viole,TRVOVFO128F930B0A4,1973,"Sotto il sole, col vestito leggero
Che un vento caldo mi stringeva più addosso
Forte respirai, col mio piccolo seno
Le mie mani pronte e gli occhi chiusi senza più paura

Tanto bella 
Da concedersi all'amore
Un amore sotto il sole
E morire tra le viole 
E morire tra le viole

Nella nebbia, io ti vedo arrivare
Fuori c'è freddo, sei stanco e seccato
Entri in casa ed io sto mangiando una mela
Ti sorrido e dico: ""Amore, domani è primavera""

Tanto bella
Da fermare quel momento
Un amore sotto il sole
E morire tra le viole
E morire tra le viole"
82,Larry Norman,Christmastime,TRAZBBY128F92F7729,1973,"Santa Claus is comin' and the kids are gettin' greedy
It's Christmas time
They know what's in the story 'cause they seen it on the TV
It's Christmas time, it's Christmas time
It used to be the birthday of the Man who saved our necks
It's Christmas time
Now it stands for Santa Claus they spell it with an X
It's Christmas time, it's Christmas time
Woah it's Christmas time
Oh woah oh baby
Oh woah oh woah it's Christmas time
Oh yeah baby
I said Yeah
Yeah
Yeah... You go into the forest and you cut down all the trees
It's Christmas time
I know you got a power saw but who plants the seeds?
It's Christmas time, it's Christmas time
I gotta buy a present can't remember who it's for
It's Christmas time
I 'll see you in a hour when I get back from the store
It's Christmas time, it's Christmas time"
83,Stealers Wheel,Stuck In The Middle With You,TRWLGQP128F92EFFE4,1973,"Well, I don't know why I came here tonight
I got the feeling that something ain't right
I'm so scared in case I fall off my chair
And I'm wondering how I'll get down the stairs
Clowns to the left of me, jokers to the right
Here I am, stuck in the middle with you

Yes, I'm stuck in the middle with you
And I'm wondering what it is I should do
It's so hard to keep this smile from my face
Losing control, yeah, I'm all over the place
Clowns to the left of me, jokers to the right
Here I am, stuck in the middle with you

Well, you started off with nothing
And you're proud that you're a self-made man
And your friends they all come crawlin'
Slap you on the back and say, ""Please, please""

Trying to make some sense of it all
But I can see it makes no sense at all
Is it cool to go to sleep on the floor?
Well, I don't think I can take anymore
Clowns to the left of me, jokers to the right
Here I am, stuck in the middle with you

Well, you started out with nothing
And you're proud that you're a self-made man
And your friends they all come crawlin'
Slap you on the back and say, ""Please, please""

Yeah, I don't know why I came here tonight
I got the feeling that something ain't right
I'm so scared in case I fall off my chair
And I'm wondering how I'll get down the stairs
Clowns to the left of me, jokers to the right
Here I am, stuck in the middle with you

Yes, I'm stuck in the middle with you
Stuck in the middle with you
Here I am, stuck in the middle with you"
84,George Harrison,Who Can See It (2006 Digital Remaster),TRBPCDJ128F1485F30,1973,"I've been held up, I've been run down
I can see quite clearly now
Through those past years
When I played towing the line

I only ask that what I feel
Should not be denied me now
As it's been earned
And I have seen my life belongs to me
My love belongs to who can see it

I've lived in fear, I've been out there
I've been 'round and seen my share
Of this sad world
And all the hate that it's stirred

I only ask that what I know
Should not be denied me now
As it's been learned
And I have seen my life belongs to me
My love belongs to who can see it

I only ask that what I feel
Should not be denied me now
As it's been earned
And I have seen my life belongs to me
My love belongs to who can see it, oh
My love belongs to who"
85,10cc,The Dean and I,TRRAKUQ128F935A1B0,1973,"Hum drum days
And a hum drum ways 

Hey kids, let me tell you how I met your mom
We were dancin' and romancin' at the Senior Prom
It was no infatuation
But a gradual graduation
From a boy to a man
Let me tell you while I can
The soda pop came free 

Hey Sis, one kiss, and I was heaven bound
Now who would have guessed Milton's paradise lost could be found
But in the eyes of the Dean, his daughter
Was doin' what she shouldn'a oughta
But a man's gotta do
What a man's gotta do
The consequence should be
Church bells, three swells
The Dean, his daughter and me 

They were dating in the park
They were smooching in the dark
Of a doorway for two
She whispered ""I love you -
Ooh, you know I never felt this way before
Ooh, you know the elevator in my heart
Has gone awol, awol, awol, awol""
And then I kissed her
And when I kissed her
It's a wonderful world
When you're rolling in kisses 

Now, the paint is peeling
(Hum drum days and hum drum ways)
Now, and when the chips are down
(Hum drum days and hum drum ways)
Now, you kinda lose all feeling
(Hum drum days and hum drum ways)
Now, your head goes round and round
(Hum drum days and hum drum ways)
Round and round and round and round and round
I'm throwing myself off this train 

Hum drum days
And a hum drum ways 

Hum drum days, he's got
Hum drum ways, oh boy 

Hey, you know I'm really earning now
My ship came in with a cargo of dollars
My name's lit up on the prow
It's a wonderful world
When you're rolling in dollars
Now!"
86,Billy Joel,Captain Jack,TRXNDZH128F425BF40,1973,"Saturday night and you're still hangin' around
You're tired of livin' in your one horse town
You'd like to find a little hole in the ground
For a while, hmmm

So you go to the Village in your tie-dye jeans
And you stare at the junkies and the closet queens
It's like some pornographic magazine
And you smile, mmm

Captain Jack will get you high tonight
And take you to your special island
Captain Jack will get you by tonight
Just a little push and you'll be smilin', oh yeah, yeah

Your sister's gone out, she's on a date
And you just sit at home and masturbate
Your phone is gonna ring soon, but you just can't wait
For that call, mmm

So you stand on the corner in your new English clothes
And you look so polished from your hair down to your toes
Oh, but still your finger's gonna pick your nose
After all, mmm, yeah

But Captain Jack will get you high tonight
And take you to your special island
Captain Jack will get you by tonight
Just a little push, you'll be smilin', oh, oh yeah, yeah

So you decide to take a holiday
You got your tape deck and your brand new Chevrolet
Ah, there ain't no place to go anyway
And what for, mmm

So, you've got everything but nothing's cool
They've just found your father in the swimming pool
And you guess you won't be going back to school
Anymore

But Captain Jack can get you high tonight
And take you to your special island
Oh, Captain Jack will get you by tonight
Just a little push and you'll be smilin'
La da da, oh yeah, yeah

So you play your albums and you smoke your pot
And you meet your girlfriend in the parking lot
Oh, but still you're aching for the things you haven't got
What went wrong, mmm

And if you can't understand why your world is so dead
Why you've got to keep in style and feed your head
Well, you're twenty-one and still your mother makes your bed
And that's too long, oh, oh yeah yeah

But Captain Jack will get you high tonight
And take you to your special island
Oh, now Captain Jack will get you by tonight
Just a little push and you'll be smilin'

Oh, Captain Jack will get you high tonight
And take you to your special island
Oh, now Captain Jack will get you by tonight
Just a little push and you'll be smilin'

Yeah, Captain Jack will get you high tonight
And take you to your special island
Oh, now Captain Jack will make it right tonight
Yeah, Captain Jack will get you high tonight"
87,Ringo Starr,I'm The Greatest,TRIWWLN128F42ACBBB,1973,"When I was a little boy,
Way back home in Liverpool,
My mama told me, I was great.

Then when I was a teenager,
I knew that I had got something going,
All my friends told me I was great.

And now I'm a man,
A woman took me by the hand,
And you know what she told me...I was great.

I was in the greatest show on earth,
For what it was worth.
Now I'm only thirty-two;
And all I wanna do, is boogaloo!

I looked in the mirror,
I saw my wife and kids,
And you know what they told me...I was great.

Yes, my name is Billy Shears,
You know it has been for so many years.
Now I'm only thirty-two;
And all I wanna do, is boogaloo!

I'm the greatest,
And you better believe it baby!
I will be the greatest in this world,
In the next world,
And anywhere!
Alright!"
88,Larry Norman,Lonely By Myself,TRRMBIX128F92F7721,1973,"If I could find someone who really cared for me
Someone to share my love and keep me company
If could find someone I'd let them take control
And in exchange for love I'd give my very soul

It's such a lonely life
I almost cry each night
Cause faith has put me on the shelf
I get so lonely, so lonely by my self

If I could find someone who'd really love me right
They'd make my life complete they'd make my soul shine bright
I've looked around the world I've walked down every street
Still I can't find no one to give me what I need

It's such a lonely life
I almost cry each night
Cause faith has put me, faith has put me on the shelf
I get so lonely so lonely by my self
I get so lonely, so lonely, so lonely by my self

Who can I turn to
Is there anybody there
Doesn't anybody care
Oh doesn't anybody listen
Doesn't anybody care"
89,Kraan,Fat Mr. Rich,TRPDLQV128F146C073,1973,"Jack Steam is sitting in a bud
Cryin' so loudly
'Till they wanna get hard, hard

Jack Steam, Jack Steam

Fat Mr. Rich and his viper witch
Wait on the rock 'till they wanna
Miles home

Jack Steam, Jack Steam

Slowly gets land
He splash all the warner
On Mr. Rich's hand

Fat Mr. Rich and his viper witch
Sit now in the part 'till they wanna gets high"
90,Harry Nilsson,It Had To Be You,TREIPFB128F42AF024,1973,"Jones-Kahn

Why do I do, just as you say
Why must I just, give you your way
Why do I sigh, why don't I try - to forget

It must have been, that something lovers call fate
Kept me saying: ""i have to wait""
I saw them all, just couldn't fall - 'til we met

It had to be you, it had to be you
I wandered around, and finally found - the somebody who
Could make me be true, and could make me be blue
And even be glad, just to be sad - thinking of you

Some others I've seen, might never be mean
Might never be cross, or try to be boss
But they wouldn't do
For nobody else, gave me a thrill - with all your faults, I love
you still
It had to be you, wonderful you
It had to be you"
91,Colin Blunstone,How Could We Dare To Be Wrong,TRFDQUZ128F4279EA9,1973,"HOW COULD WE DARE TO BE WRONG ?
Blunstone-Dennys

Take me up, fill my cup with your wine
I am your home and you are mine
I'll never leave you now that I've seen you
I'll never breathe a word of what I have found.

Make my eyes, tell no lies to my heart
I've known the way, right from the start
You know you see me here only when you free me here
When our darkest hour passes to dawn.

How could we fail to see it ?
Everything that we could be
Now that we've written this song
How could we dare to be wrong ?

There is no turning back from the truth
It took so long but now I'm there
Take my word, show me you've heard
I'll never ask again what I ask now.

How could we fail to see it ?
Everything that we could be
Now that we've written this song
How could we dare to be wrong ?

How could we fail to see it ?
Everything that we could be
Now that we've written this song
How could we dare to be wrong ?

How could we fail to see it ?
Everything that we could be
Now that we've written this song
How could we dare to be wrong ?

…"
92,Faces,Pool Hall Richard,TRVBZEO128F932792B,1973,"Sweatin' hard, I didn't get a shot
All I did was stand around and get too hot
Knowin' all the people walkin' on my side
Losin' all my money and I'm getting tired
All the women crawl around him like he's getty's son
Makes you kind of jealous but it sure is fun
I don't mind, but he wants my lady too

You know the crowd gets bigger as the word goes 'round
Pool hall king was playin' back in town
Minnesota Fats standin' up at the back
Tryin' to hide himself in a plastic mack
You ought to hear the silence when the kid walks in
His reputation's bigger than gasoline
I don't mind but he's tryin' to fill my lady too
Pool Hall Richard, you're far too wicked we know
Pool Hall Richard, kid you're wicked, we know
You broke my heart
Same as you could ever do
With your yellow carnation and your pink satin shoe
You make me jealous but I worship you
One day soon I'm gonna beat you clean
Wipe that smile right off your chin
Everybody gonna drive from miles around
Cuein' up to see me take away your crown
Then you'll never never ever take my lady then

Pool Hall Richard, you're far too wicked we know
Pool Hall Richard, kid you're wicked, we know
You broke my heart
Sme as you could ever do
Dig this
Bam goes the brown, that's another one down
Know they play much better when the sun goes down
Bang goes the green, you're so obscene
Your hands are dirty but your scent is clean
Bam goes the blue, lock away your cue
The pool hall king is hustlin' you
Bam goes the 8-ball, didn't see it spin at all
This kid can play, oh yeah

Bam goes the brown, ooh another one down
Know they play much better when the sun goes down
Bang goes the green, you're so obscene
Your hands are dirty, your scent is clean
Damn the pink, one more to sink
Gonna beat you someday 'cause you're makin' me sick
Down on the black, at the back of the pack
Aw, you nearly missed, you ain't so hot

Pool Hall Richard, kid you're wicked, we know
You broke my heart
Same as you could ever do
You're breakin' my heart
But you're stealin' my tart
Shut up"
93,Kool & The Gang,Funky Stuff,TRNPYQX128F146B962,1973,"Par...tay..., par...tay...

Can't get enough of that funky stuff
Can't get enough of that funky stuff

I said, whoa, whoa, whoa, whoa, whoa, whoa, whoa, whoa..., yeah...

Can't get enough of that funky stuff
Can't get enough of that funky stuff

I said, whoa, whoa, whoa, whoa, whoa, whoa, whoa, whoa..., yeah...

I said, whoa, whoa, whoa, whoa, whoa, whoa, whoa, whoa..., yeah..."
94,Derek & The Dominos,Why Does Love Got To Be So Sad,TRPOLUC128E0793F59,1973,"Yeah, yeah, yeah, yeah, yeah, yeah

Gotta find me a way
Get me back to yesterday
How can I ever hope to forget you?
Won't you show me a place
Where I could hide my lonely face
I know you're gonna break my heart if I let you

Why does love got to be so sad?
Why does love got to be so sad?
Why does love got to be so sad?
Why does love got to be so sad?

Like a moth to the flame
Like a song without a name
I've never been the same since I met you (woah)
Like a bird on the wing
Got a brand new song to sing
I can't keep from singing about you

Why does love got to be so sad?
Why does love got to be so sad?
Why does love got to be so sad?
Why does love got to be so sad?

I'm beginning to see
What a fool you've made of me
I might have to break the law when I find you (yes I will now)
Stop running away
I got a better game to play
You know I can't go on living without you, no

Why does love got to be so sad?
Why does love got to be so sad?
Why does love got to be so sad?
Why does love got to be so, ooh

Woah
Why does love got to be so
Why does love got to be so"
