,Artist,Title,Track_id,Year,Lyrics
0,Shangri Las,Give Us Your Blessings,TRJBICQ128F932EABD,1965,"Run, run, run
Mary, run, run, run
Jimmy, run, run, run
Mary, run, run, run

Mary and Jimmy were both very young
But as much in love
As two people could be
And all they wanted
Was to share that love eternally

They went to their folks they told them
That someday soon they'd be wed
Their folks just laughed
And called them kids
So Mary said

Give us your blessing
Please don't make us run away
Give us your blessing
Say you'll be there on our wedding day

They wouldn't have laughed at Mary
If they could have seen through the door
But Jimmy was waiting in the car
While Mary begged once more

Give us your blessing
Please don't make us run away
Give us your blessing
Say you'll be there on our wedding day

Well as they drove off they were crying
And nobody knows for sure
That, that's why they didn't see the sign
That road detour

The next day they found them
Mary and Jimmy were dead
And as their folks
Knelt beside them in the rain
They couldn't help but hear
The last words that Mary and Jimmy had said

Give us your blessing
Please don't make us run away
Give us your blessing
Say you'll be there on our wedding day

Run, run, run
Mary, run, run, run
Jimmy, run, run, run
Mary, run, run, run"
1,Dusty Springfield,Packin' Up,TRKINTI128F14637FB,1965,"So if I give up (yes, I'm packin' up)
Movin' out of the town (movin' out of the town)
Packin' up (yes, I'm packin' up)
Movin' out of the town (movin' out of the town)
I'm not chained and I'm no longer bound

Said if I get up (yes, I'm packin' up)
Movin' out of the town (movin' out of town)
Oh yeah (yes, I'm packin' up)
Movin' out of the town (movin' out of the town)
I'm not chained and I'm no longer bound

My suitcase's ready
My clothes are too
And these are the things
You took me through

My friends told me
All about you
That men are evil
The things you do
And I keep on (I'm not chained and I'm no longer bound)

And then I'm packin' (yes, I'm packin' up)
Movin' out of the town (movin' out of the town)
Oh yeah (yes, I'm packin' up)
Movin' out of the town (movin' out of the town)
I'm not chained and I'm no longer bound

Now that I'm gone
Just look at me
I'm looking better than
Any girl you see

I've gotta brand new clothes
I gotta diamond ring
I gotta brand new man
He give me everything
So keep on (I'm not chained and I'm no longer bound)

And then I'm movin' (movin' movin')
Oh, movin' (movin' movin')
And I gotta move (movin' movin')
And I wanna move (movin' movin')
Oh yeah (movin' movin')
And I gotta move (movin' movin')
And I gotta move (movin' movin')
And I gotta move (movin' movin')
Start packin' up (movin' movin')
Start packin' up (movin' movin')
Start packin' up (movin' movin')
Movin' out of town (movin' movin')
Alright (movin' movin')
Yeah, yeah (movin' movin')
Start packin' up (movin' movin')"
2,Fontella Bass,Rescue Me,TRVJYRX12903CBCA51,1965,"Rescue me
Or take me in your arms
Rescue me
I want your tender charms
Cause I'ma lonely and
I'm blue
I need you
And your love too
C'mon and rescue me
C'mon baby and rescue me
C'mon baby and rescue me
Cause I need you, by my side
Can't you see that I'm lonely?
Rescue me
C'mon and take my heart
Take your love and conquer every part
Cause imma lonely and I'm blue
I need you
And your love too
C'mon and rescue me
C'mon baby and rescue me
C'mon baby and rescue me
Cause I need ja need ja by my side
Can't you see that I'm lonely?
Rescue me
Or take me in your arms
Rescue me
I want your tender charms
Cause I'm a lonely and blue
I need you
And your love too
C'mon on and rescue me
C'mon baby
Take me baby
Hold me baby
Love me baby
Can't you see that I need you baby?
Can't you see that I'm lonely?
Rescue me
C'mon and take my hand
C'mon baby and be my man
Cause I love you
Cause I want you
Can't you see that I'm lonely?
Mhm, mhm, mhm, mhm
Take me baby, (take me baby)
Love me baby, (love me baby)
Need me baby, (need me baby)
Mhm, mhm, mhm
Can't you see that I'm lonely baby?
Rescue me
Rescue me
Mhm, mhm, mhm"
3,Buffy Sainte-Marie,Johnny Be Fair,TRBXUYO128F92FAF16,1965,"Well, Johnny be fair and Johnny be fine and wants me for to wed 
And I would marry Johnny, but my father up and said 
I'm sad to tell you daughter what your mother never knew 
But Johnny is a son of mine and so he's kin to you 

Well, Jimmy be fair and Jimmy be fine and wants me for to wed 
And I would marry Jimmy, but my father up and said 
I'm sad to tell you daughter what your mother never knew 
But Jimmy, too, is a son of mine and so he's kin to you 

Well, Billy be fair and Billy be fine and wants me for to wed 
And I would marry Billy, but my father up and said 
I'm sad to tell you daughter what your mother never knew 
But Billy, too, is a son of mine and so he's kin to you 

You never seen a girl so sad and sorry as I was 
The boys in town are all my kin and my father is the pa 
If this continue I shall die a single miss 
So I'll go to mother and complain to her of this 

Oh daughter, haven't I taught you to forgive and to forget 
Even if this all is true, still you needn't fret 
Your father may be father to all the boys in town, still 
He's not the one who sired you, so marry who you will"
4,Son House,Pearline,TRSJXGK128F427E840,1965,"Mmmm, Pearline, Pearline
Yeah oh Pearline
Matter with you?
Don't care what I do

Mmmmm, mmmm, mmmmm, mmmmmm

Love you Pearline
Love you Pearline
I love you Pearline

Mmmmm, mmmm, mmmmm, yeah"
5,Otis Redding,For Your Precious Love,TRVVBQD12903CAF5ED,1965,"For your precious love means more to me
Than any love could ever be
For when I wanted you I was so lonely and so blue
For that's what love will do

Darling, I'm so surprised,
Oh, when I first realized
That you were fooling me
Darling, they say that our love won't grow
I just want to tell them that they don't know
For as long as you, long as you are loving me
Our love will grow wider, deeper than any sea
And all the things in the world, in this whole wide world
Is just that you would say that you'd be my girl

(Wanting you) Wanting you,
(I'm lonely and blue) Whoa, lonely
That's what love will do

For your precious love means more to me
Than any love could ever be
For when I, I wanted you I was so lonely and so blue
That's what love will do"
6,Phil Ochs,I Ain't Marching Anymore (Alternate Version),TRYOFPH128F1473B1E,1965,"Oh, I marched to the battle of New Orleans,
At the end of the early British wars.
The young land started growing,
The young blood started flowing.
But I ain't a-marching anymore!

Oh I killed my share of Injuns in a thousand different fights,
I was there at the Little Big Horn.
I heard many men a-lying,
I saw many more a-dying.
But I ain't a-marching anymore!

It's always the old to lead us to the wars,
Always the young to fall.
Now look at what we've won with a saber and a gun.
Tell me is it worth it all?

For I stole California from the Mexican land,
Fought in the bloody Civil War.
Yes, I even killed my brothers,
And so many others.
But I ain't a-marching anymore!

For I marched to the battle of the German trench,
In a war that was bound to end all wars.
Oh I must have killed a million men,
And now they want me back again.
But I ain't a-marching anymore!

It's always the old to lead us to the wars,
Always the young to fall.
Now look at what we've won with a saber and a gun.
Tell me is it worth it all?

For I flew the final mission in the Japanese sky,
Set off the mighty mushroom roar.
But I saw the cities burnin',
And I knew that I was learnin',
That I ain't a-marching anymore!

Now the labor leader's screamin' when they closed the missile plant,
United Fruit screams at the Cuban shore.
Call it peace or call it treason,
Call it love or call it reason.
But I ain't a-marching anymore!
I ain't a-marching anymore!"
7,Smokey Robinson & The Miracles,My Girl Has Gone,TRKPZAC128E079429B,1965,"When you were mine I loved you so much
A got a thrill from your every touch
You went away with somebody else
Now all I can say to comfort myself

Is that my girl has gone and said goodbye
Don't you cry, hold your head up high
Don't give up, give love one more try
'Cause there's a right girl for every guy

Baby, all your love wasn't right for me
Good for another it well may be
Some girls just weren't made for some guys
Now I've got to make myself realize

That my girl has gone (yes she has)
And said goodbye (I tell myself that)
Don't you cry, hold your head up high
(Keep on trying)
Don't give up, give love one more try
(Believe me now)
There's a right girl for every guy, oh yeah

I've got the feelin'
Yeah, yeah, yeah, yeah baby

Now happiness and all the best
That's all that I wish for you, oh yeah
Don't be like me in misery
I'm feelin' so sad and blue
I said I'm sad and I'm blue, oh yeah
Sad and I'm blue, I said I'm sad and I'm blue

Because my girl has gone
And said goodbye (and I tell myself)
Don't you cry, hold your head up high
(Keep on trying)
Don't give up, give love one more try
(Believe me now)
There's a right girl for every guy, oh yeah

(And I can't go on if I hear you say)
Girl has gone (yes you can) and said goodbye
(And I start to cry, I say)
Don't you cry, hold your head up high
(Ooowweeee! )
Don't give up, give love one more try
(One time now)
There's a right girl for every guy, oh yeah

Sing it slow now children..."
8,Otis Redding,It's Too Late,TRQXTXV128F4276278,1965,"Wished i had told her
Ooh she was my only one
But it's too late, it's too late
She's gone

It's too late, she's gone now
I know she's gone now
It's too late, my baby's gone now
I need her loving
Oh more than anyone ooh
But it's too late, i know it's too late
She's gone

It's a weak man that cry now
So I guess I better
Guess I better dry my weeping eyes now
I need her loving
More than anyone oh
But it's too late
It seems like it's too late
She's gone

She's gone, my baby's gone,
She's gone, oh my baby, she's gone
She's gone, my baby's she's gone
But where can, where can my my baby be

Lord, I wonder sometimes
Does she really know
Does she really know
Does she really know when she left me
Oh it hurt little heart so now
I need your loving
Please don't make me wait
Lord, but it's too late, it's too late
She's gone
I need your loving
Oh more than anyone
Don't let it be too late
No, don't let it be too late
But she's gone

Wished I had told her
Ooh she was my only one
Ooh but it's too late
I know it's to late
She's gone
Wished I had told her
Oh she was the only one..."
9,Bert Jansch,Strolling Down The Highway,TRHMQAO128F9328C24,1965,"Strolling down the highway
I'm gonna to get there my way
Dusk 'till dawn I'm walking
Can you hear my guitar rockin'?
While I stroll on down, on down the highway

People think I'm a crazy
But lord above ain't lazy
The sun shines all day long
The garlic's far too strong
While I stroll on down, on down the highway

While I stroll on down, on down the highway

The cars won't stop for no one
They'd all think your just a rollin' bum
They think you are a spy
Gonna shoot them as a they go by
No, the cars they won't stop, won't stop for no one

Strolling down the highway
I'm gonna to get there my way
Dusk 'till dawn I'm walking
Can you hear my guitar rockin'?
While I stroll on down, on down the highway"
10,Phil Ochs,Links On The Chain (LP Version),TRIURPE128F1473B17,1965,"Come you ranks of labor, come you union core
And see if you remember the struggles of before
When you were standing helpless on the outside of the door
And you started building links on the Chain
On the Chain, you started building links on the Chain

When the police on the horses were waitin' on demand
Ridin' through the strike with the pistols in their hands
Swingin' at the skulls of many a union man
As you built one more link on the chain, on the chain
As you built one more link on the chain

Then the army of the fascists tried to put you on the run
But the army of the union, they did what could be done
Oh, the power of the factory was greater than the gun
As you built one more link on the chain, on the chain
As you built one more link on the chain

And then in 1954, decisions finally made
The black man was a-risin' fast and racin' from the shade
And your union took no stand and your union was betrayed
As you lost yourself a link on the chain, on the chain
As you lost yourslef a link on the chain

And then there came the boycotts and then the freedom rides
And forgetting what you stood for, you tried to block the tide
Oh, the automation bosses werre laughin' on the side
As they watched you lose your link on the chain, on the chain
As they watched you lose your link on the chain

You know when they block your trucks boys, by layin' on the road
All that they are doin' is all that you have showed
That you gotta strike, you gotta fight to get what you are owed
When you're building all your links on the chain, on the chain
When you're building all your links on the chain

Amd the man who tries to tell you that they'll take your job away
He's the same man who was scabbin' hard just the other day
And your union's not a union till he's thrown out of the way
And he's chokin' on your links of the chain, of the chain
And he's chokin' on your links of the chain

For now the times are tellin' you the times are rollin' on
And you're fighting for the same thing, the jobs that will be gone
Now it's only fair to ask you boys, which side are you on?
As you're buildin' all your links on the chain, on the chain
As you're buildin' all your links on the chain"
11,The Rolling Stones,I Can't Be Satisfied,TRQWNSC128F9310F15,1965,"Well I'm going away to live
Won't be back no more
Going back down south, child
Lord now don't you worry ma 

Woman I'm trouble
Trouble and all worried mind
Well I just can't be satisfied
Just can't keep on crying 

Well I feel like snapping
Pistol in your face
Going to let some graveyard
Lord be your resting place 

Woman I'm trouble
Trouble and all worried mind
Yeah I just can't be satisfied
Just can't keep on crying
Yeah 

Yeah I'm all in my sleep
Hear my doorbell ring
Looking for my baby
Lord seen a doggone thing 

Woman I'm trouble
Trouble and all worried mind
Yeah I just can't be satisfied
Just can't keep on crying 

Yeah I know my little old babe
She gonna jump and shout
That old train be late man
Lord I come walkin out 

Woman I'm trouble
Trouble and all worried mind
Yeah I just can't be satisfied
Just can't keep on crying
Well"
12,Chad & Jeremy,Sleep Little Boy,TRLBEDW128F92D86B6,1965,"Alquist

Sleep little boy
Sleep and be warm as May
Take a voyage to dreamland far away
Ride on a cloud
Run down the milky way
Fill your pockets with moonbeams
Far, far away

Sleep, sleep
Rest your head and be happy
Softly, softly
Sing this song with me

Sleep little boy
Soon you will be a man
There is nothing to harm you
I'll hold your hand"
13,Peter_ Paul and Mary,The First Time Ever I Saw Your Face (LP Version),TRYRCVP12903CBFADD,1965,"The first time ever I saw your face
I thought the sun rose in your eyes
And the moon and stars were the gifts you gave
To the dark and the empty skies my love
To the dark and the empty skies. 

The first time ever I kissed your mouth
I felt the earth move in my hand
Like the trembling heart of a captive bird
That was there at my command my love
That was there at my command. 

The first time ever I held you near
And felt your heartbeat close to mine
I thought our joy would fill the world
And would last till the end of time my love
And would last till the end of time."
14,Shangri Las,Right Now And Not Later,TRNUTMH128F932EA8E,1965,"Listen to me, baby, and listen real good.
You know you're not treating me as good as you should.
Every time I call you here by my side,
Ya have some excuse and I want to know why.
 
Right now and not later, baby.
Right now and not later.
'Cause later may be too late,
And I gotta know right now.
I mean right now and not later, baby.
Right now and not later, baby.
 
There's something wrong and it's starting to show.
An' I don't wanna be the last to know.
So, if there's someone else standing in our way,
Then I think there's somethin' that you oughta say.
 
Right now and not later, baby.
Right now and not later.
'Cause later may be too late,
And I gotta know right now.
I mean right now and not later, baby.
Right now and not later, baby.
 
If we can't be lovers we can still be friends.
'Cause life goes on, even though love ends.
Boy, if you still want romance,
Baby, I'll give you just one more chance.
 
Right now and not later, baby.
Right now and not later.
'Cause later may be too late,
And I gotta know right now.
I mean right now and not later, baby.
Right now and not later, baby.
Right now and not later, baby.
Right now and not later, baby.
Right now and not later, baby.
Right now and not later..."
15,Little Anthony & The Imperials,Take Me Back,TRBDARS128F145D0A6,1965,"Written by: Teddy Randazzo
#16 Jun '65 Hot 100

(CHORUS)
Take me back, I'm begging please
Take me back, I'm on my knees
For you to scold me
Hurt me, hold me
Darling, take me back

When you belonged to me
I had a jealous mind
Too late I learned that you
Were not the cheating kind

(CHORUS)

My jealous eyes have learned
To take a look or two
They were too blind to see
That I was losing you

(CHORUS)

They say you live and learn
And though I've tried before
I promise never to
Be jealous any more

(CHORUS)"
16,The Turtles,Eve Of Destruction (Stereo),TRPATVF128F42530A8,1965,"The eastern world it is explodin',
violence flarin', bullets loadin',
you're old enough to kill but not for votin',
you don't believe in war, what's that gun you're totin',
and even the Jordan river has bodies floatin',
but you tell me over and over and over again my friend,
ah, you don't believe we're on the eve of destruction.

Don't you understand, what I'm trying to say?
Can't you see the fear that I'm feeling today?
If the button is pushed, there's no running away,
There'll be no one to save with the world in a grave,
take a look around you, boy, it's bound to scare you, boy,
but you tell me over and over and over again my friend,
ah, you don't believe we're on the eve of destruction.

Yeah, my blood's so mad, feels like coagulatin',
I'm sittin' here, just contemplatin',
I can't twist the truth, it knows no regulation,
handful of Senators don't pass legislation,
and marches alone can't bring integration,
when human respect is disintegratin',
this whole crazy world is just too frustratin',
and you tell me over and over and over again my friend,
ah, you don't believe we're on the eve of destruction.

Think of all the hate there is in Red China!
Then take a look around to Selma, Alabama!
Ah, you may leave here, for four days in space,
but when your return, it's the same old place,
the poundin' of the drums, the pride and disgrace,
you can bury your dead, but don't leave a trace,
hate your next-door-neighbor, but don't forget to say grace,
and you tell me over and over and over and over again my friend,
ah, you don't believe we're on the eve of destruction."
17,The Zombies,Tell Her No,TRNXHVX12903CA55E5,1965,"And if she should tell you ""come closer""
And if she tempts you with her charms

Tell her no  no  no  no  no-no-no-no
No  no  no  no  no-no-no-no
No no no no no
Don't hurt me now for her love belongs to me

And if she should tell you ""I love you"", whoa-oh-oh
And if she tempts you with her charms

Tell her no  no  no  no  no-no-no-no
No  no  no  no  no-no-no-no
(Don't let her love for your arms)
No no no no no
Don't hurt me now for her love belongs to me

I know she's a kind of girl
Who'd throw my love away
But I still love her so
Don't hurt me now, don't hurt me now

If she tells you ""I love you"" whoa-oh-oh
Just remember she said that to me

Tell her no  no  no  no  no-no-no-no
No  no  no  no  no-no-no-no
(Don't take her love from my arms)
Oh, oh, oh, oh,
Don't leave me now for her love belongs to me"
18,Jody Miller,Queen Of The House,TRYDZZC128F9337DF5,1965,"Up every day at six
Bacon and eggs to fix
Four kids from one to four
Pretty soon, there'll be one more

I got old floors to wax and scrub
And there's a dirty old ring in the tub
I'll get a maid someday, but 'til then I'm
Queen of the house

No time to fix my hair
Need a new dress to wear
Old clothes will have to do
'Cause the kids all need new shoes

I got bridge club each Tuesday night
He goes out with the boys and gets tight
But when the evenin's through, he comes a-home to
Queen of the house

I know the milkman, the iceman, they come every day
They give me tips on the horses to play
And when I got the time to spare 
I sit and wish that I'd picked a rich millionare

I sing up every day at six
Bacon and eggs to fix
Four kids from one to four
Pretty soon there'll be one more

Oh by Sundays I'm mighty glad
We send the kids to his Mom and Dad
It's the day that makes me glad I'm
Queen of the house

Up every day at six
Bacon and eggs to fix
Four kids from one to four
Pretty soon there'll be one more

But Sundays I'm mighty glad
We send the kids to his Mom and Dad
It's the day that makes me glad I'm
Queen of the house"
19,The Seeds,Can't Seem To Make You Mine,TRDLYRC128F425F8A7,1965,"I can't seem to make you mine
Kissing all around all the time
You fly around like a bee
Hurtin' everything you see
I try everything I know
To make you wanna love me so
The only thing you do
Is try to put the hurt on me

Can't you see what you're doin' to me
You fill my heart with misery
With every breath and step I take
I'm more in love with you

I can't go on like this
A little bit of love and not one kiss
I've gotta have your love every day
Love that's real and will stay
I can't seem to make you mine
I can't seem to make you mine

I can't seem to make you mine
I can't seem to make you mine

Come back baby, 'cause I'm all alone
Come back darlin', 'cause I need your love
Come back, 'cause I wanna love ya
Girl, I wanna love ya tonight

I can't seem to make you mine
I can't seem to make you mine
I can't seem to make you mine
I can't seem to make you mine"
20,Gerry & The Pacemakers,I'll Be There,TRGYCTF12903CEC3C6,1965,"(Words &amp; music by Bobby Darin)
I'll be there when all your dreams are broken
To answer your unspoken prayer, oh....
When the little things you're doin', ooh, don't turn out right
Don't you worry darlin' I'll be there
There whenever you need to know that there is someone who cares, oh
yeah!
So if your new love isn't your true love
Don't you worry darlin', I'll be there
There whenever you need to know that there is someone who cares, oh
yeah!
So if your new love isn't your true love
Don't you worry darlin', I'll be there
Don't you worry darlin', I'll be there
Don't you worry darlin', I'll be there"
21,Righteous Brothers,Just Once In My Life,TRFHEOU128F9337649,1965,"There's a lot of things I want
A lot of things that I'd like to be
But girl I don't forsee a rags to riches story for me
It's just one little thing I got to make come true
It's just one round I've got to win
I can't be a loser with you

Baby baby just once in my life
I'm gonna get what I want girl don't let me down
Just once in my life let me hold on to
The good thing I found don't let me down
Baby say that you'd be staying

Cause I couldn't face the day if you weren't here by my side
And if you went away then I'd be left without any pride
I've given up on schemes cause everyone fell through
I've given up so many things don't ask me to give up on you

And baby, baby just once in my life
I'm gonna get what I want girl don't let me down
Just once in my life
Let me hold on to the good thing I found don't let me down
Baby say that you'd be staying

That old pot of gold ain't so easy to find
But if you'll stand by me
Girl I'll keep peace of mind
I can't give you the world
But I'll work hard for you girl
I'll work hard, everyday, all my life,
If you'll say you won't leave me,
Baby don't leave me,
Please don't leave me
Baby don't leave me,
Just do this for me baby,

Once in my life, let me get what I want,
Girl don't let me down;
Just once in my life, let me hold onto a good thing I've found, don't
Let me down,
Baby say that you'll be stayin' Mmmm,
Oh yeah, Mmmm

Just once in my life let me get what I want,
Girl don't let me down;
Just once in my life let me hold onto
A good thing I've found, don't let me down. (fade)"
22,The Mamas & The Papas,California Dreamin',TRJLCZV128F92F568A,1965,"All the leaves are brown (all the leaves are brown)
And the sky is gray (and the sky is gray)
I've been for a walk (I've been for a walk)
On a winter's day (on a winter's day)

I'd be safe and warm (I'd be safe and warm)
If I was in L.A. (if I was in L.A.)
California dreamin' (California dreamin')
On such a winter's day

Stopped into a church
I passed along the way
Well, I got down on my knees (got down on my knees)
And I pretend to pray (I pretend to pray)

You know the preacher likes the cold (preacher likes the cold)
He knows I'm gonna stay (knows I'm gonna stay)
California dreamin' (California dreamin')
On such a winter's day

All the leaves are brown (all the leaves are brown)
And the sky is gray (and the sky is gray)
I've been for a walk (I've been for a walk)
On a winter's day (on a winter's day)

If I didn't tell her (if I didn't tell her)
I could leave today (I could leave today)
California dreamin' (California dreamin')
On such a winter's day (California dreamin')
On such a winter's day (California dreamin')
On such a winter's day"
