,Artist,Title,Track_id,Year,Lyrics
116,Nina Simone,Porgy,TRFPKMJ128F429950D,1960,"Dorothy Fields, Jimmy MacHugh 

This song talk about the same Porgy
That we've talked about for two years now
His name is Porgy only this one was written by eh
Dorothy Fields and Jimmy McHugh

I got my man now I got Porgy
My baby understands now I got my Porgy
I'm through with bymays his way is may way forever more
Lord when i feel his arms around me
Knowing he can't go on without me
I wants to beg for a chance to camp at his door

Say he's not much for to look and see
He's lazy and no count as he can be
He's got the kind of a love for me
So I'm changing my style my way of living
Glad I've stopped taking and started giving
I got my man got my Porgy now

Though you say he's not much for to look and see
He's lazy and no count as he can be
He's got the kind of a love for me
Oh oh baby I'm changing my style nad way of living
Glad I've stopped taking and started giving
I got my man I got my Porgy now"
117,Oscar Brown Jr.,Work Song,TRBIJOA128F4270419,1960,"Breaking rocks out here on the chain gang
Breaking rocks and serving my time
Breaking rocks out here on the chain gang
Because they done convicted me of crime
Hold it steady right there while I hit it
Well reckon that ought to get it
Been working and working
But I still got so terribly far to go

I commited crime lord I needed
Crime of being hungry and poor
I left the grocery store man bleeding (breathing? )
When they caught me robbing his store
Hold it steady right there while I hit it
Well reckon that ought to get it
Been working and working
But I still got so terribly far to go

I heard the judge say five years
On chain-gang you gonna go
I heard the judge say five years labor
I heard my old man scream ""lordy, no!""
Hold it right there while I hit it
Well reckon that ought to get it
Been working and working
But I still got so terribly far to go

Gonna see my sweet honey bee
Gonna break this chain off to run
Gonna lay down somewhere shady
Lord I sure am hot in the sun
Hold it right there while I hit it
Well reckon that ought to get it
Been workin' and workin'
Been workin' and slavin'
An' workin' and workin'
But I still got so terribly far to go"
118,Oscar Brown Jr.,Dat Dere,TRBAFOK128F42734D4,1960,"Hey mama, what's that there?
And what's that doing there?
Hey mama, up here! Mama, hey look at that over there!
And what's that doing there?
And where're they going there?
And mummy can I have that big elephant over there?

Who's that in my chair?
And what's he doing there?
Mummy, up here!
Mummy, can I go over there?
Hey mummy, what is square?
And where do we get air?
And mummy can I have that big elephant over there?

Quit talking!
There's no more anything here!
Forever to manage to know who and why and where!
Quit that, child!
Sometimes the questions get filed!
And mummy can I have that big elehpant over there?

Don't wanna comb my hair
And where's my teddy bear?
Mummy, up here!
Look at the cowboy coming there!
And can I have a pair
Of boots like that to wear?
And mummy can I have that big elephant over there?

Time will march
Days will go
And little baby's going to grow
I gotta tell her what she needs to know
I'll help her along
And she'll be strong
And she'll know right from wrong

As life's parade goes marching by
She's gonna need to know some reasons why
I don't have all the answers
But I'll try the best as I can
I'll make him a man, that's right

'Cause you give the kid your best
And hope she passes the test
And I find it so hard I taught him well ***
Somewhere though she's going I betting I never will forget ***
Mummy, can I have that big elephant over there?

Hey why they do that there?
And how you put that there?
Hey mummy, up here! Hey mummy, what that say up there?
Hey mummy, what is fair?
How come I have to share?
And mummy can I have that big elephant over there?"
119,Paul Anka,You Are My Destiny,TRHBWQF128F933687C,1960,"You are my destiny
You are what you are to me
You are my happiness
That's what you are

You have my sweet caress
You share my loneliness
You are my dream come true
That's what you are

Heaven and heaven alone
Can take your love from me
'Cause I'd be a fool
To ever leave you dear
And a fool I'd never be

You are my destiny
You share my reverie
You're more than life to me
That's what you are

You are my destiny
You share my reverie
You are my happiness
That's what you are"
120,Paul Anka,Crazy Love,TRQWDIW12903CD571A,1960,"Crazy love it's just a crazy love 
I love you so but I still know 
It's a crazy love 

Crazy love it's just a crazy love 
What must I do to get through to you 
Oh my crazy love 

Everything's wrong heaven above 
Set me free from this crazy love 

Don't don't don't don't you see 
What you are doing to me 
You upset my heart right from the start 
With your crazy love 
Crazy love,crazy love 
Crazy love,crazy love"
121,Paul Anka,Lonely Boy,TRZWQHU12903CC7A67,1960,"I'm just a lonely boy
Lonely and blue
I'm all alone
With nothin' to do

I've got everything
You could think of
But all I want 
Is someone to love

Someone, yes someone to love
Someone to kiss
Someone to hold
At a moment like this

I'd like to hear
Somebody say
I'll give you my love
Each night and day

I'm just a lonely boy
Lonely and blue
I'm all alone
With nothin' to do

I've got everything
You could think of
But all I want 
Is someone to love

Somebody, somebody, somebody, please
Send her to me
I'll make her happy
Just wait and see

I've prayed so hard
To the heavens above
That I might find
Someone to love

I'm just a lonely boy
Lonely and blue
I'm all alone
With nothin' to do

I've got everything"
122,Paul Anka,I Love You Baby,TRZFYYM12903CE1A12,1960,"As I walk by the seaside
As I walk through the grass
I see little bluebirds
Making love while I pass
Bees are hummin' and they're singin' everywhere
Everyone's in love

Oh oh
I love you baby, I love you so
I need you honey, I'll never let you go
'Cause you're the girl in my heart
You're the one I adore
And I-I I love you

As I walk by the schoolyard
As I walk by the gate
I see the weeping willow
Where we kissed on every date
And carved in the bark
You'll find an arrow and a heart
And underneath it says

Oh oh
I love you baby, I love you so
I need you honey, I'll never let you go
'Cause you're the girl in my heart
You're the one I adore
And I-I I love you

[Instrumental Interlude]

As I walk to the corner
And I pass the candy store
I hear the very music
That I once heard before
Oh how you held me as the music softly played
I was so in love

Oh oh
I love you baby, I love you so
I need you honey, I'll never let you go
'Cause you're the girl in my heart
You're the one I adore
And I-I I love you
I-I I love you
I-I I love you

[Fade]"
123,Perez Prado,Patricia,TRHFVSF128EF3476C4,1960,"Kiss her and your lips will always want Patricia
Stroll her, see Patricia move with all her charms
Mambo, Cha-cha, or Meringue it's Patricia
Heaven, that's where you'll be when she's in you're arms
[Instrumental Interlude]
??? in Japan they brag about the Geisha
Who cares, long Uncle Sam has got Patricia
Eyes that have a starry sort of gleam for you
She is like a million dollar dream come true
Everybody wishes they'd could steal her heart away, I guess
There's so many trying but she never, never will say yes
Eyes that have a starry sort of gleam for you
She is like a million dollar dream come true
Kiss her and your lips will always want Patricia
Stroll her, see Patricia move with all her charms
in Japan they brag about the Geisha
Who cares, long Uncle Sam has got Patricia"
124,Sam Cooke,Wonderful World,TRMKOLR128F92FE7E0,1960,"Don't know much about history
Don't know much biology
Don't know much about a science book
Don't know much about the French I took

But I do know that I love you
And I know that if you love me, too
What a wonderful world this would be

Don't know much about geography
Don't know much trigonometry
Don't know much about algebra
Don't know what a slide rule is for

But I do know one and one is two
And if this one could be with you
What a wonderful world this would be

Now, I don't claim to be an A student
But I'm trying to be
For maybe by being an A student, baby
I can win your love for me

Don't know much about history
Don't know much biology
Don't know much about a science book
Don't know much about the French I took

But I do know that I love you
And I know that if you love me, too
What a wonderful world this would be

La ta ta ta ta ta ta (History)
Hmm-mm-mm (Biology)
La ta ta ta ta ta ta (Science book)
Hmm-mm-mm (French I took)

Yeah, but I do know that I love you
And I know that if you love me, too
What a wonderful world this would be"
125,Sam Cooke,Stealing Kisses,TRIRNUE12903D01F99,1960,"Stealing kisses, precious kisses
You should be ashamed, I trust in you
Stealing kisses, someone's kisses
Starting a romance that wasn't meant for you

I begged and begged you to be careful
But you were always acting smart
You kept on
Stealing kisses, precious kisses
And suddenly you stole my heart

(Stealing kisses, precious kisses)
You should be ashamed I trusted you
(Stealing kisses, someone's kisses)
Starting a romance that wasn't meant for you
(I begged and begged you to be careful)
But you were always acting so smart

Stealing kisses, precious kisses
You should be ashamed, I trust in you
Stealing kisses, someone's kisses
Starting a romance that wasn't meant for you

But now I wish we never, never, never part
Stealing kisses, someone's kisses
And suddenly you stole my heart"
126,Sam Cooke,Summertime,TRPKZZT128F92FE049,1960,"Don't cry, don't cry
Don't cry no no no no
Don't cry, don't cry

It's summertime and the living is easy
Fish are jumping and the cotton is high
Your daddy's rich and your mama's good-looking
Hush, little baby don't you cry
Don't cry, don't cry
Don't cry no no no no
Don't cry, don't cry

One of these mornings you're gonna rise up singing
You spread your wings and take to the sky
But until that morning there is nothing can harm you
With your daddy and mommy standing by
They are stnading by, I know, don't cry

Summertime, summertime, summertime
And the living is, living is easy
Fish are, I know the fish are jumping
And cotton is so high
You'r daddy is so, so rich and your mama good-
She had to be good-looking
So hush, little baby, don't you cry
Don't you cry, no no, don't cry
No need to cry, don't cry, don't cry
Summertime, summertime...."
127,Sam Cooke,I Thank God,TRUOIRU128F932BCF8,1960,"This wonderful world we live in
Is God's masterpiece of art
And I live each golden moment
With his love in my heart

I thank God
For blessing me
With eyes to see
Each wondrous day
And I thank God
For hands to help
My fellow man along the way

He gave me lips to speak the simple truth
And ears to hear to magic dreams of youth
I thank God for giving me
His blessed book with words devine
For now I know dear God I know
The miracle of life is mine

Yes Dear God I know
The miracle of life is mine"
128,Shirelles,Dedicated To The One I Love,TRXNNED128F92E1923,1960,"This is dedicated to the one I love...

While I'm far away from you, my baby,
I know it's hard for you, my baby,
Because it's hard for me, my baby,
And the darkest hour is just before dawn---

Each night before you go to bed, my baby,
Whisper a little prayer for me my baby.
And tell all the stars above
This is dedicated to the one I love...

""Life"" can never be exactly like we want it to be.
I could be satisfied knowing you love me.
But there's one thing I want you to do especially for me---
And it's something that everybody needs.

Each night before you go to bed, my baby,
Whisper a little prayer for me, my baby,
And tell all the stars above---
This is dedicated to the one I love.
This is dedicated to the one I love
This is dedicated to the one I love..."
129,Staple Singers,Will The Circle Be Unbroken,TRTTCWO128F92FBABB,1960,"Can the circle be unbroken,
By and by, Lord, bye and bye?
There's a better home a-waiting
In the sky, Lord, in the sky.

I was standing by the window
On one cold and cloudy day;
And I saw the hearse come rolling
For to carry my mother away.

Lord, I told the undertaker,
""Undertaker, please drive slow,
For this body you are hauling,
Lord, I hate to see her go.""

I followed close behind her,
Tried to hold up and be brave,
But I could not hide my sorrow
When they laid her in the grave.

Went back home, Lord. My home was lonesome
Since my mother, she was gone,
All my brothers, sisters crying.
What a home so sad and lone!

Now my mother, she's crossed over
Where so many have gone before;
And I know, Lord, I will meet her
Just waiting at glory's door."
130,The Coasters,Shoppin' for clothes,TRLXWCZ128F92E9A85,1960,"I was shopping for a suit the other day 
And walked into the department store 
I stepped on the elevator and told the girl 
""Dry goods floor"" 

When I got off I saw a salesman was coming to me 
He said ""Now, what can I do for you"" 
I said ""Well go in there and show me all the sport's clothes 
Like you're supposed to"" 

He said, ""Well, sure, come on in buddy 
Dig these fabrics we got laid out on the shelf"" 
He said ""Pick yourself out one 
Try it on, stand in the mirror and dig yourself"" 

Ohhhhhh...That suit's pure herringbone 
Ohhhhhh...Yeah, that's a suit I'd like to own 
Ohhhhhh...Buddy, that suit is you 
Ohhhhhh...Yeah, I believe it too 

I see for the business man you feature the natural shoulder 
That retail, wholesale indeed 
It's got the custom cuffs and the walking short 
He said ""And I'm gonna let you have at a steal"" 

And for the playboy you have the latest in tweed 

With the cut-away flap over twice 
It's a box-back, two button western model 
He said, ""Now ain't that nice"" 

Ohhhhhh...Them buttons are solid gold 
Ohhhhhh...You made a deal, sold 
Ohhhhhh...That collar's pure camel hair 
Ohhhhhh...Well, you can just set it down right in that chair 

(Sax interlude) 

Now you go back there and you get that paper and let me sign on the dotted line 
And I'll make sure I get all my payments in right on time 
Hey wait a minute buddy, let me go back there and do a little checking on you 
Then the man come back, he said ""I'm sorry my man but your credit didn't go through"" 
Why, what you mean 

Ohhhhhh...Ain't this a shame 
Ohhhhhh...My heart's in pain 
Ohhhhhh...Pure, pure herringbone 
Ohhhhhh...That's a suit you'll never own 
Oh, Lord have mercy"
131,The Drifters,Some Kind Of Wonderful (LP Version),TRWSXEL128F147C7A2,1960,"Wonderful wonderful 

All you have to do is touch my hand 
To show me you understand 
And something happens to me 
That's some kind of wonderful 
At any time my little world seems blue 
I just have to look at you 
And everything seems to be 
Some kind of wonderful 

I know I can't express 
This feeling of tenderness 
There's so much I wanna say 
But the right words just don't come my way 
I just know when I'm in your embrace 
This world is a happy place 
And something happens to me 

There's some kind of wonderful 

I know I can't express 
This feeling of tenderness 
There's so much I wanna say 
But the right words just don't come my way 
I just know when I'm in your embrace 
This world is a happy place 
And something happens to me 
There's some kind of wonderful 

Some kind of sweet lips 
Some kind of warm eyes 
Some kind of soft sigh 
There's only some kind of wonderful 

Oh yeah wonderful"
132,The Drifters,Sweets For My Sweet (LP Version),TRIXEWM128F147C79F,1960,"If you wanted that star that shines so brightly
To match the star dust in your eyes
Darlin', I would chase that bright star nightly
And try to steal it from the skies

'cause I would give sweets for my sweet, sugar for my honey
Your perfect kiss thrills me so
Sweets for my sweet, sugar for my honey
I'll never ever let you go

And if you needed a dream to keep you smiling
I'll tell the sandman you were blue
And I'd ask him to keep that sand a-piling
Till your dreams would come true

'cause I would give sweets for my sweet, sugar for my honey
Your perfect kiss thrills me so
Sweets for my sweet, sugar for my honey
I'll never ever let you go

If you wanted a love to last forever
Then I would send my love your way
And my love would only last forever
But forever and a day"
133,The Drifters,This Magic Moment,TRXBZLX128F9358E12,1960,"This magic moment
So different and so new
Was like any other
Until I kissed you

And then it happened
It took me by suprise
I knew that you felt it too
By the look in your eyes

Sweeter than wine
Softer than the summer night
Everything I want I have
Whenever I hold you tight

This magic moment
While you lips are close to mine
Will last forever
Forever til the end of time

Oh...
Oh...
Mm...

Sweeter than wine
Softer than the summer night
Everything I want I have
Whenever I hold you tight

This magic moment
While your lips are close to mine
Will last forever
Forever til the end of time

Oh...
Magic moment...
Magic moment...
Magic moment..."
134,The Everly Brothers,Sigh_ Cry_ Almost Die,TRMSJGB12903C9C9AF,1960,"Sigh, cry, almost die
I can’t kiss you again
This is the end
You’ve had your fun and now it’s done
I can’t love you again
This is the end

You’ve had your fun and now it’s done
Love is a waste on you
You couldn’t keep it if you tried
You go on being you
You like to see me sit and
Sigh, cry, almost die
I can’t kiss you again
This is the end

You’ve had your fun and now it’s done
Sigh, cry, almost die
I can’t kiss you again
This is the end

You’ve had your fun and now it’s done
You’ve had your fun and now it’s done
You’ve had your fun and now it’s done"
135,The Everly Brothers,Carol Jane,TRQEIZX12903C9C93F,1960,"Carol Carol Carol Jane
You're the one I love
Carol Carol Carol Jane
Came from above
Eyes of blue
Knows she's true
Carol Carol Jane
I love a-love a-love her

You make me sing
And joy you bring
I want our name
To be the same
Carol Jane

I want the world to know
That I still love you so

Carol Carol Carol Jane
You’re the one I love
Carol Carol Carol Jane
Came from above
Eyes of blue
Knows she's true
Carol Carol Jane
I love a-love a-love her
I love a-love a-love her
I love a-love a-love her
I love a-love a-love her..."
136,The Everly Brothers,Lucille,TRZCOXX12903CE02A1,1960,"Lucille,
You don't do your daddy's will
Lucille,
You don't do your daddy's will
There's ain't nothing to you,
But I love you still

Lucille,
Please come back where you belong
Lucille,
Please come back where you belong
I've been good to you baby,
Please don't leave me alone

I woke up this morning
Lucille was not in sight
Asked my friends about her,
All their lips were tight.

Lucille,
Please come back where you belong
I've been good to you baby,
Please don't leave me alone

Ooohhhhhh

Lucille,
You don't do your daddy's will
Lucille,
You don't do your daddy's will
There ain't nothing to you.
But I love you still

Ooohhhhhh"
137,The Everly Brothers,Made To Love,TREGQPZ12903C9C9A7,1960,"My father looked at me one day
Said ""Son, it's plain to see
That you're getting older
And should have a talk with me
You'll soon be going on lots of dates
As to a man you grow
And there's one important thing
Every boy should know:

Girls, girls, girls were made to love
Girls, girls, girls were made to love
That's why some have eyes of blue
That's why some stand five feet two
Girls, girls, girls were made to love""

""One day soon you'll have a date
And you’ll take her home that night
You'll wonder as you look at her,
Would a kiss be right?
The more you look, the more you'll find
Those doubts will fill your head
But think real hard and you might recall
The things your old dad said:

Girls, girls, girls were made to love
Girls, girls, girls were made to love
That's why you watch 'em walk down the street
That's why their kisses taste awfully sweet
Girls, girls, girls were made to love""
Love, love, love, love, love, love,
Love, love, love…"
138,The Everly Brothers,Memories Are Made Of This,TRJCQPH12903C9C939,1960,"Take one fresh and tender kiss
Add one stolen night of bliss
One girl, one boy
Some grief, some joy
Memories are made of this

Don't forget a small moonbeam
Fold it lightly with a dream
Your lips and mine
Two sips of wine
Memories are made of this

Then add the wedding bells
One house where lovers dwell
Three little kids for the flavour
Stirr carefully through the days
See how the flavour stays
These are the dreams, you will savour

Save His blessings from above
Serve it generously with love
One man, one wife
One love through life
Memories are made of this
Memories are made of this"
139,The Everly Brothers,Nashville Blues,TRSWBCO12903C9C941,1960,"A letter just came from Nashville
My sweet baby says she's blue
Gotta get back to Nashville
Or my heart will break in two
Oh I miss her so
I just gotta go
I've got the Nashville blues

Gotta get back to Nashville
'Cause that's where the good times are
Ever since I left Nashville
The kicks ain't been up to par
I'm lonely and low
I'm livin' too slow
I've got the Nashville blues

Wanna go see my Sally
And tell her that I still care
Want to see Printer's Alley
And dig all the cool spots there
I'm achin’ to be
In old Tennessee
I've got the Nashville blues"
140,The Flamingos,Mio Amore (LP Version),TRHBKIF128F148B6C7,1960,"Mio amore
Take my lips and a kiss them
Take my love
Take my hands and hold them
I am yours my love
Till the end of time

Mio amore
Take my arms let them hold you
Take my love
Take my eyes let them show you
I am yours my love
Till the end of time

Whoo, till the end, till the end
Till the end, till the end of time
Oh my love, oh my love, can't you see?
Woo, our love was meant to be
Oh my love, oh my love
You were meant for me

Mio amore
Take my heart and my soul
Take my love
Our love will never run cold
I am yours my love, till the end of time

Whoo, till the end
Till the end of time, of time"
141,The Flamingos,Lovers Never Say Goodbye,TRNITWR12903CB3A07,1960,"Please wait for me; for I shall return;
My love for you will forever burn
Though we must part;
There's no reason to cry
Just say so long;
Because lovers never say goodbye

I love you;
My darling more than life itself
I wouldn't try to hurt you;
For I'd only be hurting my self

Just kiss me dear;
And hold me tight;
For you know this is not our last night
Though we must part;
There's no reason to cry
Just say so long;
Because lovers never say goodbye"
142,The Hollywood Argyles,Alley Oop,TRCMVUL128F92F3148,1960,"(Alley Oop, oop, oop-oop)
(Alley Oop, oop, oop-oop)
Theres a man in the funny papers we all know (Alley Oop, oop, oop-oop)
He lived 'way back a long time ago (Alley Oop, oop, oop-oop)
He dont eat nothin' but a bear cat stew (Alley Oop, oop, oop-oop)
Well this cat's name is-a Alley Oop (Alley Oop, oop, oop-oop)

He got a chauffeur that's a genuwine dinosawruh (Alley Oop, oop, oop-oop)
And he can knuckle your head before you count to fawruh (Alley Oop, oop, oop-
oop)

He got a big ugly club and a head fulla hairuh (Alley Oop, oop, oop-oop)
Like great big lions and grizzly bearuhs (Alley Oop, oop, oop-oop)
(Alley Oop) He's the toughest man there is alive
(Alley Oop) Wearin' clothes from a wildcat's hide
(Alley Oop) He's the king of the jungle jive
(Look at that cave man go!!) (SCREAM)

He rides thru the jungle tearin' limbs offa trees (Alley Oop, oop, oop-oop)
Knockin' great big monstahs dead on their knees (Alley Oop, oop, oop-oop)
The cats don't bug him cuz they know bettah (Alley Oop, oop, oop-oop)
Cuz he's a mean motah scootah and a bad go-gettah (Alley Oop, oop, oop-oop)
(Alley Oop) He's the toughest man there is alive
(Alley Oop) Wearin' clothes from a wildcat's hide
(Alley Oop) He's the king of the jungle jive
(Look at that cave man go!!) (SCREAM)

Thair he goes, look at that cave man go
He sure is hip ain't he?
Like what's happening?
He's too much
Ride, Daddy, ride
Hi-yo dinosawruh
Ride, Daddy, ride
Get 'em, man"
143,The Louvin Brothers,The Kneeling Drunkard's Plea,TRBVBGO128F934CB79,1960,"""Lord, have mercy on me""
Was the kneeling drunkard's plea
And as he knelt there on the ground
I know that God in heaven looked down

I went down by an old country church
I saw the drunkard stagger and lurch
And as he reached his mother's grave
I saw that drunkard kneel and pray

""Lord, have mercy on me""
Was the kneeling drunkard's plea
And as he knelt there on the ground
I know that God in heaven looked down

""Bring my darling boy to me""
Was his mother's dying plea
And as he staggered through the gate
Alas, he came just one day too late

Three years have passed since she went away
Her son is sleeping beside her today
And I know that in heaven, his mother he'll see
For God has heard that drunkard's plea

""Lord, have mercy on me""
Was the kneeling drunkard's plea
And as he knelt there on the ground
I know that God in heaven looked down
I know that God in heaven looked down"
144,The Louvin Brothers,The Drunkard's Doom,TRLRHZH128F934CB51,1960,"It was on one dark and starless night
I heard and saw an awful sight
The lightning flashed, the thunder rolled
Across my dark denial soul
I saw a gulf form down below
Where all the dying drunkards go
I saw another weeping crowd
Bloodshotten eyes and voices loud
""Come here young man, we'll give you room
This is the whiskey seller's doom""

I started there, got there at last
I thought I'd take a social glass
But every time I started in,
I thought about the drunkard's den
I smashed it down and left the place
I went to seek redeeming Grace
I felt like Paul who once did pray
For God to wash his sins away

I started home to change my life
To see my loving neglected wife
I found her weeping over the bed
Because our infant babe was dead
I told her not to cry or weep
Our little baby had gone to sleep
It's little soul had passed away
To ring with Christ an endless day
I took her by her lilly white hand
She was so weak she could not stand
I knelt her down and prayed a prayer
That God might save and bless us there

And now I live a better life
In a Christian home with a loving wife"
