,Artist,Title,Track_id,Year,Lyrics
72,Tim Buckley,Bring It on Up,TRMLKMI128F9345693,1974,"Seems like in every hip conversation honey
People brag about where they all come from 
Seems like in every hip conversation, woman
I just end up sucking on my thumb
Lord I'm just a I'm just a pauper,
I been raised in a trailer park yeah,
Ain't got that much honey to brag about
I just drinkin' all alone in the dark
I said bring it on up
To my room woman
I can't carry this load alone

Well I don't need none of that phony moaning woman
No, I don't need it to get it on honey
No, take off your wig darlin' now
Throw away those pills now woman;
No, highway we're gonna roll;

Ah, you know that good king lovin' gonna make it
All right now honey, no,
Ah woman we--we're gonna' turn the tide around;
Talk about tongue to tongue, woman"
73,Bay City Rollers,Bringing Back The Good Times,TRYPJRF128F425A69B,1974,"Singing sha la la la la la
Shoo be doo aye
We're just bringing back the good times
Making our music our very own way
Just brining back the good times
Listen to the music
Sounds of yesterday
Sing a song with us
Come along with us now

As we're making our music and rocking along
Nobody asks us if it's right or wrong
Cause we're just glad to be
Doing what has to be done
Bringing back the good times. 
Woh oh
Bringing back the good times

We're playing our music and laying that beat
Just brining back the good times
Music that makes you get on your feet
Just bringing back the good times
Everbody's dancing, 
Out there on the floor
Now you gotta chance 
Now you gotta dance on

As we're making our music and rocking along
Nobody asks us if it's right or wrong
Cause we're just glad to be
Doing what has to be done
Bringing back the good times. 
Woh oh
Bringing back the good times

Playing music that tells you to clap your hands
Just bringin back the good times
Music that everyone understands
Just bringing back the good times
We want you to be happy
And dance the night away
You get the chance of the Shang A Lang if you try

As we're making our music and rocking along
Nobody asks us if it's right or wrong
Cause we're just glad to be
Doing what has to be done
Bringing back the good times. 
Woh oh
Bringing back the good times

Bringing back the good times. 
Woh Oh"
74,Albert Hammond,I Don't Wanna Die In An Air Disaster,TRJLCSC12903CC4D94,1974,"The engines spit out fire, I'm pushed back in my chair 
The pressure gives me thrills as we climb in the air 
And I love to watch the clouds and the mountains and the sky 
Swish around a cocktail the stewardess brings by 

Lord, this is the life for me 
Lord, oh Lord, this is the life for me 
But I don't wanna die in an air disaster 
I don't wanna die on a plane 

Well, I fishtail through the lanes, and I make my tires squeal 
Power at my feet and glory at the wheel 
And I wind the windows down, let the wind blow through my hair 
God knows where I'm going, but me, I don't care 

Lord, this is the life for me 
Lord, oh Lord, this is the life for me 
But I don't wanna die in a freeway pile-up 
I don't wanna die on the road 

Well, I'm young and I'm pretty, and I wanna stay that way 
Wanna be desirable 'til my dying day 
I don't wanna be bedridden, an old and bitter sage 
Have the nurses saying I'm young for my age 
(""He's young for his age."") 

Oh Lord, don't let me go that way 
Lord, oh Lord, don't let me go that way 
No, don't make me go like a fading chorus 
Don't make me fade like a song 

Lord, have mercy on your son 
Lord, oh Lord, oh Lord, have mercy on me 
'cause I don't wanna die in an air disaster 
And I don't wanna die in a freeway pile-up 
And I don't wanna go like a fading chorus 
And I don't wanna die for no good reason 

And I just wanna go on and on"
75,Puhdys,Wenn ein Mensch lebt,TRIYNTO128F428D7CA,1974,"Wenn ein Mensch kurze Zeit lebt
Sagt die Welt, dass er zu früh geht
Wenn ein Mensch lange Zeit lebt
Sagt die Welt, es ist Zeit
Meine Freundin ist schön
Als ich aufstand, ist sie gegangen
Weckt sie nicht, bis sie sich regt
Ich hab' mich in ihren Schatten gelegt

Jegliches hat seine Zeit
Steine sammeln, Steine zerstreu'n
Bäume pflanzen, Bäume abhau'n
Leben und sterben und Streit
Wenn ein Mensch kurze Zeit lebt
Sagt die Welt, dass er zu früh geht
Wenn ein Mensch lange Zeit lebt
Sagt die Welt, es ist Zeit, daß er geht

Jegliches hat seine Zeit
Steine sammeln, Steine zerstreu'n
Bäume pflanzen, Bäume abhau'n
Leben und sterben und Frieden und Streit

Weckt sie nicht, bis sie selber sich regt
Ich habe mich in ihren Schatten gelegt

Wenn ein Mensch kurze Zeit lebt
Sagt die Welt, dass er zu früh geht
Weckt sie nicht, bis sie sich regt
Ich hab' mich in ihren Schatten gelegt

Meine Freundin ist schön
als ich aufstand ist sie gegangen
Weckt sie nicht, bis sie sich regt
Ich habe mich in ihren Schatten gelegt"
76,Van Morrison,Country Fair,TRYQMHS128F42747F6,1974,"We stood and watched the river flow
We were too young to really know
In the country fair
Oh, in the country fair 

We laid out in the long green grass
And never thought that it would pass
In the country fair
In the country fair 

On an old, on an old open day
On an old rainshine open day
In the country fair
In the cool night air
In sweet summer time 

We counted pebbles in the sand
Sand like time slippin' through our hand
In the country fair
In the country fair 

On an old, on an old open day
On an old raintrack open day
In the country fair
In the cool night air
In sweet summer time 

Hmmm mmmm
On an old open day
On an old
Pinecone open day"
77,Cher,Needles And Pins (1990 Digital Remaster),TRLFDPV128F145AFE8,1974,"Saw him today
I saw his face, it was the face I love
And I knew I had to run away
And get down on my knees and pray
That they go away but still they begin

Needles and pins
Because of all my pride
The tears I gotta hide
Hey I thought I was smart
I'd won his heart
I didn't think I'd lose
But I see she worst to him than me
Let him go ahead take her love instead
And one day he will see
Just how to say please

Wow and get down on his knees
That's how it begins
Hurtin' him hurtin' him
Why can't I stop and tell myself
It's wrong so wrong
Why can't I stand up
Tell myself to be strong

Because I saw him today
I saw his face it was the face I love
I can't let go, although I know
He'll make me cry until the day I die

But people I got to live now
Wow Lord knows I should forgive now
That's how they begin
You'll feel those needles and pins

Somebody stop'em now
Stop those needles and pins
Somebody take'em away now
Stop those needles and pins

Somebody stop'em now
Stop those needles and pins
Somebody take'em away now
Stop those needles and pins"
78,Nana Mouskouri,Turn On The Sun,TRSFECE128F933795A,1974,"Turn on the sun, turn on the sun
Light up the world, come everyone
Turn off the wind, thunder and rain
Turn on the sun, let's smile again
Turn on the sun, let's smile again

Thinker,tailor man
Radiate all the love you can
Lawyer, engineer
Let your heart be a pioneer

Turn on the sun, turn on the sun
Open the doors, come tell everyone
Bad times are out,good times are in
Turn on the sun, let's smile again

Minors,steeple-jack
Warm emotions are coming back
Sailor, stevedore
Here's a message you can't ignore

Turn on the sun, turn on the sun
Light up the world,come everyone
Turn off the wind, thunder and rain
Turn on the sun, let's smile again

Gather up all the goddness in you
Turn on the sun,turn on the sun
What a world when we all thinking good
Turn on the sun, let's smile again

Turn on the sun, turn on the sun
Open the doors, come tell everyone
Bad times are out,good times are in
Turn on the sun, let's smile again"
79,Hatfield And The North,Big Jobs (Poo Poo Extract),TRONWLI128F1458DB7,1974,"Here's a song to begin the beginning
A few notes which are arbitrary
But we try our best to make it sound nice
And hope that the music turns you on to our latest L.P.
Should be a laugh certainly"
80,Little Feat,Skin It Back,TRXMUIV128F9344356,1974,"Barrère

Well I'm waitin' for something to take place
Something to take me away from this race
'Round city to city, town to town
Runnin' around in the shoes of a clown
And that desperate, no count, desperado
A depot of love, my business is the street
I be shakin' 'em down, oh Colorado
Texas she's nice but Georgia's oh so sweet
Steal away with me darlin', your lovin' just can't be beat
So it seems that the world keeps on turnin' but so what
I don't doubt it, it just keeps on the move
You're a dream and that's all that I ask for
So well now, I'm wonderin' just how I'm gonna tell it to you
Skin it back  (skin it back).

Somethin' real, somethin' to feel
I can't find a soul who'll take on this mess
It's those rock and roll hours
Early graves without flowers
Please, please darlin' put my mind at rest 
I'm beggin', please darlin' put my mind at rest
So it seems that the world keeps on turnin' but so what
I don't doubt it, it just keeps on the move
You're a dream and that's all that I ask for
So well now, I'm wonderin' just how I'm gonna tell it to you
Skin it back, tell it to you 
Skin it back, tell it to you
Skin it back, tell it to you
Skin it back, tell it to you."
81,Elton John,The Bitch Is Back,TRKZKWA128F92F59AE,1974,"I was justified when I was five
Raising Cain, I spit in your eye
Times are changing, now the poor get fat
But the fever's gonna catch you when the bitch gets back

Eat meat on a Friday, that's alright
Even like steak on a Saturday night
I can bitch the best at your social do's
I get high in the evening sniffing pots of glue

I'm a bitch, I'm a bitch
Oh, the bitch is back
Stone cold sober as a matter of fact
I can bitch, I can bitch
'Cause I'm better than you
It's the way that I move
The things that I do, woah

I entertain by picking brains
Sell my soul by dropping names
I don't like those, my God, what's that
Oh, it's full of nasty habits when the bitch gets back

I'm a bitch, I'm a bitch
Oh, the bitch is back
Stone cold sober as a matter of fact
I can bitch, I can bitch
'Cause I'm better than you
It's the way that I move
The things that I do, woah

I'm a bitch, I'm a bitch
Oh, the bitch is back
Stone cold sober as a matter of fact
I can bitch, I can bitch
'Cause I'm better than you
It's the way that I move
The things that I do, woah

Bitch, bitch, bitch is back
Bitch, bitch, bitch is back
Bitch, bitch, the bitch is back
Bitch, bitch, the bitch is back

Bitch, bitch, the bitch is back
Bitch, bitch, bitch is back
Bitch, bitch, bitch is back
Bitch, bitch, bitch is back"
82,Olivia Newton-John,Goodbye Again,TRUKTZS128F932970C,1974,"It's five o'clock this morning and the sun is on the rise 
There's frosting on the window pane and sorrow in your eyes 
The stars are fading quietly, the night is nearly gone 
You slowly turn away from me and tears begin to come 

And it's 
Goodbye again, I'm sorry to be leaving you 
Goodbye again, 'cause if you didn't know 
It's goodbye again, and I wish you could tell me 
Why do we always fight when I have to go? 

It seems a shame to leave you now, the days are soft and warm 
I long to lay me down again and hold you in my arms 
I long to kiss the tears away and give you back your smile 
But other voices beckon me and for a little while 

It's 
Goodbye again, I'm sorry to be leaving you 
Goodbye again, 'cause if you didn't know 
It's goodbye again, and I wish you could tell me 
Why do we always fight when I have to go? 

I have to go and see some friends of mine, and some that I don't know 
And some who aren't familiar with my name 
It's something that's inside of me, not hard to understand 
It's anyone who will listen to me sing 

But if your arms are empty now, then who am I to blame 
You think if I was always here our love would be the same 
But as it is, the time we have is worth the time alone 
And lying by your side, the greatest peace I've ever known 

But it's 
Goodbye again, I'm sorry to be leaving you 
Goodbye again, 'cause if you didn't know 
It's goodbye again, and I wish you could tell me 
Why do we always fight when I have to go?"
83,Leonard Cohen,Field Commander Cohen,TREXTCZ128F426EA81,1974,"Field Commander Cohen, he was our most important spy.
Wounded in the line of duty,
Parachuting acid into diplomatic cocktail parties,
Urging Fidel Castro to abandon fields and castles.
Leave it all and like a man,
Come back to nothing special,
Such as waiting rooms and ticket lines,
Silver bullet suicides,
And messianic ocean tides,
And racial roller-coaster rides
And other forms of boredom advertised as poetry.

I know you need your sleep now,
I know your life's been hard.
But many men are falling,
Where you promised to stand guard.

I never asked but I heard you cast your lot along with the poor.
But then I overheard your prayer,
That you be this and nothing more
Than just some grateful faithful woman's favourite singing millionaire,
The patron Saint of envy and the grocer of despair,
Working for the Yankee Dollar.

I know you need your sleep now,
I know your life's been hard.
But many men are falling,
Where you promised to stand guard.

Ah, lover come and lie with me, if my lover is who you are,
And be your sweetest self awhile until I ask for more, my child.
Then let the other selves be ONE, yeah, let them manifest and come
Till every taste is on the tongue,
Till love is pierced and love is hung,
And every kind of freedom done, then oh,
Oh my love, oh my love, oh my love,
Oh my love, oh my love, oh my love."
84,Toots & The Maytals,Having A Party,TRMXAHF128F1462A95,1974,"Talk about a party party
Everybody sing party party
Everybody go and party party
Everyone of you party party
I will party party
Do you want to go and party party
Listen"
85,Blue Magic,Look Me Up (Remastered Album Version),TRBWNFR128F4239371,1974,"When you are down and feeling low
 and you don't know which way to go
 you just pick up your own telephone girl
 If you get in-touch with me
 I'll be there instantly,
 It's a shame you can't belong to me, So

 Whenever you're down (Look me up)
 Whenever you're down (Look me up)
 Because whenever you're down, just look around

 Life too short to live along,
 If you were mine I would build you a home.
 It's so nice to have someone to lean on
 When you need some company
 all you have to do is call on me
 In my arms you'll find security, so

 Whenever you're down (Look me up)
 Whenever you're down (Look me up)
 Because whenever you're down, just look around

 (Look me up baby) Whenever you're down
 (Look me up girl) Whenever you're down
 (Look me up baby) Whenever you're down
 (Look me up girl) Because whenever you're down, just look around

 (Music)
 It's so nice to have someone to lean on

 (Music)
 You just pick up your own telephone, girl, so

 Whenever you're down (Look me up)
 Whenever you're down (Look me up)
 Because whenever you're down, just look around"
86,Roy Buchanan,Hey Joe,TRATDTH128F4263AAD,1974,"Hey Joe.
Where you goin' with that gun in your hand?
Hey Joe.
I said where you goin' with that gun in your hand?

I'm goin' down to shoot my old lady.
You know I caught her messin' round with another man. 
Yeah.
I'm goin' down to shoot my old lady.
You know I caught her messin' around with another man. 
Huh. And that ain't too cool. 

Uh Hey Joe. 
I heard you shot your woman down, shot her down now.
Hey Joe.
I heard you shot your old lady down, shot her down in the ground. 
Yeah.

Yes I did, I shot her.
You know I caught her messin' round, messin' round town.
Yes I did, I shot her.
You know I caught my old lady messin' round town.
And I gave her the gun.
I shot her!

Alright. Shoot her one more time for me.

Yeah! Aww, Mmm.

Alright.

Hey Joe I said uh, 
Where you gonna run to now? Where you gonna run to?
Hey Joe I said, 
Where you gonna run to now? 
Where ya, where you gonna go?

Well dig, I'm goin' way down South.
Way down Mexico way.
Alright.
I'm goin' way down South.
Way down where I could be free!

Ain't no one gonna find me.
Ain't no hangman gonna, 
He ain't gonna put a rope around me!
You better believe it right now! 
I gotta go now.

Hey, hey, Joe!
You better run on down.
Good bye everybody!
Hey, Hey, Joe."
87,Carole King,Jazzman,TRVSXTD128F427AA18,1974,"Lift me, won't you lift me above the old routine;
Make it nice, play it clean jazzman.

When the jazzman's testifyin' a faithless man believes
he can sing you into paradise or bring you to your knees.
It's a gospel kind of feelin', a touch of Georgia slide,
a song of pure revival and a style that's sanctified.

Jazzman take my blues away; make my pain
the same as yours with every change you play.
Jazzman, oh jazzman.

When the jazzman's signifyin', and the band is windin' low.
It's the late night side of morning in the darkness of his soul.
He can fill a room with sadness as he fills his horn with tears.
He can cry like a fallen angel when risin' time is near.

Jazzman take my blues away; make my pain
the same as yours with every change you play.
Oh lift me, won't you lift me with ev'ry turn around.
Play it sweetly, take me down, oh jazzman."
88,Kansas,Journey From Mariabronn,TRRWGPU128F4264C01,1974,"Two began together, lived as one
Each one to the other had become
More than a friend, living to meet a common end
They were true, each one knew all is well

Still the elder knew it could not last
Hidden memories from the young one's past
Drew them apart
Both knew that deep within his heart they must part
Each their own separate way

It puzzles me how we can be so close and yet worlds apart
Can it be, my memory has torn my life in two
From the very start
I screamed for the devil to let me be
I called to the heavens to set me free
Today I prayed for the answer and not one
Of the gods in the sky would rescue me

Dreams of fortune fill the young one's mind
Learn the worldly ways of hope to find
Love on the way, searching to find the light of day
In his soul he had found his own way

But to each other they soon will return
Destiny fulfilled, their words will burn an eternal flame"
89,Status Quo,Just Take Me,TRRPYIP128E0784C13,1974,"I am just a poor man, got nowhere to go
All my leaves have fallen, left me all alone
If I was a rich man, if I was a king
I would give you all I have, give you everything
If you'd just take me, just take me now
If you'd just take me

Never seen my daddy, died when I was two
Mama did the best she could, taught me all she knew
Said that love was everything, tears came to her eyes
Never knew the meaning, now I realise
Love is all you need, all you need now
If you just take me

I'm trying hard to get you, I'm not the only one
Never had a big car, but I'm not on the run
If love has got a meaning see it in my eyes
If you see the beginning, then you'd realise
Love is all you need, all you need now
If you just take me
Just take me
Just take me now
Won't you just take me"
90,Slapp Happy,The Secret,TRTRLBN128F1468D36,1974,"There he goes, my hero in wonderful clothes
- passing me by, giving me the eye
- he's my guy &amp; he really keeps a secret.

From the start his message went straight to my heart &amp; over my head
- heavy as lead
- I'd tell you what he said, but I swore I'd keep it secret.

There's something hypnotising 'bout the way he walks -
There's something supernatural 'bout the way he talks -
Coming from another world I know he doesn't find it easy -
Keeps me up every night telling me the same old story -
I told him it's alright no matter what he does he never really bores me.

strike a light he's making my days into night
- mercury man does everything he can
- and my only plan is to keep his secret secret

There's something hypnotising 'bout the way he walks -
There's something supernatural 'bout the way he talks -
Coming from another world I know he doesn't find it easy -
Keeps me up every night telling me the same old story -
I told him it's alright no matter what he does he never really bores me."
91,Randy Newman,Mr. President (Have Pity On The Working Man),TRJBRHQ128F92F56B7,1974,"We've taken all you've given
But it's gettin' hard to make a livin'
Mr. President, have pity on the working man

We ain't asking you to love us
You may place yourself high above us
Mr. President, have pity on the working man

I know it may sound funny
But people ev'rywhere are runnin' out of money
We just can't make it by ourself

It is cold and the wind is blowing
We need something to keep us going
Mr. President, have pity on the working man

Maybe you've cheated
Maybe you've lied
Maybe you have lost your mind
Maybe you're only thinking 'bout yourself

Too late to run
Too late to cry now
The time has come for us to say goodbye now
Mr. President, have pity on the working man
Mr. President, have pity on the working man"
92,Gilbert O'Sullivan,Christmas Song,TRRBEGH128F149B641,1974,"I'm not dreaming of a white Christmas
I'm not dreaming of a white Christmas
All I'm dreaming of the whole day long
Is a peaceful world

Merry Christmas, and Happy New Year
To those of you who live in fear
And let us hope that very soon
The peace you seek will then resume

I'm not dreaming of a white Christmas
I'm not dreaming of a white Christmas
All I'm dreaming of the whole day long
Is a peaceful peaceful world

(I'm not dreaming of a white Christmas
I'm not dreaming of a white Christmas
All I'm dreaming of the whole day long
Is a peaceful world)

Merry Christmas, and Happy New Year
To those of you who live in fear
And let us hope that very soon
The peace you seek will then resume

I'm not dreaming of a white Christmas
I'm not dreaming of a white Christmas
All I'm dreaming of the whole day long 
Is a peaceful peaceful world"
93,Ann Peebles,A Love Vibration,TRMVBDQ128F92CFF09,1974,"We don't need to shed a tear
'Cause it's too late for us to cry
If we had've known what we had goin' on
We never would've let this feeling die

We let a love vibration pass us by
We let a love vibration pass us by

I can still recall the feeling
Boy you made me feel so good inside
Because we both had been used by love before
We've got this feeling we had to hide

We let a love vibration pass us by
We let a love vibration pass us by

Neither one of us
Played the game by the rules
I was too busy being tough
And you were too busy being cool
(Cool)

Next time around I'll be ready
If the feeling ever comes again
I won't be a fool, I'll play the game by the rules
I won't let this feeling get away from me again

We let a love vibration pass us by
We let a love vibration pass us by

We let a love vibration pass us by
We let a love vibration pass us by"
94,America,Tin Man,TREBKMA128F92F2CFF,1974,"Sometimes late when things are real
And people share the gift of gab between themselves
Some are quick to take the bait
And catch the perfect prize that waits among the shells 

But Oz never did give nothing to the Tin Man
That he didn't, didn't already have
And cause never was the reason for the evening
Or the tropic of Sir Galahad
So please believe in me

When I say I'm spinning round, round, round, round
Smoke glass stained bright colors
Image going down, down, down, down
Soapsud green like bubbles

Oz never did give nothing to the Tin Man
That he didn't, didn't already have
And cause never was the reason for the evening
Or the tropic of Sir Galahad
So please believe in me

When I say I'm spinning round, round, round, round
Smoke glass stained bright colors
Image going down, down, down, down
Soap sud green like bubbles

No, Oz never did give nothing to the Tin Man
That he didn't, didn't already have
And cause never was the reason for the evening
Or the tropic of Sir Galahad
So please believe in me"
95,Skyhooks,Balwyn Calling,TRDOBZB128F14A510C,1974,"You met her at a party on Saturday night
She was drinkin' advocaat
Her skin was smooth and her jeans were tight
You didn't think she'd go that far
She mighta looked like a princess
But why'd you have to give her your address
Cos you ain't safe when you get home
She's gonna call you on the telephone

Hey boy that's Balwyn callin'
Hey boy that's Balwyn callin'
Hey boy that's Balwyn callin'
Get on the phone and do a bit of stallin'

It was just too easy when you got to her flat
And she kicked off her platform shoes
And you played around like a cat and a rat
And now you've got the Balwyn blues
Well you thought she ould be a one nighter
But she wants to squeeze you tighter
Cos you ain't safe when you get home
She's gonna call you on the telephone

She sure knows when she's got a good catch
And she just won't let go
She's been searchin' for the perfect match
Her ambition with your dough
A brick veneer prison is waitin' for you
But you just smile while she turns the screw
And you ain't safe when you get home she
She's gonna call you on the telephone

Hey boy that's Balwyn calling X 3
Get off the phone and get out of Balwyn"
96,Kool & The Gang,Summer Madness,TRSEWKS128E07942F7,1974,"Summer madness
Summer madness

Summer madness
Summer madness

Summer madness
Summer madness

Summer madness
Summer madness"
