,Artist,Title,Track_id,Year,Lyrics
143,The Dramatics,Fell For You,TRCAYGX128F92E5492,1973,"Like a star, slipping out of place
Sliding from the sky, tumbling through space
When you touch my hand, 
I swear I feel... like I'm falling 
(falling, falling, falling)
Seems like I'm falling...
(falling, falling, falling)

Like a wheel whirling, round and round, 
Rolling down a hill (rolling-down-a-hill), 
Spining on the ground
Your kisses make my dizzy (yeah)
In the head.... and I'm falling, 
(falling, falling, falling)
Falling...

Uh-oh girl, 
I think that I have fell for you 
Uh-oh girl, 
I think that I have fell for you 

I was a bird soaring, through the air
Flying fancy free, without a care
Until you clipped my wings
Now look at me... Oh, I'm falling
(falling, falling, falling)
Yeah, falling
(falling, falling, falling)

Oh here I go, down and down I go
I can't help myself
Girl you thrill me so
Yeah you blew my mind
And I know... that I'm falling
(falling, falling, falling)
Yes, I'm falling
(falling, falling, falling)

Uh-oh girl, 
I think that I have fell for you 
Uh-oh girl, 
I think that I have fell for you 

Oh, down, down, down I go (falling)
Oh, down, down, down I go (falling)
Oh, down, down, down I go (falling)
Yeah, yeah, yeah

Uh-oh girl, 
I think that I have fell for you 
(seems like, seems like)
Uh-oh girl, 
I think that I have fell for you 
Oh-oh girl, 
I think that I have fell for you..."
144,Buddy Holly,Modern Don Juan,TRFPAMQ128F4270073,1973,"Well, I ain't nothin' but a man in love
I ain't nothin' but a man in love
The girls they say I'm their only one
They even say I'm a modern Don Juan

Well, there ain't but a-one thing puzzlin' me
I got a girl and she can't see
That I want only to make her mine
Well, she thinks I'm just handin' her a line

Oh, I love her so
I'll never ever let her go

I ain't nothin' but a man in love
I ain't nothin' but a man in love
The girls they say I'm their only one
They even say I'm a modern Don Juan

Oh, I love her so
I'll never ever let her go

I ain't nothin' but a man in love
I ain't nothin' but a man in love
The girls they say I am their only one
They even say I'm a modern Don Juan

Well, I ain't nothin' but a man in love
Ain't nothin' but a man in love
I ain't nothin' but a man in love"
145,Aerosmith,Mama Kin,TRVLMOF128F92FC635,1973,"It ain't easy, livin' like a gypsy
Tell ya, honey, how I feel
I've been dreaming
Floatin' downstream and
Losin' touch with all that's real
Whole earth lover, keepin' undercover
Never knowin' where ya been
You been fadin', always out paradin'
Keep in touch with Mama Kin

Well, you've always got your tail on the wag
Shootin' fire from your mouth just like a dragon
You act like a perpetual drag
You better check it out
'Cause someday soon you'll have to climb back on the wagon

It ain't easy, livin' like you wanna
And it's so hard to find piece of mind, yes it is
The way I see it, you've got to say shit
But don't forget to drop me a line

Said you're as bald as an egg at eighteen
And workin' for you dad is just a drag, man
He still stuffs your mouth with your dreams
You better check it out
'Cause someday soon you'll have to climb back on the wagon

Keep in touch with Mama Kin
Tell her where you've gone and been
Livin' out your fantasy
Sleepin' late and smokin' tea

Keep in touch with Mama Kin
Tell her where you've gone and been
Livin' out your fantasy
Sleepin' late and smokin' tea

It ain't easy, livin' like ya wanna
And it's so hard to find piece of mind, yes it is
The way I see it, you've got to say shit
But don't forget to drop me a line

Said you're as bald as an egg at eighteen
And workin' for your dad is just a drag, man
He still stuffs your mouth with your dreams
You better check it out
'Cause someday soon you'll have to climb back on the wagon

Keep in touch with Mama Kin
Tell her where you've gone and been
Livin' out your fantasy
Sleepin' late and smokin' tea

Keep in touch with Mama Kin
I said I tell her where you've gone and been
Livin' out your fantasy
Sleepin' late and smokin' tea"
146,Spooky Tooth,Self Seeking Man,TRJMCAP128F9310D46,1973,"Wright

If there's any justice in the world
Then there's something I've got to say
For all the fools who fend for themselves
For you it's dying day
I've been done out of my money and wealth
And I'm sitting on square one
Trying to get my head together
Waiting for the sun

I tried so hard to win
Sometimes I'd gamble  my own life
And anyone who crossed my path
Would never cross it twice
I'd take until there was nothing left
But the odds turned on me
Now I'm down and out again
Deep in misery

I've been a self-seeking man
Self-seeking man
Self-seeking man
Who lived for himself
Who wound up the fool
And got nothing for it

I've been done out of my money and wealth
And I'm sitting on square one
Trying to get my head together
Waiting for the sun

I've been a self-seeking man
Self-seeking man
Self-seeking man
Who lived for himself
Who wound up the fool
And got nothing for it"
147,Jeanne Pruett,Satin Sheets,TRHIZII128F1484D13,1973,"Satin sheets to lie on, satin pillows to cry on
Still, I'm not happy don't you see
Big long Cadillac, tailor-mades upon my back
Still, I want you to set me free

I've found another man who can give more than you can
Though you've given me everything money can buy
But your money can't hold me tight like he does on a long, long night
No, you didn't keep me satisfied

Satin sheets to lie on, satin pillows to cry on
Still, I'm not happy don't you see
Big long Cadillac, tailor-mades upon my back
Still, I want you to set me free

Satin sheets to lie on, satin pillows to cry on
Still, I'm not happy don't you see
Big long Cadillac, tailor-mades upon my back
Still, I want you to set me free

Satin sheets to lie on, satin pillows to cry on
Still, I'm not happy don't you see
Big long Cadillac, tailor-mades upon my back
Still, I want you to set me free"
148,Marvin Gaye,Just To Keep You Satisfied,TRAMUZE128C7196B34,1973,"You were my wife, my life, my hopes and dreams
For you to understand what this means, I shall explain
I stood all the jealousy, all the bitchin' too
Yes, I'd forget it all once in bed with you
Ooo darling how could we end up like this?
Oh baby let me reminisce

Oh and when we, woo, stopped the hands of time
You set my soul on fire, my one desire
Was to love you and think of you with pride
And keep you satisfied, oh baby oh baby
We could not bear the mental strain
Leave you, I laugh at men too
Now you see how much you hurt me
But if you ever need me, I'll be by your side
Though the many happy times we had
Can never really outweigh the bad
Oh I'll never love nobody like I loved you baby

It's time for us to say farewell, farewell my darlin'
Maybe we'll meet down the line
It's too late for you and me, it's too late for you and I
Much too late for you to cry
It's too late for you and me, much too late for you and I
It's too late for you and me, much too late for you to cry baby
Ah we tried, God knows we tried
Now it's too late to live and love and ah it's too late baby
It's too late for you and me, much too late for you to cry
Oh oh ohhh it's much too late
Well, all we can do is, we can both try to be happy"
149,Nazareth,Night Woman,TRWGOGW128F933550C,1973,"She's a night woman of my dreams
And I saw her glidin' on a moon beam
Silver stardust in her eyes
In the way she leaves her sighs.

Last night I fell asleep
Thought I heard her voice begin to speak
My mind is in distress
On my cheek I felt her breath.

I could feel her body's warmin' glow
My frozen blood begn to flow
She's a night woman of my dreams
And I saw her glidin' on a moon beam
Comes, stays, then disappears
In the morning sun my vision clears.

I could smell the roses in her hair
But when I awoke, she was not there.

Oooh, oooh, night woman of my dream
Oooh, oooh, night woman of my dream
Oooh, oooh, she's a night woman of my dream
Oooh, oooh, night woman of my dream."
150,Iggy & The Stooges,Gimme Danger,TRNEHKF12903D097AE,1973,"Gimme danger, little stranger
And I feel with you at ease
Gimme danger, little stranger
And I'll heal your disease
There's nothing in my dreams just some ugly memories
Kiss me like the ocean breeze

Hey

Now if you will be my lover
I will shiver and sing
But if you can be my master
I will do anything
There's nothing left alive but a pair of glassy eyes
Raise my feelings one more time

Yeah

Come on little danger, die a little stranger
Swear you're gonna feel my hand
Come on little stranger, die a little later
Swear you're gonna feel my hand
Swear you're gonna feel my hand

Gimme danger
Little stranger
Gimme danger
Little stranger
Gimme danger
Little stranger
Gimme danger
Little stranger
Gimme danger
Gimme danger
Can you feel it?
You gotta feel it, I gotta feel it
Gimme danger"
151,Sui Generis,Cuando Ya Me Empiece A Quedar Solo,TRAIPQN128F933A3AA,1973,"Tendré los ojos muy lejos
Y un cigarrillo en la boca
El pecho dentro de un hueco
Y una gata medio loca

Un escenario vacío
Un libro muerto de pena
Un dibujo destruído
Y la caridad ajena

Un televisor inútil
Eléctrica compañía
La radio a todo volumen
Y una prisión que no es mía

Una vejez sin temores
Y una vida reposada
Ventanas muy agitadas
Y una cama tan inmóvil

Y un montón de diarios apilados
Y una flor cuidando mi pasado
Y un rumor de voces que me gritan
Y un millón de manos que me aplauden
Y el fantasma tuyo, sobre todo
Cuando ya me empiece a quedar solo"
152,Jackson 5,The Boogie Man,TRNNWYG12903D085A7,1973,"My mama told me when I was quite young
Don't be a bad boy and don't run
'Cause he's gonna get you
He's gonna get you

So little girl that's why I'm tellin' you
Don't you dare break my heart in two
Or he's gonna get you
He's gonna get you (Sing)

THE BOOGIE MAN is gonna get you
If you're messin' around in the dark
Playin' with my love and affection
That ain't smart, no that ain't smart, oh

So little girl that's why I'm tellin' you
Take my love, take my money
But don't you dare break my heart in two
Or he's gonna get you (He's gonna get you)
He's gonna get you (He's gonna get you) Sing

THE BOOGIE MAN is gonna get you
If you're messin' around in the dark
Playin' with my love and affection
That ain't smart, no that ain't smart, oh

Look out, look out, here he comes, there he is, run
The Boogie Man will get ya
The Boogie Man will get ya
The Boogie Man is gonna get ya (If you're a bad girl)
The Boogie Man is gonna get ya (Don't make me sad girl, oh)
Here he comes, here he comes, here he comes, here he comes, whoo

The Boogie Man is gonna get you
If you're messin' around in the dark
Playin' with my love and affection
That ain't smart, no that ain't smart, oh

The Boogie Man is gonna get you ( I'm crazy about you baby)
If you're messin' around in the dark (I'm crazy 'bout your love)
Playin' with my love and affection
That ain't smart, no that ain't smart, oh"
153,Judee Sill,Down Where The Valleys Are Low,TRYLYRN128F92E3C6C,1973,"Down where the valleys are low, there's a refuge so high
And down where the coldest winds blow, there the warmest winds hide
And deep in the forest of woe, sweet deliverance is nigh
And deep in the heart there's a rose that a glimmer keeps guidin'

'Til the heaven's song begins the holy files a-burnin'
And the harmony is set to weave a silver sermon
And my heart's aflame until the blessed rhythm's churnin'

Push me on from the danger that's pullin' me
And holds me so strong...
Send a song on the wind to deliver me
Take me and rise, when the fire is on...
Take the reins, and the loneliness fillin' me
And make my fear fuel, and the fuel hi-octane

Down where the valleys are low, there's a refuge so high
And down where the coldest winds blow, there the warmest winds hide
And deep in the forest of woe, sweet deliverance is nigh
And deep in the heart there's a rose that a glimmer keeps guidin'

'Til the heaven's song begins the holy files a-burnin'
And the harmony is set to weave a silver sermon
And my heart's aflame until the blessed rhythm's churnin'

Lead the way thru the glories deceivin' me
And reverie's sway...
Thru the day when the hereafter's holdin' me
Lend me a hand and I won't delay
Send a ray thru the seven veiled mysteries
And break their sweet spell, and their links of chain"
154,Jackson 5,Skywriter,TRNXSEY128F42BB371,1973,"(Chorus) 
Skywriter 
Sweep your silver pen, 
Across the sky So high 

Skywriter 
Won't you write the biggest 
I love you 
Cross the sky 

She don't read the letters 
I write anymore 
Sorry I upset her 
But I wasn't sure 
Now I know I love her 
I hope that she will see 
A message high above her 
That you write for me, yeah. 

(Chorus) 

Hey Hey 
Send a box of cande 
And flowers every day 
Still she wouldn't listen 
Her pride got in the way 

Now it's up to you 
It won't fade away 
Write it on the heavens 
Love will make it stay, yeah 

(Chorus)"
155,Charley Pride,Don't Fight The Feelings Of Love,TRPENIN128F428D4EC,1973,"Don'tcha don'tcha don'tcha fight the feelings of love
Cause love is something nobody ever gets enough of
So reach out your hand take in all the sunshine from above
Well now love is believing so don't fight the feelings don't fight the feelings of love

A boy and a girl in a big spinning world upside down in love from the start
Sunny days and laughing skies true love in both their eyes
Spending happy good times in the park
Learning all about living taking and the giving love is growing stronger every day
Well now there'll never be another cause they're trusting each other
Good love seems to just work out that way
I said now don'tcha...
Don't fight the feelings don't fight the feelings don't fight the feelings of love"
156,Sui Generis,Bienvenidos Al Tren,TRLBGIE128F933B063,1973,"Recoge tus cosas y largo de aquí
En nombre de Cristo, no quieras seguir
Si nadie me acepta, okay, ya me iré
Estoy esperando que llegue mi tren

Si tu eres mi dama, jamás lo sabré
Si yo no te río, pues bien mátame
Recógete el pelo, ven a la estación
Si no me acompañas puedes decirme adiós

Pueden venir cuantos quieran
Que serán tratados bien
Los que estén en el camino
Bienvenidos al tren

Si vendo mi alma, ¿quién la comprará?
Si compro tu tiempo nunca mía serás;
Por eso es que vago y esa es la verdad
Si miento un poquito ya me perdonarás"
157,The Kinks,Misty Water,TRPQDTR128F92F99F4,1973,"By the town of Straight and Narrow, 
There's a dark and misty place. 
Everything is hazy, 
So the people are afraid. 

All except Maria's daughters, 
Who believe in misty ways. 
Everything is lovely, 
In a misty morning glaze. 

I like misty water, 
I like fog and haze. 
Anne Maria and her daughters, 
They like misty water. 

I like misty water, 
I like fog and haze. 
Anne Maria and her daughters, 
Take a sip of misty water. 

Though Maria is not lovely, 
She's the lady of my dreams. 
'Cause I see my lady, 
Through a misty, silky screen. 

And in seeing is believing, 
But I can't believe my eyes. 
Everything is lovely, 
In a misty paradise. 

I like misty water, 
I like fog and haze. 
Anne Maria and her daughters, 
They like misty water. 

They like misty water, 
I like fog and haze. 
Anne Maria and her daughters, 
Take a sip of misty water. 

I like misty water, 
I like fog and haze. 
Anne Maria and her daughters, 
They like misty water. 

They like misty water, 
I like fog and haze. 
Anne Maria and her daughters, 
They like misty water. 

I like misty water, 
I like fog and haze. 
Anne Maria and her daughters..."
158,Brownsville Station,Let Your Yeah Be Yeah (LP Version),TRSWMMY128F42309EF,1973,"You keep telling me yes
But you don't mean it
You keep telling me no
And try to lean it
You're giving me buts and maybe
You know this will drive me crazy
Why can't you tell it like it is 

Let your yeah be yeah and your no be no, now 
Let your yeah be yeah and your no be no, now 
Becuse I'm on my guard and I'm watching you from head to toe
You better let your yeah be yeah and your no be no 

You wear a plastic smile
I know by you eyes
You speak with indefinite style
You're telling me lies
You've got to face reality
What is wrong with you and me
Why can't you free your honesty

Let your yeah be yeah and your no be no, now 
Let your yeah be yeah and your no be no, now 
Becuse I'm on my guard and I'm watching you from head to toe
You better let your yeah be yeah and your no be no"
159,John Prine,Sweet Revenge (LP Version),TRNKMUH128F92FA140,1973,"I got kicked off Noah's Ark
I turn my cheek to unkind remarks
There was two of everything but one of me
And when the rains came tumbling down
I held my breath and I stood my ground
And I watched that ship go sailing out to sea

Take it back, take it back
Oh no, you can't say that
All of my friends are now dead or in jail
Through rock and through stone
The black wind still moans
Sweet revenge, sweet revenge without fail

I caught an aisle seat on a plane
And drove an English teacher half insane
Making up jokes about bicycle spokes and red balloons
So I called up my local deejay
And he didn't have a lot to say
But the radio has learned all of my favorite tunes

Take it back, take it back
Oh no, you can't say that
All of my friends are now dead or in jail
Through rock and through stone
The black wind still moans
Sweet revenge, sweet revenge without fail

The white meat is on the run
And the dark meat is far too done
And the milkman left me a note yesterday
Get out of this town by noon
You're coming on way too soon
And besides that we never liked you any way

Take it back, take it back
Oh no, you can't say that
All of my friends are now dead or in jail
Through rock and through stone
The black wind still moans
Sweet revenge, sweet revenge without fail
Sweet revenge, sweet revenge will prevail without fail"
160,Darryl Way's Wolf,Go Down,TRUWJGQ128F92DFC87,1973,"Strange, you waiting here for me
Patience doesn't suit you now
I can use the company
But you know what you're used to now

Without trying to restore
Anything that couldn't be thought
While you're passing through me once more
You'll go down, you'll go down

Strange, you waiting here for me
Patience doesn't suit you now
I still need the company
But you know what you're used to now

Even if I could not see
Why you've come here teasing me
If you need the last laugh from me
I'll go down, I'll go down"
161,Paul McCartney / Wings,Jet,TRMEIIA12903CFB76F,1973,"I can almost remember their funny faces
That time you told 'em that you were going to be marrying soon
And Jet
I thought the only lonely place was on the moon
 
Was your father as bold as a sergeant major?
Well how come he told you that you were hardly old enough yet?
And Jet
I thought the major was a lady sufragette
 
Ah, mater, want Jet to always love me?
Ah, mater, much later
 
With the wind in your hair of a thousand laces
Climb on the back and we'll go for a ride in the sky
And Jet
I thought the major was a little lady suffragette
 
And Jet
You know I thought you was a little lady suffragette
 
A little lady, my little lady yes!"
162,Johnnie Taylor,I Believe In You (You Believe In Me),TRCEUOG128F428A7D6,1973,"I feel sorry, I feel sorry
I feel sorry, I feel sorry

I feel for sorry
For any man out there
When he can't look around
And say this is my woman
My woman alone

I feel sorry, yeah
For any woman out there
Who can't say I got somebody
That I can call my very own

I feel sorry, I feel sorry
I feel sorry, I feel sorry

One thing I can say about
The people of the world today
They see you with a good thing
They want to take it away

But I believe in you
You believe in me too, yeah
Even your best friend will come
Around making sly remarks
Trying to put you down
I believe in you
You believe in me too

Listen, honey
People talking
Trying to pull us apart
Sticking pins and needles
In both of our hearts
I love you no matter
Don't care about
The stormy weather

I heard your mother say
Loving me didn't make no sense
But when she put me down
You stood up in my defense

I believe in you
Anytime you against
Your own mother
It makes me know
You believe in me, yeah
Here's another thing

We had our hard times
And almost didn't make it
We always worked it
Never tried to fake it

But I believe in you
You believe in me too
Here's anything about it

People talking
Trying to pull us apart
Always ticking pins and
Needles in both of our hearts
Our love together
Don't care about
The stormy weather

I believe in you
You believe in me too, yeah

I believe
That's why every time
We get a chance
I tell you, honey
How much I love you
Love you, love you
Love you, love you...

And most of all
How much I trust you
The reason why I trust you, baby
Is because of one thing
I can lean on you, yeah, baby
And you can lean on me too
One more time I'm gonna say

I believe in you
Honey, please
Let me believe in you
I know a lot of folk out there
Wish they had somebody
They could believe in

I believe, I believe in you
You believe in me too
Anytime you against
Your own mother
It makes me know

You believe in me
I believe in you
And you've shown me enough
To know you believe in me too"
163,Kool & The Gang,Jungle Boogie,TRDRMEA128E078435A,1973,"Get down, get down
Get down, get down
Get down, get down
Get down, get down
Get down, get down
Get down, get down
Get down, get down
Get down, get down

Jungle boogie
(Get down with the boogie)
Jungle boogie
(Get it up)
Jungle boogie
(Get down with the boogie)
Jungle boogie
(Get it up)
Jungle boogie
(Get up with the boogie)
Jungle boogie
(Get up wit da get down)
Jungle boogie
(Get down with the boogie)
Jungle boogie
(Shake it around)

Jungle boogie
(Get up, wit da get down)
Jungle boogie
(Boogie, boogie)
Jungle boogie
(Boogie, boogie)
Jungle boogie
(Brrr)
Jungle boogie
(Get up wit da  get down)
Jungle boogie
(Get the boogie)
Jungle boogie
(Yeah in the jungle)
Jungle boogie
(Get down with the boogie)

Get down, get down
Get down, get down
(With the boogie)
Get down, get down
Get down, get down
(Jungle boogie)
Get down, get down
Get down, get down
(With the boogie)
Get down, get down
(Jungle boogie)
Get down, get down
(With the boogie)
Get down, get down
(Jungle boogie)
Get down, get down
(With the boogie)
Get down, get down
(It's the boogie)
Get down, get down

Uh, get it
Feel the funk, y'all
Let let it flow
Huh, uh uh
Huh, uh uh uh
Huh, uh mm'
Get down with the boogie
Get it, get the jungle boogie
Get down
Huh, uh, get down with the boogie
Said uh, uh
Get down
Said uh, uh
Get down
Said uh, uh
Get down
Said uh, uh
Huh, 'til ya feel it y'all
Huh, get down y'all
Huh, uh get down
Huh, uh y'all get down
Uh, oh, with the get down
Uh, ugh
Uh, ha, get down
Whoa"
164,The Sweet,The Ballroom Blitz,TRUHUSL128F92D2D0A,1973,"Are you ready, Steve? Uh-ha! 
Andy? Yeah! 
Mick? Okay.
All right, fellows, let's go!

Oh, it's been getting so hard
Livin' with the things you do to me, ah-ha
My dreams are getting so strange
I'd like to tell you everything I see, mm

Oh, I see a man at the back as a matter of fact
His eyes are red as the sun
And a girl in the corner, let no one ignore her
'Cause she thinks she's the passionate one

Oh yeah, it was like lightning
Everybody was frightening
And the music was soothing
And they all started grooving
Yeah, yeah, yeah, yeah, yeah

And the man at the back said: ""Everyone attack""
And it turned into a ballroom blitz
And the girl in the corner said: ""Boy, I wanna warn ya""
It'll turn into a ballroom blitz
Ballroom blitz
Ballroom blitz
Ballroom blitz
Ballroom blitz

Oh, I'm reaching out for something
Touching nothing's all I ever do
Oh, I softly call you over
When you appear, there's nothing left of you, ah-ha

Now the man at the back is ready to crack
As he raises his hands to the sky
And the girl in the corner is everyone's mourner
She could kill you with a wink of her eye

Oh yeah, it was electric
So frantically hectic
And the band started leaving
'Cause they all stopped breathing
Yeah, yeah, yeah, yeah, yeah

And the man at the back said: ""Everyone attack""
And it turned into a ballroom blitz
And the girl in the corner said: ""Boy, I wanna warn ya""
It'll turn into a ballroom blitz
Ballroom blitz

Oh yeah, it was like lightning
Everybody was frightening
And the music was soothing
'Cause they all started grooving
Yeah, yeah, yeah, yeah, yeah

And the man at the back said: ""Everyone attack""
And it turned into a ballroom blitz
And the girl in the corner said: ""Boy, I wanna warn ya""
It'll turn into a ballroom blitz
Ballroom blitz
Ballroom blitz
Ballroom blitz
Ballroom blitz

It's, it's a ballroom blitz
It's, it's a ballroom blitz
It's, it's a ballroom blitz
Yeah, it's a ballroom blitz"
165,Black Sabbath,Sabbath Bloody Sabbath,TRBNHRQ128F4262AB4,1973,"You see right through distorted eyes, you know you have to learn
The execution of your mind, you really have to turn
The race is run, the book is read, the end begins to show
The truth is out, the lies are old but you don't want to know

Nobody will ever let you know
When you ask the reasons why
They just tell you that you're on your own
Fill your head all full of lies

The people who have crippled you, you want to see them burn
The gates of life have closed on you and there's just no return
You're wishing that the hands of doom could take your mind away
And you don't care if you don't see again the light of day

Nobody will ever let you know
When you ask the reasons why
They just tell you that you're on your own
Fill your head all full of lies
You bastards

Where can you run to?
What more can you do?
No more tomorrow
Life is killing you

Dreams turn to nightmares
Heaven turns to Hell
Burnt out confusion
Nothing more to tell, yeah

Everything around you
What's it coming to
God knows as your dog knows
Bog blast all of you

Sabbath, bloody Sabbath
Nothing more to do
Living just for dying
Dying just for you, yeah"
