,Artist,Title,Track_id,Year,Lyrics
62,Hank Thompson,Wake Up Irene,TRKPQYU12903D031FA,1960,"For months and months and months around the country
Everybody sang Irene goodnight
But she wouldnt go to bed no matter what they said
Though everybody tried with all their might

She stayed awake while steel guitars were a going
In every honky tonk she could be seen
But she finally went to bed and covered up her head
And now theres not a thing can wake Irene

Wake up Irene, youve sleep too long
Wake up Irene, its time to move along
Wake up Irene, and pay for your bed
Wake up Irene or folks will think you're dead

Lots of guitar pickers by the dozen
Sang 'Goodnight Irene' all night and day
And even Crosby too with his bo bo bo bo be do
Tried to get Irene to hit the hay

Well I guess they finally sang her off to slumber
They must have tried a million times or more
But, oh, my aching back when she finally hit the sack man
You ought to hear that women snore

Wake up Irene, youve sleep too long
Wake up Irene, its time to move along
Wake up Irene, and pay for your bed
Wake up Irene or folks will think you're dead"
63,Hank Thompson,Breakin' The Rules,TRYLYTL128F429FB0F,1960,"Breakin' the rules every time I hug and kiss you darling
While you wear another's name
If you're breakin' the rules in any kind of game you're playing reckless
And taking chances just the same

Can it be a sin to love you like I do
And we'd just be called a pair of fools
If it's so wrong to want to be with you my darling
Then I guess I'll go on breakin' rules
[ steel - fiddle ]
Can it be a sin..."
64,Howlin Wolf,Spoonful,TROABVH128F9349291,1960,"It could be a spoonful of diamonds
Could be a spoonful of gold
Just a little spoon of your precious love
Satisfy my soul

Men lied about a little
Some of them cried about little
Some of them died about a little spoon
Everything fightin' about a spoonful
That spoon, that spoon, that

It could be a spoonful of coffee
Could be a spoonful of tea
But a little spoon of your precious love
Good enough for me

Men lied about that
Some of them died about that
Some of them cried about that
Everybody fightin' about a spoonful
That spoon, that spoon, that

It could be a spoonful of water
Save you from the desert sand
But one spoon of lead from my forty-five
Save you from another man

Men lied about that
Some of them cried about that
Some of them died about that
Everybody fightin' about a spoonful
That spoon, that spoon, that

That spoon, dat spoon, dat spoonful"
65,Jackson Do Pandeiro,O Canto Da Ema,TRWVCLV128F92FEA56,1960,"A ema gemeu no tronco do juremá
(A ema gemeu no tronco do juremá)
Foi um sinal bem triste, morena
Fiquei a imaginar
Será que o nosso amor, morena
Que vai se acabar?

Você bem sabe que a ema quando canta
Vem trazendo no seu canto um bucado de azar
Eu tenho medo
Pois acho que é muito cedo
Muito cedo, meu benzinho
Para esse amor se acabar

Vem morena
(Vem, vem ,vem)
Me beijar (me beijar)
Dá-me um beijo
(Dá-me um beijo)
Pra esse medo
(Se acabar)

A ema gemeu no tronco do juremá
(A ema gemeu no tronco do juremá)
Foi um sinal bem triste, morena
Fiquei a imaginar
Será que o nosso amor, morena
Que vai se acabar?

Você bem sabe que a ema quando canta
Vem trazendo no seu canto um bucado de azar
Eu tenho medo
Pois acho que é muito cedo
Muito cedo, meu benzinho
Para esse amor se acabar

Vem morena
(Vem, vem ,vem)
Me beijar (me beijar)
Dá-me um beijo
(Dá-me um beijo)
Pra esse medo
(Se acabar)

Você bem sabe que a ema quando canta
Vem trazendo no seu canto um bucado de azar
Eu tenho medo
Pois acho que é muito cedo
Muito cedo, meu benzinho
Para esse amor se acabar

Vem morena
(Vem, vem ,vem)
Me beijar (me beijar)
Dá-me um beijo
(Dá-me um beijo)
Pra esse medo
(Se acabar)

A ema gemeu no tronco do juremá
(A ema gemeu no tronco do juremá)
Foi um sinal bem triste, morena
Fiquei a imaginar
Será que o nosso amor, morena
Que vai se acabar?

A ema gemeu no tronco do juremá
(A ema gemeu no tronco do juremá)"
66,Jackson Do Pandeiro,Sebastiana,TRJILUW128F92F8BFF,1960,"Convidei a comadre Sebastiana
Pra cantar e xaxar na Paraíba
Ela veio com uma dança diferente
E pulava que só uma guariba
E gritava: a, e, i, o, u, y

Já cansada no meio da brincadeira
E dançando fora do compasso
Segurei Sebastiana pelo braço
E gritei, não faça sujeira
O xaxado esquentou na gafieira
E Sebastiana não deu mais fracasso
Mas gritava: a, e, i, o, u, y"
67,Jacques Brel,Le Moribond,TRYBKGH128F145618F,1960,"Adieu l'Émile je t'aimais bien
Adieu l'Émile je t'aimais bien tu sais
On a chanté les mêmes vins
On a chanté les mêmes filles
On a chanté les mêmes chagrins
Adieu l'Émile je vais mourir
C'est dur de mourir au printemps tu sais
Mais je pars aux fleurs la paix dans l'âme
Car vu que tu es bon comme du pain blanc
Je sais que tu prendras soin de ma femme
Je veux qu'on rie
Je veux qu'on danse
Je veux qu'on s'amuse comme des fous
Je veux qu'on rie
Je veux qu'on danse
Quand c'est qu'on me mettra dans le trou

Adieu Curé je t'aimais bien
Adieu Curé je t'aimais bien tu sais
On n'était pas du même bord
On n'était pas du même chemin
Mais on cherchait le même port
Adieu Curé je vais mourir
C'est dur de mourir au printemps tu sais
Mais je pars aux fleurs la paix dans l'âme
Car vu que tu étais son confident
Je sais que tu prendras soin de ma femme
Je veux qu'on rie
Je veux qu'on danse
Je veux qu'on s'amuse comme des fous
Je veux qu'on rie
Je veux qu'on danse
Quand c'est qu'on me mettra dans le trou

Adieu l'Antoine je t'aimais pas bien
Adieu l'Antoine je t'aimais pas bien tu sais
J'en crève de crever aujourd'hui
Alors que toi tu es bien vivant
Et même plus solide que l'ennui
Adieu l'Antoine je vais mourir
C'est dur de mourir au printemps tu sais
Mais je pars aux fleurs la paix dans l'âme
Car vu que tu étais son amant
Je sais que tu prendras soin de ma femme
Je veux qu'on rie
Je veux qu'on danse
Je veux qu'on s'amuse comme des fous
Je veux qu'on rie
Je veux qu'on danse
Quand c'est qu'on me mettra dans le trou

Adieu ma femme je t'aimais bien
Adieu ma femme je t'aimais bien tu sais
Mais je prends le train pour le Bon Dieu
Je prends le train qu'avant le tien
Mais on prend tous le train qu'on peut
Adieu ma femme je vais mourir
C'est dur de mourir au printemps tu sais
Mais je pars aux fleurs les yeux fermés ma femme
Car vu que je les ai fermés souvent
Je sais que tu prendras soin de mon âme
Je veux qu'on rie
Je veux qu'on danse
Je veux qu'on s'amuse comme des fous
Je veux qu'on rie
Je veux qu'on danse
Quand c'est qu'on me mettra dans le trou"
68,Jerry Butler,He Will Break Your Heart,TRRRIFG128F4232AF6,1960,"He don't love you like I love you
If he did, he wouldn't break your heart
He don't love you like I love you
He's tryin' to tear us apart

Fare thee well, I know you're leavin' (I know you're leavin')
For the new love that you've found
The handsome guy that you've been dating, whoa
I got a feelin' he's gonna put you down, 'cause

He don't love you like I love you
If he did, he wouldn't break your heart
He don't love you like I love you
He's tryin' to tear us apart

He uses all the great quotations
Says the things I wish I could say
Whoa, but he's had so many rehearsals
Girl, to him it's just another play
But wait
When the final act is over
And you're left standing all alone
When he takes his bow and makes his exit
Girl, I'll be there to take you home

He don't love you (and he never will) like I love you
If he did, he wouldn't break your heart
Oh, he don't love you, girl, like I love you
He's tryin' to tear us apart

Whoa, he don't love you"
69,Jimmy Reed,Found Love,TRWSWFL128F4263FFD,1960,"I found true love, one worth waitin' for
I found true love, one worth waitin' for
I'm gonna sign it to a contract, you won't find one little flaw

It's hard to believe the condition the world is in
It's hard to believe the condition the world is in
You can't trust nobody and girl, you know it's a sin

I found true love, one worth me waitin' for
I found true love, one worth me waitin' for
And I'll sign it to a contract, you won't find one little flaw"
70,Jimmy Reed,Big Boss Man,TRCWJWK128F932C815,1960,"Big boss man, can't you hear me when I call
Big boss man, can't you hear me when I call
Well, you ain't so big, you're just tall, that's all

Got me working, boss man, working 'round the clock
I want me a drink of water, but you won't let Jimmy stop
Big boss man, can't you hear me when I call?
Well, you ain't so big, you just tall, that's all

Well, I'm gonna get me a bossman, one gonna treat me right
Work hard in the day time, rest easy at night
Big boss man, can't you hear me when I call?
Well, you ain't so big, you're just tall, that's all"
71,Jimmy Reed,I Was So Wrong,TRTZWZK12903CDB97E,1960,"It's hard to be lonely, feel ev'ryone is down on you
It's hard to be lonely, feel ev'ryone is down on you
And you find out later on, that they care so much for you

There's no need to worry, one day things'll come your way
There's no need to worry, one day things'll come your way
I heard my baby say it so often, where there's a will, there is a way

I know I was wrong, baby, honey, the way I doubted you
Well, I know I was wrong, honey, girl, the way I doubted you
Well, if you forgive me, 'give me baby, from now on I'll listen to you"
72,Jimmy Reed,Where Can You Be,TRYLEHL12903CDB980,1960,"Ev'ry sixty second, of ev'ry minute
Ev'ry sixty minute, of the hour
Ev'ry twenty-four hours of the day
I just sit a-round an'pray

Wonder where, oh where can you be?
I wonder, where, well babe
Won't you come on home to me?

Ev'ry seven days, of the week
Ev'ry four week, of the month
Ev'ry twelve month, of the year
I just sit an' wish, you was here

I wonder where, well where can you be?
I wonder where, well baby
Please come on home to me"
73,Jimmy Witherspoon,Trouble In Mind,TRMWDGP128F93153F9,1960,"Trouble in mind, I'm blue
But I won't be blue always,
'Cause that sun is gonna shine in my back door someday

I'm going down to the river
I'm going top take me a rocking chair
And if the blues don't leave me, I rock on away from here

Trouble in mind, I'm blue
But I won't be blue always,
'Cause that sun is gonna shine in my back door someday

Trouble in mind, that's true
I have almost lost my mind
Life ain't worth living, I feel like I could die

Trouble in mind, I'm blue
My poor heart is healing slow
I've never had such trouble in my whole life before

I'm gonna lay my head on some lonesome railroad line
And let that 2: 19 special ease my troubled mind

Trouble in mind, I'm blue,
But I won't be blue always
'Cause that sun is gonna shine in my back door someday"
74,Jimmy Witherspoon,Ain't Nobody's Business,TRQJZHB128F92FA42D,1960,"One day we got ham and bacon
The next day ain't nothin' shakin'
Ain't nobody's business, if I do
Nobody's business what I do

If me and my baby, fuss and fight
The next day people we all right
Ain't nobody's business if we do

Baby oh baby you know our love is true
It ain't nobody's business what we do
Times three times seven that makes twenty one
Ain't nobody's business what I do

Ain't nobody's business what I do"
75,Jimmy Witherspoon,Roll 'Em Pete,TREUMON128F93153A0,1960,"Well, I got a gal, she lives up on the hill
Well, I got a gal, she lives up on the hill
Well, this woman's tryin' to quit me, Lord, but I love her still
She's got eyes like diamonds, they shine like Klondike gold

She's got eyes like diamonds, they shine like Klondike gold
Every time she loves me, she sends my mellow soul
Well, you're so beautiful, you've got to die someday
Well, you're so beautiful, you've got to die someday

All I want's a little loving, just before you pass away
Pretty baby, I'm goin' away and leave you by yourself
Pretty baby, I'm goin' away and leave you by yourself
You've mistreated me, now you can mistreat somebody else"
76,Jimmy Witherspoon,Good Rockin' Tonight,TROXIQT128F93153EC,1960,"Well, I heard the news
There's good rockin' tonight.
Well, I heard the news
There's good rockin' tonight.

I'm gonna hold my baby
As tight as I can.
Tonight she'll know
I'm a mighty, mighty man.
I heard the news,
There's good rockin' tonight.

I say, well, meet me in a hurry
Behind the barn,
Don't you be afraid, darling,
I'll do you no harm
I want you to bring
Along my rockin' shoes,
'cause tonight I'm gonna rock away
All my blues.
I heard the news,
There's good rockin' tonight.

Well, we're gonna rock. we're gonna rock.
Let's rock. come on and rock.
We're gonna rock all our blues away.

Have you heard the news?
Everybody's rockin' tonight.
Have you heard the news?
Everybody's rockin' tonight.

I'm gonna hold my baby
As tight as I can,
Well, tonight she'll know
I'm a mighty, mighty man.
I heard the news,
There's good rockin' tonight.

Well, we're gonna rock, rock, rock,
Come on and rock, rock, rock,
Well, rock, rock, rock, rock,
Let's rock, rock, rock, rock,
We're gonna rock all our blues away."
77,Joan Baez,Mary Hamilton,TRWHFYD128F92FBAE3,1960,"Word is to the kitchen gone, and word is to the Hall
And word is up to Madam the Queen, and that's the worst of all
That Mary Hamilton has borne a babe
To the highest Stuart of all

Oh rise, arise Mary Hamilton 
Arise and tell to me
What thou hast done with thy wee babe 
I saw and heard weep by thee

I put him in a tiny boat
And cast him out to sea
That he might sink or he might swim
But he'd never come back to me

Oh rise arise Mary Hamilton
Arise and come with me
There is a wedding in Glasgow  town
This night we'll go and see

She put not on her robes of black
Nor her robes of brown
But she put on her robes of white
To ride into Glasgow town

And as she rode into Glasgow town
The city for to see
The bailiff's wife and the provost's wife
Cried Alack and alas for thee

You need not weep for me she cried
You need not weep for me
For had I not slain my own wee babe 
This death I would not dee

Oh little did my mother think
When first she cradled me
The lands I was to travel in 
And the death I was to dee

Last night I washed the Queen's feet
And put the gold in her hair
And the only reward I find for this
The gallows to be my share

Cast off cast off my gown she cried
But let my petticoat be
And tie a napkin round my face 
The gallows I would not see

Then by them come the king himself
Looked up with a pityful eye
Come down come down Mary Hamilton
Tonight you will dine with me

Oh hold your tongue my sovereign liege
And let your folly be
For if you'd a mind to save my life
You'd never have shamed me here

Last night there were four marys 
Tonight there'll be but three
T'was Mary Beaton and Mary Seton
And Mary Carmichael and me."
78,Joan Baez,Little Moses,TRHEOXF128F92F9D2C,1960,"Away by the waters so blue
The ladies were winding their way
When Pharaoh's little daughter went down to the water
To bathe in the cool of the day
And before it was dark she looked in the ark
And found a sweet infant was there
And before it was dark she looked in the ark
And found a sweet infant was there

And away by the waters so blue
They carried that beautiful child
To his tender mother, his sister and brother
Little Moses looked happy and smiled
And she called him her own, her beautiful son
And sent for a nurse that was near
And she called him her own, her beautiful son
And sent for a nurse that was near

And away by the sea that was red, so red
Little Moses the servant of God
Before him subsided, the seas were divided
As upwards he lifted his rod
And the Jews safely crossed while Pharaoh's host
Were drownded in the waters and lost
And the Jews safely crossed while Pharaoh's host
Were drownded in the waters and lost

And away on a mountain so high
The last one that he ever did see
With Israel victorious, his hopes were most glorious
That same day all the Jordan be free
When his spirit did cease, he departed in peace
And rested in the Heavens above
When his spirit did cease, he departed in peace
And rested in the Heavens above"
79,Joan Baez,John Riley,TRCRFZP12903CF36F0,1960,"Fair young maid all in a garden
Strange young man, passerby
He said, ""Fair maid, will you marry me?""
This then, sir, was her reply:

Oh, no, kind sir, I cannot marry thee
For I've a love who sails all on the sea.
He's been gone for seven years
Still no man shall marry me

What if he's in some battle slain
Or drownded (sic) in the deep salt sea
What if he's found another love
And he and his love both married be?

If he's in some battle slain
I will die when the moon doth wane
And if he's drowned in the deep salt sea
I'll be true to his memory

And if he's found another love
And he and his love both married be
I'll wish them health and happiness
Where they dwell across the sea

He picked her up all in his arms
Kisses gave her: One, two, three
Said, Weep no more, my own true love
I am your long-lost John Riley!"
80,Joan Baez,Wildwood Flower,TRQLXDF128F92F9D25,1960,"I will twine with my mingles of raven black hair
With the roses so red and the lilies so fair
The myrtles so bright with the emerald dew
And the pale and the leader and eyes look so blue

I will dance, I will sing and my life shall be gay
I will charm every heart, in his crown I will sway
I woke from my dream and all idols was clay
And all portions of love then had all flown away

He taught me to love him and promised to love
And cherish me over all others above
My poor heart is wondering no misery can tell
He left me no warning, no words of farewell

He taught me to love him and called me his flower
That was blooming to cheer him through life's weary hour
How I long to see him and regret the dark hour
He's gone and neglected his frail wildwood flower"
81,Joan Baez,El Preso Numero Nueve,TRIJCMY128F92F9D31,1960,"El preso numero nueve ya lo van a confesar
Esta encerrado en la celda con el cura  del penal
Y antes del amanecer la vida le han de quitar
Porque mató a su mujer y a un amigo desleal
Dice así al confesar
Los maté si señor
Y si vuelvo a nacer
Yo los vuelvo a matar

Padre no me arrepiento 
Ni me da miedo la eternidad
Yo se que allá en el cielo 
El ser supremo nos juzgará 
Voy a seguir sus pasos 
Voy a buscarla hasta el más allá.

Ay. yayayayayyyyy

El preso numero nueve era un hombre muy cabal
Iba en la noche del pueblo muy contento en su jacal
Pero al mirar a su amor en brazos de su rival
Ardió en el pecho el rencor y no se pudo aguantar
Al sonar el clarín se formo el pelotón
Y rumbo al paredón, se oye al preso decir:

Padre, no me arrepiento, ni me da miedo la eternidad
Yo se que allá en el cielo el ser supremo nos juzgará 
Voy a seguir sus pasos voy a buscarla hasta el más allá.

Ay. yayayayayyyyy yaay"
82,Joan Baez,Silver Dagger,TRVCRSX128F92F9D1C,1960,"Don't sing love songs, you'll wake my mother
She's sleeping here right by my side
And in her right hand a silver dagger,
She says that I can't be your bride.

All men are false, says my mother,
They'll tell you wicked, lovin' lies.
The very next evening, they'll court another,
Leave you alone to pine and sigh.

My daddy is a handsome devil
He's got a chain five miles long,
And on every link a heart does dangle
Of another maid he's loved and wronged.

Go court another tender maiden,
And hope that she will be your wife,
For I've been warned, and I've decided
To sleep alone all of my life."
83,Joan Baez,East Virginia,TRKEXIG128F92F9D1E,1960,"I was born in East Virginia, 
North Caroline I did roam,
There I met a fair pretty maiden,
Her name and age I do not Know.

Her hair it was of a brightsome color,
And her lips of a ruby red,
On her breast she wore white lilies,
There I longed to lay my head.

Well, in my heart you are my darlin',
At my door you're welcome in,
At my gate I'll meet you my darlin',
If your love I could only win.

I'd rather be in some dark holler,
Where the sun refuse to shine,
Then to see you be another man's darlin',
And to know that you'll never be mine.

Well in the night I'm dreamin' about you,
In the day I find no rest,
Just the thought of you my darlin',
Sends aching pain all through my breast.

Well when I'm dead and in my coffin,
With my feet turned toward the sun,
Come and sit beside me darlin',
Come and think on the way you done."
84,John D. Loudermilk,Tobacco Road,TRRMLQC12903CD02D4,1960,"I was born in a trunk
Mama died and my daddy got drunk
Left me here to die alone
In the middle of Tobacco Road

Growin' up rusty shack
All I had was hangin' on my back
Only you know how I loathe
This place called Tobacco Road

But it's home, the only life I ever known
Only you know how I loathe Tobacco Road

Gonna leave, get a job
With the help and the grace from above
Save some money, get rich and old
Bring it back to Tobacco Road

But it's home, the only life I ever known
Only you know how I loathe Tobacco Road

Bring that dynamite and a crane
Blow it up, start all over again
Build a town, be proud to show
Gives the name Tobacco Road"
85,John Lee Hooker,No Shoes,TRAEJWD128F92FDD32,1960,"No food on my table
And no shoes to go on my feet
No food on my table
And no shoes to go on my feet
My children cry for mercy
They got no place to call your own

Hard times, hard times
Hard times seem like a jealous thing
Hard times, hard times
Hard times seem like a jealous thing
If someone don't help me
And I just can't be around three months long

No shoes on my feet
And no food to go on my table
Oh, no, too sad
Children crying for bread"
86,John Lee Hooker,No More Doggin',TRSWJLK128F92EBD43,1960,"Honey, no more foolin', foolin' 'round with you
Honey, no more foolin', foolin' 'round with you
I'm gonna let you go, baby, that's what I've got to do

Well, I thought that you loved me how, I thought it was true
You taken my money and you play me for fool
No more foolin', foolin' 'round with you
I got to let you go, baby, that's what I've got to do

Well, I take you out the streets and I made you fine
You spend my money on whiskey, beer and wine
No more foolin', foolin' 'round with you
I got to let you go, baby, that's what I've got to do, oh

Well, you said that you love me and you told me a lie
Well, yes, I'll love you until the day I die
No more foolin', foolin' 'round with you
I got to let you go, baby, that's what I've got to do
I got to let you go, baby, that's what I've got to do"
87,Johnny Burnette,You're Sixteen,TRCNLXE12903CC096A,1960,"You come on like a dream, peaches and cream
Lips like strawberry wine
You're sixteen, you're beautiful and you're mine

You're all ribbons and curls, ooh what a girl
Eyes that sparkle and shine
You're sixteen, you're beautiful and you're mine

You're my baby, you're my pet
We fell in love on the night we met
You touched my hand, my heart went pop
Ooh, when we kissed I could not stop

You walked out of my dreams and into my arms
Now you're my angel divine
You're sixteen, you're beautiful and you're mine

You're my baby, you're my pet
We fell in love on the night we met
You touched my hand, my heart went pop
Ooh, when we kissed I could not stop

You walked out of my dreams, and into my car
Now you're my angel divine
You're sixteen, you're beautiful, and you're mine"
88,Johnny Cash,Old Doc Brown,TRMBNJH128F42603DF,1960,"He was just an old country doctor in a little country town 
Fame and fortune had passed him by though we never saw him frown 
As day by day in his kindly way he'd serve us one and all 
Many a patient forgot to pay although Doc's fees were small 

Though he needed his dimes and there were times that he'd receive a fee 
He'd pass it onto some poor soul that needed it worse than he 
He had to sell his furniture couldn't pay his office rent 
So to a dusty room over a livery stable Doc Brown and his satchel went
 
And on the hitchin' post at the kerb below to advertise his wares 
He nailed a little sign that read Doc Brown has moved upstairs
There he kept on helping folks get well,for his heart was jus'pure gold,
But anyone with eyes could see that Doc was gettin' old. 

Then one day he didn't answer when they knocked upon his door 
Old Doc Brown was layin' down but his soul was no more 
They found him there in that old black suit on his face was a smile of content 
But all the money they could find on him was a quarter and a copper cent 

So they opened up his ledger and what they saw gave their hearts a pull 
Beside each debtor's name old Doc had write these words Paid In Full 
Old Doc should had a funeral fine enough for a king 
It's a ghastly joke our town was broke and no one could give a thing 

'Cept Jones an undertaker he did mighty well 
Donatin' an old iron casket he had never been able to sell 
And the funeral procession it wasn't much for grace and pomp and the style 
But those wagon loads of mourners they stretched out for more than a mile 

We wanted to give him a monument we kinda figured we owed him one 
Cause he made our town a better place for all the good he'd done 
We pulled up that old hitchin' post where Doc had nailed a sign 
We'd painted it white and to all of us it certainly did look fine 

Now the rains and the snows have washed away our white trimmin's of paint 
There ain't nothin' left but Doc's own sign and that's gettin' pretty faint 
But you can still see that old hitchin' post as if in answer to our prayers 
Mutely tellin' the whole wide world Doc Brown has moved upstairs"
