,Artist,Title,Track_id,Year,Lyrics
210,Gram Parsons,Kiss The Children,TRKDPVB128F147B6F4,1973,"Well, it's said my life is been so free and easy
But I'll tell you now the story isn't so,
Cause I've spent a lot of time down on the corner
Tasting tears and spilling whisky on the floor

Such a shame that it's so hard from me
To tell the truth to you,
But by now you know the kind of man I am;
So don't turn your pretty face away from me, dear
Cause there's kids and this game don't understand

One more night like this would put me six feet under
But my heart will still be fighting for your love
Just remember, little darling, that I love you
And kiss the children for me, please, before you go.

So don't play this crazy game with me no longer
Cause I won't be able to resist my rage
And the gun that's hangin on the kitchen wall, dear
Is like the road sign pointing straight to satan's cage.
And the gun that's hangin on the kitchen wall, dear
Is like the road sign pointing straight to satan's cage."
211,Eno,Baby's On Fire,TRAVROB128F9305B80,1973,"Baby's on fire
Better throw her in the water
Look at her laughing
Like a heifer to the slaughter
Baby's on fire
And all the laughing boys are bitching
Waiting for photos
Oh the plot is so bewitching
Rescuers row row
Do your best to change the subject
Blow the wind, blow, blow
Lend some assistance to the object
Photographers snip snap
Take your time she's only burning
This kind of experience
Is necessary for her learning
If you'll be my flotsam
I could be half the man I used to
They said you were hot stuff
And that's what baby's been reduced to

Juanita and Juan
Very clever with maracas
Making their fortunes
Selling second-hand tobaccos
Juan dances at Chico's
And when the clients are evicted
He empties the ashtrays
And pockets all that he's collected
But baby's on fire
And all the instruments agree that
Her temperature's rising
But any idiot would know that"
212,Robin Trower,Rock Me Baby,TRFLEAG12903D074CF,1973,"Rock me baby, rock me all night long
Rock me baby, honey, rock me all night long
I want you to rock me baby like my back ain't got no bone

Roll me baby, like you roll a wagon wheel
I want you to roll me baby like you roll a wagon wheel
Want you to roll me baby
You don't know how it makes me feel

Rock me baby, honey, rock me slow
Yeah, rock me pretty baby, baby rock me slow
Want you to rock me baby till I want no more

Rock me baby, rock me all night long
Rock me baby, honey, rock me all night long
I want you to rock me baby like my back ain't got no bone"
213,John Holt,Ali Baba,TRBPOCR128F931FB49,1973,"My dream last night was about Ali Baba
With the forty thieves
Tom, Tom, the piper's son
He was there with me

I rode through the valley
With the princess by my side
The Duke and the Duchess
Was there to meet me with a smile

Alice was there in a Wonderland
Staring far away
The three blind mice was there with me
To tell the Teddy bear the tale

The Teddy bear came smiling there
With a big smile
The little Bo-peep
Has lost a sheep last night

Dream last night about Ali Baba
With the forty thieves
Tom, Tom, the piper's son
He was there with me

I rode through the valley
With the princess by my side
The Duke and the Duchess
Did a reggae, reggae, reggae last night

My dream last night was about Ali Baba
With the forty thieves
Tom, Tom, the piper's son
He was there with me

I rode through the valley
With the princess by my side
I did a reggae, reggae last night
With the princess [Incomprehensible]

The Duke and the Duchess
Was there with me to meet me with a smile
Alice was there in a wonderland
Staring far away

I did a reggae, reggae, reggae
Reggae, reggae, reggae last night
Ooh yeah, ooh yeah
Do the reggae, reggae, reggae
Reggae, reggae, reggae"
214,Anne Murray,I'll Be Home,TRHKWQF128F424B559,1973,"I'll be home
I'll be home

When your life's in trouble and you are all alone
When you feeling down and need some sympathy
And there's no one else around to keep you company
I'll be here to comfort you and see you through
I'll be home, I'll be home, I'll be hom&amp;101

I'll be home
(Oh yes, you will)
I'll be home
(Even in the morning, yeah)

Where ever you may wonder or where ever you may roam
You come back and I'll be waiting here for you
'Cause there's no one else, who'll ever love you the way I do
Remember baby, you can always count on me
I'll be home, I'll be home, I'll be home"
215,Daniel Boone,Annabelle,TRNOPTI12903CA7968,1973,"There's a certain thing that
Happens when you're near me
And I think that I can see
Just how you feel

So let me tell you one more time
I love you dearly
And I'll never put you down
Never let you go free

Annabelle, I got a feeling, girl
You know darn well
That I really couldn't live
Without you by my side
Annabelle, I'm in love with you
Can't you tell that I really
Haven't got a single thing to hide
My Annabelle

You keep telling me
That I don't really love you
You keep saying things
That make me feel so sad

But I'm sure you know
I put no one above you
And I'll keep on trying
Til you know I ain't so bad

Annabelle, I got a feeling, girl
You know darn well
That I really couldn't live
Without you by my side
Annabelle, I'm in love with you
Can't you tell that I really
Haven't got a single thing to hide
My Annabelle

Annabelle, I got a feeling, girl
You know darn well
That I really couldn't live
Without you by my side
Annabelle, I'm in love with you
Can't you tell that I really
Haven't got a single thing to hide
My Annabelle

Annabelle, I got a feeling, girl
You know darn well
That I really couldn't live
Without you by my side
Annabelle, I'm in love with you
Can't you tell that I really
Haven't got a single thing to hide
My Annabelle"
216,Betty Davis,Anti Love Song,TRFYCTL128F4285250,1973,"No I don’t wanna love you
Cause I know how you are
That’s why I’ve been staying away from you
That’s why I haven’t called you

Cause I know you could possess my body
I know you could make me scrawl
I know could have me shaking
I know you could have me climbing walls

That’s why I don’t wanna love you

Cause I know how you are
Sure you say you’re right on and you’re righteous
But with me I’d know you’d be right off
Cause you know I could possess your body too, don’t cha?
You know I could make you crawl

And just as hard as I’d fall for you, boy
Well You know you’d fall for me harder

That’s why I don’t wanna love you

Cause I’d know what you’d do to my heart
You’d scorch it just like a hot iron
Leave me burning alone in the dark

Cause I know you’d could make me suffer
I know you could drive me mad
I know you’d just take me in a circle
And when it got real I know you’d disappear

That’s why I ain’t gonna love you

Cause I know you like to be in charge
But with me you know you couldn’t control me, don’t cha?
Cause you know I’d make you drop your guard
Cause I’d have you eating your ego
I’d make you pocket your pride

And just as hard as I’d be loving you, boy
Well you know you’d be loving me harder

That’s why I don’t wanna love you

No no no
I said I don’t wanna love you
No no no no no no
I said I ain’t gonna
No no no
I said I don’t wanna
No no no no no"
217,Larry Norman,Baroquen Spirits (Single),TRFSFKA128F92F7727,1973,"Waiting around since last night sitting in your garden chair
When you decide to come home I suppose I'll still be there
Everything comes to the man waits for everything to come
But what can he do when the thing he wants the most he's farthest from

Yes I guess I see your point
Patience growing thin
How can you respect a man who needs you more than you need him

Baroquen spirits do you love me
Baroquen spirits I can't say
Baroquen spirits do you love me
Baroquen spirits I can't say

Give me your love or let go but don't play with my affairs
Kiss me goodbye or hello but don't take lightly what we share

Yes I guess I see your point
Patience growing thin
How can you respect a man who needs you more than you need him

Baroquen spirits do you love me
Baroquen spirits I can't say
Baroquen spirits do you love me
Baroquen spirits I can't say

What will I do if you tell me that you love me not at all
I'll charter a ship to the edge of the world and sail off"
218,The Chi-Lites,A Letter To Myself,TRYHFVB12903CF4B32,1973,"Write a letter, write another letter 
Write a letter, write another letter 
I´m sealing up this letter 
I just finished signing your name 
My friends would all be surprised 
If they knew I was playing this game 
I´ll pretend it´s a special delivery 
And just to give me a hint 
I´ll use your favorite color 
Smear it with your favorite scent 
I know you think that i´m crazy 
But I can´t loose what have I left 
So i´ve decided to write this letter 
And send it to myself 
So to make my story short 
In the mail box I will kiss 
This letter that I wrote 
And it´s stamped with your lovely face 
When I´m alone 
And I need someone to talk to 
I talk to your picture 
Get me a pencil and paper 


And write all the things 
Say all the things i´ve heard you say before 
But with a little ´extra, extra read all about it´ 
Sugar and spice 
I guess it makes me feel kind of nice 
I write a letter to myself 
Oh, write another letter to myself 
I write another letter to myself 
Oh, write another letter to myself 
When is a home when you´re all alone 
It seems so full 
It seems so full 
And yet so empty 
Oh, I get my coat 
Leave you a note and go to the places 
Were we used to be 
I pretend you are there 
Order dinner for two 
Your presence is all in the air 
( repeat ) 

I write a letter to myself, oh, write another letter to myself"
219,Roxy Music,Sunset,TRURWQK128F1491502,1973,"Oh look at the sun - it's all aglow
Slow burning star - sinking low
Heaven knows where you go
Out of sight, out of minds eye, no
Aw such a shame - you must leave
All day long you were a friend to me
Still - the moon's company
Until morning when larks will sing
Horizon's appointment you'll keep
For sunswept flamingos must sleep
Scenes like these from my dreams
Cover cutting-room floors all over...

Warm heart we spin slowly from view
Why are you sad - do you disapprove?
How we've wasted our time
Sunset - end of my day - my decline
Postscript you trace colours the sky
Red-letter light fades, is filed away
Sunburst fingers you raise
One last sigh of farewell - goodbye"
220,Brownsville Station,Sweet Jane (LP Version,TRWPWIE128F42309F0,1973,"Reed

Standing on the corner, suitcase in my hand
Jack is in his corset and Jane is in her vest and me I'm in a rock and roll band
Riding in a Stutz Bearcat Jim, those were different times
And the poets studied rules of verse and all the ladies rolled their eyes.

Sweet Jane
Sweet Jane
Sweet Jane.

Now Jack he is a banker and Jane she is a clerk
And they're both saving up all their money and when they come home from work
Sitting by the fire, radio's playin' a little classical music for you, kids
To the march of the wooden soldiers and you can hear Jack say.

Sweet Jane
Sweet Jane
Sweet Jane.

Some people like to go out dancing, other people they got to work
And there's always some evil mothers, I tell you life is just full of dirt
And the women never really faint and the villains always blink their eyes
And children are the only ones that blush and that life is just to die
But anyone who had a heart, he wouldn't want to turn around and break it
And anyone who ever played a part, he wouldn't want to turn around and hate it.

Sweet Jane 
Sweet Jane 
Sweet Jane 
Sweet Jane
Sweet Jane 
Sweet Jane 
Sweet Jane
Sweet Jane
Oh my sweet Jane."
221,Iggy & The Stooges,Search And Destroy,TRCXEIR12903D097AF,1973,"I'm a street walking cheetah with a heart full of napalm
I'm a runaway son of a nuclear A-bomb
I am the world's forgotten boy
The one who searches and destroys

Honey, gotta help me please
Somebody gotta save my soul
Baby, detonate for me, oh

Look out honey 'cause I'm using technology
Ain't got time to make no apology
Solar radiation in the dead of night
Love in the middle of a firefight

Honey, gotta strike me a plan
Somebody gotta save my soul
Baby, penetrate my mind

And I'm the world's forgotten boy
The one who's searching, searching to destroy
And honey, I'm the world's forgotten boy
The one who's searching only to destroy, hey

Hey, hey
Hey, hey

Look out honey 'cause I'm using technology
Ain't got time to make no apology
Solar radiation in the dead of night
Love in the middle of a firefight

Honey, gotta strike me a plan
Somebody gotta save my soul
Baby, penetrate my mind

I'm the world's forgotten boy
The one who's searching, searching to destroy 
And honey, I'm the world's forgotten boy
The one who's searching, searching to destroy

Forgotten boy
Forgotten boy
Forgotten boy, I said ah, yeah
Forgotten boy, I said ah, yeah
Hey, hey, hey ..."
222,Queen,Stone Cold Crazy,TRLCHLW128F4298248,1973,"Sleeping very soundly on a Saturday morning I was dreaming I was Al Capone
There's a rumour going round, gotta clear outta town
Yes smelling like a dry fish bone
Here come the law, gonna break down the door, gonna carry me away once more
Never, never, never get it any more
Gotta get away from this stone cold floor
Crazy
Stone cold crazy, you know

Ow
Rainy afternoon I gotta blow a typhoon and I'm playing on my slide trombone
Anymore, anymore, cannot take it anymore

Gotta get away from this stone cold floor
Crazy
Stone cold crazy, you know, watch out

Walking down the street, shooting people that I meet
With my rubber tommy water gun
Here come the deputys, he's gonna come and getta me
I gotta get me get up and run
They got the sirens loose
I ran right outta juice
They're gonna put me in a cell, if I can't go to heaven
Will they let me go to hell
Crazy
Stone cold crazy, you know, ow"
223,Barry White,Standing In The Shadows Of Love,TRUQPYH12903CD94D3,1973,"Standing in the shadows of love
I'm getting ready for the heartaches to come
Standing in the shadows of love
I'm just waitin' for the heartaches to come

I want to run but there's no place to go
'cause heartaches will follow me I know
Without your love the love I need
It's the beginning of the end for me
'Cause you've taking away all my reason for living
When you pushed aside all the love I been giving

Didn't I treat you right now baby didn't I
Didn't I do the best for you now didn't I
Don't you leave me
Standing in the shadows of love
I'm getting ready for the heartaches to come
Standing in the shadows of love
I'm getting ready for the heartaches to come

All alone I'm destined to be
With misery my only company
Might come today, might come tomorrow
But it's for sure I ain't got nothing but sorrow
Now don't your conscience kind of bother you
How can you watch me cry after all I done for you
Now hold on a minute

Didn't I treat you right now honey didn't I
Didn't I do the best for you now didn't I
So don't you leave me
Standing in the shadows of love
Getting ready for the heartaches to come
Standing in the shadows of love
I'm getting ready for the heartaches to come

I want to run but there's no place to go
'cause heartaches will follow me I know
Without your love the love that I need
It's the beginning of the end for me
Now don't your conscience kinda, kinda bother you
How can you watch me cry
After all the things I done for you

Didn't I treat you right now baby didn't I
Didn't I do the best for you couldn't I
Didn't I do right by you didn't I
Didn't I screw you right now

Kept you in luxury didn't I
Didn't I do the best for you didn't I
Didn't I treat you right now didn't I
Didn't I do the best for you now didn't I

I'm trying hard not to cry
You know my crying ain't gonna help me now
Without your love the love that I need
It's the beginning of the end for me
So don't you leave me

Standing in the shadows of love
I'm getting ready for the heartaches to come
Standing in the shadows of love
I'm getting ready for the heartaches to come"
224,John Denver,River Of Love,TRZAYLU128F428B5FD,1973,"All of my life I've been so happy
While I have had you by my side
And now you say you're gonna leave me
For to become someone else's bride

Oh the river of love it has gone muddy
And the flowers they are dying on the shore
And the blue skies have all turned to darkness
And the nightingales will sing no more

What can I do to hide my sorrow?
What can I do to ease my pain?
And how can I keep these tears from fallin'?
Oh darlin' won't you come back hpme again?

Oh the river of love it has gone muddy
And the flowers they are dying on the shore
And the blue skies have all turned to darkness
And the nightingales will sing no more

Tomorrow I will take you to the station
And see that you're safely on that train
And when that 2:19 has departed
I'll never ever see your smile again

Oh the river of love it has gone muddy
And the flowers they are dying on the shore
And the blue skies have all turned to darkness
And the nightingales will sing no more
And the blue skies have all turned to darkness
And the nightingales will sing no more"
225,Larry Norman,Be Careful What You Sign,TRCGGWV128F92F7724,1973,"I was walking down the road when I bumped into you
I was walking down the road when I bumped into you
You stopped me you touched me you looked me in the eye
I had a feeling that you knew me I decided you must die
I pulled out my Thornton special I shot you in the head
I threw you in the alley way and I left you for dead

Then a man with a hat came up from behind
The sky went black and I thought i was blind
He put his hand inside my jacket and left a million dollar bill
He slipped his hand into my pocket and gave me women and thrills
And when I turned around to thank him there was no one there but me
And both my hands where filled with sand I was standing by the sea

We had a dinner at eight and women at nine
The party was great till we ran out of wine
There was a knock upon the bedroom door my knees began to shake
And this man came in and melted all the candles on my cake
He said I've come here to escort you it's time for you to go

I was running down the road
I was trying to leave
And I saw you all alone in between the thieves
And when the lightning flashed I saw somebody hanging from a tree
And as I turned to walk away I realized it was me
I pulled out my Thornton special I shot me in the head
I threw me in the alley way and left me for dead
Down the road
Down the road"
226,Blue Oyster Cult,7 Screaming Diz-Busters,TRPLUGJ128F4277249,1973,"They held their heads with laughs of pain
They'd learned from men who'd just refrain
From glancing at a mirror's face

Seven screaming diz-busters
Who lurk behind the rose
Cast iron for a bloodstream
And ice behind their eyes

On each and all those holy nights
When duster's dust becomes the sale
And Lucifer the light, the light

They're long so long this time of year
When stars be crossed by twirling fear
You don't suppose I'd prove surprised

Well seven screaming diz-busters
Should go the route and die
Without that warmth they've learned to crave
With hardened smiles and evil signs (ah, well)

Bury me near the secret cove 
So they'll not know the way
Bury me round behind the rose
So they'll not rile my grave
I'll not reveal whose name's still lost

Well their laughs of pain, ah ha ha ha!

And their harder smiles...
And their rigid arms...
And their evil signs...

The longer days and the longer nights
Yeah they're longer...
They're longer still

On each and all those holy nights
When duster's dust becomes the sale
And Lucifer the light

Lucifer the light
Lucifer the light
Lucifer the light
Lucifer the light
Lucifer the light Oh, the light
Lucifer the light I can't stand the light
Lucifer the light I can't stand it now
Lucifer the light No
Lucifer the light Can't stand the light
Lucifer the light
Lucifer the light Can't stand the light
Lucifer the light Can't stand the light
Lucifer the light
Lucifer the light Can't stand the light
Lucifer the light Oh no!
Lucifer the light Aahhh
Lucifer the light
Lucifer the light I can't I can't
Lucifer the light No
Lucifer the light Can't stand it
Lucifer the light Can't stand it, no
Lucifer the light Can't stand it
Lucifer the light Can't
Lucifer the light Can't I can't I can't can't can't can't stand it
Lucifer the light
Lucifer the light Just can't stand the light
Lucifer the light one
Lucifer the light two
Lucifer the light three
Lucifer the light four
Lucifer the light five
Lucifer the light six
Lucifer the light And seven"
227,Bryan Ferry,I Love How You Love Me (1999 Digital Remaster),TREDDXL128F146A11E,1973,"I love how your eyes close
Whenever you kiss me
And when I'm away from you
I love how you miss me
I love the way you always
Treat me tenderly
But darlin' most of all
I love how you love me
I love how your heart beats
Whenever I hold you
I love how you think of me
Without being told to
I love the way your touch
Is so heavenly
But darling' most of all
I love how you love me...
I love how your eyes close
Whenever you kiss me
And when I'm away from you
I love how you miss me
I love the way you always
Treat me tenderly
But darlin' most of all
I love how you love me
....love me, love me
Love how you hug me
I love how you squeeze me
I love how you squeeze me
Tease me, please me
Love how you tease me
I love the way you always treat me tenderly
But darling most of all, I love how you love me"
228,Procol Harum,Grand Hotel,TRZRPSU128F9351080,1973,"Tonight we sleep on silken sheets
We drink fine wine and eat rare meats
On Carousel and gambling stake
Our fortunes speed, and dissipate.
It's candlelight and chandelier,
It's silver plate and crystal clear.
It's serenade and Sarabande,
The nights we stay at Hotel Grand

Tonight we dine at Hotel Ritz.
(A golden dish with every wish ).
It's mirrored walls, and velvet drapes,
Dry champagne, and bursting grapes.
Dover sole, and Oeufs Mornay,
Profiteroles and Peach Flambe,
The waiters dance on fingertips
The nights we dine at Hotel Ritz 

One more toast to greet the morn
The wine and dine have danced till dawn
Where's my Continental Bride?
We'll Continental slip and slide
Early morning pinch and bite -
(These French girls always like to fight)
It's serenade and Sarabande,
The nights we stay at Hotel Grand
Les nuits qu'on passe à l'Hotel Grande."
229,Gregg Allman,Don't Mess Up A Good Thing,TRKZFRS128F42137CA,1973,"You been cheating on me
You know my love is true
Ain't nobody in the whole wide world
Gonna love you like I do

CHORUS
Don't you be no fool
Don't you be no fool
If you keep messing around now baby
You gonna mess up a good thing
You gonna mess up a good thing

I'm might have cheated just a little bit baby
Like all the others do
Ain't about time to get my check
Now I rush it home to you

Don't you be no fool
Don't you be no fool
If you keep messing around now baby

(Good thing)
Gonna mess up a good thing
(Good thing)
You don't know what you're hitting
(Good thing)
Gonna mess up a good thing
(Good thing)
Na na na na na

You tell me that you got a part-time lover
Living away cross town
But it won't be just about little while baby
Before you put me down

[chorus]

Now don't you go running across town baby
To catch me doing wrong
I'm just a little bit jealous baby
'Cause we got a thing going on

[chorus]

(Good thing)
Gonna mess up a good thing
(Good thing)
You don't know what you're hitting
(Good thing)
Gonna mess up a good thing
(Good thing)
No no no no no"
230,Stevie Wonder,Higher Ground,TRQHMUC128F146E2CF,1973,"People keep on learnin'
Soldiers keep on warrin'
World keep on turnin'
'Cause it won't be too long

Powers keep on lyin'
While your people keep on dyin'
World keep on turnin'
'Cause it won't be too long

I'm so darn glad he let me try it again
'Cause my last time on earth I lived a whole world of sin
I'm so glad that I know more than I knew then
Gonna keep on tryin'
'Til I reach the highest ground

Teachers keep on teachin'
Preachers keep on preachin'
World keep on turnin'
'Cause it won't be too long
Oh no

Lovers keep on lovin'
Believers keep on believin'
Sleepers just stop sleepin'
Cause it won't be too long
Oh no

I'm so glad that he let me try it again
'Cause my last time on earth I lived a whole world of sin
I'm so glad that I know more than I knew then
Gonna keep on tryin'
'Til I reach my highest ground

'Til I reach my highest ground
Oh no
No one's gonna bring me down
Oh no
'Til I reach my highest ground
Don't you let nobody bring you down
God is gonna show you higher ground
He's the only friend you have around"
231,John Martyn,Dreams By The Sea,TRHIZWS128E078DCD8,1973,"No, no, no, no - it can't be true
No, no, no, no - it isn't you
No, no, no, no - it's not the way you are
No, no, no, no - it isn't you
No, no, no, no - it can't be true
No, no, no, no - it's not the way you are

Bad dreams for me
Bad dreams by the sea

Dreaming you've got a lover
Dreaming I got another
Dreaming that there's a killer in your eyes
Dreaming that you're a user
Dreaming that I'm a loser
Dreaming that there's a killer in my eyes

Bad dreams for me
Bad dreams by the sea

Dreaming about a place of shades
Dreaming about the ace of spades
Dreaming about us taking things too far
No, no, no, no - it can't be you
No, no, no, no - it isn't true
No, no, no, no - it's not the way you are

Bad dreams for me
Bad dreams by the sea"
