,Artist,Title,Track_id,Year,Lyrics
0,Big Mama Thornton,Hound Dog,TRWVXTC128F930FFF6,1953,"You ain't nothing but a hound dog
Been snoopin' round my door
You ain't nothing but a hound dog
Been snoopin' round my door
You can wag your tail
But I ain't gonna feed you no more

You told me you was high class
But I could see through that
Yes, you told me you was high class
But I could see through that
And, daddy, I know
You ain't no real cool cat

You ain't nothing but a hound dog
Been snoopin' round my door
You're just an old hound dog
Been snoopin' round my door
You can wag your tail
But I ain't gonna feed you no more

Aw, listen to that little hound dog, oow
Aw, play it, it's alright up here
Listen to that old hound dog howl, ooh
Aw, play it, boy, play it
Aw, it makes me feel good
Aw, do the mess around right along here
Now wag your tail
Aw, get it
Aw, get it now, get it, get it, get it
Aw, you're a old hound dog

You made me feel so blue
You made me weep and moan
You made me feel so blue
Well, you made me weep and moan
Cause you ain't looking for a woman
All you're lookin' is for a home

You ain't nothing but a hound dog
Quit snoopin' round the door
You ain't nothing but a hound dog
Been snoopin' 'round my door
You can wag your tail
But I ain't gonna feed you no more
Ooh"
1,Clyde McPhatter,Money Honey,TRLIYZD12903CF35ED,1953,"You know, the landlord rang my front door bell
I let it ring for a long, long spell
I looked through the window, I peeked through the blind
And asked him to tell me what was on his mind

He said, ""Money, honey
Money, honey, money, honey
If you wanna get along with me""

I was cleaned and skinned and so hard pressed
I called the woman that I love the best
I finally reached my baby 'bout a half past three
She said, ""I'd like to know what you want with me""

I said, ""Money, honey
Money, honey, money, honey
If you wanna get along with me""

She screamed and said, ""What's wrong with you?
From this day on, our romance is through""
I said, ""Tell me, baby, face to face
A-how could another man take my place?""

She said, ""Money, honey
Money, honey, money, honey
If you wanna get along with me""

Well, I learned my lesson and now I know
The sun may shine and the wind may blow
Women may come and the women may go
But before I say, I love 'em so

I want money, honey
Money, honey, money, honey
If you wanna get along with me

(If you wanna get along)
Well, make some money
(If you wanna get along)
Well, I ain't jivin' you, honey

(If you wanna get along)
You better give up some money
If you wanna get along with me"
2,Dean Martin,That's Amore,TRHPXES128F92D1932,1953,"(In Napoli where love is king
When boy meets girl here's what they say)

When the moon hits your eye like a big pizza pie
That's amore
When the world seems to shine like you've had too much wine
That's amore
Bells will ring ting-a-ling-a-ling, ting-a-ling-a-ling
And you'll sing ""Vita bella""
Hearts will play tippy-tippy-tay, tippy-tippy-tay
Like a gay tarantella

When the stars make you drool just like a pasta e fasul
That's amore
When you dance down the street with a cloud at your feet
You're in love
When you walk in a dream but you know you're not
Dreaming signore
Scuzzi me, but you see, back in old Napoli
That's amore

When the moon hits you eye like a big pizza pie
That's amore
When the world seems to shine like you've had too much wine
That's amore
Bells will ring ting-a-ling-a-ling, ting-a-ling-a-ling
And you'll sing ""Vita bella""
Hearts will play tippy-tippy-tay, tippy-tippy-tay
Like a gay tarantella
Lucky Fella

When the stars make you drool just like a pasta e fasul
That's amore
When you dance down the street with a cloud at your feet
You're in love
When you walk in a dream but you know you're not
Dreaming signore
Scusami, but you see, back in old Napoli
That's amore,(amore)
That's amore"
3,Eartha Kitt,Angelitos Negros,TRCSGZT128F931CD87,1953,"Pintor nacido en mi tierra
Con el pincel extranjero
Pintor que sigues el rumbo
De tantos pintores viejos

Aunque la virgen sea blanca
Píntale angelitos negros
Que también se van al cielo
Todos los negritos buenos

Pintor si pintas con amor
Por qué desprecias su color?
Si sabes que en el cielo
También los quiere Dios

Pintor de santos alcoba
Si tienes alma en el cuerpo
Por qué al pintar en tus cuadros
Te olvidaste de los negros

Siempre que pintas iglesias
Pintas angelitos bellos
Pero nunca te acordaste
De pintar un ángel negro"
4,Eartha Kitt,Santa Baby,TRDZYSN128F933D42C,1953,"Santa baby, just slip a sable under the tree,
For me.
Been an awful good girl,
Santa baby, so hurry down the chimney tonight.

Santa baby, a 54 convertible too,
Light blue.
I'll wait up for you dear,
Santa baby, so hurry down the chimney tonight.

Think of all the fun I've missed,
Think of all the fellas that I haven't kissed,
Next year I could be just as good,
If you'll check off my Christmas list,

Santa baby, I wanna yacht,
And really that's not a lot,
Been an angel all year,
Santa baby, so hurry down the chimney tonight.

Santa honey, one little thing I really need,
The deed
To a platinum mine,
Santa baby, so hurry down the chimney tonight.

Santa cutie, and fill my stocking with a duplex,
And checks.
Sign your 'X' on the line,
Santa cutie, and hurry down the chimney tonight.

Come and trim my Christmas tree,
With some decorations bought at Tiffany's,
I really do believe in you,
Let's see if you believe in me,

Santa baby, forgot to mention one little thing,
A ring.
I don't mean on the phone,
Santa baby, so hurry down the chimney tonight,
Hurry down the chimney tonight,
Hurry, tonight."
5,Eartha Kitt,Under The Bridges Of Paris,TRKQIRI12903CDC7D8,1953,"How would you like to be
Down by the Seine with me
Oh, what I'd give for a moment or two
Under the bridges of Paris with you

Darling, I'd hold you tight
Far from the eyes of night
Under the bridges of Paris with you
I'd make your dreams come true

How would you like to be
Down by the Seine with me
Oh, what I'd give for a moment or two
Under the bridges of Paris with you

Darling, I'd hold you tight
Far from the eyes of night
Under the bridges of Paris with you
I'd make your dreams come true"
6,Eddie Boyd,Third Degree,TRMKHHU128F424A047,1953,"Got me accused of peeping, I can't see a thing
Got me accused of petting, I can't even raise my hand
Bad luck, bad luck is killing me

Well I just can't stand no more of this third degree
Got me accused of murder, I ain't harmed a man
Got me accused of forgery, I can't even write my name

Got me accused of taxes, I ain't got a dime
Got me accused of children, and ain't nary one of them was mine

Got me accused of taxes, I ain't got a dime
Got me accused of children, and ain't nary one of them was mine"
7,Eddie Fisher,I'm Yours,TRGFFEO128F9353BA6,1953,"I'm yours
Heart and soul I am yours
Can't you see it my eyes
Can't you hear it in my sighs
I'm yours

I'm yours
Every kiss says I'm yours
Take my lips and take my arms
I'm a victim of your charms
I'm yours

My life and my love, dear
Are yours to command
I stand here before you
My heart in my hand

I'm yours
All the world knows I'm yours
And I only hope and pray
That someday I'll hear you say
I'm yours

My life and my love, dear
Are yours to command
I stand here before you
My heart in my hand

I'm yours
All the world knows I'm yours
And I only hope and pray
That someday I'll hear you say
I'm, yours"
8,Elmore James,I Believe,TRWPJEE12903CB5722,1953,"I'm gonna get up in the mornin',
I believe I should go back home
I'm gonna get up in the mornin',
I believe I should go back home
I'm gonna find my baby,
acknowledge that I done her wrong
I don't want no woman,
that stays drunk all the time
I don't want no woman,
that stays drunk all the time
Well you know she's a wild woman,
'bout to drive me out of my mind
I believe, I believe,
I'm going back home
I believe, I believe,
I'm going back home
I gotta lie to my baby,
I know I treated her wrong
I believe, I believe,
my time ain't long
I believe, I believe,
my time ain't long
I left my room this mornin',
I know I treat my baby wrong"
9,Frank Chacksfield & His Orchestra,Ebb Tide,TRIOZJN128F931EDD8,1953,"First the tide rushes in
Plants a kiss on the shore
Then rolls out to sea
And the sea is very still once more

So I rush to your side
Like the oncoming tide
With one burning thought
Will your arms open wide

At last we're face to face
And as we kiss through an embrace
I can tell, you are love
Really mine in the rain

In the dark, in the sun
Oh, like the tide at its ebb
I'm at peace in the web of your arms"
10,Furry Lewis,John Henry,TRRJYRQ128F428C044,1953,"John Henry was a little baby boy, settin' at home on his mother's knee
Cryin', ""That Big Bend tunnel on that YMV, it's gon' be the death of me, 'fore I die
Lord, it's gonna be the death of me, Lord, Lord, says it's gon'""

When John Henry hammered in the mountain 'til the head of his hammer caught fire
He cried, ""Y'all just pick 'em up and let 'em down again
Just give me one cool drink of water 'fore I die, Lord, Lord
Just give me one cool drink of water.""

Spoken: You know, one time John Henry had a job to do, one time, Red
He's the best at it, people say that awful day will surely come, that's funny
how it would make it

Said I'm goin' where John Henry fell dead

When the women in the West heard of John Henry's death, they couldn't sleep at home in their beds
Some was dressed in white, some was dressed in red, said
""Take me where John Henry fell dead, baby, please take me (guitar finishes line)
I'm goin' where John Henry fell dead, baby"", he said, ""Lord knows I'm goin' where
John Henry fell dead, dead, I'm goin' where John Henry"" (guitar finishes line)

John Henry told his captain one day, ""You can give me my time
I can make more money on that C &amp; O than I can on that IC line, Lord knows, than I can""

Spoken: You know, one time John Henry had a piker, he had to hold a little piece of steel
just 'bout that tall, he told his piker to hold that steel, he said
What's gonna happen?"", Booker, he says, ""I'm goin' down, I'm gonna drive some steel today.""
I'm goin' where John Henry sat all dead

John Henry told his piker, ""I 'clare you better pray
If I miss this steel with this 10 pound mawl, tomorrow gon' be your buryin' day, goddamn, haha"
11,Gayla Peevey,I Want a Hippopotamus for Christmas,TRIKZMT12903CF5139,1953,"I want a hippopotamus for Christmas
Only a hippopotamus will do
Don't want a doll, no dinky Tinkertoy
I want a hippopotamus to play with and enjoy

I want a hippopotamus for Christmas
I don't think Santa Claus will mind, do you?
He won't have to use our dirty chimney flue
Just bring him through the front door,
that's the easy thing to do

I can see me now on Christmas morning,
creeping down the stairs
Oh what joy and what surprise
when I open up my eyes
to see a hippo hero standing there

I want a hippopotamus for Christmas
Only a hippopotamus will do
No crocodiles, no rhinoceroses
I only like hippopotamuses
And hippopotamuses like me too

Mom says the hippo would eat me up, but then
Teacher says a hippo is a vegetarian

There's lots of room for him in our two-car garage
I'd feed him there and wash him there and give him his massage

I can see me now on Christmas morning,
creeping down the stairs
Oh what joy and what surprise
when I open up my eyes
to see a hippo hero standing there

I want a hippopotamus for Christmas
Only a hippopotamus will do
No crocodiles or rhinoceroseses
I only like hippopotamuseses
And hippopotamuses like me too!"
12,Georges Brassens,J'Ai Rendez-Vous Avec Vous,TRMCMRJ12903CC3999,1953,"Monseigneur l'astre solaire
Comme je n'l'admire pas beaucoup
M'enlève son feu,
Oui mais, d'son feu, moi j'm'en fous
J'ai rendez-vous avec vous
La lumière que je préfère
C'est celle de vos yeux jaloux
Tout le restant m'indiffère
J'ai rendez-vous avec vous

Monsieur mon propriétaire
Comme je lui dévaste tout
M'chasse de son toit,
Oui mais, d'son toit, moi j'm'en fous
J'ai rendez-vous avec vous
La demeure que je préfère
C'est votre robe à froufrous
Tout le restant m'indiffère
J'ai rendez-vous avec vous

Madame ma gargotière
Comme je lui dois trop de sous
M'chasse de sa table,
Oui mais, d'sa table, moi j'm'en fous
J'ai rendez-vous avec vous
Le menu que je préfère
C'est la chair de votre cou
Tout le restant m'indiffère
J'ai rendez-vous avec vous

Sa Majesté financière
Comme je n'fais rien à son goût
Garde son or,
Or, de son or, moi j'm'en fous
J'ai rendez-vous avec vous
La fortune que je préfère
C'est votre cœur d'amadou
Tout le restant m'indiffère
J'ai rendez-vous avec vous"
13,Georges Brassens,Pauvre Martin,TRGQMSH12903D10F9C,1953,"Avec une bêche à l'épaule,
Avec, à la lèvre, un doux chant,
Avec, à la lèvre, un doux chant,
Avec, à l'âme, un grand courage,
Il s'en allait trimer aux champs!

Pauvre Martin, pauvre misère,
Creuse la terre, creuse le temps!

Pour gagner le pain de sa vie,
De l'aurore jusqu'au couchant,
De l'aurore jusqu'au couchant,
Il s'en allait bêcher la terre
En tous les lieux, par tous les temps!

Pauvre Martin, pauvre misère,
Creuse la terre, creuse le temps!

Sans laisser voir, sur son visage,
Ni l'air jaloux ni l'air méchant,
Ni l'air jaloux ni l'air méchant,
Il retournait le champ des autres,
Toujours bêchant, toujours bêchant!

Pauvre Martin, pauvre misère,
Creuse la terre, creuse le temps!

Et quand la mort lui a fait signe
De labourer son dernier champ,
De labourer son dernier champ,
Il creusa lui-même sa tombe
En faisant vite, en se cachant...

Pauvre Martin, pauvre misère,
Creuse la terre, creuse le temps!

Il creusa lui-même sa tombe
En faisant vite, en se cachant,
En faisant vite, en se cachant,
Et s'y étendit sans rien dire
Pour ne pas déranger les gens...

Pauvre Martin, pauvre misère,
Dors sous la terre, dors sous le temps!"
14,Georges Brassens,Brave Margot,TRHKMOH12903CC3992,1953,"Margoton, la jeune bergère,
Trouvant dans l'herbe un petit chat
Qui venait de perdre sa mère
L'adopta...
Elle entr'ouvre sa collerette
Et le couche contre son sein.
C'était tout c'quelle avait, pauvrette,
Comme coussin...
Le chat, la prenant pour sa mère,
Se mit à téter tout de go.
Ému', Margot le laissa faire...
Brav' Margot !
Un croquant, passant à la ronde
Trouvant le tableau peu commun,
S'en alla le dire à tout l'monde,
Et, le lendemain...

Quand Margot dégrafait son corsage
Pour donner la gougoutte à son chat,
Tous les gars, tous les gars du village,
Étaient là, la la la la la la...
Étaient là, la la la la la...
Et Margot, qu'était simple et très sage,
Présumait qu'c'était pour voir son chat
Qu'tous les gars, tous les gars du village,
Étaient là, la la la la la la...
Étaient là, la la la la la...

L'maître d'école et ses potaches,
Le mair', le bedeau, le bougnat,
Négligeaient carrément leur tâche
Pour voir ça...
Le facteur, d'ordinair' si preste,
Pour voir ça, ne distribuait plus
Les lettres que personne, au reste,
N'aurait lues...
Pour voir ça (Dieu le leur pardonne !)
Les enfants de choeur, au milieu
Du saint sacrifice, abandonnent
Le saint lieu...
Les gendarmes, mêm' les gendarmes,
Qui sont par natur' si ballots,
Se laissaient toucher par les charmes
Du joli tableau...

Mais les autr's femm's de la commune
Privé's d'leurs époux d'leurs galants,
Accumulèrent la rancune,
Patiemment...
Puis un jour, ivres de colère,
Elles s'armèrent de bâtons
Et, farouch's, elles immolèrent le chaton...
La bergère, après bien des larmes,
Pour s'consoler prit un mari
Et ne dévoila plus ses charmes
Que pour lui...
Le temps passa sur les mémoires,
On oublie l'événement,
Seuls des vieux racontent encore
À leurs p'tits enfants"
15,Georges Brassens,Comme hier,TRAOFJS12903CF3F3D,1953,"Hé ! donne moi ta bouche, hé ! ma jolie fraise !
L'aube a mis des fraises plein notre horizon
Garde tes dindons, moi mes porcs, Thérèse
Ne repousse pas du pied mes petits cochons

Va, comme hier ! comme hier ! comme hier !
Si tu ne m'aimes point, c'est moi qui t'aimerons
L'un tient le couteau, l'autre la cuiller
La vie, c'est toujours les mêmes chansons

Pour sauter le gros sourceau de pierre en pierre
Comme tous les jours mes bras t'enlèveront
Nos dindes, nos truies nous suivront légères
Ne repousse pas du pied mes petits cochons

Va, comme hier ! comme hier ! comme hier !
Si tu ne m'aimes point, c'est moi qui t'aimerons
La vie, c'est toujours amour et misère
La vie, c'est toujours les mêmes chansons

J'ai tant de respect pour ton cœur, Thérèse
Et pour tes dindons, quand nous nous aimons
Quand nous nous fâchons, hé ! ma jolie fraise
Ne repousse pas du pied mes petits cochons

Va, comme hier ! comme hier ! comme hier !
Si tu ne m'aimes point, c'est moi qui t'aimerons
L'un tient le couteau, l'autre la cuiller
La vie, c'est toujours les mêmes chansons"
16,Georges Brassens,La cane de Jeanne,TROWQEN12903CF3F36,1953,"La cane
De Jeanne
Est morte au gui l'an neuf
L'avait fait la veille
Merveille
Un œuf

La cane
De Jeanne
Est morte d'avoir fait
Du moins on le présume
Un rhume
Mauvais

La cane
De Jeanne
Est morte sur son œuf
Et dans son beau costume
De plumes
Tout neuf

La cane
De Jeanne
Ne laissant pas de veuf
C'est nous autres qui eûmes
Les plumes
Et l'œuf

Tous, toutes
Sans doute
Garderons longtemps le
Souvenir de la cane
De Jeanne
Morbleu"
17,Guitar Slim,The Things That I Used To Do,TRWUQVU128F4242F7D,1953,"The things that I used to do....Lord, I won't do no more
The things that I used to do....Lord, I won't do no more
I used to sit and hold your hand darlin'....and cry, oh babe do not go

I used to search all night for you darlin'
Lord, and my search would always end in vain
I used to search all night for you darlin'
Lord, and my search would always end in vain
But I knew all the time darlin'....that you was hid out wit' your other man

I'm goin' to send you back to your mama darlin'
Lord, and I'm goin' back to my family too
I'm goin' to send you back to your mama darlin'
Lord, and I'm goin' back to my family too
Nothin' I can do to please ya' darlin'....i just can't get along with you"
18,Hank Williams,Half As Much,TRGCWLY128F9322E91,1953,"If you love me half as much as I love you
You wouldn't worry me half as much as you do
You're nice to me when there's no one else around
You only build me up to let me down

If you missed me half as much as I miss you
You wouldn't stay away half as much as you do
I know that I would never be this blue
If you only loved me half as much as I love you

If you love me half as much as I love you
You wouldn't worry me half as much as you do
You're nice to me when there's no one else around
You only build me up to let me down

If you missed me half as much as I miss you
You wouldn't stay away half as much as you do
I know that I would never be this blue
If you only loved me half as much as I love you"
19,Hank Williams / The Drifting Cowboys,Your Cheatin' Heart,TRMCCNB128F9308F5F,1953,"Your cheatin' heart
Will make you weep
You'll cry and cry
And try to sleep
But sleep won't come
The whole night through
Your cheatin' heart will tell on you

When tears come down
Like falling rain
You'll toss around
And call my name
You'll walk the floor
The way I do
Your cheatin' heart will tell on you

Your cheatin' heart
Will pine some day
And crave the love
You threw away
The time will come
When you'll be blue
Your cheatin' heart will tell on you

When tears come down
Like falling rain
You'll toss around
And call my name
You'll walk the floor
The way I do
Your cheatin' heart will tell on you"
20,Jacques Brel,La Foire,TRWZWQT12903C95062,1953,"J'aime la foire où pour trois sous
L'on peut se faire tourner la tête
Sur les manèges aux chevaux roux
Au son d'une musique bête

Les lampions jettent au firmament
Alignés en nombre pair
Comme des sourcils de géant
Leurs crachats de lumière
Les moulins tournent, tournent sans trêve
Emportant tout notre argent
Et nous donnant d'un peu de rêve
Pour que les hommes soient contents
Les moulins tournent, tournent sans trêve
Emportant tout notre argent
Et nous donnant d'un peu de rêve
Pour que les hommes soient contents

J'aime la foire où pour trois sous
L'on peut se faire tourner la tête
Sur les manèges aux chevaux roux
Au son d'une musique bête

Ça sent la graisse où dansent les frites
Ça sent les frites dans les papiers
Ça sent les beignets qu'on mange vite
Ça sent les hommes qui les ont mangés
Partout je vois à petits pas
Des couples qui s'en vont danser
Mais moi sûrement je n'irai pas
Grand-mère m'a dit de me méfier
Partout je vois à petits pas
Des couples qui s'en vont danser
Mais moi sûrement je n'irai pas
Grand-mère m'a dit de me méfier

J'aime la foire où pour trois sous
L'on peut se faire tourner la tête
Sur les manèges aux chevaux roux
Au son d'une musique bête

Et lorsque l'on n'a plus de sous
Pour se faire tourner la tête
Sur les manèges aux chevaux roux
Au son d'une musique bête
On rentre chez soi lentement
Et tout en regardant les cieux
On se demande simplement
S'il n'existe rien de mieux
On rentre chez soi lentement
Et tout en regardant les cieux
On se demande simplement
S'il n'existe rien de mieux

J'aimais la foire où pour trois sous
L'on pouvait se faire tourner la tête
Sur les manèges aux chevaux roux
Au son d'une musique bête
La, la, la, la"
21,Jacques Brel,Il y a,TRGWFPA12903CC932E,1953,"Il y a tant de brouillard dans les ports, au matin
Qu'il n'y a de filles dans le cœur des marins
Il y a tant de nuages qui voyagent là-haut
Qu'il n'y a d'oiseaux
Il y a tant de labours, il y a tant de semences
Qu'il n'y a de joie d'espérance
Il y a tant de ruisseaux, il y a tant de rivières
Qu'il n'y a de cimetières

Mais il y a tant de bleu
Dans les yeux de ma mie
Il y a dans ses yeux tant de vie
Il y a dans ses cheveux
Un peu d'éternité
Sur sa lèvre tant de gaieté

Il y a tant de lumières dans les rues des citées
Qu'il n'y a d'enfants désolés
Il y a tant de chansons perdues dans le vent
Qu'il n'y a d'enfants
Il y a tant de vitraux, il y a tant de clochers
Qu'il n'y a de voix qui nous disent d'aimer
Il y a tant de canaux qui traversent la terre
Qu'il n'y a de rides au visage des mères

Mais il y a tant de bleu
Dans les yeux de ma mie
Il y a dans ses yeux tant de vie
Il y a dans ses cheveux
Un peu d'éternité
Sur sa lèvre tant, tant de gaieté"
22,Jimmy Rogers,Act Like You Love Me,TRBMSVQ128F148B054,1953,"Baby that's all right for you
You treat me mean
That's the way you do
If you love me call me on the phone sometime
To you hear your voice ease my worryin mind
One of these days i'm going to show you how nice i can be
The love i got for you swear is good for me
The sun is gonna shine in my front door someday
The wind is gonna ride all my troubles away"
23,Lightnin' Hopkins,Mistreated Blues,TRFFZPZ128F4247E6C,1953,"Baby, you mistreated me all the time
Baby, you mistreated me all the time
Yes, you know I hope some day, baby
That you will change your mind

Baby, now what wrong have I done
Baby, now what wrong have I done
You try to mistreat me, baby
When I try to have my fun

Baby, it's all comin' back to you
Baby, it's all comin' back to you
You're gonna be sorry, darlin'
That you treat me like you do

Baby, got to go and leave you here
Baby, got to go and leave you here
But maybe some day, baby
You will feel my care"
24,Little Walter,You're So Fine,TRMRAFF128F92FB7D1,1953,"You're so fine wanna love you all the time
You're so fine pretty baby, let me love you all the time

Well and I got a girl she's fine and brown
What I like about her, she's mine all mine
She's so fine, yes she's so fine
You're so fine pretty baby, let me love you all the time

Well I wanna give you all my money buy you diamond, everything
Till you be mine, baby then we will make amends
You're so fine, yes you're so fine
You are a fine healthy thing, I wanna love you all the time

Now you fill my conversation baby, you made me talk myself to death
I'm in love with you baby and I don't want nobody else
You're so fine, yeah you're so fine
You are a fine healthy thing, I wanna love you all the time

Yeah you're so fine baby, let me love you all the time

Now you know I love you baby and I just can't help myself
Goin' crazy 'cause you're lovin' someone else
You're so fine, yeah you're so fine
You are a fine healthy thing, let me love you all the time"
25,Little Walter,Tell Me Mama,TRMNVAU128F92F3239,1953,"Oh, tell me mama
Who's that while ago?
Oh, tell me mama
Who's that while ago?
Yes, when I come in
Who went out that back door?

Now don't come here mama
I'm gonna start a raisin' sand
You been out boogie-woogie'n
There's somethin' I don't understand

I want you to tell me mama
Who's that while ago?
Yes, when I come in
Who went out that back door?

Now this is somethin'
I never seen before
A man is gettin' my money
Always slammin' my back door

I want you to tell me mama
Who's that while ago?
Yes, when I came in
Who went out that back door?

Oh, I had to wanna kneel down
He Couldn't get threw 
His hat in his hand
And his overcoat too

I want you to tell me mama
Why can't you be true?
Yes, when I came in
Who went out that back door?

He came by me runnin'
Smellin' like a whiskey can
My hat in his hand
And my overcoat too

I want you to tell me mama
Who's that while ago?
Yes, when I came in
Who went out that back door?"
26,Little Walter,Tonight With A Fool,TRWPWFQ128F92F3230,1953,"Wished I had someone
Just to love me all the time

I wished I had somebody to
Love me all the time
I wouldn't be so worried baby
I would have a piece of mind

Well, you say you didn't love me
Oh, that hurts me so
Said you gonna leave me
And you, won't be back no more

I wished I had somebody to
Love me all the time
I wouldn't be so worried baby
I would have a piece of mind

Well, you know we been in love
Baby, since we both were kids
Say you gonna leave me
I just can't keep you here

I wished I had somebody to
Love me all the time
I wished I had somebody to
Love me all the time"
