,Artist,Title,Track_id,Year,Lyrics
173,Jr. Walker & The All Stars,Do The Boomerang,TRZLQUV128F931B21F,1965,"Now, you step to the left, baby
You step to the right, now
Do the Boomerang, now
Do the all new thing around

Get yourself together, now
Get on and soul, now
Dance like you never danced
Woo!

Get down on your knees, now
Baby, do the Sweet Pea, now
Step to the left, now
Step to the right, now
Do the Boomerang, girl
Do the all new thing around

I said, step to the left, now
Step to the right, now


Woo!
Do the Boomerang, girl
(Said)
Do the all new thing around

Hey!

I said now
Left-left-left-left
Step-left, right now, girl
That's what I say

I said now
Left-step, left-step
Left-step (left step)
Hear 'bout what I say."
174,The Everly Brothers,I Got A Woman,TRQWDTO12903C9C92D,1965,"Well,
I got a woman
Way over town
That's good to me
Oh yeah

I got a woman
Way over town
That's good to me
Oh yeah

She is my baby
Don't you understand
And I'm her lover man
I got a woman
Way over town
That's good to me
Oh yeah

She gives me lovin'
Early in the morning
Just for me
Oh yeah

She gives me lovin
Early in the morning
Just for me
Oh yeah

She is my baby
Don't you understand
And I'm her lover man
I got a woman
Way over town
That's good to me
Oh yeah

She is my baby
Don't you understand
And I'm her lover man
I got a woman
Way over town
That's good to me
Oh yeah

She's alright
She's alright
She's alright
She's alright
She's alright
She's alright..."
175,Nina Simone,Be My Husband,TRIDGZO128F428C5CB,1965,"Be my husband man I be your wife
Be my husband man I be your wife
Be my husband man I be your wife
Loving all of you the rest of your life yeah

If you promise me you'll be my man
If you promise me you'll be my man
If you promise me you'll be my man
I will love you the best I can yeah

Stick the promise man you made me
Stick the promise man that you made me
Yeah yeah yeah yeah yeah
Stick the promise man you made me
That you stay away from Rosalie yeah

Oh daddy love me good
Oh daddy now love me good
Oh daddy love me good
Oh daddy now love me good

If you want me to cook and sew
If you want me to cook and sew
If you want me to cook and sew yeah
Outside of you there is no place to go

Please don't treat me so doggone mean
Please don't treat me so doggone mean
Please don't treat me so now doggone mean yeah
You're the meanest man I ever see

Oh daddy now love me good
Oh daddy love me good yeah
Oh daddy love me good yeah
Oh daddy now love me good"
176,Dionne Warwick,Who Can I Turn To,TRBMDGL12903CDB507,1965,"Who can I turn to 
When nobody needs me?
My heart wants to know 
And so I must go 
Where destiny leads me

With no star to guide me 
And no one beside me
I'll go on my way 
And, after the day
The darkness will hide me

And maybe tomorrow 
I'll find what I'm after
I'll throw off my sorrow
Beg, steal, or borrow 
My share of laughter
With you I could learn to
With you what a new day
But who can I turn to 
If you turn away?

With you I could learn to
With you what a new day
But who can I turn to 
If you turn away?"
177,Burl Ives,A Holly Jolly Christmas,TRBQJRX128F92DEB8B,1965,"(Ding-dong-ding)
(Ding-dong-ding)

(Ding-dong-ding) Have a holly jolly Christmas
(Ding-dong-ding) It's the best time of the year
I don't know if there'll be snow
But have a cup of cheer

(Ding-dong-ding) Have a holly jolly Christmas
(Ding-dong-ding) And when you walk down the street
Say hello to friends you know
And everyone you meet

Oh ho, the mistletoe
Hung where you can see
Somebody waits for you
Kiss her once for me

(Ding-dong-ding) Have a holly jolly Christmas
(Ding-dong-ding) And in case you didn't hear
Oh, by golly, have a holly jolly Christmas this year

Have a holly jolly Christmas
It's the best time of the year

Have a holly jolly Christmas
And when you walk down the street
Say hello to friends you know
And everyone you meet

Oh ho, the mistletoe
Hung where you can see
Somebody waits for you
Kiss her once for me

(Ding-dong-ding) Have a holly jolly Christmas
(Ding-dong-ding) And in case you didn't here
Oh, by golly, have a holly jolly Christmas this year

(Ding-dong-ding-dong)
(Ding-dong-ding-dong)
(Ding-dong-ding)"
178,The Rolling Stones,As Tears Go By,TRBZXHP128F427D0E5,1965,"It is the evening of the day
I sit and watch the children play
Smiling faces I can see
But not for me
I sit and watch as tears go by

My riches can't buy everything
I want to hear the children sing
All I hear is the sound
Of rain falling on the ground
I sit and watch as tears go by

It is the evening of the day
I sit and watch the children play
Doin' things I used to do
They think are new
I sit and watch as tears go by

Mmm, mmm"
179,Otis Redding,Your One And Only Man,TRKYBYO128F4276275,1965,"If I can only, make you see
That you were only, meant for me, now
Our love will be free
And I'll be your destiny
Destiny, destiny, right, now, now, now, babe

If I can make you only understand
Treat me right and love me
Then I will be your man
Your one and only man

These are the words
That I have to say
Live by them each and every day, now
And as the time pass
I know our love will last, our love will last, our love will last
Now, now, now babe

Take me blue
Understand them
Live by them and love me
Then I will be your man
Your one and only man

These are the words
That I have to say
Just live by them each and every day, now
And as the time pass
I know our love will last, our love will last, our love will last
Now

Take me blue
Understand them
Live by them and love me
Honey I will be your man
I said your one and only man

Yes your truly lovely man
Yes your lovely lovely man
You don't need nobody to do nothing for you baby
I said I could just love and be just one guy that you need
I could say I could be one guy that you love
I could just be anyone you want me to be, now, now
I said I could be just anyone you want me to be
Darling, baby, my, my, my, my baby
Na, na, wow..."
180,Little Milton,Blind Man,TRMTYVG128F931900A,1965,"Blind man standing on the corner
Crying out the blues, said, ""I don't need a dollar
And don't you give me a dime
Until you bring back that little girl of mine""

I can't let her go, I'm hooked, I can't let her go
People try to tell me, ""Stop crying, and find you someone new
'Cause when that good Lord made one woman
Hallelujah, don't you know he made two?""

But I can't let her go, I'm hooked, I can't let her go
I can't let her go, Lord, I can't let her go

He lifted up his head toward Heaven and said
""Good Lord, I'd rather die than to let a no good
A no good cheating woman
Make me stand on the corner and cry""

Lord knows I'm living in a world of darkness
But that don't, that don't bother me
And until I find that sweet little girl of mine
Lord knows, I just don't want to see

But I can't let her go, Lord, I'm hooked
I can't let her go, Lord, I can't let her go
Won't somebody please help the blind me?
Lord, won't somebody please help the blind me?
I can't let her go, I'm hooked, I can't let her go"
181,The Byrds,The Bells Of Rhymney,TRTCINI128F426B2AB,1965,"Oh what will you give me?
Say the sad bells of Rhymney
Is there hope for the future?
Say the brown bells of Merthyr
Who made the mine owner?
Say the black bells of Rhondda
And who killed the miner?
Say the grim bells of Blaina

Throw the vandals in court
Say the bells of Newport
All will be well if, if, if, if, if
Say the green bells of Cardiff
Why so worried sisters? Why?
Sang the silver bells of Wye
And what will you give me?
Say the sad bells of Rhymney

Oh what will you give me?
Say the sad bells of Rhymney
Is there hope for the future?
Say the brown bells of Merthyr
Who made the mine owner?
Say the black bells of Rhondda
And who killed the miner?
Say the grim bells of Blaina"
182,The Moody Blues,I'll Go Crazy,TRCRQMX128F9345B98,1965,"Oh you know I feel alright, 
Oh yeah. 
You know I feel alright, children. 
Oh yeah. 
You know I feel alright, 
Oh yeah. 
Ah, you're hanging me up, baby, 
Yeah babe. 
If you leave me, 
I'll go crazy,  
If you leave me, babe, 
Shall I go crazy, 

'Cause I love you, 
I love you. 
Oh I love you too much, 

And if you hurt me 
I'll go crazy. 
If you ever go and hurt me, baby, 
I'll go crazy. 

'Cause I love you, 
I love you. 
Oh I love you too much, 

You've got to live for yourself, 
Yourself, for nobody else. 
You've got to live for yourself, 
Yourself, for nobody else. 

Oh baby, I'll go crazy. 
If you ever leave me, babe, 
I'll go crazy 
'Cause I love you, 
I love you, 
Oh I love you too much. 

You've got to live for yourself, 
Yourself, for nobody else. 
You've got to live for yourself, 
Yourself, for nobody else. 

Talk about me ever loving you. 
If you hurt me, baby,  
You know thart I'll go crazy 
'Cause I love you, 
I love you. 

Oh I love you much more than I can stand, 
I'm talking about you."
183,P. J. Proby,Maria,TRDODNG128F427C24A,1965,"The most beautiful sound I ever heard:
 Maria, Maria, Maria, Maria.
 All the beautiful sounds of the world in a single word:
 Maria, Maria, Maria, Maria, Maria, Maria.
 
Maria, I've just met a girl named Maria,
 And suddenly the name will never be the same to me.
 Maria! I've just kissed a girl named Maria.
 And suddenly I've found how wonderful a sound can be.
 
Maria, say it loud and there's music playing.
 Say it soft and it's almost like praying,
 Maria, I never stop saying: ""Maria!"""
184,The Mamas & The Papas,Somebody Groovy,TRXZFJN12903CBD4C8,1965,"I need somebody groovy,
Someone who's able to move me, yeah. (yeah) 
They gotta move me like they should.
And when I find somebody, yeah, I'll gonna treat em? good. 
(No) Don't need no imitations!
(No) Can't use my imagination, no! (Yeah...yeah) 
They gotta move me like they should. 
And when I find somebody, yeah, I'll gonna treat em? good.

Oh, please, please believe me;
I need someone to relieve me. 
Yeah, (yeah, yeah) they gotta move me like they should.
And when I find somebody, yeah, I'll gonna treat em? good.

I need somebody groovy,
Someone who really can move me, yeah. (yeah) 
Yeah, they gotta move me like they should.
And when I find somebody, yeah, I'll gonna treat em? good.
And when I find somebody, yeah, I'll gonna treat em? good."
185,The Rolling Stones,Get Off Of My Cloud,TRPDGUC128F9310F1D,1965,"I live in an apartment on the 99th floor of my block
And I sit at home looking out the window imagining the world has stopped
Then in flies a guy who's all dressed up just like a Union Jack
And says I've won five pounds if I have his kind of detergent pack

I said hey (hey), you (you), get off of my cloud
Hey (hey), you (you), get off of my cloud
Hey (hey), you (you), get off of my cloud
Don't hang around 'cause two's a crowd on my cloud, baby

The telephone is ringing I say, ""Hi, it's me, who is it there on the line?""
A voice says, ""Hi, hello, how are you?"" ""Well, I guess I'm doin' fine.""
He says, ""It's 3 AM, there's too much noise, don't you people ever wanna go to bed?
Just 'cause you feel so good, do you have to drive me out of my head?""

I said hey (hey), you (you), get off of my cloud
Hey (hey), you (you), get off of my cloud
Hey (hey), you (you), get off of my cloud
Don't hang around 'cause two's a crowd on my cloud, baby, yeah

I was sick and tired, fed up with this and decided to take a drive downtown
It was so very quiet and peaceful, there was nobody, not a soul around
I laid myself out, I was so tired and I started to dream
In the mornin' the parkin' tickets were just like rags stuck on my window screen

I said hey (hey), you (you), get off of my cloud
Hey (hey), you (you), get off of my cloud
Hey (hey), you (you), get off of my cloud
Don't hang around 'cause two's a crowd on my cloud

Hey (hey), you (you), get off of my cloud
Hey (hey), you (you), get off of my cloud
Hey (hey), you (you), get off of my cloud
Don't hang around, baby, two's a crowd on my cloud"
186,Bob Dylan,She Belongs To Me,TRCBOLE128F92F76F2,1965,"She's got everything she needs, she's an artist, she don't look back
She's got everything she needs, she's an artist, she don't look back
She can take the dark out of the nighttime and paint the daytime black

You will start out standing, proud to steal her anything she sees
You will start out standing, proud to steal her anything she sees
But you will wind up peeking through her keyhole, down upon your knees

She never stumbles, she's got no place to fall
She never stumbles, she got no place to fall
She's nobody's child, the law can't touch her at all

She wears an Egyptian ring, it sparkles before she speaks
She wears an Egyptian ring, it sparkles before she speaks
She's a hypnotist collector, you are a walking antique

Bow down to her on Sunday, salute her when her birthday comes
Bow down to her on Sunday, salute her when her birthday comes
For Halloween, buy her a trumpet and for Christmas, give her a drum"
187,Sonny & Cher,I Got You Babe,TRBZNMB128F9307828,1965,"They say we're young and we don't know
We won't find out until we grow
Well I don't know if all that's true
'Cause you got me, and baby I got you

Babe
I got you babe
I got you babe

They say our love won't pay the rent
Before it's earned, our money's all been spent
I guess that's so, we don't have a pot
But at least I'm sure of all the things we got

Babe
I got you babe
I got you babe

I got flowers in the spring
I got you to wear my ring
And when I'm sad, you're a clown
And if I get scared, you're always around

Don't let them say your hair's too long
'Cause I don't care, with you I can't go wrong
Then put your little hand in mine
There ain't no hill or mountain we can't climb

Babe
I got you babe
I got you babe

I got you to hold my hand
I got you to understand
I got you to walk with me
I got you to talk with me

I got you to kiss goodnight
I got you to hold me tight
I got you, I won't let go
I got you to love me so

I got you babe

I got you babe
I got you babe
I got you babe
I got you babe"
188,Astrud Gilberto,Dreamer,TRPGNRB128F9307E5F,1965,"Why are my eyes always full
Of this vision of you
Why do I dream silly dreams
That I fear won't come true
I long to show you the stars
Caught in the dark of the sea
I long to speak of my love
But you don't come to me

So I go on asking if maybe
One day you'll care
I tell my sad little dreams
To the soft evening air
I am quite hopeless it seems
Two things I know how to do
One is to dream
Two is loving you"
189,Phil Ochs,Draft Dodger Rag,TRYLBNL128F1473B12,1965,"Oh I'm just a typical American boy 
from a typical American town
I believe in God and Senator Dodd 
and keeping old Castro down.
And when it came my time to serve 
I knew better dead than red
But when I got to my old draft board, 
buddy, this is what I said:

Sarge, I'm only eighteen, I got a ruptured spleen 
and I always carry a purse
I got eyes like a bat, my feet are flat, 
and my asthma's getting worse
O think of my career, my sweetheart dear, 
and my poor old invalid aunt
Besides, I ain't no fool, I'm a goin' to school, 
and I'm working in a defense plant.

I've got a dislocated disc and a racked-up back
I'm allergic to flowers and bugs
And when the bombshell hits, I get epileptic fits
And I'm addicted to a thousand drugs.
I got the weakness woes, I can't touch my toes
I can hardly reach my knees
And if the enemy came close to me
I'd probably start to sneeze.

(chorus)

I hate Chou En Lai, and I hope he dies,
but one thing you gotta see
That someone's gotta go over there
and that someone isn't me.
So I wish you well, Sarge, give 'em Hell
Yeah, Kill me a thousand or so
And if you ever get a war without blood and gore
I'll be the first to go."
190,Nina Simone,One September Day,TRBPNOR128EF351562,1965,"Years, they will come and go
Sometimes the tears will flow
Some of my memories will fade
But I'll always remember that one September day

I used to reminisce
'Cause I thought that love was bliss
How did they know it would go astray
It began and it ended on one September day

We met by chance
As people often do
But it blossomed, yes it blossomed
Into something I never knew

Now... It is in the past
They said it would never last
I'll not forget the moment back
Nor hot May or December
Nor June or November
But one September day"
191,The Temptations,My Baby,TRRPUTT128F931B27B,1965,"Whose hair styles are out of this world 
Whether it's straight or bu'font or it's curled
My baby my baby my baby ... hey hey hey 
My baby, Baby pretty Baby 

Hair soft like a baby lamb I love to run my fingers through it.
I hope she digs me the way I am, but if I have to change.
You know I'm gonna do it for my baby,
(I'm gonna do it for my baby) 

Personality contains more gold than any bank in this world could hold. 
My baby, my baby, my baby, hey hey hey 
My baby, Baby, pretty Baby 

Enough gold in her personality, to set Fort Knox to shame. 
This golden girl belongs to me, Yet you know Eli tried 
To stake his claim on my baby.

(my baby) she's cute as can be (my baby) this girl's got a hold on me 
(my baby) has a kiss so sweet, she knocks me off my feet, 
She makes my life complete 

Oh yeah, she's my baby 
Oh yeah, she's my baby 
And I love her soooooo 
Yeah, I love my baby sooooo

My baby, she's cute as can be, my baby, this girl's got a hold on me 
My baby, has a kiss so sweet, she knocks me off my feet, 
She makes my life complete 

Who has my mind in a kind of haze,Who has me walkin' around in a daze. 
My baby, my baby, my baby, hey hey hey 
My baby, Baby, pretty Baby

She gives me a feelin I can't explain,She sets my soul on fire.
But I don't feel hurt and I don't feel pain.
All I feel is strong desire for my baby,

Oh yeah my baby, that personality to satisfy me 
Woooo that's my baby, my baby, my baby"
192,Little Anthony and The Imperials,Hurt So Bad,TRWQHZM12903CDDB07,1965,"I know you
Don't know what I'm goin' through
Standing here
Looking at you

Well, let me tell you that it
(Hurt) Hurts so bad (Hurts so bad)
It makes me feel so sad (Hurts so bad)
It makes me hurt so bad
To see you again

Like needles and pins, people say
You've been making out okay
She's in love, don't stand in her way

But let me tell you that it
(Hurt) Hurts so bad (Hurts so bad)
It makes me feel so sad (Hurts so bad)
It's gonna hurt so bad
If you walk away

Why don't you stay and let me make it up to you
(Stay) I'll do anything you want me to
You loved me before
Please love me again
I can't let you go back to him

Please don't go, please don't go
Ohhhh, hurts so bad
Come back, it hurts so bad
Don't make it hurt so bad
I'm beggin' you please

Please don't go, please don't go
Ohhhh, hurts so bad
Come back, it hurts so bad
Don't make it hurt so bad
I'm beggin' you please

Please don't go, please don't go
Ohhhh, hurts so bad
Come back, it hurts so bad"
193,The Temptations,My Girl,TRHTRKM128E0792004,1965,"I've got sunshine
On a cloudy day
When it's cold outside
I've got the month of May

I guess you'd say
What can make me feel this way?
My girl, my girl, my girl
Talkin' 'bout my girl
My girl

I've got so much honey
The bees envy me
I've got a sweeter song
Than the birds in the trees

Well, I guess you'd say
What can make me feel this way?
My girl, my girl, my girl
Talkin' 'bout my girl
My girl
Ooo-ooo, hoo-ooo

Hey, hey, hey
Hey, hey, hey
Ooh yeah

I don't need no money
Fortune or fame
I got all the riches, baby
One man can claim

Well, I guess you'd say
What can make me feel this way?
My girl, my girl, my girl
Talkin' 'bout my girl
My girl

(Talkin' 'bout my girl)
I got sunshine on a cloudy day with my girl
I've even got the month of May with my girl
(Talkin' 'bout my girl)
Talkin' bout, talkin' 'bout, talkin' 'bout my girl"
194,Billy Walker,Matamoros,TRFDTAG12903CCCF07,1965,"In old Mexico I stand on the square in Matamoros
Round a Plazza the couples were walking to music so sweet
I've found my love not too long ago in Matamoros
But I'm feeling low as the beggar who sits in the street
All the promises that she made me with eyes black as midnight
How could I know how fickle her promise would be
Now I'm back to find for I feel is mine in Matamoros
And there'll be bad trouble if I catch her cheating on me

Streets're narrow and dark and tequilla runs free in Matamoros
I stopped for one moment outside at Maguel's swinging doors
My heart breaks to hear the same haunting sounds of Granada
She once called it our song and vowed should be mine evermore
Then across the square went this wild young bracero I see her
Laughing and dancing and tossing her raven black hair
They'd may take a hand when I face this man from Matamoros
For the love of my woman is one thing that I'll never share

Now I walk in the night far away from the lights of Matamoros
And recall the last moments when I knew she loved me more than life
I can still hear her cry I love you and I'll prove it Manana
Then seeing my danger she jumped in front of his knife
I know the stories they'll tell in dimly casinos
Of the raven haired beauty who for her love laid dead on the floor
They'll speak of the fight with the gringo that night in Matamoros
And wonder what happened for he never returned anymore oh oh hoo"
195,Phil Ochs,Days Of Decision (LP Version),TRJZQPT128F1473B1C,1965,"Oh, the shadows of doubt are in many a mind,
Lookin' for an answer they're never gonna find,
But they'd better decide 'cause they're runnin' out of time,
For these are the days of decision.

Oh, the games of stalling you cannot afford,
Dark is the danger that's knocking on the door,
And the far-reaching rockets say you can't wait anymore,
For these are the days of decision.

In the face of the people who know they're gonna win,
There's a strength that's greater than the power od the wind,
And you can't stand around when the ice is growing thin,
For these are the days of decision.

I've seen your heads hinding 'neath the blankets of fear,
When the paths they are plain and the choices are clear,
But with each passing day, boys, the cost is more dear
For these are the days of decision.

There's many a cross that burns in the night,
And the fingers of the fire are pointing as they bite,
Oh you can't let the smoke keep on blinding all your sight,
For these are the days of decision.

Now the mobs of anger are roamin' the street,
From the rooftops they are aimin' at the police on the beat,
And in city after city you know they will repeat,
For these are the days of decision.

There's been warnin's of fire, warnin's of flood,
Now there's the warnin' of the bullet and the blood,
From the three bodies buried in the Mississippi mud,
Sayin' these are the days of decision.

There's a change in the wind, and a split in the road,
You can do what's right or you can do what you are told,
And the prize of the victory will belong to the bold,
Yes, these are the days of decision."
196,The Supremes,White Christmas,TRSTWNO128F1463BB5,1965,"I'm dreaming of a white christmas
Just like the ones I used to know
Where the tree tops glisten
And children listen
To hear sleigh bells in the snow

Ooh, I'm dreaming of a white christmas
With every christmas card I write
May your days be merry and bright
And may all your christmases be white

Ooh, white christmas
Sleigh bells in the snow

Ooh, I'm dreaming of a white christmas
With every christmas card I write
May your days be merry and bright
And may all your christmases be white"
197,Otis Redding,A Change Is Gonna Come,TRPNCYY12903CD2B06,1965,"I was born by a river in this little old tent
Oh just like this river I've been running ever since
It's been a long, long time coming
But I know, but I know a change is gotta come
Oh yes it is
On my!

It's been too hard living, oh my
And I'm afraid to die
I don't know what's up there
Beyond the clouds

It's been a long long time coming
But I know, but I know a change is gotta come
Oh yes it is
On my!

There was a time I would go to my brother
I asked my brother,  ""Will you help me please?""
He turned me down and then I ask my dear mother, oh
I said ""Mother!""
I said ""Mother! I'm down on my knees""

It's been a time that I thought
Lord this couldn't last for very long
But somehow I thought I was still able to try to carry on
It's been a long, long time coming
But I know a change is gonna come
Oh, yes it is

Just like I said, I went to my little bitty brother, my little brother
I asked my brother ""Brother help me please?""
He turned me down and then I go to my little mother, my dear mother
I said ""Mother!""
I said ""Mother! I'm down on my knees""

But there was a time that I thought
Lord this couldn't last for very long
But somehow I thought I was still able to try to carry on
It's been a long, long time coming
But I know, but I know a change is gotta come
Oh yes it will

So tired of standing by myself
You know that I know that a change is gotta come"
198,Mercedes Sosa,El Jangadero,TRIKCQZ128F427CF27,1965,"Río abajo voy llevando la jangada,
río abajo por el alto Paraná.
Es el peso de la sombra derrumbada,
que buscando el horizonte bajará.

Río abajo, río abajo, río abajo:
a flor de agua voy sangrando esta canción.
En el sueño de la vida y el trabajo
se me vuelve camalote el corazón

Jangadero, jangadero:
mi destino por el río es derivar
desde el fondo del obraje maderero,
con el anhelo del agua que se va.

Padre río, tus escamas de oro vivo
son la fiebre que me lleva más allá.
Voy detrás de tu horizonte fugitivo
y la sangre con el agua se me va

Banda, banda; sol y luna; cielo y agua:
espejismo que no acaba de pasar.
Piel de barro, fabulosa lampalagua:
me devora la pasión de navegar.

Jangadero, jangadero:
mi destino por el río es derivar
desde el fondo del obraje maderero,"
