,Artist,Title,Track_id,Year,Lyrics
26,Chuck Berry,Roll Over Beethoven,TRCPMZS128F427D5EF,1956,"Well I'm-a write a little letter
I'm gonna mail it to my local D.J.
Yeah and it's a jumpin' little record
I want my jockey to play
Roll over Beethoven
I gotta hear it again today

You know my temperature's risin'
The jukebox's blowin' a fuse
My heart beatin' rhythm
And my soul keep-a singing the blues
Roll over Beethoven
And tell Tchaikovsky the news

I got the rockin' pneumonia
I need a shot of rhythm and blues
I caught the rollin' athritis
Sittin' down at a rhythm review
Roll over Beethoven
They rockin' in two by two

Well if you feel and like it
Go get your lover then reel and rock it
Roll it over then move on up, yes-a
Try for further then
Reel and rock with one another
Roll over Beethoven
And dig these rhythm and blues

Well early in the mornin'
And I'm givin' you my mornin'
Don't you step on my blue suede shoes
Hey diddle-diddle, I'm-a play my fiddle
Ain't got nothing to lose
Roll over Beethoven
And tell Tchaikovsky the news

You know she wiggle like a glow worm
Dance like a spinnin' top
She got a crazy partner
You oughta see 'em reel an rock
Long as she got a dime
The music will never stop

Roll over Beethoven
Roll over Beethoven
Roll over Beethoven
Roll over Beethoven
Roll over Beethoven
And dig these rhythm and blues"
27,Chuck Berry,Too Much Monkey Business,TRCVQII128E079091F,1956,"Runnin' to and fro, hard workin' at the mill
Never failed in the mail, yet come a rotten bill
Too much monkey business, too much monkey business
Too much monkey business for me to be involved in

Salesman talking to me tryin' to run me up a creek
Says you can buy it, go on try it, you can pay me next week
Ah, too much monkey business, too much monkey business
Too much monkey business for me to be involved in

Blonde haired, good lookin' tryin' to get me hooked
Wants me to marry, get a home, settle down, write a book
Ha, too much monkey business, too much monkey business
Too much monkey business for me to be involved in

Same thing every day, gettin' up, goin' to school
No need to be complainin', my objections overruled
Ah, too much monkey business, too much monkey business
Too much monkey business for me to be involved in

Pay phone, somethin' wrong, dime gone, will mail
I ought to sue the operator for tellin' me a tale
Ah, too much monkey business, too much monkey business
Too much monkey business for me to be involved in

I been to Yokohama, been a fightin' in the war
Army bunk, army chow, army clothes, army car
Ha, too much monkey business, too much monkey business
Too much monkey business for me to be involved in

Workin' in the fillin' station, too many tasks
Wipe the windows, check the tires, check the oil, dollar gas
Uh-uh, too much monkey business, too much monkey business
I don't want your botheration, go away, leave me be

Too much monkey business for me"
28,Chuck Berry,Drifting Heart,TRAYBUO128F935012B,1956,"Who set my heart
Ever - drifting?
You, from the start never lifting
I fight it but it downs me
Despite the joy around me
I can't free myself from sorrow

All through the day it's a wonder
Fall will the night, still I wonder
If I'm the only
Or are you as lonely
Come home to me tomorrow
Why should the past so change
How you feel!
Oh but I ask you
""Forgive, if you will""
These lonely hours are
So hard to bear
I don't deny that I was unfair

You paid enough to be gay
Who made me love you this way?
So give me the chance
To renew our romance
For this time I know it will stay
Oh yes, this time I know it will stay"
29,Dalida,Bambino,TRQJLJW128F148C984,1956,"Bambino
Bambino
Ne pleure pas, Bambino

Les yeux battus, la mine triste et les joues blêmes,
Tu ne dors plus, tu n’es que l’ombre de toi-même.
Seul dans la rue tu rôdes comme une âme en peine,
Et tous les soirs sous sa fenêtre on peut te voir.

Je sais bien que tu l’adores,
— Bambino, bambino
Et qu’elle a de jolis yeux,
— Bambino, bambino
Mais tu es trop jeune encore
— Bambino, bambino
Pour jouer les amoureux.

Et gratte, gratte sur ta mandoline
Mon petit Bambino,
Ta musique est plus jolie
Que tout le ciel de l’Italie
Et chante, chante de ta voix câline
Mon petit Bambino
Tu peux chanter tant que tu veux
Elle ne te prend pas au sérieux

Avec tes cheveux si blonds,
— Bambino, bambino
Tu as l’air d’un chérubin.
— Bambino, bambino
Vas plutôt jouer au ballon,
— Bambino, bambino
Comme font tous les gamins.

Tu peux fumer comme un Monsieur des cigarettes,
Te déhancher sur le trottoir quand tu la guettes,
Tu peux pencher sur ton oreille ta casquette,
Ce n’est pas ça, qui dans son cœur, te vieillira.

L’amour et la jalousie
— Bambino, bambino
Ne sont pas des jeux d’enfant,
— Bambino, bambino
Et tu as toute la vie
— Bambino, bambino
Pour souffrir comme les grands.
— Bambino, bambino

Et gratte, gratte sur ta mandoline, mon petit Bambino
Ta musique est plus jolie
Que tout le ciel de l’Italie
Et chante, chante de ta voix câline
Mon petit Bambino
Tu peux chanter tant que tu veux
Elle ne te prend pas au sérieux.

Si tu as trop de tourments,
— Bambino, bambino
Ne les garde pas pour toi
— Bambino, bambino
Vas les dire à ta maman,
— Bambino, bambino
les mamans c'est fait pour ça.

Et là, blotti dans l’ombre douce de ses bras,
Pleure un bon coup, et ton chagrin s’envolera."
30,Doris Day,If I Give My Heart To You,TRXSWZV128F4219DAA,1956,"If I give my heart to you 
Will you handle it with care 
Will you always treat me tenderly 
And in every way be fair 

If I give my heart to you 
Will you give me all your love 
Will you swear that you'll be true to me 
By the light that shines above 

And will you sigh with me when I'm sad 
Smile with me when I'm glad 
And always be as you are with me tonight 

Think it over and be sure 
Please don't answer till you do 
When you promise all those things to me 
Then I'll give my heart to you 

And will you sigh with me when I'm sad 
Smile with me when I'm glad 
And always be as you are with me tonight 

Think it over and be sure 
Please don't answer till you do 
When you promise all those things to me 
Then I'll give my heart to you"
31,Eddy Arnold,Texarkana Baby,TRMHBHX12903CBD1C0,1956,"(Fred Rose - Cottonseed Clark)

She's my Texarkana baby
Do I love her Lowdy Law
Her pappy came from Texas
Her maw from Arkansas.

I'm twisted round her finger
Like a little piece of string
And yet I'm satisfied because
She's such a precious thing.

If she hauled off and slapped me
I would never feel the sting
She's my Texarkana baby

She's my Texarkana baby
Do I love her Lowdy Law
Her pappy came from Texas
And her maw from Arkansas.

She's pretty as a picture
And you ought to hear her name
It's sweet as sarghum syrup
And good ol' blue ribbon cane.

She gives me lots of sugar
and she never spills a grain
she's my Texarkana baby.

She's my Texarkana baby
Do I love her Lowdy Law
Her pappy came from Texas
And her maw from Arkansas.

One night I went a callin'
On my pretty little maid
I must admit to you
I was a little bit afraid.

To offer her a diamond ring
With one installment pay
She's my Texarkana baby.

--- Instrumental ---

She's my Texarkana baby
Do I love her Lowdy Law
Her pappy came from Texas
And her maw from Arkansas.

She's got two eyes that twinkle
Like a good ol' country star
She's got a perfect figure
That'll stop you where you are.

Why everytime I look at her
I think of my guitar
She's my Texarkana baby..."
32,Eddy Arnold,Don't Rob Another Man's Castle,TRGGJZG128F934243D,1956,"(Jenny Lou Carson)

They say a man's home is his castle
He's like a king on a throne
It may be a shack down alongside the track
But everything in it's his own.

So don't think of taking his loved one
It's written Thou shall not steal
Don't rob another man's castle
No matter how lonesome you feel.

--- Instrumental ---

Don't rob another man's castle
Don't take his treasures away
Strange as it seems when you steal a man's dreams
You'll never know then how you'll pay.

So don't rob a man of his loved one
You'll break his heart don't you see
I robbed another man's castle
Now someone just stole her from me..."
33,Eddy Arnold,Anytime,TRCLZZY128F4289D09,1956,"Anytime you're feeling lonely
Anytime you're feeling blue
Anytime you feel down hearted
That will prove your love for me is true.

Anytime you're thinking 'bout me
That's the time I'll think of you
Anytime you say you want me back again
That's the time I'll come back home to you.

Anytime your world is lonely
And you'll find true friends a few
Anytime you see a rainbow
That will be a sign the storm is through.

Anytime will be the right time
Anytime at all will do
Anytime you're sure you want only my love
That's the time I'll come back home to you.

Anytime you're thinking 'bout me
That's the time I'll think of you
Anytime you say you want me back again
That's the time I'll come back home to you..."
34,Eddy Arnold,Bouquet of Roses,TRRQGSM128F92F208E,1956,"I'm sending you a big bouquet of roses
One for every time you broke my heart
And as the door of love between us closes
Tears will fall like petals when we part.

I begged you to be different
But you'll always be untrue
I'm tired of forgiving
Now there's nothing left to do.

So I'm sending you a big bouquet of roses
One for every time you broke my heart.

You made our lover's lane a road of sorrow
'Til at last we have to say goodbye
You're leaving me to face each new tomorrow
With a broken heart you taught to cry.

I know that I should hate you
After all you've put me through
But how can I be bitter
When I'm still in love with you.

So I'm sending you a big bouquet of roses
One for every time you broke my heart..."
35,Eddy Arnold,Molly Darling,TRBHOXV128F92FBB72,1956,"Won't you tell me Molly darling
That you love none else but me?
For I love you Molly darling
You are all the world to me

Oh, tell darling, that you love me
Put your little hand in mine
Take my heart sweet Molly darling
Say that you will give me time

Stars are smiling Molly darling
Through a misty veil of night
They seem laughing Molly darling
While the Moon hides her light

Oh, no one listens but the flowers
While they hang their heads in shame
They are modest Molly darling
When they hear me call your name

Molly there is sweetest dearest
Look up darling tell me this
Do you love me Molly darling
Let your answer be a kiss"
36,Eddy Arnold,It's A Sin,TRBVZIP128F4289CFA,1956,"It's a sin, my darling, how I love you
Because I know our love can never be
It's a sin to keep this mem'ry of you
When silence proves that you've forgotten me

The dream I built for us has tumbled
Each promise broken like my heart
It's a sin, my darling, how I love you
So much in love and yet so far apart

It's a sin to hide behind this heartache
To make-believe that I've found someone new
It's a sin to say that I don't miss you
When people know I'm still in love with you

I'm sure you're happy with another
Who shares the love I couldn't win
Why pretend that I can't live without you
When deep inside, I know that it's a sin"
37,Eddy Arnold,That's How Much I Love You,TRJASMF128F428EA7E,1956,"Now If I had a nickel I know what I would do
I'd spend it all for candy and give it all to you
I'd spend it all for candy and give it all to you
'Cause that's how much I love you baby
That's how much I love you.

Now if you were a kitten with pretty glossy fur
I'd take you up and stroke you and listen to you purr
I'd take you up and stroke you and listen to you purr
'Cause that's how much I love you baby
That's how much I love you.

Now if you were a tiger I'd hang around your den
I'd pester you my honey until you let me in
I'd pester you my honey until you let me in
'Cause that's how much I love you baby
That's how much I love you.

Now if you were a horsefly and I an old grey mare
I'd stand and let you bite me and never move a hair
I'd stand and let you bite me and never move a hair
'Cause that's how much I love you baby
That's how much I love you

Now if you want to marry now let me tell you what
I'll go and find the parson and let him tie the knot
We'll go and find the parson and let him tie the knot
'Cause that's how much I love you woman
That's how much I love you..."
38,Eddy Arnold,Will The Circle Be Unbroken (My Family Circle),TRKEPGE12903CBD205,1956,"There are loved ones in the glory whose dear forms you often miss
When you close your earthly story will you join them in their bliss

Will the circle be unbroken by and by by and by
In a better home awaiting in the sky Lord in the sky

In the jouous days of childhood oft' they told of wond'rous love
Pointed to the dying Saviour now they dwell with him above

Will the circle be unbroken...
[ steel ]
You can picture happy gath'rings round the fireside long ago
And you think of tearful partings when they left you here below

Will the circle be unbroken..."
39,Eddy Arnold,You Don't Know Me,TRYNARO128F42AD149,1956,"You give your hand to me
And then you say hello
And I can hardly speak
My heart is beating so
And anyone could tell
You think you know me well
But you don't know me

No, you don't know the one
Who dreams of you at night
And longs to kiss your lips
And longs to hold you tight
To you, I'm just a friend
That's all I've ever been
But you don't know me

For I never knew the art of making love
Though my heart aches with love for you
Afraid and shy, I let my chance go by
The chance you might have loved me too

You give your hand to me
And then you say goodbye
I watch you walk away
Beside the lucky guy
To never, never know
The one who loves you so
No, you don't know me

You give your hand to me
And then you say goodbye
I watch you walk away
Beside the lucky guy
To never, never know
The one who loves you so
No, you don't know me"
40,Edith Piaf,Les trois cloches,TRZEZQM128F934ED4A,1956,"Village au fond de la vallée
Comme égaré, presque ignoré
Voici qu'en la nuit étoilée
Un nouveau-né nous est donné
Jean-François Nicot il se nomme
Il est joufflu, tendre et rosé
À l'église, beau petit homme,
Demain tu seras baptisé

Une cloche sonne, sonne
Sa voix d'écho en écho
Dit au monde qui s'étonne:
«C'est pour Jean-François Nicot»
C'est pour accueillir une âme
Une fleur qui s'ouvre au jour
À peine, à peine une flamme
Encore faible qui réclame
Protection, tendresse, amour

Village au fond de la vallée
Loin des chemins, loin des humains
Voici qu'après dix-neuf années
Cœur en émoi, le Jean-François
Prend pour femme la douce Élise
Blanche comme fleur de pommier
Devant Dieu, dans la vieille église
Ce jour il se sont mariés

Toutes les cloches sonnent, sonnent
Leurs voix d'écho en écho
Merveilleusement couronnent
La noce à François Nicot
«Un seul cœur, une seule âme»,
Dit le prêtre, «et pour toujours
Soyez une pure flamme
Qui s'élève et qui proclame
La grandeur de votre amour»

Village au fond de la vallée
Des jours, des nuits, le temps a fui
Voici qu'en la nuit étoilée
Un cœur s'endort, François est mort...
Car toute chair est comme l'herbe
Elle est comme la fleur des champs
Épis, fruits mûrs, bouquets et gerbes,
Hélas tout va se desséchant

Une cloche sonne, sonne
Elle chante dans le vent
Obsédante et monotone
Elle redit aux vivants:
«Ne tremblez pas cœurs fidèles
Dieu vous fera signe un jour!
Vous trouverez sous son aile
Avec la vie éternelle
L'éternité de l'amour»"
41,Ella Fitzgerald,Manhattan,TRAVDBM128EF35E257,1956,"Summer journeys to Niag'ra
and to other places aggra-
vate all our cares.
We'll save our fares!

I've a cozy little flat in
what is known as old Manhattan
we'll settle down
right here in town!

We'll have Manhattan
the Bronx and Staten
Island too.
It's lovely going through
the zoo!

It's very fancy
on old Delancy
street you know.
The subway charms us so
when balmy breezes blow
to and fro.

And tell me what street
compares with Mott Street
in July?
Sweet pushcarts gently gli-ding by.

The great big city's a wonderous toy
just made for a girl and boy.
We'll turn Manhattan
into an isle of joy!

We'll go to Yonkers
Where true love conquers
In the whiles
And starve together dear, in Chiles

We'll go to Coney
And eat baloney on a roll
In Central Park we'll stroll
Where our first kiss we stole
Soul to soul

And ""My Fair Lady"" is a terrific show they say
We both may see it close, some day

The city's glamour can never spoil
The dreams of a boy and goil
We'll turn Manhattan
into an isle of joy!


Transcribed by Todd Peach &lt;todd@thepeaches.com&gt;
(from this specific recording)

Guy from Bath England sent me this more complete version:
VERSE

Summer journeys to Niag'ra
And to other places aggra-
vate all our cares.
We'll save our fares;

I've a cozy little flat in
What is known as old Manhattan,
We'll settle down
Right here in town.

CHORUS 1

We'll have Manhattan,
The Bronx and Staten
Island too.
It's lovely going through the Zoo.

It's very fancy
On old Delancey
Street you know.
The subway charms us so,
When balmy breezes blow
To and fro.

And tell me what street
Compares with Mott Street
In July?
Sweet pushcarts gently gliding by.

The great big city's a wondrous toy
Just made for a girl and boy --
We'll turn Manhattan
Into an isle of joy.

CHORUS 2

We'll go to Greenwich,
Where modern men itch
To be free,
And Bowling Green you'll see with me.

We'll bathe at Brighton,
The fish you'll frighten
When you're in,
Your bathing suit so thin
Will make the shellfish grin,

Fin to fin.

I'd like to take a
Sail on Jamaica
Bay with you,
And fair Canarsie's Lakes we'll view.

The city's bustle cannot destroy
The dreams of a girl and boy --
We'll turn Manhattan
Into an isle of joy.

CHORUS 3

We'll go to Yonkers,
Where true love conquers
In the wilds
And starve together, dear, in Childs'.

We'll go to Coney
And eat bologny
On a roll,
In Central Park we'll stroll
Where our first kiss we stole,
Soul to soul.

And South Pacific
Is a terrific
Show they say,
We both may see it close some day.

The city's clamour can never spoil
The dreams of a boy and goil --
We'll turn Manhattan
Into an isle of joy.

CHORUS 4

We'll have Manhattan,
The Bronx and Staten
Island too,
We'll try to cross Fifth Avenue.

As black as onyx
We'll find the Bronix
Park Express,
Our Flatbush flat, I guess,
Will be a great success,
More or less.

A short vacation
On Inspiration
Point we'll spend,
And in the station house we'll end.

But Civic Virtue cannot destroy
The dreams of a girl and boy --
We'll turn Manhattan
Into an isle of joy!"
42,Ella Fitzgerald,The Lady Is A Tramp,TRTIGXG12903C94F6F,1956,"I've wined and dined on Mulligan stew and never wished for turkey
As I hitched and hiked and grifted too, from Maine to Albuquerque
Alas I missed the Beaux Arts Ball and what is twice as sad
I was never at a party where they honored Noel Ca-ad
But social circles spin too fast for me
My ""hobohemia"" is the place to be

I get too hungry for dinner at eight
I like the theater, but never come late
I never bother with people I hate
That's why the lady is a tramp

I don't like crap games with barons and earls
Won't go to Harlem in ermine and pearls
Won't dish the dirt with the rest of the girls
That's why the lady is a tramp

I like the free, fresh wind in my hair
Life without care
I'm broke, it's oke
Hate California, it's cold and it's damp
That's why the lady is a tramp

I go to Coney, the beach is divine
I go to ballgames, the bleachers are fine
I follow Winchell and read every line
That's why the lady is a tramp

I like a prizefight that isn't a fake
I love the rowing on Central Park lake
I go to Opera and stay wide awake
That's why the lady is a tramp

I like the green grass under my shoes
What can I lose, I'm flat, that's that
I'm alone when I lower my lamp
That's why the lady is a tramp"
43,Ella Fitzgerald,You Took Advantage Of Me,TRENGVB128F930323F,1956,"When a girl has the heart of a mother
It must go to someone of course
It can't be a sister or a brother
And so I love my horse

But horses are frequently silly
Mine ran from the beach of Okhala
And left me alone for a filly
So I picked you up

I'm a sentimental sap, that's all
What's the use of trying not to fall?
I have no will, you've made your kill
'Cause you took advantage of me!

I'm just like an apple on a bough
And you're gonna shake me down somehow
So, what's the use,
You've cooked my goose
'Cause you took advantage of me!

I'm so hot and bothered that I don't know
My elbow from my ear
I suffer something awful each time you go
And much worse when you're near

Here I am with all my bridges burned
Just a babe in arms where you're concerned
So lock the doors and call me yours
'Cause you took advantage of me."
44,Ella Fitzgerald & Louis Armstrong,Stars Fell On Alabama,TRWZWNV128F92C7097,1956,"We lived our little drama
We kissed in a field of white
And stars fell on Alabama
Last night

I can't forget the glamour
Your eyes held a tender light
And stars fell on Alabama
Last night

I never planned in my imagination
A situation so heavenly
A fairy land where no one else could enter
And in the center just you and me

My heart beat like a hammer
My Arms wound around you tight
And stars fell on Alabama
Last night"
45,Ella Fitzgerald & Louis Armstrong,Isn't This A Lovely Day,TRHMYXS128F93155CE,1956,"The weather is frightening
The thunder and lightning
Seem to be having their way
But as far as I'm concerned
It's a lovely day

The turn in the weather
Will keep us together
So I can honestly say
That as far as I'm concerned
It's a lovely day and everything's okay

Isn't this a lovely day
To be caught in the rain?
You were going on your way
Now you've got to remain

Just as you were going
Leaving me all at sea
The clouds broke
They broke and oh
What a break for me

I can see the sun up high
Though we're caught in the storm
I can see where you and I
Could be cozy and warm

Let the rain pitter patter
But it really doesn't matter
If the skies are gray
Long as I can be with you
It's a lovely day"
46,Ella Fitzgerald & Louis Armstrong,Moonlight In Vermont,TRCRKTC128F92FB867,1956,"Pennies in a stream
Falling leaves, a sycamore
Moonlight in Vermont

Icy finger waves
Ski trails on a mountain side
Snowlight in Vermont

Telegraph cables, they sing down the highway
And travel each bend in the road
People who meet in this romantic setting
Are so hypnotized by the lovely

Evening summer breeze
Warbling of a meadowlark
Moonlight in Vermont

You and I and
Moonlight in Vermont"
47,Ella Fitzgerald & Louis Armstrong,Cheek To Cheek,TRCKMVP128F424A315,1956,"Heaven, I'm in heaven
And my heart beats so that I can hardly speak
And I seem to find the happiness I seek
When we're out together dancing cheek to cheek

Heaven, I'm in heaven
And the cares that hung around me through the week
Seem to vanish like a gambler's lucky streak
When we're out together dancing cheek to cheek

Oh I love to climb a mountain
And to reach the highest peak
But it doesn't thrill me half as much
As dancing cheek to cheek

Oh I love to go out fishing
In a river or a creek
But I don't enjoy it half as much
As dancing cheek to cheek

Dance with me
I want my arm about you
That charm about you
Will carry me through

To heaven, I'm in heaven
And my heart beats so that I can hardly speak
And I seem to find the happiness I seek
When we're out together dancing cheek to cheek"
48,Ella Fitzgerald & Louis Armstrong,A Foggy Day,TRBTRGI128F92FB859,1956,"I was a stranger in the city
Out of town were the people I knew
I had that feeling of self-pity
What to do, what to do, what to do
The outlook was decidedly blue

But as I walked through the foggy streets alone
It turned out to be the luckiest day I've known

A foggy day in London town
Had me low, and it had me down
I viewed the morning with alarm
The British Museum had lost its charm

How long, I wondered, could this thing last
But the age of miracles hadn't passed
For suddenly I saw you there
And through foggy London town
The sun was shining everywhere"
49,Ella Fitzgerald & Louis Armstrong,April In Paris,TRQRBML12903CCC4B5,1956,"April in Paris, chestnuts in blossom
Holiday tables under the trees
April in Paris, this is a feeling
No one can ever reprise

I never knew the charm of spring
Never met it face to face
I never knew my heart could sing
Never missed a warm embrace

Till April in Paris
Whom can I run to
What have you done to my heart"
50,Ella Fitzgerald & Louis Armstrong,Tenderly,TRUSHRW128F92FB863,1956,"The evening breeze
Caressed the trees
Tenderly

The trembling trees
Embraced the breeze
Tenderly

Then you and I
Came wandering by
And lost in a sigh
Were we

The shore was kissed
By sea and mist
Tenderly

I can't forget
How two hearts met
Breathlessly

Your arms are opened wide
And closed me inside
You took my lips
You took my love
So tenderly"
51,Ella Fitzgerald & Louis Armstrong,The Nearness Of You,TRDWXCJ128F424A331,1956,"It's not the pale moon that excites me
That thrills and delights me, oh no
It's just the nearness of you

It isn't your sweet conversation
That brings this sensation, oh no
It's just the nearness of you

When you're in my arms
And I feel you so close to me
All my wildest dreams come true

I need no soft light to enchant me
If you'll only grant me the right
To hold you ever so tight
And to feel in the night
The nearness of you"
52,Ella Fitzgerald / Louis Armstrong,They Can't Take That Away From Me,TRBENGQ128F149628C,1956,"The way you wear your hat
The way you sip your tea
The memory of all that
No, no, they can't take that away from me

The way your smile just beams
The way you sing off key
The way you haunt my dreams
No, no, they can't take that away from me

We may never, never meet again
On the bumpy road to love
Still I'll always
Always keep the memory of

The way you hold your knife
The way we danced till three
The way you changed my life
No, no, they can't take that away from me
No, they can't take that away from me"
