,Artist,Title,Track_id,Year,Lyrics
32,Curtis Lee,Pretty Little Angel Eyes,TRCSFWV128F933D827,1961,"Pretty little angel eyes
Pretty little angel eyes
Pretty little angel pretty little angel
Pretty little pretty little
Pretty little angel
Pretty little little little angel eyes

Angel eyes
I really love you so
Angel eyes
I'll never let you go
Because I love you
My darling angel eyes
Pretty, pretty, pretty little angel eyes

Angel eyes
You are so good to me
And when I'm in your arms
It feels so heavenly
You know I love you
My darling angel eyes

I know you were sent from heaven above
To fill my life with your wonderful love
I know we'll be happy for eternity
'Cause I know that our love is really real

Angel eyes
I really love you so
Angel eyes
I'll never let you go
Because I love you
My darling angel eyes

Pretty little angel eyes
Pretty little angel eyes
Pretty little angel pretty little angel
Pretty little pretty little
Pretty little angel

Angel eyes
I really love you so
Angel eyes
I'll never let you go
Because I love you
My darling angel eyes
Pretty pretty pretty little angel eyes"
33,Del Shannon,Jody,TRMYTUF128F42874C6,1961,"Jody, I miss you so
More than you ever know
And I'll wait for Jody
Each year, you go away

I count the lonely days
'Til you return in June
The leaves begin to fall
The summer I'll recall
Next year, we'll be alone
Forever together

I'll write you every day
I'll buy a ring in May
And I'll wait for Jody
Jody, Jody, Jody, Jody, Jody"
34,Del Shannon,Hats Off To Larry,TRHUIUK128F92F1525,1961,"Once I had a pretty girl
Her name it doesn't matter
She went away with another guy
Now he won't even look at her

Hats off to Larry
He broke your heart
Just like you broke mine 
When you said we must part
He told you lies, 
Now it's your turn to cry-cry-cry
Now that Larry's said goodbye to you

I know this may sound strange
I want you back, I think you'll change
But there's one more thing I got to say

Hats off to Larry
It may sound cruel
But you laughed at me 
When you said we were through
You told me lies, 
Now its your turn to cry-cry-cry
Now that Larry's said goodbye to you"
35,Del Shannon,Runaway,TRCPGPU12903CD924E,1961,"As I walk along, I wonder
A-what went wrong with our love
A love that was so strong

And as I still walk on, I think of
The things we've done together
While our hearts were young

I'm a-walkin' in the rain
Tears are fallin' and I feel the pain
Wishin' you were here by me
To end this misery

I wonder
I wah-wah-wah-wah-wonder
Why
Why, why, why, why, why
She ran away

And I wonder
Where she will stay
My little runaway
A-run, run, run, run, runaway

I'm a-walkin' in the rain
Tears are fallin' and I feel the pain
Wishin' you were here by me
To end this misery

And I wonder
I wah-wah-wah-wah-wonder
Why
Why, why, why, why, why
She ran away

And I wonder
Where she will stay
My little runaway
A-run, run, run, run, runaway
A-run, run, run, run, runaway
A-run, run, run, run, runaway"
36,Del Shannon,So Long Baby,TRPSKNO12903CEA12B,1961,"I see you're laughing and 
A-telling everyone in town
That you've made a fool of me
Well go ahead and talk some more
'cause, baby, I don't care no more
You don't bother me at all

'cause I got news for you:
I was untrue too
And I don't care what you say
So go and laugh some more
'cause baby I don't care no more
I got another lover of my own

Step by step you put me down
Always calling me a clown
If you ever go away
Promise that you'll stay
Far, far, far away from me

Now that we played our game
I guess we're both to blame
We tried to break each other's hearts
You had one jump on me
But I jumped twice, you see
It's over now, be on your way

So long, baby, be on your way
I had a ball, you thought I'd fall
You had one jump on me
But I jumped twice, you see
It's over now, be on your way

So long, baby, be on your way
So long, baby, be on your way
So long, baby, be on your way"
37,Don Gibson,Sea of Heartbreak,TRMLYXQ128F92E9DC9,1961,"The lights in the harbor
Don't shine for me
I'm like a lost ship
Adrift on the sea

Yeah, the sea of heartbreak
Lost love and loneliness
Memories of your caress so divine
How I wish you were mine

Again my dear
I'm on this sea of tears
Sea of heartbreak

Oh, how did I lose you
Oh, where did I fail
Why did you leave me
Always to sail

Yeah, the sea of heartbreak
Lost love and loneliness
Memories of your caress so divine
How I wish you were mine

Again my dear
I'm on this sea of tears
Sea of heartbreak

Oh, what I'd give just to sail back to shore
Back to your arms once more

Oh, come to my rescue
Come here to me
Take me and keep me
Away from the sea

Yeah, the sea of heartbreak
Lost love and loneliness
Memories of your caress so divine
How I wish you were mine

Again my dear
I'm on this sea of tears
Sea of heartbreak

(Sea of heartbreak)
Yeah, sea of heartbreak
(Sea of heartbreak)
Heartbreak"
38,Eddie Cochran,Weekend,TRAUJRH128EF342251,1961,"Friday night, everything's right for the weekend
Crazy clothes, anything goes on a weekend
John called Ann and Jim got Sue
And I made a date with little ol' you
Off we went to make a big tent on the weekend

Boy, it's great just a-stayin' out late on a weekend
Know a spot and like it a lot on a weekend
Took a road to lookout hill
The view up there is sure a thrill
What a night to hold you tight on a weekend

There we were just sittin' cool and cozy
Just about to steal a little kiss
The police with a flashlight bright and nosy
Sayin', ""Holdin' neck o'er there, what is all this?""

Car top down, just ridin' around on a weekend
Took a chance on crashin' a dance on a weekend
We were almost inside the place
When somebody slammed the door in my face
""Hey, you guys have gotta wear ties on a weekend!""

No harm done, just a-havin' some fun on a weekend
That was all, we had a big ball on the weekend"
39,Ella Fitzgerald,I've Got You Under My Skin,TRGALDX12903C94F72,1961,"I've got you under my skin.
I've got you deep in the heart of me.
So deep in my heart that you're really a part of me.
I've got you under my skin.
I'd tried so not to give in.
I said to myself: this affair never will go so well.
But why should I try to resist when, baby, I know so well
I've got you under my skin?

I'd sacrifice anything come what might
For the sake of havin' you near
In spite of a warnin' voice that comes in the night
And repeats, repeats in my ear:
Don't you know, little fool, you never can win?
Use your mentality, wake up to reality.
But each time that I do just the thought of you
Makes me stop before I begin
'Cause I've got you under my skin.

(Musical interlude)

I would sacrifice anything come what might
For the sake of havin' you near
In spite of the warning voice that comes in the night
And repeats - how it yells in my ear:
Don't you know, little fool, you never can win?
Why not use your mentality - step up, wake up to reality?
But each time I do just the thought of you
Makes me stop just before I begin
'Cause I've got you under my skin.
Yes, I've got you under my skin."
40,Ella Fitzgerald,Night And Day,TRHCYSB128F14994B7,1961,"Like the beat beat beat of the tom-tom
When the jungle shadows fall
Like the tick tick tock of the stately clock
As it stands against the wall
Like the drip drip drip of the raindrops
When the summer shower is through
So a voice within me keeps repeating you, you, you
Night and day, you are the one
Only you beneath the moon AND under the sun
Whether near to me, or far
It's no matter darling where you are
I think of you
NIGHT AND DAY, DAY AND NIGHT, why is it so
That this longing for you follows wherever I go
In the roaring traffic's boom
In the silence of my lonely room
I think of you
NIGHT AND DAY, NIGHT AND DAY
Under the hide of me
There's an oh such a hungry yearning burning inside of me
And ITS torment won't be through
'TIL you let me spend my life making love to you
Day and night, night and day"
41,Ella Fitzgerald,I Am In Love,TRBZPDE12903CE1AB9,1961,"I am dejected. I am depressed.
Yet resurrected and sailing the crest.
Why this elation, mixed with deflation?
What explanation? I am in love.

Such conflicting questions rise
around in my brain: Should I order cynanide
or order champagne?

Oh, what is this sudden jolt?
I feel like a frightened colt,
just hit by a thunderbolt. I am in love.

I knew the odds were against me before,
I had no flair for flaming desire,
But since the gods gave me you to adore,
I may lose but I refuse to fight the fire,

So come and enlighten my days and never depart.
You only can brighten the blaze that burns in my heart,
For I am wildly in love with you,
and so in need of a stampede of love.

I knew the odds were against me before,
I had no flair for flaming desire,
But since the gods gave me you to adore,
I may lose but I refuse to fight the fire,

So come and enlighten my days and never depart.
You only can brighten the blaze that burns in my heart,
For I am wildly in love with you,
and so in need of a stampede of love,
and so in need of a stampede of love."
42,Ella Fitzgerald,In The Still Of The Night,TRAHZAG128EF340637,1961,"In the still of the night
As I gaze from my window 
At the moon in its flight
My thoughts all stray to you

In the still of the night
While the world lies in slumber
The times without number
Darling that I say to you

Do you love me 
As I love you
Are you my life to be
My dream come true
Or will that dream of mine fade out of sight
Like the moon growing dim
On the rim of the hill
In the chill, still of the night"
43,Ella Fitzgerald,Begin The Beguine,TRNUWHJ128F9303227,1961,"When they begin the beguine
It brings back the sound of music so tender,
It brings back a night of tropical splendor,
It brings back a memory ever green.
I'm with you once more under the stars,
And down by the shore an orchestra's playing
And even the palms seem to be swaying
When they begin the beguine.
To live it again is past all endeavor,
Except when that tune clutches my heart,
And there we are, swearing to love forever,
And promising never, never to part.
What moments divine, what rapture serene,
Till clouds came along to disperse the joys we had tasted,
And now when I hear people curse the chance that was wasted,
I know but too well what they mean;
So don't let them begin the beguine
Let the love that was once a fire remain an ember;
Let it sleep like the dead desire I only remember
When they begin the beguine.
Oh yes, let them begin the beguine, make them play
Till the stars that were there before return above you,
Till you whisper to me once more,
Darling, I love you!
And we suddenly know What heaven we're in,
When they begin the beguine"
44,Ella Fitzgerald,I Get A Kick out Of You,TRTTPOY12903CF3C81,1961,"My story is much to sad to be told
But practically everything leaves me totally cold
The only exception I know is the case
When I'm out on a quiet spree, fighting vainly the old ennui
And I suddenly turn and see
Your fabulous face

I get no kick from champagne
Mere alcohol doesn't thrill me at all
So tell me why should it be true
That I get a kick out of you

Some get a kick from cocaine
I'm sure that if I took even one sniff
That would bore me terrifically too
But I get a kick out of you
I get a kick every time I see you standing there before me
I get a kick though it's clear to me, you obviously don't adore me
I get no kick in a plane
Flying too high with some guy in the sky
Is my idea of nothing to do
Yet I get a kick out of you"
45,Ella Fitzgerald / Louis Armstrong,Let's Do It (Let's Fall In Love),TRAZUPM128F1496556,1961,"Birds do it, bees do it
Even educated fleas do it
Let's do it, let's fall in love

In Spain, the best upper sets do it

Lithuanians and Letts do it
Let's do it, let's fall in love

The Dutch in old Amsterdam do it
Not to mention the Finns
Folks in Siam do it - think of Siamese twins

Some Argentines, without means, do it
People say in Boston even beans do it
Let's do it, let's fall in love

Romantic sponges, they say, do it
Oysters down in Oyster Bay do it
Let's do it, let's fall in love

Cold Cape Cod clams, 'gainst their wish, do it
Even lazy jellyfish, do it
Let's do it, let's fall in love

Electric eels I might add do it
Though it shocks 'em I know
Why ask if shad do it - Waiter bring me
""shad roe""

In shallow shoals English soles do it
Goldfish in the privacy of bowls do it
Let's do it, let's fall in love

Transcribed (from the stated recording) by Todd Peach &lt;todd@thepeaches.com&gt;
Other verses I've seen in print follow:

In old Japan, all the Japs do it
Up in Lapland little Laps do it
Let's do it, let's fall in love

The chimpanzees in the zoos do it
Some courageous kangaroos do it
Let's do it, let's
fall in love

I'm sure giraffes on the sly do it
Even eagles as they fly do it
Let's do it, let's fall
in love

Electric eels I might add do it
Though it shocks em I know
Why ask if shad do it - garcon de
""shad roe""

The world admits bears in pits do it
Even Pekingeses at the Ritz do it
Let's do it, let's fall in love

The royal set sans regret did it
And they considered it fun
Marie Antoinette did it -
with or without Napoleon"
46,Elmore James,Look On Yonder Wall,TRWUAON128F93138AC,1961,"Look on yonder wall and hand me down my walkin' cane
Look on yonder wall and hand me down my walkin' cane
I got me another woman, baby, yon' come your man

Look on yonder wall and hand me down my walkin' cane
Look on yonder wall and hand me down my walkin' cane
I got me another woman and, uhh, baby, yon' come your man

You hurried up and went to the wall,
And you know it was tough, uhh
I don't know how many men you's killed,
But, I know you done killed enough for two

Look on yonder wall and hand me down my walkin' cane
Look on yonder wall and hand me down my walkin' cane
I got me another woman, now baby, yon' come your man

Ooh yeah

I love you baby, but you just can't treat me right,
spend all my money and walk the streets all night
But, look on yonder wall and hand me down my walkin' cane
I got me another woman, and baby, yon' come your man"
47,Elmore James,Shake Your Moneymaker,TRSKOXK12903CF8E0C,1961,"Shake your moneymaker
Shake your moneymaker
Shake your moneymaker
Shake your moneymaker
Shake your moneymaker
And then?
Shake your moneymaker
Shake your moneymaker
Shake your moneymaker
Shake your moneymaker
Shake your moneymaker
And then?
I got a girl who lives up on the hill
I got a girl who lives up on the hill
Talk she gonna love me
But I don't believe she will
You got shake your moneymaker
Shake your moneymaker, babe
Shake your moneymaker
Shake your moneymaker
You gotta shake your moneymaker
And then?
I got a girl and she just won't be true
I got a girl and she just won't be true
She's locked to the bridge
She won't do a thing I tell her to do
She won't shake her moneymaker
Won't shake her moneymaker
She wanna roll her activator
She won't shake her moneymaker
She won't shake her moneymaker
She won't?"
48,Elvis Presley,Can't Help Falling In Love,TRQHJAK128F428F2D0,1961,"Wise men say, only fools rush in
But I can't help falling in love with you

Shall I stay? Would it be a sin?
If I can't help falling in love with you

Like a river flows, surely to the sea
Darling so it goes, some things are meant to be

Take my hand, take my whole life too
For I can't help falling in love with you

Like a river flows, surely to the sea
Darling so it goes, some things are meant to be

Take my hand, take my whole life too
For I can't help falling in love with you
For I can't help falling in love with you"
49,Elvis Presley,Sentimental Me,TRSEUVA12903CBB29B,1961,"Sentimental me
Guess I'll always will be
So in love with you
Say you love me too
Sentimental me

Dreaming while I live
Living just to give
All my love to you
No one else will do
Sentimental me

Reaching for the moon
Wishing on the stars
On my honeymoon
I want to be where you are

Darling can't you see
It was meant to be
I'm in love with you
Say you love me too
Sentimental me

Darling can't you see
It was meant to be
I'm in love with you
No-one else will do"
50,Elvis Presley,It's A Sin,TRVFZRN128F428A1AB,1961,"It's a sin, my darling
How I love you
Because I know
Our love could never be

It's a sin
To keep this memory of you
When silence proves
That you've forgotten me

The dreams I built for us
Has tumbled

Each promise broken
Like my heart

It's a sin, my darling
How I love you
So much in love
And yet so far apart

I'm sure you're happy with another
Who shares the love I cannot win
Why pretend that I can live without you
When deep inside I know that it's a sin"
51,Elvis Presley,I Slipped_ I Stumbled_ I Fell,TRXOXCF128F42A703D,1961,"I look at you and wham,
I'm head over heels,
I guess that love,
Is a banana peel,
I feel so bad and yet,
I'm feeling so well.

I slipped, I stumbled, I fell.

One crazy kiss and bam,
I head for the skies,
I guess that love,
Is like a cake of ice,
You skate along but then,
You never can tell.

I slipped, I stumbled, I fell.

I never thought I'd get caked,
By your sweet talkin' lies,
You got a bag of tricks,
And when you got busy,
I got dazzled and dizzy,
I fell like a ton of bricks.

My knee's are weak,
My head is spinning around,
I guess that love,
Has turned me upside down,
But i get hurt, well gee,
It's turning out swell.

I slipped, I stumbled, I fell.

I never thought I'd get kicked
By your sweet talkin' lies,
You got a bag of tricks,
And when you got busie,
I got dazzled and dizzy,
I fell like a ton of bricks.

I never thought I'd get caked,
By your sweet talkin' lies,
You got a bag of tricks,
And when you got busy,
I got dazzled and dizzy,
I fell like a ton of bricks.

My knee's are weak,
My head is spinning around,
I guess that love,
Has turned me upside down,
But i get hurt, well gee,
It's turning out swell.

I slipped, I stumbled, I fell.

I slipped, I stumbled, I fell."
52,Ernie K-Doe,Mother-In-Law,TRFKDEO128F92F17FA,1961,"(Mother in law)
Mother in law
(Mother in law)
Mother in law

The worst person I know
(Mother in law, mother in law)
(Mother in law, mother in law)

A she worries me, so
If she'd leave us alone
A we would have a happy home
Sent from down below

Mother in law, mother in law

Satan should be her name
To me they're bout the same
Every time I open my mouth
She steps in, tries to put me out
How could she stoop so low

I come home with my pay
She asks me what I made
She thinks her advice is the constitution
But if she would leave that would be the solution
And don't come back no more

Mother in law
My mother in law, ah
Oh, yeah"
53,Faron Young,Hello Walls,TRMAZWS128F9358997,1961,"Hello walls (hello hello) how things go for you today
Don't you miss her since she upped and walked away
And I'll bet you dread to spend another lonely night with me
But lonely walls I'll keep you company.

Hello window (hello hello) well I see that you're still here
Aren't you lonely since our darling disappeared
Well look here is that a teardrop in the corner of your pane
Now don't you try to tell me that it's rain.

She went away and left us all alone the way she planned
Yes, we'll have to learn to get along without her if we can
Hello ceiling (hello hello) I'm gonna stare at you a while
You know I can't sleep so won't you bear with me awhile.

We must all stick together or else I'll lose my mind
I've got a feeling she'll be gone a long, long time.
(hello, hello)..."
54,Faron Young,Congratulations,TRRALQZ128F424A8EB,1961,"I can tell that you're already growing tired of me
You want no part of me even strated lying to me
And if you started out to break this heart inside of me
Congratulations to you dear you're doing fine.

I pass you on the street and you don't speak to me
You just look at me and then you walk away from me
And if you started out to make a fool of me
Congratulations to you dear you're doing fine.

Well, you should be comanded for the sorrow you cause me
How does it feel to be the Queen of Misery
If you started out to break this heart inside of me
Congratulations to you dear you're doing fine.

Well you should be comanded for the sorrow you cause me
How does it feel to be the Queen of Misery
If you started out to break this heart inside of me
Congratulations to you dear you're doing fine..."
55,Faron Young,Live Fast_ Love Hard_ Die Young,TRINCVS128E0790966,1961,"I wanna live fast, love hard, die young
And leave a beautiful memory
I wanna live fast, love hard. die young
And leave a beautiful memory.

Don't want slow walkin' or sad singin'
Let 'em have a jubilee
I wanna leave a lot of happy women
A thinking pretty thoughts of me.
I wanna live fast. love hard, die young
And leave a beautiful memory.

I got a hot-rod car and a cowboy suit
And I really do get around
I got a little black book and the gals look cute
And I know the name of every spot in town.

I wanna find 'em, fool 'em, leave 'em
And let 'em do the same to me
I wanna live fast. love hard, die young
And leave a beautiful memory.

I wanna live fast, love hard, die young
And leave a beautiful memory
I'm a wampus cat, let me grab my hat
And baby come along with me.

We're gonna do some fancy stepping
We're really goin' on a spree
I wanna live fast, love hard, die young
And leave a beautiful memory.

Now you may not approve of the things I do
But it really don't bother me
But don't ever think you can tie me down
I'm gonna stay footloose and fancy free.

So jump back, make tracks, move out
And let the pretty gals at me
I wanna live fast, love hard, die young
And leave a beautiful memory..."
56,Faron Young,There's Not Any Like You Left,TRVQYTB128F424A8E0,1961,"I used to think all the girls I knew were just the same
I thought the only difference in them was their name
Since I lost you I realized I once have the best
And I can't find a little part of you in all the rest.

There's not any like you left I was too blind to see
Too late I realized how much you meant to me
Now that you're gone well it seems I'm always by myself
Too late I find that there's not any like you left.

There's not any like you left I was too blind to see
Too late I realized how much you meant to me
Now that you're gone well it seems I'm always by myself
Too late I find that there's not any like you left...
Too late I find that there's not any like you left"
57,Faron Young,Big Shoes,TRDPTHZ12903CDC474,1961,"And so I finally get the chance to love you
Just when I thought everything was lost
But he walked out on you and now you need me
You want me to take up where he left off.

So I've got big shoes to fill and I do the best I can
I just hope my best is good enough for you
Yes I've got big shoes to fill and I hear he wore 'em well
But don't forget to use these shoes to walk right out on you.

I know how it must hurt to know you'd lost him
But truth is sometimes pretty hard to face
Well all that I can promise is to love you
And hope somehow that I can take his place.

So I've got big shoes to fill and I do the best I can
I just hope my best is good enough for you
Yes I've got big shoes to fill and I hear he wore 'em well
But don't forget to use these shoes to walk right out on you..."
58,Faron Young,Is She All You Thought She'd Be,TRDKSDM12903CD8FAF,1961,"Is she all that you thought she would be
The day you took her from me
Does she still meet someone secretly
Is she all you thought she would be.

Is she fooling your heart the same way she fooled mine
Do you have a feeling you'll lose her in time
Though her lips were so warm they're untrue
Do you think she'll always love you.

Remember she once belonged to me
Is she all you thought she would be.

Is she fooling your heart the same way she fooled mine
Do you have a feeling you'll lose her in time
Though her lips were so warm they're untrue
Do you think she'll always love you..."
59,Fats Domino,Let The Four Winds Blow,TRKKHNE128F1459671,1961,"I like the way you walk
I like the way you talk
Let me hold yo' hand
Try to understand

I want a girl like you
Tell my troubles to
You won't be afraid
You heard what I said

Let the four wind blow
Let 'em blow, let 'em blow
From the east to the west
I love you the best

Let the four wind blow
Let 'em blow, let 'em blow
From the east to the west
I love you the best

I like the way you walk
I like the way you talk
Let me hold yo' hand
Try to understand

I want a girl like you
Tell my troubles to
Don't be afraid
You heard what I said

Let the four wind blow
Let 'em blow, let 'em blow
From the east to the west
I love you the best

Let the four wind blow
Let 'em blow, let 'em blow
From east to the west
I love you the best"
60,Floyd Cramer,Last Date,TRBSKFR128F428A20B,1961,"It's over our love affair
Too late now I find I care
His sweet love no more I'll share
Now he's gone I'm alone
I was wrong should have known
Took me home on our last date

I search for a single way
To tell him what I had to say
I kissed him watched him walk away
Set him free foolishly destiny misery
Tragedy on our last date

Took the ring from my trembling fingers
Brushed a tear from my baby's eye
Walked away didn't know that
I'd soon miss him so
Guess I was too young to realize
So blind I couldn't see
How much he really meant to me
And that soon he would always be
On my mind in my heart I was blind from the start
Lost his love on our last date"
61,Floyd Cramer,Tennessee Waltz,TROOJRX128F428EA88,1961,"I was dancin' with my darlin'
To the Tennessee Waltz
When an old friend I happened to see
I introduced her to my loved one
And while they were dancin'
My friend stole my sweetheart from me

I remember the night and the Tennessee Waltz
Now I know just how much I have lost
Yes, I lost my little darlin'
The night they were playing
The beautiful Tennessee Waltz"
